CVE,Description,CVSS3_BaseScore,CWE
CVE-2023-6013,H2O is vulnerable to stored XSS vulnerability which can lead to a Local File Include attack.,5.4,CWE-79
CVE-2024-32867,Suricata is a network Intrusion Detection System Intrusion Prevention System and Network Security Monitoring engine. Prior to 7.0.5 and 6.0.19 various problems in handling of fragmentation anomalies can lead to mis-detection of rules and policy. This vulnerability is fixed in 7.0.5 or 6.0.19.,5.3,CWE-754
CVE-2021-43650,WebRun 3.6.0.42 is vulnerable to SQL Injection via the P_0 parameter used to set the username during the login process.,9.8,CWE-89
CVE-2024-27757,flusity CMS through 2.45 allows tools/addons_model.php Gallery Name XSS. The reporter indicates that this product ceased its development as of February 2024.,6.1,CWE-79
CVE-2025-21593,An Improper Control of a Resource Through its Lifetime vulnerability in the routing protocol daemon (rpd) of Juniper Networks Junos OS and Junos OS Evolved allows an unauthenticated network-based attacker to cause a Denial-of-Service (DoS).  On devices with SRv6 (Segment Routing over IPv6) enabled an attacker can send a malformed BGP UPDATE packet which will cause the rpd to crash and restart. Continued receipt of these UPDATE packets will cause a sustained DoS condition.   This issue affects iBGP and eBGP and both IPv4 and IPv6 are affected by this vulnerability.This issue affects Junos OS:       *  All versions before 21.2R3-S9    *  from 21.4 before 21.4R3-S10    *  from 22.2 before 22.2R3-S5    *  from 22.3 before 22.3R3-S4    *  from 22.4 before 22.4R3-S3    *  from 23.2 before 23.2R2-S2    *  from 23.4 before 23.4R2;    and Junos OS Evolved:       *  All versions before 21.2R3-S9-EVO    *  from 21.4-EVO before 21.4R3-S10-EVO    *  from 22.2-EVO before 22.2R3-S5-EVO    *  from 22.3-EVO before 22.3R3-S4-EVO    *  from 22.4-EVO before 22.4R3-S3-EVO   *  from 23.2-EVO before 23.2R2-S2-EVO    *  from 23.4-EVO before 23.4R2-EVO.,6.5,CWE-664
CVE-2022-21195,All versions of package url-regex are vulnerable to Regular Expression Denial of Service (ReDoS) which can cause the CPU usage to crash.,5.3,CWE-1333
CVE-2024-7850,The BP Profile Search plugin for WordPress is vulnerable to Cross-Site Request Forgery in all versions up to and including 5.7.5. This is due to missing or incorrect nonce validation on the bps_ajax_field_selector() bps_ajax_template_options() and bps_ajax_field_row() functions. This makes it possible for unauthenticated attackers to inject malicious web scripts via a forged request granted they can trick a site administrator into performing an action such as clicking on a link.,6.1,CWE-352
CVE-2023-43076, Dell PowerScale OneFS 8.2.x9.0.0.x-9.5.0.x contains a denial-of-service vulnerability. A low privilege remote attacker could potentially exploit this vulnerability to cause an out of memory (OOM) condition.  ,6.5,CWE-401
CVE-2024-7921,A vulnerability has been found in Anhui Deshun Intelligent Technology Jieshun JieLink+ JSOTC2016 up to 20240805 and classified as problematic. Affected by this vulnerability is an unknown functionality of the file /report/ParkOutRecord/GetDataList. The manipulation leads to improper access controls. The attack can be launched remotely. The exploit has been disclosed to the public and may be used.,4.3,CWE-284
CVE-2025-23940,Improper Neutralization of Input During Web Page Generation ('Cross-site Scripting') vulnerability in Saiem Khan Image Switcher allows Stored XSS.This issue affects Image Switcher: from n/a through 0.1.1.,6.5,CWE-79
CVE-2022-48809,In the Linux kernel the following vulnerability has been resolved:  net: fix a memleak when uncloning an skb dst and its metadata  When uncloning an skb dst and its associated metadata a new dst+metadata is allocated and later replaces the old one in the skb. This is helpful to have a non-shared dst+metadata attached to a specific skb.  The issue is the uncloned dst+metadata is initialized with a refcount of 1 which is increased to 2 before attaching it to the skb. When tun_dst_unclone returns the dst+metadata is only referenced from a single place (the skb) while its refcount is 2. Its refcount will never drop to 0 (when the skb is consumed) leading to a memory leak.  Fix this by removing the call to dst_hold in tun_dst_unclone as the dst+metadata refcount is already 1.,5.5,CWE-401
CVE-2024-20280,A vulnerability in the backup feature of Cisco UCS Central Software could allow an attacker with access to a backup file to learn sensitive information that is stored in the full state and configuration backup files.    This vulnerability is due to a weakness in the encryption method that is used for the backup function. An attacker could exploit this vulnerability by accessing a backup file and leveraging a static key that is used for the backup configuration feature. A successful exploit could allow an attacker with access to a backup file to learn sensitive information that is stored in full state backup files and configuration backup files such as local user credentials authentication server passwords Simple Network Management Protocol (SNMP) community names and the device SSL server certificate and key.,6.3,CWE-321
CVE-2024-45604,Contao is an Open Source CMS. In affected versions authenticated users in the back end can list files outside the document root in the file selector widget. Users are advised to update to Contao 4.13.49. There are no known workarounds for this vulnerability.,4.3,CWE-22
CVE-2023-28646,Nextcloud android is an android app for interfacing with the nextcloud home server ecosystem. In versions from 3.7.0 and before 3.24.1 an attacker that has access to the unlocked physical device can bypass the Nextcloud Android Pin/passcode protection via a thirdparty app. This allows to see meta information like sharer sharees and activity of files. It is recommended that the Nextcloud Android app is upgraded to 3.24.1. There are no known workarounds for this vulnerability.,4.4,CWE-281
CVE-2024-28195,your_spotify is an open source self hosted Spotify tracking dashboard. YourSpotify versions < 1.9.0 do not protect the API and login flow against Cross-Site Request Forgery (CSRF). Attackers can use this to execute CSRF attacks on victims allowing them to retrieve modify or delete data on the affected YourSpotify instance. Using repeated CSRF attacks it is also possible to create a new user on the victim instance and promote the new user to instance administrator if a legitimate administrator visits a website prepared by an attacker. Note: Real-world exploitability of this vulnerability depends on the browser version and browser settings in use by the victim. This issue has been addressed in version 1.9.0. Users are advised to upgrade. There are no known workarounds for this vulnerability.,8.1,CWE-352
CVE-2024-36257,Mattermost versions 9.5.x <= 9.5.5 and 9.8.0 when using shared channels with multiple remote servers connected fail to check that the remote server A requesting the server B to update the profile picture of a user is the remote that actually has the user as a local one . This allows a malicious remote A to change the profile images of users that belong to another remote server C that is connected to the server A.,2.7,CWE-284
CVE-2022-28961,Spip Web Framework v3.1.13 and below was discovered to contain multiple SQL injection vulnerabilities at /ecrire via the lier_trad and where parameters.,8.8,CWE-89
CVE-2023-31609,An issue in the dfe_unit_col_loci component of openlink virtuoso-opensource v7.2.9 allows attackers to cause a Denial of Service (DoS) via crafted SQL statements.,7.5,CWE-89
CVE-2022-2895,Measuresoft ScadaPro Server (All Versions) uses unmaintained ActiveX controls. These controls may allow two stack-based buffer overflow instances while processing a specific project file.,7.8,CWE-121
CVE-2024-40083,A Buffer Overflow vulnerabilty in the local_app_set_router_token function of Vilo 5 Mesh WiFi System <= 5.16.1.33 allows remote unauthenticated attackers to execute arbitrary code via sscanf reading the token and timezone JSON fields into a fixed-length buffer.,9.6,CWE-120
CVE-2024-1579,Incorrect Usage of Seeds in Pseudo-Random Number Generator (PRNG) vulnerability in Secomea GateManager (Webserver modules) allows Session Hijacking.This issue affects GateManager: before 11.2.624071020.  ,8.1,CWE-335
CVE-2024-10875,The Gallery Manager plugin for WordPress is vulnerable to Reflected Cross-Site Scripting due to the use of remove_Query_Arg without appropriate escaping on the URL in all versions up to and including 1.6.58. This makes it possible for unauthenticated attackers to inject arbitrary web scripts in pages that execute if they can successfully trick a user into performing an action such as clicking on a link.,6.1,CWE-79
CVE-2024-57223,Linksys E7350 1.1.00.032 was discovered to contain a command injection vulnerability via the ifname parameter in the apcli_wps_gen_pincode function.,9.8,CWE-77
CVE-2024-26198,Microsoft Exchange Server Remote Code Execution Vulnerability,8.8,CWE-426
CVE-2024-30422,Improper Neutralization of Input During Web Page Generation ('Cross-site Scripting') vulnerability in WPVibes Elementor Addon Elements allows Stored XSS.This issue affects Elementor Addon Elements: from n/a through 1.13.1.  ,6.5,CWE-79
CVE-2023-36661,Shibboleth XMLTooling before 3.2.4 as used in OpenSAML and Shibboleth Service Provider allows SSRF via a crafted KeyInfo element. (This is fixed in for example Shibboleth Service Provider 3.4.1.3 on Windows.),7.5,CWE-918
CVE-2023-5884,The Word Balloon WordPress plugin before 4.20.3 does not protect some of its actions against CSRF attacks allowing an unauthenticated attacker to trick a logged in user to delete arbitrary avatars by clicking a link.,6.5,CWE-352
CVE-2023-32533,Certain dashboard widgets on Trend Micro Apex Central (on-premise) are vulnerable to cross-site scripting (XSS) attacks that may allow an attacker to achieve remote code execution on affected servers.    This is similar to but not identical to CVE-2023-32531 through 32535.,6.1,CWE-79
CVE-2024-41972,A low privileged remote attacker can overwrite an arbitrary file on the filesystem which may lead to an arbitrary file read with root privileges.,6.5,CWE-35
CVE-2024-46700,In the Linux kernel the following vulnerability has been resolved:  drm/amdgpu/mes: fix mes ring buffer overflow  wait memory room until enough before writing mes packets to avoid ring buffer overflow.  v2: squash in sched_hw_submission fix  (cherry picked from commit 34e087e8920e635c62e2ed6a758b0cd27f836d13),7.8,CWE-120
CVE-2023-37864,In PHOENIX CONTACTs WP 6xxx series web panels in versions prior to 4.0.10 a remote attacker with SNMPv2 write privileges may use an a special SNMP request to gain full access to the device.,7.2,CWE-494
CVE-2022-40974,Incomplete cleanup in the Intel(R) IPP Cryptography software before version 2021.6 may allow a privileged user to potentially enable information disclosure via local access.,1.8,CWE-459
CVE-2024-13849,The Cookie Notice Bar plugin for WordPress is vulnerable to Stored Cross-Site Scripting in all versions up to and including 1.3.0 due to insufficient input sanitization and output escaping. This makes it possible for authenticated attackers with administrator-level access to inject arbitrary web scripts in pages that will execute whenever a user accesses an injected page. This only affects multi-site installations and installations where unfiltered_html has been disabled.,5.5,CWE-79
CVE-2022-1264,The affected product may allow an attacker with access to the Ignition web configuration to run arbitrary code.,6.8,CWE-22
CVE-2022-20844,A vulnerability in authentication mechanism of Cisco Software-Defined Application Visibility and Control (SD-AVC) on Cisco vManage could allow an unauthenticated remote attacker to access the GUI of Cisco SD-AVC using a default static username and password combination. This vulnerability exists because the GUI is accessible on self-managed cloud installations or local server installations of Cisco vManage. An attacker could exploit this vulnerability by accessing the exposed GUI of Cisco SD-AVC. A successful exploit could allow the attacker to view managed device names SD-AVC logs and SD-AVC DNS server IP addresses.,5.3,CWE-798
CVE-2018-25036,A vulnerability has been found in Thomson TCW710 ST5D.10.05 and classified as problematic. Affected by this vulnerability is an unknown functionality of the file /goform/RgTime. The manipulation of the argument TimeServer1/TimeServer2/TimeServer3 with the input ><script>alert(1)</script> as part of POST Request leads to cross site scripting (Persistent). The attack can be launched remotely. The exploit has been disclosed to the public and may be used.,3.5,CWE-80
CVE-2023-37439,Multiple vulnerabilities in the web-based management interface of EdgeConnect SD-WAN Orchestrator could allow an authenticated remote attacker to conduct SQL injection attacks against the EdgeConnect SD-WAN Orchestrator instance. An attacker could exploit these vulnerabilities to     obtain and modify sensitive information in the underlying database potentially leading to the exposure and corruption of sensitive data controlled by the EdgeConnect SD-WAN Orchestrator host.  ,6.1,CWE-79
CVE-2023-35965,Two heap-based buffer overflow vulnerabilities exist in the httpd manage_post functionality of Yifan YF325 v1.0_20221108. A specially crafted network request can lead to a heap buffer overflow. An attacker can send a network request to trigger these vulnerabilities.This integer overflow result is used as argument for the malloc function.,9.8,CWE-190
CVE-2024-56032,Improper Neutralization of Input During Web Page Generation ('Cross-site Scripting') vulnerability in Foliovision FV Descriptions allows Reflected XSS.This issue affects FV Descriptions: from n/a through 1.4.,7.1,CWE-79
CVE-2024-36396,Verint - CWE-434: Unrestricted Upload of File with Dangerous Type,8.8,CWE-434
CVE-2022-2780,In affected versions of Octopus Server it is possible to use the Git Connectivity test function on the VCS project to initiate an SMB request resulting in the potential for an NTLM relay attack.,8.1,CWE-294
CVE-2022-28496,TOTOLink outdoor CPE CP900 V6.3c.566_B20171026 discovered to contain a command injection vulnerability in the setPasswordCfg function via the adminuser and adminpassparameter. This vulnerability allows attackers to execute arbitrary commands via a crafted request.,9.8,CWE-77
CVE-2022-36887,A cross-site request forgery (CSRF) vulnerability in Jenkins Job Configuration History Plugin 1155.v28a_46a_cc06a_5 and earlier allows attackers to delete entries from job agent and system configuration history or restore older versions of job agent and system configurations.,4.3,CWE-352
CVE-2022-31079,KubeEdge is an open source system for extending native containerized application orchestration capabilities to hosts at Edge. Prior to versions 1.11.1 1.10.2 and 1.9.4 the Cloud Stream server and the Edge Stream server reads the entire message into memory without imposing a limit on the size of this message. An attacker can exploit this by sending a large message to exhaust memory and cause a DoS. The Cloud Stream server and the Edge Stream server are under DoS attack in this case. The consequence of the exhaustion is that the CloudCore and EdgeCore will be in a denial of service. Only an authenticated user can cause this issue. It will be affected only when users enable `cloudStream` module in the config file `cloudcore.yaml` and enable `edgeStream` module in the config file `edgecore.yaml`. This bug has been fixed in Kubeedge 1.11.1 1.10.2 and 1.9.4. As a workaround disable cloudStream module in the config file `cloudcore.yaml` and disable edgeStream module in the config file `edgecore.yaml`.,4.4,CWE-400
CVE-2022-36593,kkFileView v4.0.0 was discovered to contain an arbitrary file deletion vulnerability via the fileName parameter at /controller/FileController.java.,6.5,CWE-22
CVE-2024-7681,A vulnerability was found in code-projects College Management System 1.0. It has been declared as critical. This vulnerability affects unknown code of the file login.php of the component Login Page. The manipulation of the argument email/password leads to sql injection. The attack can be initiated remotely. The exploit has been disclosed to the public and may be used.,7.3,CWE-89
CVE-2024-21208,Vulnerability in the Oracle Java SE Oracle GraalVM for JDK Oracle GraalVM Enterprise Edition product of Oracle Java SE (component: Networking).  Supported versions that are affected are Oracle Java SE: 8u421 8u421-perf 11.0.24 17.0.12 21.0.4 23; Oracle GraalVM for JDK: 17.0.12 21.0.4 23; Oracle GraalVM Enterprise Edition: 20.3.15 and  21.3.11. Difficult to exploit vulnerability allows unauthenticated attacker with network access via multiple protocols to compromise Oracle Java SE Oracle GraalVM for JDK Oracle GraalVM Enterprise Edition.  Successful attacks of this vulnerability can result in unauthorized ability to cause a partial denial of service (partial DOS) of Oracle Java SE Oracle GraalVM for JDK Oracle GraalVM Enterprise Edition. Note: This vulnerability applies to Java deployments typically in clients running sandboxed Java Web Start applications or sandboxed Java applets that load and run untrusted code (e.g. code that comes from the internet) and rely on the Java sandbox for security. This vulnerability does not apply to Java deployments typically in servers that load and run only trusted code (e.g. code installed by an administrator). CVSS 3.1 Base Score 3.7 (Availability impacts).  CVSS Vector: (CVSS:3.1/AV:N/AC:H/PR:N/UI:N/S:U/C:N/I:N/A:L).,3.7,CWE-203
CVE-2024-47145,Mattermost versions 9.5.x <= 9.5.8 fail to properly authorize access to archived channels when viewing archived channels is disabled which allows an attacker to view posts and files of archived channels via file links.,3.1,CWE-284
CVE-2022-47458,In wlan driver there is a possible missing params check. This could lead to local denial of service in wlan services.,5.5,CWE-125
CVE-2025-2093,A vulnerability was found in PHPGurukul Online Library Management System 3.0. It has been declared as problematic. Affected by this vulnerability is an unknown functionality of the file /change-password.php. The manipulation of the argument email/phone number leads to weak password recovery. The attack can be launched remotely. The complexity of an attack is rather high. The exploitation appears to be difficult. The exploit has been disclosed to the public and may be used.,3.1,CWE-640
CVE-2024-35231,rack-contrib provides contributed rack middleware and utilities for Rack a Ruby web server interface. Versions of rack-contrib prior to 2.5.0 are vulnerable to denial of service due to the fact that the user controlled data `profiler_runs` was not constrained to any limitation. This would lead to allocating resources on the server side with no limitation and a potential denial of service by remotely user-controlled data. Version 2.5.0 contains a patch for the issue.,8.6,CWE-770
CVE-2025-21182,Windows Resilient File System (ReFS) Deduplication Service Elevation of Privilege Vulnerability,7.4,CWE-415
CVE-2025-2097,A vulnerability which was classified as critical has been found in TOTOLINK EX1800T 9.1.0cu.2112_B20220316. This issue affects the function setRptWizardCfg of the file /cgi-bin/cstecgi.cgi. The manipulation of the argument loginpass leads to stack-based buffer overflow. The attack may be initiated remotely. The exploit has been disclosed to the public and may be used.,8.8,CWE-119
CVE-2024-7697,Logical vulnerability in the mobile application (com.transsion.carlcare) may lead to user information leakage risks.,7.5,CWE-863
CVE-2025-1833,A vulnerability which was classified as critical has been found in zj1983 zz up to 2024-8. Affected by this issue is the function sendNotice of the file src/main/java/com/futvan/z/erp/customer_notice/Customer_noticeAction.java of the component HTTP Request Handler. The manipulation of the argument url leads to server-side request forgery. The attack may be launched remotely. The exploit has been disclosed to the public and may be used. The vendor was contacted early about this disclosure but did not respond in any way.,6.3,CWE-918
CVE-2024-32865,Under certain circumstances the exacqVision Server will not properly validate TLS certificates provided by connected devices.,6.4,CWE-295
CVE-2023-44763,Concrete CMS v9.2.1 is affected by an Arbitrary File Upload vulnerability via a Thumbnail file upload which allows Cross-Site Scripting (XSS). NOTE: the vendor's position is that a customer is supposed to know that pdf should be excluded from the allowed file types even though pdf is one of the allowed file types in the default configuration.,5.4,CWE-434
CVE-2023-2639,The underlying feedback mechanism of   Rockwell Automation's FactoryTalk System Services that transfers the FactoryTalk Policy Manager rules to relevant devices on the network does not verify that the origin of the communication is from a legitimate local client device.  This may allow a threat actor to craft a malicious website that when visited will send a malicious script that can connect to the local WebSocket endpoint and wait for events as if it was a valid client device. If successfully exploited this would allow a threat actor to receive information including whether FactoryTalk Policy Manager is installed and potentially the entire security policy.    ,4.1,CWE-346
CVE-2023-38465,In ims service there is a possible missing permission check. This could lead to local information disclosure with no additional execution privileges,5.5,CWE-862
CVE-2023-5339,Mattermost Desktop fails to set an appropriate log level during initial run after fresh installation resulting in logging all keystrokes including password entry being logged.   ,4.7,CWE-200
CVE-2022-43935,An information exposure through log file vulnerability exists in Brocade SANnav before Brocade SANnav 2.2.2 where Brocade Fabric OS Switch passwords and authorization IDs are printed in the embedded MLS DB file.,5.3,CWE-532
CVE-2023-51067,An unauthenticated reflected cross-site scripting (XSS) vulnerability in QStar Archive Solutions Release RELEASE_3-0 Build 7 allows attackers to execute arbitrary javascript on a victim's browser via a crafted link.,6.1,CWE-79
CVE-2023-38171,Microsoft QUIC Denial of Service Vulnerability,7.5,CWE-476
CVE-2022-35910,In Jellyfin before 10.8 stored XSS allows theft of an admin access token.,5.4,CWE-79
CVE-2024-38745,Missing Authorization vulnerability in Rymera Web Co Wholesale Suite allows Accessing Functionality Not Properly Constrained by ACLs.This issue affects Wholesale Suite: from n/a through 2.1.12.,5.3,CWE-862
CVE-2024-30890,Cross Site Scripting vulnerability in ED01-CMS v.1.0 allows an attacker to obtain sensitive information via the categories.php component.,4.7,CWE-79
CVE-2024-9741,Tungsten Automation Power PDF PDF File Parsing Heap-based Buffer Overflow Remote Code Execution Vulnerability. This vulnerability allows remote attackers to execute arbitrary code on affected installations of Tungsten Automation Power PDF. User interaction is required to exploit this vulnerability in that the target must visit a malicious page or open a malicious file.  The specific flaw exists within the parsing of PDF files. The issue results from the lack of proper validation of the length of user-supplied data prior to copying it to a fixed-length heap-based buffer. An attacker can leverage this vulnerability to execute code in the context of the current process. Was ZDI-CAN-24457.,7.8,CWE-122
CVE-2023-30620,mindsdb is a Machine Learning platform to help developers build AI solutions. In affected versions an unsafe extraction is being performed using `tarfile.extractall()` from a remotely retrieved tarball. Which may lead to the writing of the extracted files to an unintended location. Sometimes the vulnerability is called a TarSlip or a ZipSlip variant. An attacker may leverage this vulnerability to overwrite any local file which the server process has access to. There is no risk of file exposure with this vulnerability. This issue has been addressed in release `23.2.1.0 `. Users are advised to upgrade. There are no known workarounds for this vulnerability.,7.5,CWE-22
CVE-2023-3009,Cross-site Scripting (XSS) - Stored in GitHub repository nilsteampassnet/teampass prior to 3.0.9.,5.4,CWE-79
CVE-2024-7579,A vulnerability was found in Alien Technology ALR-F800 up to 19.10.24.00. It has been declared as critical. Affected by this vulnerability is the function popen of the file /var/www/cgi-bin/upgrade.cgi of the component File Name Handler. The manipulation of the argument uploadedFile leads to os command injection. The attack can be launched remotely. The exploit has been disclosed to the public and may be used. NOTE: The vendor was contacted early about this disclosure but did not respond in any way.,6.3,CWE-78
CVE-2022-25247,Axeda agent (All versions) and Axeda Desktop Server for Windows (All versions) may allow an attacker to send certain commands to a specific port without authentication. Successful exploitation of this vulnerability could allow a remote unauthenticated attacker to obtain full file-system access and remote code execution.,9.8,CWE-306
