CVE,Description,CVSS3_BaseScore,CWE
CVE-2025-48999,DataEase is an open source business intelligence and data visualization tool. A bypass of CVE-2025-46566's patch exists in versions prior to 2.10.10. In a malicious payload `getUrlType()` retrieves `hostName`. Since the judgment statement returns false it will not enter the if statement and will not be filtered. The payload can be directly concatenated at the replace location to construct a malicious JDBC statement. Version 2.10.10 contains a patch for the issue.,8.8,CWE-284
CVE-2024-47063,Computer Vision Annotation Tool (CVAT) is an interactive video and image annotation tool for computer vision. If a malicious CVAT user with permissions to either create a task or edit an existing task can trick another logged-in user into visiting a maliciously-constructed URL they can initiate any API calls on that user's behalf. This gives the attacker temporary access to all data that the victim user has access to. Upgrade to CVAT 2.19.0 or a later version to fix this issue.,6.1,CWE-79
CVE-2022-35469,OTFCC v0.10.4 was discovered to contain a segmentation violation via /x86_64-linux-gnu/libc.so.6+0xbb384.,6.5,CWE-754
CVE-2024-31474,There is an arbitrary file deletion vulnerability in the CLI service accessed by PAPI (Aruba's Access Point management protocol). Successful exploitation of this vulnerability results in the ability to delete arbitrary files on the underlying operating system which could lead to the ability to interrupt normal operation and impact the integrity of the affected Access Point,8.2,CWE-463
CVE-2022-24850,Discourse is an open source platform for community discussion. A category's group permissions settings can be viewed by anyone that has access to the category. As a result a normal user is able to see whether a group has read/write permissions in the category even though the information should only be available to the users that can manage a category. This issue is patched in the latest stable beta and tests-passed versions of Discourse. There are no workarounds for this problem.,5.3,CWE-200
CVE-2024-49860,In the Linux kernel the following vulnerability has been resolved:  ACPI: sysfs: validate return type of _STR method  Only buffer objects are valid return values of _STR.  If something else is returned description_show() will access invalid memory.,7.1,CWE-843
CVE-2023-40968,Buffer Overflow vulnerability in hzeller timg v.1.5.1 and before allows a remote attacker to cause a denial of service via the 0x61200000045c address.,7.5,CWE-120
CVE-2025-5161,A vulnerability classified as problematic was found in H3C SecCenter SMP-E1114P02 up to 20250513. Affected by this vulnerability is the function operationDailyOut of the file /safeEvent/download. The manipulation of the argument filename leads to path traversal. The attack can be launched remotely. The exploit has been disclosed to the public and may be used. The vendor was contacted early about this disclosure but did not respond in any way.,4.3,CWE-22
CVE-2024-23960,Alpine Halo9 Improper Verification of Cryptographic Signature Vulnerability. This vulnerability allows physically present attackers to bypass signature validation mechanism on affected installations of Alpine Halo9 devices. Authentication is not required to exploit this vulnerability.  The specific flaw exists within the firmware metadata signature validation mechanism. The issue results from the lack of proper verification of a cryptographic signature. An attacker can leverage this in conjunction with other vulnerabilities to execute arbitrary code in the context of root.  Was ZDI-CAN-23102,4.6,CWE-347
CVE-2025-4334,The Simple User Registration plugin for WordPress is vulnerable to Privilege Escalation in all versions up to and including 6.3. This is due to insufficient restrictions on user meta values that can be supplied during registration. This makes it possible for unauthenticated attackers to register as an administrator.,9.8,CWE-269
CVE-2023-52891,A vulnerability has been identified in SIMATIC Energy Manager Basic (All versions < V7.5) SIMATIC Energy Manager PRO (All versions < V7.5) SIMATIC IPC DiagBase (All versions) SIMATIC IPC DiagMonitor (All versions) SIMIT V10 (All versions) SIMIT V11 (All versions < V11.1). Unified Automation .NET based OPC UA Server SDK before 3.2.2 used in Siemens products are affected by a similar vulnerability as documented in CVE-2023-27321 for the OPC Foundation UA .NET Standard implementation. A successful attack may lead to high load situation and memory exhaustion and may block the server.,5.3,CWE-1325
CVE-2025-24949,In JotUrl 2.0 is possible to bypass security requirements during the password change process.,6.5,CWE-287
CVE-2022-43649,This vulnerability allows remote attackers to execute arbitrary code on affected installations of Foxit PDF Reader 12.0.2.12465. User interaction is required to exploit this vulnerability in that the target must visit a malicious page or open a malicious file. The specific flaw exists within the handling of Annotation objects. The issue results from the lack of validating the existence of an object prior to performing operations on the object. An attacker can leverage this vulnerability to execute code in the context of the current process. Was ZDI-CAN-19478.,7.8,CWE-416
CVE-2025-29661,Litepubl CMS <= 7.0.9 is vulnerable to RCE in admin/service/run.,7.2,CWE-94
CVE-2023-41705,Processing of user-defined DAV user-agent strings is not limited. Availability of OX App Suite could be reduced due to high processing load. Please deploy the provided updates and patch releases. Processing time of DAV user-agents now gets monitored and the related request is terminated if a resource threshold is reached. No publicly available exploits are known.,6.5,CWE-400
CVE-2024-4592,A vulnerability classified as problematic was found in DedeCMS 5.7. This vulnerability affects unknown code of the file /src/dede/sys_group_edit.php. The manipulation leads to cross-site request forgery. The attack can be initiated remotely. The exploit has been disclosed to the public and may be used. VDB-263314 is the identifier assigned to this vulnerability. NOTE: The vendor was contacted early about this disclosure but did not respond in any way.,4.3,CWE-352
CVE-2022-2293,A vulnerability classified as problematic was found in SourceCodester Simple Sales Management System 1.0. Affected by this vulnerability is an unknown functionality of the file /ci_ssms/index.php/orders/create. The manipulation of the argument customer_name with the input <script>alert(XSS)</script> leads to cross site scripting. The attack can be launched remotely. The exploit has been disclosed to the public and may be used.,3.5,CWE-79
CVE-2024-0943,A vulnerability was found in Totolink N350RT 9.3.5u.6255. It has been declared as problematic. Affected by this vulnerability is an unknown functionality of the file /cgi-bin/cstecgi.cgi. The manipulation leads to session expiration. The attack can be launched remotely. The complexity of an attack is rather high. The exploitation appears to be difficult. The exploit has been disclosed to the public and may be used. The associated identifier of this vulnerability is VDB-252187. NOTE: The vendor was contacted early about this disclosure but did not respond in any way.,3.7,CWE-613
CVE-2025-24887,OpenCTI is an open-source cyber threat intelligence platform. In versions starting from 6.4.8 to before 6.4.10 the allow/deny lists can be bypassed allowing a user to change attributes that are intended to be unmodifiable by the user. It is possible to toggle the `external` flag on/off and change the own token value for a user. It is also possible to edit attributes that are not in the allow list such as `otp_qr` and `otp_activated`. If external users exist in the OpenCTI setup and the information about these users identities is sensitive the above vulnerabilities can be used to enumerate existing user accounts as a standard low privileged user. This issue has been patched in version 6.4.10.,6.3,CWE-284
CVE-2024-38115,Windows IP Routing Management Snapin Remote Code Execution Vulnerability,8.8,CWE-122
CVE-2025-21205,Heap-based buffer overflow in Windows Telephony Service allows an unauthorized attacker to execute code over a network.,8.8,CWE-122
CVE-2024-7904,A vulnerability was found in DedeBIZ 6.3.0. It has been rated as critical. Affected by this issue is some unknown functionality of the file admin/file_manage_control.php of the component File Extension Handler. The manipulation of the argument upfile1 leads to unrestricted upload. The attack may be launched remotely. The exploit has been disclosed to the public and may be used. NOTE: The vendor was contacted early about this disclosure but did not respond in any way.,6.3,CWE-434
CVE-2024-30390,An Improper Restriction of Excessive Authentication Attempts vulnerability in Juniper Networks Junos OS Evolved allows an unauthenticated network-based attacker to cause a limited Denial of Service (DoS) to the management plane.  When an incoming connection was blocked because it exceeded the connections-per-second rate-limit the system doesn't consider existing connections anymore for subsequent connection attempts so that the connection limit can be exceeded. This issue affects Junos OS Evolved:      *  All versions before 21.4R3-S4-EVO   *  22.1-EVO versions before 22.1R3-S3-EVO   *  22.2-EVO versions before 22.2R3-S2-EVO    *  22.3-EVO versions before 22.3R2-S1-EVO 22.3R3-EVO.,5.3,CWE-307
CVE-2020-35531,In LibRaw an out-of-bounds read vulnerability exists within the get_huffman_diff() function (libraw\src\x3f\x3f_utils_patched.cpp) when reading data from an image file.,5.5,CWE-125
CVE-2023-24117,Jensen of Scandinavia Eagle 1200AC V15.03.06.33_en was discovered to contain a stack overflow via the wepauth_5g parameter at /goform/WifiBasicSet.,6.5,CWE-787
CVE-2024-13656,The Click Mag - Viral WordPress News Magazine/Blog Theme theme for WordPress is vulnerable to unauthorized modification of data that can lead to a denial of service due to a missing capability check on the propanel_of_ajax_callback() function in all versions up to and including 3.6.0. This makes it possible for authenticated attackers with subscriber-level access and above to delete arbitrary option values on the WordPress site. This can be leveraged to delete an option that would create an error on the site and deny service to legitimate users.,8.1,CWE-862
CVE-2024-44281,An out-of-bounds read was addressed with improved input validation. This issue is fixed in macOS Ventura 13.7.1 macOS Sonoma 14.7.1. Parsing a file may lead to disclosure of user information.,5.5,CWE-125
CVE-2021-32157,A Cross-Site Scripting (XSS) vulnerability exists in Webmin 1.973 via the Scheduled Cron Jobs feature.,9.6,CWE-79
CVE-2024-12977,A vulnerability which was classified as critical was found in PHPGurukul Complaint Management System 1.0. This affects an unknown part of the file /admin/state.php. The manipulation of the argument state leads to sql injection. It is possible to initiate the attack remotely. The exploit has been disclosed to the public and may be used.,6.3,CWE-74
CVE-2022-2961,A use-after-free flaw was found in the Linux kernel’s PLP Rose functionality in the way a user triggers a race condition by calling bind while simultaneously triggering the rose_bind() function. This flaw allows a local user to crash or potentially escalate their privileges on the system.,7.0,CWE-416
CVE-2024-55987,Improper Neutralization of Special Elements used in an SQL Command ('SQL Injection') vulnerability in Ritesh Sanap Advanced What should we write next about allows SQL Injection.This issue affects Advanced What should we write next about: from n/a through 1.0.3.,8.5,CWE-89
CVE-2019-16638,An issue was found on the Ruijie EG-2000 series gateway. An attacker can easily dump cleartext stored passwords in /data/config.text with simple XORs. This affects EG-2000SE EG_RGOS 11.1(1)B1.,7.5,CWE-312
CVE-2023-30799,MikroTik RouterOS stable before 6.49.7 and long-term through 6.48.6 are vulnerable to a privilege escalation issue. A remote and authenticated attacker can escalate privileges from admin to super-admin on the Winbox or HTTP interface. The attacker can abuse this vulnerability to execute arbitrary code on the system.  ,9.1,CWE-269
CVE-2024-38606,In the Linux kernel the following vulnerability has been resolved:  crypto: qat - validate slices count returned by FW  The function adf_send_admin_tl_start() enables the telemetry (TL) feature on a QAT device by sending the ICP_QAT_FW_TL_START message to the firmware. This triggers the FW to start writing TL data to a DMA buffer in memory and returns an array containing the number of accelerators of each type (slices) supported by this HW. The pointer to this array is stored in the adf_tl_hw_data data structure called slice_cnt.  The array slice_cnt is then used in the function tl_print_dev_data() to report in debugfs only statistics about the supported accelerators. An incorrect value of the elements in slice_cnt might lead to an out of bounds memory read. At the moment there isn't an implementation of FW that returns a wrong value but for robustness validate the slice count array returned by FW.,7.1,CWE-125
CVE-2021-42893,In TOTOLINK EX1200T V4.1.2cu.5215 an attacker can obtain sensitive information (wifikey etc.) without authorization through getSysStatusCfg.,7.5,CWE-306
CVE-2023-28597,Zoom clients prior to 5.13.5 contain an improper trust boundary implementation vulnerability. If a victim saves a local recording to an SMB location and later opens it using a link from Zoom’s web portal an attacker positioned on an adjacent network to the victim client could set up a malicious SMB server to respond to client requests causing the client to execute attacker controlled executables. This could result in an attacker gaining access to a user's device and data and remote code execution.,8.3,CWE-501
CVE-2024-49597,Dell Wyse Management Suite versions WMS 4.4 and prior contain an Improper Restriction of Excessive Authentication Attempts vulnerability. A high privileged attacker with remote access could potentially exploit this vulnerability leading to Protection mechanism bypass.,7.6,CWE-307
CVE-2023-23771,Motorola MBTS Base Radio accepts hard-coded backdoor password. The Motorola MBTS Base Radio Man Machine Interface (MMI) allowing for service technicians to diagnose and configure the device accepts a hard-coded backdoor password that cannot be changed or disabled.,8.4,CWE-259
CVE-2024-5003,The WP Stacker WordPress plugin through 1.8.5 does not have CSRF check in some places and is missing sanitisation as well as escaping which could allow attackers to make logged in admin add Stored XSS payloads via a CSRF attack,5.4,CWE-352
CVE-2025-21160,Illustrator versions 29.1 28.7.3 and earlier are affected by an Integer Underflow (Wrap or Wraparound) vulnerability that could result in arbitrary code execution in the context of the current user. Exploitation of this issue requires user interaction in that a victim must open a malicious file.,7.8,CWE-191
CVE-2024-38456,HIGH-LEIT V05.08.01.03 and HIGH-LEIT V04.25.00.00 to 4.25.01.01 for Windows from Vivavis contain an insecure file and folder permissions vulnerability in prunsrv.exe. A regular user (non-admin) can exploit the weak folder and file permissions to escalate privileges and execute arbitrary code in the context of NT AUTHORITY\SYSTEM.,7.8,CWE-732
CVE-2022-20804,A vulnerability in the Cisco Discovery Protocol of Cisco Unified Communications Manager (Unified CM) and Cisco Unified Communications Manager Session Management Edition (Unified CM SME) could allow an unauthenticated adjacent attacker to cause a kernel panic on an affected system resulting in a denial of service (DoS) condition. This vulnerability is due to incorrect processing of certain Cisco Discovery Protocol packets. An attacker could exploit this vulnerability by continuously sending certain Cisco Discovery Protocol packets to an affected device. A successful exploit could allow the attacker to cause a kernel panic on the system that is running the affected software resulting in a DoS condition.,5.3,CWE-754
CVE-2024-49059,Microsoft Office Elevation of Privilege Vulnerability,7.0,CWE-59
CVE-2024-25417,flusity-CMS v2.33 was discovered to contain a Cross-Site Request Forgery (CSRF) via the component /core/tools/add_translation.php.,8.8,CWE-352
CVE-2023-48827,Time Slots Booking Calendar 4.0 is vulnerable to Multiple HTML Injection issues via the name plugin_sms_api_key plugin_sms_country_code calendar_id title country name or customer_name parameter.,5.4,CWE-79
CVE-2023-48811,In TOTOLINK X6000R V9.4.0cu.852_B20230719 the shttpd file sub_4119A0 function obtains fields from the front-end through Uci_ Set_ The Str function that when passed to the CsteSystem function creates a command execution vulnerability.,9.8,CWE-78
CVE-2025-3960,A vulnerability was found in withstars Books-Management-System 1.0. It has been rated as critical. Affected by this issue is some unknown functionality of the file /allreaders.html of the component Background Interface. The manipulation leads to missing authorization. The attack may be launched remotely. The exploit has been disclosed to the public and may be used. This vulnerability only affects products that are no longer supported by the maintainer.,7.3,CWE-862
CVE-2021-43090,An XML External Entity (XXE) vulnerability exists in soa-model before 1.6.4 in the WSDLParser function.,9.8,CWE-611
CVE-2020-21325,An issue in WUZHI CMS v.4.1.0 allows a remote attacker to execute arbitrary code via the set_chache method of the function\common.func.php file.,8.8,CWE-434
CVE-2024-33549,Improper Privilege Management vulnerability in AA-Team WZone allows Privilege Escalation.This issue affects WZone: from n/a through 14.0.10.,8.8,CWE-269
CVE-2022-42074,Online Diagnostic Lab Management System v1.0 is vulnerable to SQL Injection via /diagnostic/editcategory.php?id=.,7.2,CWE-89
CVE-2024-41355,phpipam 1.6 is vulnerable to Cross Site Scripting (XSS) via /app/tools/request-ip/index.php.,6.5,CWE-79
CVE-2025-24451,Substance3D - Painter versions 10.1.2 and earlier are affected by an out-of-bounds write vulnerability that could result in arbitrary code execution in the context of the current user. Exploitation of this issue requires user interaction in that a victim must open a malicious file.,7.8,CWE-787
CVE-2024-27334,Kofax Power PDF JPG File Parsing Out-Of-Bounds Read Information Disclosure Vulnerability. This vulnerability allows remote attackers to disclose sensitive information on affected installations of Kofax Power PDF. User interaction is required to exploit this vulnerability in that the target must visit a malicious page or open a malicious file.  The specific flaw exists within the parsing of JPG files. The issue results from the lack of proper validation of user-supplied data which can result in a read past the end of an allocated object. An attacker can leverage this in conjunction with other vulnerabilities to execute arbitrary code in the context of the current process. Was ZDI-CAN-21978.,3.3,CWE-125
CVE-2024-33559,Improper Neutralization of Special Elements used in an SQL Command ('SQL Injection') vulnerability in 8theme XStore allows SQL Injection.This issue affects XStore: from n/a through 9.3.5.  ,9.3,CWE-89
CVE-2023-1000,A vulnerability was found in cyanomiko dcnnt-py up to 0.9.0. It has been classified as critical. Affected is the function main of the file dcnnt/plugins/notifications.py of the component Notification Handler. The manipulation leads to command injection. It is possible to launch the attack remotely. Upgrading to version 0.9.1 is able to address this issue. The patch is identified as b4021d784a97e25151a5353aa763a741e9a148f5. It is recommended to upgrade the affected component. VDB-262230 is the identifier assigned to this vulnerability.,6.3,CWE-77
CVE-2025-47937,TYPO3 is an open source PHP based web content management system. Starting in version 9.0.0 and prior to versions 9.5.51 ELTS 10.4.50 ELTS 11.5.44 ELTS 12.4.31 LTS and 13.4.12 LTS when performing a database query involving multiple tables through the database abstraction layer (DBAL) frontend user permissions are only applied via `FrontendGroupRestriction` to the first table. As a result data from additional tables included in the same query may be unintentionally exposed to unauthorized users. Users should update to TYPO3 version 9.5.51 ELTS 10.4.50 ELTS 11.5.44 ELTS 12.4.31 LTS or 13.4.12 LTS to fix the problem.,3.7,CWE-863
CVE-2021-40025,The eID module has a vulnerability that causes the memory to be used without being initializedSuccessful exploitation of this vulnerability may affect data confidentiality.,7.5,CWE-665
CVE-2024-9244,Foxit PDF Reader Update Service Incorrect Permission Assignment Local Privilege Escalation Vulnerability. This vulnerability allows local attackers to escalate privileges on affected installations of Foxit PDF Reader. An attacker must first obtain the ability to execute low-privileged code on the target system in order to exploit this vulnerability.  The specific flaw exists within the handling of the configuration files used by the Foxit Reader Update Service. The issue results from incorrect permissions set on a resource used by the service. An attacker can leverage this vulnerability to escalate privileges and execute code in the context of SYSTEM. Was ZDI-CAN-23933.,7.8,CWE-732
CVE-2021-45966,An issue was discovered in Pascom Cloud Phone System before 7.20.x. In the management REST API /services/apply in exd.pl allows remote attackers to execute arbitrary code via shell metacharacters.,9.8,CWE-78
CVE-2025-30690,Vulnerability in the Oracle Solaris product of Oracle Systems (component: Filesystem).   The supported version that is affected is 11. Difficult to exploit vulnerability allows high privileged attacker with logon to the infrastructure where Oracle Solaris executes to compromise Oracle Solaris.  Successful attacks require human interaction from a person other than the attacker and while the vulnerability is in Oracle Solaris attacks may significantly impact additional products (scope change). Successful attacks of this vulnerability can result in takeover of Oracle Solaris. CVSS 3.1 Base Score 7.2 (Confidentiality Integrity and Availability impacts).  CVSS Vector: (CVSS:3.1/AV:L/AC:H/PR:H/UI:R/S:C/C:H/I:H/A:H).,7.2,CWE-284
CVE-2023-31310,Improper input validation in Power Management Firmware (PMFW) may allow an attacker with privileges to send a malformed input for the set temperature input selection command potentially resulting in a loss of integrity and/or availability.,5.0,CWE-1284
CVE-2024-55891,TYPO3 is a free and open source Content Management Framework. It has been discovered that the install tool password has been logged as plaintext in case the password hashing mechanism used for the password was incorrect. Users are advised to update to TYPO3 versions 13.4.3 ELTS which fixes the problem described. There are no known workarounds for this vulnerability.,3.1,CWE-532
CVE-2024-6515,Web browser interface may manipulate application username/password in clear text or Base64 encoding providing a higher probability of  unintended credentails exposure.  Affected products:   ABB ASPECT - Enterprise v3.08.02;  NEXUS Series v3.08.02;  MATRIX Series v3.08.02,9.6,CWE-319
CVE-2024-56732,HarfBuzz is a text shaping engine. Starting with 8.5.0 through 10.0.1 there is a heap-based buffer overflow in the hb_cairo_glyphs_from_buffer function.,8.8,CWE-122
CVE-2025-23630,Improper Neutralization of Input During Web Page Generation ('Cross-site Scripting') vulnerability in NotFound Cyber Slider allows Reflected XSS. This issue affects Cyber Slider: from n/a through 1.1.,7.1,CWE-79
CVE-2024-6240,Improper privilege management vulnerability in Parallels Desktop Software which affects versions earlier than 19.3.0. An attacker could add malicious code in a script and populate the BASH_ENV environment variable with the path to the malicious script executing on application startup. An attacker could exploit this vulnerability to escalate privileges on the system.,7.7,CWE-269
CVE-2024-35643,Cross Site Scripting (XSS) vulnerability in Xabier Miranda WP Back Button allows Stored XSS.This issue affects WP Back Button: from n/a through 1.1.3.,5.9,CWE-79
CVE-2024-40723,The specific API in HWATAIServiSign Windows Version from CHANGING Information Technology does not properly validate the length of server-side inputs. When a user visits a spoofed website unauthenticated remote attackers can cause a stack-based buffer overflow in the HWATAIServiSign temporarily disrupting its service.,4.3,CWE-121
CVE-2024-4389,The Slider and Carousel slider by Depicter plugin for WordPress is vulnerable to arbitrary file uploads due to missing file type validation in the uploadFile function in all versions up to and including 3.1.1. This makes it possible for authenticated attackers with contributor access or higher to upload arbitrary files on the affected site's server which may make remote code execution possible.,8.8,CWE-434
CVE-2025-27263,Improper Neutralization of Special Elements used in an SQL Command ('SQL Injection') vulnerability in NotFound Doctor Appointment Booking allows SQL Injection. This issue affects Doctor Appointment Booking: from n/a through 1.0.0.,8.5,CWE-89
CVE-2024-13440,The Super Store Finder plugin for WordPress is vulnerable to SQL Injection via the ‘ssf_wp_user_name’ parameter in all versions up to and including 7.0 due to insufficient escaping on the user supplied parameter and lack of sufficient preparation on the existing SQL query.  This makes it possible for unauthenticated attackers to append additional SQL queries into an already existing query to store cross-site scripting in store reviews.,8.2,CWE-89
