CVE,Description,CVSS3_BaseScore,CWE
CVE-2025-30287,ColdFusion versions 2023.12 2021.18 2025.0 and earlier are affected by an Improper Authentication vulnerability that could result in arbitrary code execution in the context of the current user. A low privileged attacker with local access could leverage this vulnerability to bypass security protections and execute code. Exploitation of this issue requires user interaction in that a victim must be coerced into performing actions within the application and scope is changed.,8.2,CWE-287
CVE-2025-26984,Improper Neutralization of Input During Web Page Generation ('Cross-site Scripting') vulnerability in Cozy Vision SMS Alert Order Notifications – WooCommerce allows Reflected XSS. This issue affects SMS Alert Order Notifications – WooCommerce: from n/a through 3.7.8.,7.1,CWE-79
CVE-2024-9265,The Echo RSS Feed Post Generator plugin for WordPress is vulnerable to privilege escalation in all versions up to and including 5.4.6. This is due to the plugin not properly restricting the roles that can set during registration through the echo_check_post_header_sent() function. This makes it possible for unauthenticated attackers to register as an administrator.,9.8,CWE-269
CVE-2023-22700,Cross-Site Request Forgery (CSRF) vulnerability in PixelYourSite PixelYourSite – Your smart PIXEL (TAG) Manager plugin <= 9.3.0 versions.,4.3,CWE-352
CVE-2021-31681,Deserialization of Untrusted Data vulnerability in yolo 3 allows attackers to execute arbitrary code via crafted yaml file.,7.8,CWE-502
CVE-2021-44856,An issue was discovered in MediaWiki before 1.35.5 1.36.x before 1.36.3 and 1.37.x before 1.37.1. A title blocked by AbuseFilter can be created via Special:ChangeContentModel due to the mishandling of the EditFilterMergedContent hook return value.,5.3,CWE-754
CVE-2021-47185,In the Linux kernel the following vulnerability has been resolved:  tty: tty_buffer: Fix the softlockup issue in flush_to_ldisc  When running ltp testcase(ltp/testcases/kernel/pty/pty04.c) with arm64 there is a soft lockup which look like this one:    Workqueue: events_unbound flush_to_ldisc   Call trace:    dump_backtrace+0x0/0x1ec    show_stack+0x24/0x30    dump_stack+0xd0/0x128    panic+0x15c/0x374    watchdog_timer_fn+0x2b8/0x304    __run_hrtimer+0x88/0x2c0    __hrtimer_run_queues+0xa4/0x120    hrtimer_interrupt+0xfc/0x270    arch_timer_handler_phys+0x40/0x50    handle_percpu_devid_irq+0x94/0x220    __handle_domain_irq+0x88/0xf0    gic_handle_irq+0x84/0xfc    el1_irq+0xc8/0x180    slip_unesc+0x80/0x214 [slip]    tty_ldisc_receive_buf+0x64/0x80    tty_port_default_receive_buf+0x50/0x90    flush_to_ldisc+0xbc/0x110    process_one_work+0x1d4/0x4b0    worker_thread+0x180/0x430    kthread+0x11c/0x120  In the testcase pty04 The first process call the write syscall to send data to the pty master. At the same time the workqueue will do the flush_to_ldisc to pop data in a loop until there is no more data left. When the sender and workqueue running in different core the sender sends data fastly in full time which will result in workqueue doing work in loop for a long time and occuring softlockup in flush_to_ldisc with kernel configured without preempt. So I add need_resched check and cond_resched in the flush_to_ldisc loop to avoid it.,4.4,CWE-667
CVE-2024-2248,A Header Injection vulnerability in the JFrog platform in versions below 7.85.0 (SaaS) and 7.84.7 (Self-Hosted) may allow threat actors to take over the end user's account when clicking on a specially crafted URL sent to the victim’s user email.,6.4,CWE-20
CVE-2023-40607,Cross-Site Request Forgery (CSRF) vulnerability in CLUEVO CLUEVO LMS E-Learning Platform plugin <= 1.10.0 versions.,4.3,CWE-352
CVE-2023-37413,IBM Aspera Faspex 5.0.0 through 5.0.10 could disclose sensitive username information due to an observable response discrepancy.,5.3,CWE-204
CVE-2025-4134,Lack of file validation in do_update_vps in Avast Business Antivirus for Linux 4.5 on Linux allows local user to spoof or tamper with the update file via an unverified file write.,7.3,CWE-552
CVE-2025-3793,The Buddypress Force Password Change plugin for WordPress is vulnerable to authenticated account takeover due to the plugin not properly validating a user's identity prior to updating their password through the 'bp_force_password_ajax' function in all versions up to and including 0.1. This makes it possible for authenticated attackers with subscriber-level access and above and under certain prerequisites to change arbitrary user's passwords including administrators and leverage that to gain access to their accounts.,4.2,CWE-620
CVE-2022-44796,An issue was discovered in Object First Ootbi BETA build 1.0.7.712. The authorization service has a flow that allows getting access to the Web UI without knowing credentials. For signing the JWT token uses a secret key that is generated through a function that doesn't produce cryptographically strong sequences. An attacker can predict these sequences and generate a JWT token. As a result an attacker can get access to the Web UI. This is fixed in Object First Ootbi BETA build 1.0.13.1611.,9.8,CWE-338
CVE-2025-21967,In the Linux kernel the following vulnerability has been resolved:  ksmbd: fix use-after-free in ksmbd_free_work_struct  ->interim_entry of ksmbd_work could be deleted after oplock is freed. We don't need to manage it with linked list. The interim request could be immediately sent whenever a oplock break wait is needed.,7.8,CWE-416
CVE-2022-27213,Jenkins Environment Dashboard Plugin 1.1.10 and earlier does not escape the Environment order and the Component order configuration values in its views resulting in a stored cross-site scripting (XSS) vulnerability exploitable by attackers with View/Configure permission.,5.4,CWE-79
CVE-2023-5925,A vulnerability which was classified as critical has been found in Campcodes Simple Student Information System 1.0. This issue affects some unknown processing of the file /classes/Master.php. The manipulation of the argument f leads to sql injection. The exploit has been disclosed to the public and may be used. The identifier VDB-244325 was assigned to this vulnerability.,5.5,CWE-89
CVE-2023-26830,An unrestricted file upload vulnerability in the administrative portal branding component of Gladinet CentreStack before 13.5.9808 allows authenticated attackers to execute arbitrary code by uploading malicious files to the server.,7.2,CWE-434
CVE-2017-20029,A vulnerability was found in PHPList 3.2.6 and classified as critical. This issue affects some unknown processing of the file /lists/index.php of the component Edit Subscription. The manipulation leads to sql injection. The attack may be initiated remotely. The exploit has been disclosed to the public and may be used. Upgrading to version 3.3.1 is able to address this issue. It is recommended to upgrade the affected component.,7.3,CWE-89
CVE-2025-5445,A vulnerability was found in Linksys RE6500 RE6250 RE6300 RE6350 RE7000 and RE9000 1.0.013.001/1.0.04.001/1.0.04.002/1.1.05.003/1.2.07.001 and classified as critical. Affected by this issue is the function RP_checkFWByBBS of the file /goform/RP_checkFWByBBS. The manipulation of the argument type/ch/ssidhex/security/extch/pwd/mode/ip/nm/gw leads to os command injection. The attack may be launched remotely. The exploit has been disclosed to the public and may be used. The vendor was contacted early about this disclosure but did not respond in any way.,6.3,CWE-77
CVE-2022-30736,Improper privilege management vulnerability in Samsung Account prior to 13.2.00.6 allows attackers to get the data of contact and gallery without permission.,5.3,CWE-200
CVE-2022-30205,Windows Group Policy Elevation of Privilege Vulnerability,6.6,CWE-362
CVE-2024-8045,The Advanced WordPress Backgrounds plugin for WordPress is vulnerable to Stored Cross-Site Scripting via the ‘imageTag’ parameter in all versions up to and including 1.12.3 due to insufficient input sanitization and output escaping. This makes it possible for authenticated attackers with Contributor-level access and above to inject arbitrary web scripts in pages that will execute whenever a user accesses an injected page.,6.4,CWE-79
CVE-2022-3525,Deserialization of Untrusted Data in GitHub repository librenms/librenms prior to 22.10.0.,8.8,CWE-502
CVE-2021-42535,VISAM VBASE version 11.6.0.6 does not neutralize or incorrectly neutralizes user-controllable input before the data is placed in output used as a public-facing webpage.,5.3,CWE-79
CVE-2021-33159,Improper authentication in subsystem for Intel(R) AMT before versions 11.8.93 11.22.93 11.12.93 12.0.92 14.1.67 15.0.42 16.1.25 may allow a privileged user to potentially enable escalation of privilege via local access.,7.4,CWE-287
CVE-2024-31986,XWiki Platform is a generic wiki platform. Starting in version 3.1 and prior to versions 4.10.19 15.5.4 and 15.10-rc-1 by creating a document with a special crafted documented reference and an `XWiki.SchedulerJobClass` XObject it is possible to execute arbitrary code on the server whenever an admin visits the scheduler page or the scheduler page is referenced e.g. via an image in a comment on a page in the wiki. The vulnerability has been fixed in XWiki 14.10.19 15.5.5 and 15.9. As a workaround apply the patch manually by modifying the `Scheduler.WebHome` page.,9.0,CWE-95
CVE-2025-2056,The WP Ghost (Hide My WP Ghost) – Security & Firewall plugin for WordPress is vulnerable to Path Traversal in all versions up to and including 5.4.01 via the showFile function. This makes it possible for unauthenticated attackers to read the contents of specific file types on the server which can contain sensitive information.,7.5,CWE-23
CVE-2023-35123,Uncaught exception in OpenBMC Firmware for some Intel(R) Server Platforms before versions egs-1.14-0 bhs-0.27 may allow an authenticated user to potentially enable denial of service via network access.,4.3,CWE-600
CVE-2025-0393,The Royal Elementor Addons and Templates plugin for WordPress is vulnerable to Cross-Site Request Forgery in all versions up to and including 1.7.1006. This is due to missing or incorrect nonce validation on the wpr_filter_grid_posts() function. This makes it possible for unauthenticated attackers to inject malicious web scripts via a forged request granted they can trick a site administrator into performing an action such as clicking on a link.,6.1,CWE-352
CVE-2025-28031,TOTOLINK A810R V4.1.2cu.5182_B20201026 was discovered to contain a hardcoded password for the telnet service in product.ini.,6.5,CWE-259
CVE-2024-51187,TRENDnet TEW-651BR 2.04B1 TEW-652BRP 3.04b01 and TEW-652BRU 1.00b12 devices contain a Store Cross-site scripting (XSS) vulnerability via the firewallRule_Name_1.1.1.0.0 parameter on the /firewall_setting.htm page.,4.8,CWE-79
CVE-2023-0639,A vulnerability was found in TRENDnet TEW-652BRP 3.04b01 and classified as problematic. This issue affects some unknown processing of the file get_set.ccp of the component Web Management Interface. The manipulation of the argument nextPage leads to cross site scripting. The attack may be initiated remotely. The associated identifier of this vulnerability is VDB-220019.,2.4,CWE-79
CVE-2023-29153,Uncontrolled resource consumption for some Intel(R) SPS firmware before version SPS_E5_06.01.04.002.0 may allow a privileged user to potentially enable denial of service via network access.,4.9,CWE-400
CVE-2023-5023,A vulnerability was found in Tongda OA 2017 and classified as critical. Affected by this issue is some unknown functionality of the file general/hr/manage/staff_relatives/delete.php. The manipulation of the argument RELATIVES_ID leads to sql injection. The exploit has been disclosed to the public and may be used. The identifier of this vulnerability is VDB-239864.,5.5,CWE-89
CVE-2023-51840,DoraCMS 2.1.8 is vulnerable to Use of Hard-coded Cryptographic Key.,9.8,CWE-798
CVE-2020-36618,A vulnerability classified as critical has been found in Furqan node-whois. Affected is an unknown function of the file index.coffee. The manipulation leads to improperly controlled modification of object prototype attributes ('prototype pollution'). It is possible to launch the attack remotely. The name of the patch is 46ccc2aee8d063c7b6b4dee2c2834113b7286076. It is recommended to apply a patch to fix this issue. The identifier of this vulnerability is VDB-216252.,6.3,CWE-74
CVE-2023-28628,lambdaisland/uri is a pure Clojure/ClojureScript URI library. In versions prior to 1.14.120 `authority-regex` allows an attacker to send malicious URLs to be parsed by the `lambdaisland/uri` and return the wrong authority. This issue is similar to but distinct from CVE-2020-8910. The regex in question doesn't handle the backslash (`\`) character in the username correctly leading to a wrong output. ex. a payload of `https://example.com\\@google.com` would return that the host is `google.com` but the correct host should be `example.com`. Given that the library returns the wrong authority this may be abused to bypass host restrictions depending on how the library is used in an application. Users are advised to upgrade. There are no known workarounds for this vulnerability.,5.4,CWE-706
CVE-2025-31090,Improper Neutralization of Input During Web Page Generation ('Cross-site Scripting') vulnerability in alordiel Dropdown Multisite selector allows Stored XSS. This issue affects Dropdown Multisite selector: from n/a through n/a.,6.5,CWE-79
CVE-2024-48818,An issue in IIT Bombay Mumbai India Bodhitree of cs101 version allows a remote attacker to execute arbitrary code.,9.8,CWE-94
CVE-2022-41666,A CWE-347: Improper Verification of Cryptographic Signature vulnerability exists that allows adversaries with local user privileges to load a malicious DLL which could lead to execution of malicious code. Affected Products: EcoStruxure Operator Terminal Expert(V3.3 Hotfix 1 or prior) Pro-face BLUE(V3.3 Hotfix1 or prior).,7.0,CWE-347
CVE-2023-33222,         When handling contactless cards usage of a specific function to get additional information from the card which doesn't  check the boundary on the data received while reading. This allows a stack-based buffer overflow that could lead to a  potential Remote Code Execution on the targeted device        ,6.8,CWE-121
CVE-2024-4493,A vulnerability which was classified as critical was found in Tenda i21 1.0.0.14(4656). Affected is the function formSetAutoPing. The manipulation of the argument ping1/ping2 leads to stack-based buffer overflow. It is possible to launch the attack remotely. The exploit has been disclosed to the public and may be used. VDB-263082 is the identifier assigned to this vulnerability. NOTE: The vendor was contacted early about this disclosure but did not respond in any way.,8.8,CWE-121
CVE-2025-1039,The Lenix Elementor Leads addon plugin for WordPress is vulnerable to Stored Cross-Site Scripting via a URL form field in all versions up to and including 1.8.2 due to insufficient input sanitization and output escaping. This makes it possible for unauthenticated attackers to inject arbitrary web scripts in pages that will execute whenever a user accesses an injected page.,7.2,CWE-79
CVE-2023-31177,An Improper Neutralization of Input During Web Page Generation  ('Cross-site Scripting') in the Schweitzer Engineering Laboratories SEL-451 could allow an attacker to craft a link that could execute arbitrary code on a victim's system.    See product Instruction Manual Appendix A dated 20230830 for more details.   ,4.3,CWE-79
CVE-2023-22599, InHand Networks InRouter 302 prior to version IR302 V3.5.56 and InRouter 615 prior to version InRouter6XX-S-V2.3.0.r5542 contain vulnerability CWE-760: Use of a One-way Hash with a Predictable Salt. They   send MQTT credentials in response to HTTP/HTTPS requests from the cloud platform. These credentials are encoded using a hardcoded string into an MD5 hash. This string could be easily calculated by an unauthorized user who spoofed sending an HTTP/HTTPS request to the devices. This could result in the affected devices being temporarily disconnected from the cloud platform and allow the user to receive MQTT commands with potentially sensitive information.            ,7.0,CWE-760
CVE-2024-32893,In _s5e9865_mif_set_rate of exynos_dvfs.c there is a possible out of bounds read due to improper casting. This could lead to local information disclosure with no additional execution privileges needed. User interaction is not needed for exploitation.,5.5,CWE-125
CVE-2025-0487,A vulnerability was found in Fanli2012 native-php-cms 1.0. It has been rated as critical. Affected by this issue is some unknown functionality of the file /fladmin/cat_edit.php. The manipulation of the argument id leads to sql injection. The attack may be launched remotely. The exploit has been disclosed to the public and may be used.,6.3,CWE-74
CVE-2024-30158,A vulnerability in the web conferencing component of Mitel MiCollab through 9.7.1.110 could allow an authenticated attacker with administrative privileges to conduct a SQL Injection attack due to insufficient validation of user input. A successful exploit could allow an attacker to execute arbitrary database and management operations.,7.2,CWE-89
CVE-2025-47466,Cross-Site Request Forgery (CSRF) vulnerability in Rustaurius Ultimate WP Mail allows Cross Site Request Forgery. This issue affects Ultimate WP Mail: from n/a through 1.3.4.,5.4,CWE-352
CVE-2024-27235,In plugin_extern_func of  there is a possible out of bounds read due to a missing bounds check. This could lead to local information disclosure with no additional execution privileges needed. User interaction is not needed for exploitation.,5.5,CWE-125
CVE-2023-28855,Fields is a GLPI plugin that allows users to add custom fields on GLPI items forms. Prior to versions 1.13.1 and 1.20.4 lack of access control check allows any authenticated user to write data to any fields container including those to which they have no configured access. Versions 1.13.1 and 1.20.4 contain a patch for this issue.,6.5,CWE-269
CVE-2023-38248,Adobe Acrobat Reader versions 23.003.20244 (and earlier) and 20.005.30467 (and earlier) are affected by an out-of-bounds read vulnerability that could lead to disclosure of sensitive memory. An attacker could leverage this vulnerability to bypass mitigations such as ASLR. Exploitation of this issue requires user interaction in that a victim must open a malicious file.,5.5,CWE-125
CVE-2024-43599,Remote Desktop Client Remote Code Execution Vulnerability,8.8,CWE-416
CVE-2023-1683,A vulnerability was found in Xunrui CMS 4.61 and classified as problematic. Affected by this issue is some unknown functionality of the file /dayrui/Fcms/View/system_log.html. The manipulation leads to information disclosure. The attack may be launched remotely. The exploit has been disclosed to the public and may be used. The identifier of this vulnerability is VDB-224240.,4.3,CWE-200
CVE-2022-30732,Exposure of Sensitive Information vulnerability in Samsung Account prior to version 13.2.00.6 allows attacker to access sensitive information via onActivityResult.,5.5,CWE-200
CVE-2023-32093,Cross-Site Request Forgery (CSRF) vulnerability in Criss Swaim TPG Redirect plugin <= 1.0.7 versions.,8.8,CWE-352
CVE-2023-24977,Out-of-bounds Read vulnerability in Apache Software Foundation Apache InLong.This issue affects Apache InLong: from 1.1.0 through 1.5.0. Users are advised to upgrade to Apache InLong's latest version or cherry-pick  https://github.com/apache/inlong/pull/7214 https://github.com/apache/inlong/pull/7214  to solve it.  ,7.5,CWE-125
CVE-2022-20213,In ApplicationsDetailsActivity of AndroidManifest.xml there is a possible DoS due to a tapjacking/overlay attack. This could lead to local denial of service with no additional execution privileges needed. User interaction is needed for exploitation.Product: AndroidVersions: Android-10 Android-11 Android-12Android ID: A-183410508,5.5,CWE-1021
CVE-2023-33515,SoftExpert Excellence Suite 2.1.9 is vulnerable to Cross Site Scripting (XSS) via query screens.,5.4,CWE-79
CVE-2025-26943,Improper Neutralization of Special Elements used in an SQL Command ('SQL Injection') vulnerability in Jürgen Müller Easy Quotes allows Blind SQL Injection. This issue affects Easy Quotes: from n/a through 1.2.2.,9.3,CWE-89
CVE-2023-43642,snappy-java is a Java port of the snappy a fast C++ compresser/decompresser developed by Google. The SnappyInputStream was found to be vulnerable to Denial of Service (DoS) attacks when decompressing data with a too large chunk size. Due to missing upper bound check on chunk length an unrecoverable fatal error can occur. All versions of snappy-java including the latest released version 1.1.10.3 are vulnerable to this issue. A fix has been introduced in commit `9f8c3cf74` which will be included in the 1.1.10.4 release. Users are advised to upgrade. Users unable to upgrade should only accept compressed data from trusted sources.,7.5,CWE-770
CVE-2023-4179,A vulnerability classified as critical has been found in SourceCodester Free Hospital Management System for Small Practices 1.0. Affected is an unknown function of the file /vm/doctor/doctors.php?action=view. The manipulation of the argument id leads to sql injection. It is possible to launch the attack remotely. The exploit has been disclosed to the public and may be used. VDB-236214 is the identifier assigned to this vulnerability.,6.3,CWE-89
CVE-2022-3339,A reflected cross-site scripting (XSS) vulnerability in ePO prior to 5.10 Update 14 allows a remote unauthenticated attacker to potentially obtain access to an ePO administrator's session by convincing the authenticated ePO administrator to click on a carefully crafted link. This would lead to limited access to sensitive information and limited ability to alter some information in ePO.,5.4,CWE-79
CVE-2025-22711,Improper Neutralization of Input During Web Page Generation ('Cross-site Scripting') vulnerability in Thomas Maier Image Source Control allows Reflected XSS. This issue affects Image Source Control: from n/a through 2.29.0.,7.1,CWE-79
CVE-2023-29120,Waybox Enel X web management application could be used to execute arbitrary OS commands and provide administrator’s privileges over the Waybox system.,9.6,CWE-78
CVE-2024-45388,Hoverfly is a lightweight service virtualization/ API simulation / API mocking tool for developers and testers. The `/api/v2/simulation` POST handler allows users to create new simulation views from the contents of a user-specified file. This feature can be abused by an attacker to read arbitrary files from the Hoverfly server. Note that although the code prevents absolute paths from being specified an attacker can escape out of the `hf.Cfg.ResponsesBodyFilesPath` base path by using `../` segments and reach any arbitrary files. This issue was found using the Uncontrolled data used in path expression CodeQL query for python. Users are advised to make sure the final path (`filepath.Join(hf.Cfg.ResponsesBodyFilesPath filePath)`) is contained within the expected base path (`filepath.Join(hf.Cfg.ResponsesBodyFilesPath /)`). This issue is also tracked as GHSL-2023-274.,7.5,CWE-200
CVE-2023-21500,Double free validation vulnerability in setPinPadImages in mPOS TUI trustlet prior to SMR May-2023 Release 1 allows local attackers to access the trustlet memory.,6.0,CWE-415
CVE-2023-37950,A missing permission check in Jenkins mabl Plugin 0.0.46 and earlier allows attackers with Overall/Read permission to enumerate credentials IDs of credentials stored in Jenkins.,4.3,CWE-862
CVE-2023-33328,Auth. (admin+) Stored Cross-Site Scripting (XSS) vulnerability in PluginOps MailChimp Subscribe Form plugin <= 4.0.9.1 versions.,5.9,CWE-79
CVE-2023-39525,PrestaShop is an open source e-commerce web application. Prior to version 8.1.1 in the back office files can be compromised using path traversal by replaying the import file deletion query with a specified file path that uses the traversal path. Version 8.1.1 contains a patch for this issue. There are no known workarounds.,6.5,CWE-22
CVE-2023-42040,PDF-XChange Editor mailForm Use-After-Free Code Execution Vulnerability. This vulnerability allows remote attackers to execute arbitrary code on affected installations of PDF-XChange Editor. User interaction is required to exploit this vulnerability in that the target must visit a malicious page or open a malicious file.  The specific flaw exists within the mailForm method. The issue results from the lack of validating the existence of an object prior to performing operations on the object. An attacker can leverage this vulnerability to execute code in the context of the current process. Was ZDI-CAN-20663.,7.8,CWE-416
CVE-2023-50222,Inductive Automation Ignition ResponseParser Notification Deserialization of Untrusted Data Remote Code Execution Vulnerability. This vulnerability allows remote attackers to execute arbitrary code on affected installations of Inductive Automation Ignition. User interaction is required to exploit this vulnerability in that the target must connect to a malicious server.  The specific flaw exists within the ResponseParser method. The issue results from the lack of proper validation of user-supplied data which can result in deserialization of untrusted data. An attacker can leverage this vulnerability to execute code in the context of the current user. Was ZDI-CAN-22067.,8.8,CWE-502
CVE-2023-29985,Sourcecodester Student Study Center Desk Management System v1.0 admin\reports\index.php#date_from has a SQL Injection vulnerability.,9.8,CWE-89
CVE-2023-48801,In TOTOLINK X6000R_Firmware V9.4.0cu.852_B20230719 the shttpd file sub_415534 function obtains fields from the front-end connects them through the snprintf function and passes them to the CsteSystem function resulting in a command execution vulnerability.,9.8,CWE-77
