CVE,Description,CVSS3_BaseScore,CWE
CVE-2023-40026,Argo CD is a declarative continuous deployment framework for Kubernetes. In Argo CD versions prior to 2.3 (starting at least in v0.1.0 but likely in any version using Helm before 2.3) using a specifically-crafted Helm file could reference external Helm charts handled by the same repo-server to leak values or files from the referenced Helm Chart. This was possible because Helm paths were predictable. The vulnerability worked by adding a Helm chart that referenced Helm resources from predictable paths. Because the paths of Helm charts were predictable and available on an instance of repo-server it was possible to reference and then render the values and resources from other existing Helm charts regardless of permissions. While generally secrets are not stored in these files it was nevertheless possible to reference any values from these charts. This issue was fixed in Argo CD 2.3 and subsequent versions by randomizing Helm paths. User's still using Argo CD 2.3 or below are advised to update to a supported version. If this is not possible disabling Helm chart rendering or using an additional repo-server for each Helm chart would prevent possible exploitation.,5.0,CWE-22
CVE-2026-1895,A flaw has been found in WeKan up to 8.20. Affected is the function applyWipLimit of the file models/lists.js of the component Attachment Storage Handler. Executing a manipulation can lead to improper access controls. The attack can be executed remotely. Upgrading to version 8.21 is able to address this issue. This patch is called 8c0b4f79d8582932528ec2fdf2a4487c86770fb9. It is recommended to upgrade the affected component.,6.3,CWE-266
CVE-2022-45076,Cross-Site Request Forgery (CSRF) vulnerability in WebMat Flexible Elementor Panel plugin <= 2.3.8 versions.,4.3,CWE-352
CVE-2023-40843,Tenda AC6 US_AC6V1.0BR_V15.03.05.16_multi_TD01.bin is vulnerable to Buffer Overflow via function sub_73004.,9.8,CWE-787
CVE-2022-27197,Jenkins Dashboard View Plugin 2.18 and earlier does not perform URL validation for the Iframe Portlet's Iframe source URL resulting in a stored cross-site scripting (XSS) vulnerability exploitable by attackers able to configure views.,5.4,CWE-79
CVE-2023-39163,Improper Limitation of a Pathname to a Restricted Directory ('Path Traversal') vulnerability in Averta Phlox Shop allows PHP Local File Inclusion.This issue affects Phlox Shop: from n/a through 2.0.0.,8.6,CWE-22
CVE-2023-1464,A vulnerability which was classified as critical was found in SourceCodester Medicine Tracker System 1.0. This affects an unknown part of the file Users.php?f=save_user. The manipulation of the argument firstname/middlename/lastname/username/password leads to improper authentication. It is possible to initiate the attack remotely. The associated identifier of this vulnerability is VDB-223311.,7.3,CWE-287
CVE-2025-32019,Harbor is an open source trusted cloud native registry project that stores signs and scans content. Versions 2.11.2 and below as well as versions 2.12.0-rc1 and 2.13.0-rc1 contain a vulnerability where the markdown field in the info tab page can be exploited to inject XSS code. This is fixed in versions 2.11.3 and 2.12.3.,4.1,CWE-79
CVE-2023-45383,In the module SoNice etiquetage (sonice_etiquetage) up to version 2.5.9 from Common-Services for PrestaShop a guest can download personal information without restriction by performing a path traversal attack. Due to a lack of permissions control and a lack of control in the path name construction a guest can perform a path traversal to view all files on the information system.,7.5,CWE-22
CVE-2023-28467,In MyBB before 1.8.34 there is XSS in the User CP module via the user email field.,6.1,CWE-79
CVE-2025-32647,Deserialization of Untrusted Data vulnerability in PickPlugins Question Answer allows Object Injection. This issue affects Question Answer: from n/a through 1.2.70.,8.8,CWE-502
CVE-2023-5302,A vulnerability which was classified as problematic has been found in SourceCodester Best Courier Management System 1.0. This issue affects some unknown processing of the component Manage Account Page. The manipulation of the argument First Name leads to cross site scripting. The attack may be initiated remotely. The exploit has been disclosed to the public and may be used. The identifier VDB-240941 was assigned to this vulnerability.,3.5,CWE-79
CVE-2025-20647,In Modem there is a possible system crash due to a missing bounds check. This could lead to remote denial of service if a UE has connected to a rogue base station controlled by the attacker with no additional execution privileges needed. User interaction is not needed for exploitation. Patch ID: MOLY00791311 /  MOLY01067019; Issue ID: MSV-2721.,6.5,CWE-476
CVE-2025-21260,Windows Digital Media Elevation of Privilege Vulnerability,6.6,CWE-125
CVE-2022-1702,SonicWall SMA1000 series firmware 12.4.0 12.4.1-02965 and earlier versions accept a user-controlled input that specifies a link to an external site and uses that link in a redirect which leads to Open redirection vulnerability.,6.1,CWE-601
CVE-2024-43492,Microsoft AutoUpdate (MAU) Elevation of Privilege Vulnerability,7.8,CWE-284
CVE-2022-28693,Unprotected alternative channel of return branch target prediction in some Intel(R) Processors may allow an authorized user to potentially enable information disclosure via local access.,4.7,CWE-420
CVE-2021-47141,In the Linux kernel the following vulnerability has been resolved:  gve: Add NULL pointer checks when freeing irqs.  When freeing notification blocks we index priv->msix_vectors. If we failed to allocate priv->msix_vectors (see abort_with_msix_vectors) this could lead to a NULL pointer dereference if the driver is unloaded.,5.5,CWE-476
CVE-2026-1134,A vulnerability was identified in itsourcecode Society Management System 1.0. This affects an unknown function of the file /admin/expenses.php. The manipulation of the argument detail leads to cross site scripting. The attack may be initiated remotely. The exploit is publicly available and might be used.,4.3,CWE-79
CVE-2025-4258,A vulnerability which was classified as critical was found in zhangyanbo2007 youkefu up to 4.2.0. Affected is the function Upload of the file \youkefu-master\src\main\java\com\ukefu\webim\web\handler\resource\MediaController.java. The manipulation of the argument imgFile leads to unrestricted upload. It is possible to launch the attack remotely. The exploit has been disclosed to the public and may be used.,6.3,CWE-284
CVE-2023-48763,Improper Neutralization of Script-Related HTML Tags in a Web Page (Basic XSS vulnerability in Crocoblock JetFormBuilder allows Code Injection.This issue affects JetFormBuilder: from n/a through 3.1.4.  ,5.3,CWE-80
CVE-2025-39451,Missing Authorization vulnerability in Crocoblock JetBlocks For Elementor allows Accessing Functionality Not Properly Constrained by ACLs.This issue affects JetBlocks For Elementor: from n/a through 1.3.16.,7.5,CWE-862
CVE-2023-32229,Due to an error in the software interface to the secure element chip on Bosch IP cameras of family CPP13 and CPP14 the chip can be permanently damaged when enabling the Stream security option (signing of the video stream) with option MD5 SHA-1 or SHA-256.,4.9,CWE-1246
CVE-2020-37132,UltraVNC Launcher 1.2.4.0 contains a denial of service vulnerability in its password configuration properties that allows local attackers to crash the application. Attackers can paste an overly long 300-character string into the password field to trigger an application crash and prevent normal launcher functionality.,6.2,CWE-121
CVE-2025-22376,In Net::OAuth::Client in the Net::OAuth package before 0.29 for Perl the default nonce is a 32-bit integer generated from the built-in rand() function which is not cryptographically strong.,5.3,CWE-338
CVE-2021-46868,The HW_KEYMASTER module has a problem in releasing memory.Successful exploitation of this vulnerability may result in out-of-bounds memory access.,7.5,CWE-125
CVE-2021-32982,Automation Direct CLICK PLC CPU Modules: C0-1x CPUs with firmware prior to v3.00 passwords are sent as plaintext during unlocking and project transfers. An attacker who has network visibility can observe the password exchange.,7.5,CWE-319
CVE-2021-4040,A flaw was found in AMQ Broker. This issue can cause a partial interruption to the availability of AMQ Broker via an Out of memory (OOM) condition. This flaw allows an attacker to partially disrupt availability to the broker through a sustained attack of maliciously crafted messages. The highest threat from this vulnerability is system availability.,5.3,CWE-400
CVE-2026-2523,A vulnerability was detected in Open5GS up to 2.7.6. The affected element is the function smf_gn_handle_create_pdp_context_request of the file /src/smf/gn-handler.c of the component SMF. The manipulation results in reachable assertion. It is possible to launch the attack remotely. The exploit is now public and may be used. The project was informed of the problem early through an issue report but has not responded yet.,5.3,CWE-617
CVE-2025-66921,A Cross-site scripting (XSS) vulnerability in Create/Update Item(s) Module in Open Source Point of Sale v3.4.1 allows remote attackers to inject arbitrary web script or HTML via the name parameter.,7.2,CWE-20
CVE-2025-55462,A CORS misconfiguration in Eramba Community and Enterprise Editions v3.26.0 allows an attacker-controlled Origin header to be reflected in the Access-Control-Allow-Origin response along with Access-Control-Allow-Credentials: true. This permits malicious third-party websites to perform authenticated cross-origin requests against the Eramba API including endpoints like /system-api/login and /system-api/user/me. The response includes sensitive user session data (ID name email access groups) which is accessible to the attacker's JavaScript. This flaw enables full session hijack and data exfiltration without user interaction. Eramba versions 3.23.3 and earlier were tested and appear unaffected. The vulnerability is present in default installations requiring no custom configuration.,6.5,CWE-942
CVE-2022-45381,Jenkins Pipeline Utility Steps Plugin 2.13.1 and earlier does not restrict the set of enabled prefix interpolators and bundles versions of Apache Commons Configuration library that enable the 'file:' prefix interpolator by default allowing attackers able to configure Pipelines to read arbitrary files from the Jenkins controller file system.,8.1,CWE-22
CVE-2025-55071,A reflected cross-site scripting (xss) vulnerability exists in the modifyAnonymize functionality of MedDream PACS Premium 7.3.6.870. A specially crafted malicious URL can lead to arbitrary javascript code execution. An attacker can provide a crafted URL to trigger this vulnerability.,6.1,CWE-79
CVE-2024-5735,Full Path Disclosure vulnerability in AdmirorFrames Joomla! extension in afHelper.php script allows an unauthorised attacker to retrieve location of web root folder. This issue affects AdmirorFrames: before 5.0.,7.5,CWE-497
CVE-2024-23704,In onCreate of WifiDialogActivity.java there is a possible way to bypass the DISALLOW_ADD_WIFI_CONFIG restriction due to a missing permission check. This could lead to local escalation of privilege with no additional execution privileges needed. User interaction is not needed for exploitation.,7.8,CWE-862
CVE-2023-33883,In telephony service there is a missing permission check. This could lead to local information disclosure with no additional execution privileges needed.,5.5,CWE-862
CVE-2024-45284,An authenticated attacker with high privilege can use functions of SLCM transactions to which access should be restricted. This may result in an escalation of privileges causing low impact on integrity of the application.,2.4,CWE-862
CVE-2024-27958,Improper Neutralization of Input During Web Page Generation ('Cross-site Scripting') vulnerability in Themeisle Visualizer allows Reflected XSS.This issue affects Visualizer: from n/a through 3.10.5.  ,7.1,CWE-79
CVE-2022-27164,CSZ CMS 1.2.2 is vulnerable to SQL Injection via cszcms_admin_Users_viewUsers,9.8,CWE-89
CVE-2024-4893,DigiWin EasyFlow .NET lacks validation for certain input parameters allowing remote attackers to inject arbitrary SQL commands. This vulnerability enables unauthorized access to read modify and delete database records as well as execute system commands.,9.8,CWE-89
CVE-2024-6109,A vulnerability was found in itsourcecode Tailoring Management System 1.0. It has been declared as critical. Affected by this vulnerability is an unknown functionality of the file addmeasurement.php. The manipulation of the argument id leads to sql injection. The attack can be launched remotely. The exploit has been disclosed to the public and may be used. The associated identifier of this vulnerability is VDB-268855.,6.3,CWE-89
CVE-2024-13126,The Download Manager WordPress plugin before 3.3.07 doesn't prevent directory listing on web servers that don't use htaccess allowing unauthorized access of files.,4.6,CWE-552
CVE-2024-28551,Tenda AC18 V15.03.05.05 has a stack overflow vulnerability in the ssid parameter of form_fast_setting_wifi_set function.,7.5,CWE-121
CVE-2015-10050,A vulnerability was found in brandonfire miRNA_Database_by_PHP_MySql. It has been declared as critical. This vulnerability affects the function __construct/select_single_rna/count_rna of the file inc/model.php. The manipulation leads to sql injection. The patch is identified as 307c5d510841e6142ddcbbdbb93d0e8a0dc3fd6a. It is recommended to apply a patch to fix this issue. VDB-218374 is the identifier assigned to this vulnerability.,5.5,CWE-89
CVE-2023-39245, DELL ESI (Enterprise Storage Integrator) for SAP LAMA version 10.0 contains an information disclosure vulnerability in EHAC component. An remote unauthenticated attacker could potentially exploit this vulnerability by eavesdropping the network traffic to gain admin level credentials.  ,9.8,CWE-319
CVE-2023-47619,Audiobookshelf is a self-hosted audiobook and podcast server. In versions 2.4.3 and prior users with the update permission are able to read arbitrary files delete arbitrary files and send a GET request to arbitrary URLs and read the response. This issue may lead to Information Disclosure. As of time of publication no patches are available.,8.1,CWE-200
CVE-2022-24106,In Xpdf prior to 4.04 the DCT (JPEG) decoder was incorrectly allowing the 'interleaved' flag to be changed after the first scan of the image leading to an unknown integer-related vulnerability in Stream.cc.,7.8,CWE-190
CVE-2025-22891,When BIG-IP PEM Control Plane listener Virtual Server is configured with Diameter Endpoint profile undisclosed traffic can cause the Virtual Server to stop processing new client connections and an increase in memory resource utilization. Note: Software versions which have reached End of Technical Support (EoTS) are not evaluated.,7.5,CWE-772
CVE-2022-46381,Certain Linear eMerge E3-Series devices are vulnerable to XSS via the type parameter (e.g. to the badging/badge_template_v0.php component). This affects 0.32-08f 0.32-07p 0.32-07e 0.32-09c 0.32-09b 0.32-09a and 0.32-08e.,6.1,CWE-79
CVE-2024-30072,Microsoft Event Trace Log File Parsing Remote Code Execution Vulnerability,7.8,CWE-190
CVE-2021-34911,This vulnerability allows remote attackers to execute arbitrary code on affected installations of Bentley View 10.15.0.75. User interaction is required to exploit this vulnerability in that the target must visit a malicious page or open a malicious file. The specific flaw exists within the parsing of 3DS files. The issue results from the lack of validating the existence of an object prior to performing operations on the object. An attacker can leverage this vulnerability to execute code in the context of the current process. Was ZDI-CAN-14884.,7.8,CWE-416
CVE-2025-36096,IBM AIX 7.2 and 7.3 and IBM VIOS 3.1 and 4.1 stores NIM private keys used in NIM environments in an insecure way which is susceptible to unauthorized access by an attacker using man in the middle techniques.,9.0,CWE-522
CVE-2025-53018,Lychee is a free open-source photo-management tool. Prior to version 6.6.13 a critical Server-Side Request Forgery (SSRF) vulnerability exists in the `/api/v2/Photo::fromUrl` endpoint. This flaw lets an attacker instruct the application’s backend to make HTTP requests to any URL they choose. Consequently internal network resources—such as localhost services or cloud-provider metadata endpoints—become reachable. The endpoint takes a URL from the user and calls it server-side via fopen() without any safeguards. There is no IP address validation nor are there any allow-list timeout or size restrictions. Because of this attackers can point the application at internal targets. Using this flaw an attacker can perform internal port scans or retrieve sensitive cloud metadata. Version 6.6.13 contains a patch for the issue.,3.0,CWE-918
CVE-2024-8870,The Forms for Mailchimp by Optin Cat – Grow Your MailChimp List plugin for WordPress is vulnerable to Reflected Cross-Site Scripting due to the use of add_query_arg without appropriate escaping on the URL in all versions up to and including 2.5.6. This makes it possible for unauthenticated attackers to inject arbitrary web scripts in pages that execute if they can successfully trick a user into performing an action such as clicking on a link.,6.1,CWE-79
CVE-2025-9389,A vulnerability was identified in vim 9.1.0000. Affected is the function __memmove_avx_unaligned_erms of the file memmove-vec-unaligned-erms.S. The manipulation leads to memory corruption. The attack needs to be performed locally. The exploit is publicly available and might be used. Some users are not able to reproduce this. One of the users mentions that this appears not to be working when coloring is turned on.,3.3,CWE-119
CVE-2021-26370,Improper validation of destination address in SVC_LOAD_FW_IMAGE_BY_INSTANCE and SVC_LOAD_BINARY_BY_ATTRIB in a malicious UApp or ABL may allow an attacker to overwrite arbitrary bootloader memory with SPI ROM contents resulting in a loss of integrity and availability.,7.1,CWE-20
CVE-2023-3763,A vulnerability was found in Intergard SGS 8.7.0. It has been declared as problematic. This vulnerability affects unknown code of the component SQL Query Handler. The manipulation leads to cleartext transmission of sensitive information. The attack can be initiated remotely. The complexity of an attack is rather high. The exploitation appears to be difficult. The exploit has been disclosed to the public and may be used. The identifier of this vulnerability is VDB-234448. NOTE: The vendor was contacted early about this disclosure but did not respond in any way.,3.7,CWE-319
CVE-2024-20533,A vulnerability in the web UI of Cisco Desk Phone 9800 Series Cisco IP Phone 6800 7800 and 8800 Series and Cisco Video Phone 8875 with Cisco Multiplatform Firmware could allow an authenticated remote attacker to conduct stored cross-site scripting (XSS) attacks against users.    This vulnerability exists because the web UI of an affected device does not properly validate user-supplied input. An attacker could exploit this vulnerability by injecting malicious code into specific pages of the interface. A successful exploit could allow the attacker to execute arbitrary script code in the context of the affected interface or access sensitive browser-based information.  Note: To exploit this vulnerability Web Access must be enabled on the phone and the attacker must have Admin credentials on the device. Web Access is disabled by default.,4.8,CWE-79
CVE-2025-5575,A vulnerability classified as critical was found in PHPGurukul Dairy Farm Shop Management System 1.3. This vulnerability affects unknown code of the file /add-product.php. The manipulation of the argument productname leads to sql injection. The attack can be initiated remotely. The exploit has been disclosed to the public and may be used.,7.3,CWE-74
CVE-2023-37031,A Null pointer dereference vulnerability in the Mobile Management Entity (MME) in Magma <= 1.8.0 (fixed in v1.9 commit 08472ba98b8321f802e95f5622fa90fec2dea486) allows network-adjacent attackers to crash the MME via an S1AP `eNB Configuration Transfer` packet missing its required `Target eNB ID` field.,6.5,CWE-476
CVE-2025-6707,Under certain conditions an authenticated user request may execute with stale privileges following an intentional change by an authorized administrator. This issue affects MongoDB Server v5.0 version prior to 5.0.31 MongoDB Server v6.0 version prior to 6.0.24 MongoDB Server v7.0 version prior to 7.0.21 and MongoDB Server v8.0 version prior to 8.0.5.,4.2,CWE-863
CVE-2025-4077,A vulnerability classified as critical was found in code-projects School Billing System 1.0. This vulnerability affects the function searchrec. The manipulation of the argument Name leads to stack-based buffer overflow. It is possible to launch the attack on the local host. The exploit has been disclosed to the public and may be used.,5.3,CWE-119
CVE-2023-1979,The Web Stories for WordPress plugin supports the WordPress built-in functionality of protecting content with a password. The content is then only accessible to website visitors after entering the password. In WordPress users with the Author role can create stories but don't have the ability to edit password protected stories. The vulnerability allowed users with said role to bypass this permission check when trying to duplicate the protected story in the plugin's own dashboard giving them access to the seemingly protected content. We recommend upgrading to version 1.32 or beyond commit  ad49781c2a35c5c92ef704d4b621ab4e5cb77d68 https://github.com/GoogleForCreators/web-stories-wp/commit/ad49781c2a35c5c92ef704d4b621ab4e5cb77d68  ,4.9,CWE-863
CVE-2025-57788,A vulnerability in a known login mechanism allows unauthenticated attackers to execute API calls without requiring user credentials. RBAC helps limit the exposure but does not eliminate risk.,6.5,CWE-259
CVE-2025-49973,Missing Authorization vulnerability in GrandPlugins Image Sizes Controller Create Custom Image Sizes Disable Image Sizes allows Exploiting Incorrectly Configured Access Control Security Levels. This issue affects Image Sizes Controller Create Custom Image Sizes Disable Image Sizes: from n/a through 1.0.9.,4.3,CWE-862
CVE-2022-33021,CVA6 commit 909d85a accesses invalid memory when reading the value of MHPMCOUNTER30.,7.5,CWE-125
CVE-2023-1847,A vulnerability was found in SourceCodester Online Payroll System 1.0 and classified as critical. This issue affects some unknown processing of the file attendance.php. The manipulation of the argument employee leads to sql injection. The attack may be initiated remotely. The exploit has been disclosed to the public and may be used. The associated identifier of this vulnerability is VDB-224987.,6.3,CWE-89
CVE-2024-25221,A cross-site scripting (XSS) vulnerability in Task Manager App v1.0 allows attackers to execute arbitrary web scripts or HTML via a crafted payload injected into the Note Section parameter at /TaskManager/Tasks.php.,6.1,CWE-79
CVE-2025-15117,A weakness has been identified in Dromara Sa-Token up to 1.44.0. This affects the function ObjectInputStream.readObject of the file SaJdkSerializer.java. Executing manipulation can lead to deserialization. The attack may be launched remotely. This attack is characterized by high complexity. It is indicated that the exploitability is difficult. The vendor was contacted early about this disclosure but did not respond in any way.,3.1,CWE-20
CVE-2022-38610,Garage Management System v1.0 was discovered to contain a SQL injection vulnerability via the id parameter at /garage/editclient.php.,7.2,CWE-89
CVE-2025-22500,Improper Neutralization of Input During Web Page Generation ('Cross-site Scripting') vulnerability in Ali Ali Alpha Price Table For Elementor allows DOM-Based XSS.This issue affects Alpha Price Table For Elementor: from n/a through 1.0.8.,6.5,CWE-79
CVE-2025-7194,A vulnerability was found in D-Link DI-500WF 17.04.10A1T. It has been declared as critical. Affected by this vulnerability is the function sprintf of the file ip_position.asp of the component jhttpd. The manipulation of the argument ip leads to stack-based buffer overflow. The attack can be launched remotely. The exploit has been disclosed to the public and may be used.,8.8,CWE-119
CVE-2023-42405,SQL injection vulnerability in FIT2CLOUD RackShift v1.7.1 allows attackers to execute arbitrary code via the `sort` parameter to taskService.list() bareMetalService.list() and switchService.list().,9.8,CWE-89
CVE-2024-37323,SQL Server Native Client OLE DB Provider Remote Code Execution Vulnerability,8.8,CWE-190
CVE-2025-32997,In http-proxy-middleware before 2.0.9 and 3.x before 3.0.5 fixRequestBody proceeds even if bodyParser has failed.,4.0,CWE-754
CVE-2023-46559,TOTOLINK X2000R Gh v1.0.0-B20230221.0948.web was discovered to contain a stack overflow via the function formIPv6Addr.,9.8,CWE-787
CVE-2022-3923,The ActiveCampaign for WooCommerce WordPress plugin before 1.9.8 does not have authorisation check when cleaning up its error logs via an AJAX action which could allow any authenticated users such as subscriber to call it and remove error logs.,4.3,CWE-862
CVE-2022-47560,The lack of web request control on ekorCCP and ekorRCI devices allows a potential attacker to create custom requests to execute malicious actions when a user is logged in.,5.7,CWE-319
CVE-2023-28863,AMI MegaRAC SPx12 and SPx13 devices have Insufficient Verification of Data Authenticity.,9.1,CWE-345
CVE-2025-48560,In AndroidManifest.xml there is a possible way for an app to monitor motion events due to a confused deputy. This could lead to local information disclosure with no additional execution privileges needed. User interaction is not needed for exploitation.,5.5,CWE-441
