CVE,Description,CVSS3_BaseScore,CWE
CVE-2023-20078,Multiple vulnerabilities in the web-based management interface of certain Cisco IP Phones could allow an unauthenticated remote attacker to execute arbitrary code or cause a denial of service (DoS) condition. For more information about these vulnerabilities see the Details section of this advisory.,9.8,CWE-121
CVE-2023-42633,In validationtools there is a possible missing permission check. This could lead to local information disclosure with no additional execution privileges needed,5.5,CWE-862
CVE-2023-32270,Access of memory location after end of buffer issue exists in TELLUS v4.0.15.0 and TELLUS Lite v4.0.15.0. Opening a specially crafted V8 file may lead to information disclosure and/or arbitrary code execution.,7.8,CWE-119
CVE-2023-6102,A vulnerability which was classified as problematic was found in Maiwei Safety Production Control Platform 4.1. Affected is an unknown function of the file /Content/Plugins/uploader/FileChoose.html?fileUrl=/Upload/File/Pics/&parent. The manipulation leads to unrestricted upload. It is possible to launch the attack remotely. The exploit has been disclosed to the public and may be used. The identifier of this vulnerability is VDB-245064. NOTE: The vendor was contacted early about this disclosure but did not respond in any way.,5.3,CWE-434
CVE-2023-22474,Parse Server is an open source backend that can be deployed to any infrastructure that can run Node.js. Parse Server uses the request header `x-forwarded-for` to determine the client IP address. If Parse Server doesn't run behind a proxy server then a client can set this header and Parse Server will trust the value of the header. The incorrect client IP address will be used by various features in Parse Server. This allows to circumvent the security mechanism of the Parse Server option `masterKeyIps` by setting an allowed IP address as the `x-forwarded-for` header value. This issue has been patched in version 5.4.1. The mechanism to determine the client IP address has been rewritten. The correct IP address determination now requires to set the Parse Server option `trustProxy`. ,8.7,CWE-290
CVE-2022-44473,Adobe Experience Manager version 6.5.14 (and earlier) is affected by a reflected Cross-Site Scripting (XSS) vulnerability. If a low-privileged attacker is able to convince a victim to visit a URL referencing a vulnerable page malicious JavaScript content may be executed within the context of the victim's browser.,5.4,CWE-79
CVE-2023-49394,Zentao versions 4.1.3 and before has a URL redirect vulnerability which prevents the system from functioning properly.,6.1,CWE-601
CVE-2024-11681,A malicious or compromised MacPorts mirror can execute arbitrary commands as root on the machine of a client running port selfupdate against the mirror.,6.8,CWE-78
CVE-2023-33563,In PHP Jabbers Time Slots Booking Calendar 3.3  lack of verification when changing an email address and/or password (on the Profile Page) allows remote attackers to take over accounts.,8.8,CWE-287
CVE-2022-38534,TOTOLINK-720R v4.1.5cu.374 was discovered to contain a remote code execution (RCE) vulnerability via the setdiagnosicfg function.,7.2,CWE-78
CVE-2023-6231,Buffer overflow in WSD probe request process of Office Multifunction Printers and Laser Printers(*) which may allow an attacker on the network segment to trigger the affected product being unresponsive or to execute arbitrary code.*: Satera LBP670C Series/Satera MF750C Series firmware v03.07 and earlier sold in Japan. Color imageCLASS LBP674C/Color imageCLASS X LBP1333C/Color imageCLASS MF750C Series/Color imageCLASS X MF1333C Series firmware v03.07 and earlier sold in US. i-SENSYS LBP673Cdw/C1333P/i-SENSYS MF750C Series/C1333i Series firmware v03.07 and earlier sold in Europe.  ,9.8,CWE-787
CVE-2024-30012,Windows Mobile Broadband Driver Remote Code Execution Vulnerability,6.8,CWE-190
CVE-2023-35052,Missing Authorization vulnerability in wpWax - WP Business Directory Plugin and Classified Listings Directory Directorist allows Exploiting Incorrectly Configured Access Control Security Levels.This issue affects Directorist: from n/a through 7.5.4.,4.3,CWE-862
CVE-2023-3450,A vulnerability was found in Ruijie RG-BCR860 2.5.13 and classified as critical. This issue affects some unknown processing of the component Network Diagnostic Page. The manipulation leads to os command injection. The attack may be initiated remotely. The exploit has been disclosed to the public and may be used. The associated identifier of this vulnerability is VDB-232547. NOTE: The vendor was contacted early about this disclosure but did not respond in any way.,4.7,CWE-78
CVE-2024-8084,A vulnerability which was classified as problematic was found in SourceCodester Online Computer and Laptop Store 1.0. This affects an unknown part of the file /php-ocls/classes/SystemSettings.php?f=update_settings of the component Setting Handler. The manipulation of the argument System Name leads to cross site scripting. It is possible to initiate the attack remotely. The exploit has been disclosed to the public and may be used.,2.4,CWE-79
CVE-2022-3263,The security descriptor of Measuresoft ScadaPro Server version 6.7 has inconsistent permissions which could allow a local user with limited privileges to modify the service binary path and start malicious commands with SYSTEM privileges.,7.8,CWE-284
CVE-2024-4554,Improper Input Validation vulnerability in OpenText NetIQ Access Manager leads to Cross-Site Scripting (XSS) attack. This issue affects NetIQ Access Manager before 5.0.4.1 and 5.1.,7.3,CWE-79
CVE-2021-38894,IBM Security Verify 10.0.0 10.0.1.0 and 10.0.2.0 could allow a remote attacker to obtain sensitive information when a detailed technical error message is returned in the browser. This information could be used in further attacks against the system. IBM X-Force ID: 209515.,2.7,CWE-209
CVE-2022-2975,A vulnerability related to weak permissions was detected in Avaya Aura Application Enablement Services web application allowing an administrative user to modify accounts leading to execution of arbitrary code as the root user. This issue affects Application Enablement Services versions 8.0.0.0 through 8.1.3.4 and 10.1.0.0 through 10.1.0.1. Versions prior to 8.0.0.0 are end of manufacturing support and were not evaluated.,7.7,CWE-269
CVE-2024-6586,Lightdash version 0.1024.6 allows users with the necessary permissions such as Administrator or Editor to create and share dashboards. A dashboard that contains HTML elements which point to a threat actor controlled source can trigger an SSRF request when exported via a POST request to /api/v1/dashboards//export. The forged request contains the value of the exporting user’s session token. A threat actor could obtain the session token of any user who exports the dashboard. The obtained session token can be used to perform actions as the victim on the application resulting in session takeover.,7.3,CWE-201
CVE-2023-5386,The Funnelforms Free plugin for WordPress is vulnerable to unauthorized modification of data due to a missing capability check on the fnsf_delete_posts function in versions up to and including 3.4. This makes it possible for authenticated attackers with subscriber-level permissions and above to delete arbitrary posts including administrator posts and posts not related to the Funnelforms Free plugin.,6.5,CWE-862
CVE-2022-45892,In Planet eStream before 6.72.10.07 multiple Stored Cross-Site Scripting (XSS) vulnerabilities exist: Disclaimer Search Function Comments Batch editing tool Content Creation Related Media Create new user and Change Username.,5.4,CWE-79
CVE-2024-33004,SAP Business Objects Business Intelligence Platform is vulnerable to Insecure Storage as dynamic web pages are getting cached even after logging out. On successful exploitation the attacker can see the sensitive information through cache and can open the pages causing limited impact on Confidentiality Integrity and Availability of the application.,4.3,CWE-524
CVE-2024-3895,The WP Datepicker plugin for WordPress is vulnerable to unauthorized modification of data due to a missing capability check on the wpdp_add_new_datepicker_ajax() function in all versions up to and including 2.1.0. This makes it possible for authenticated attackers with  subscriber-level access and above to update arbitrary options that can be used for privilege escalation. This was partially patched in 2.0.9 and 2.1.0 and fully patched in 2.1.1.,8.8,CWE-862
CVE-2023-38389,Incorrect Authorization vulnerability in Artbees JupiterX Core allows Accessing Functionality Not Properly Constrained by ACLs.This issue affects JupiterX Core: from n/a through 3.3.8.,9.8,CWE-863
CVE-2024-0794,Certain HP LaserJet Pro HP Enterprise LaserJet and HP LaserJet Managed Printers are potentially vulnerable to Remote Code Execution due to buffer overflow when rendering fonts embedded in a PDF file.,9.8,CWE-125
CVE-2023-6008,The UserPro plugin for WordPress is vulnerable to Cross-Site Request Forgery in versions up to and including 5.1.1. This is due to missing or incorrect nonce validation on multiple functions. This makes it possible for unauthenticated attackers to add modify or delete user meta and plugin options.,6.3,CWE-352
CVE-2022-22396,Credentials are printed in clear text in the IBM Spectrum Protect Plus 10.1.0.0 through 10.1.9.3 virgo log file in certain cases. Credentials could be the remote vSnap offload targets or VADP credentials depending on the operation performed. Credentials that are using API key or certificate are not printed. IBM X-Force ID: 222231.,7.5,CWE-522
CVE-2022-36520,H3C GR-1200W MiniGRW1A0V100R006 was discovered to contain a stack overflow via the function DEleteusergroup.,9.8,CWE-787
CVE-2024-2389,In Flowmon versions prior to 11.1.14 and 12.3.5 an operating system command injection vulnerability has been identified.  An unauthenticated user can gain entry to the system via the Flowmon management interface allowing for the execution of arbitrary system commands.  ,10.0,CWE-78
CVE-2023-30955,A security defect was identified in Foundry workspace-server that enabled a user to bypass an authorization check and view settings related to 'Developer Mode'. This enabled users with insufficient privilege the ability to view and interact with Developer Mode settings in a limited capacity. A fix was deployed with workspace-server 7.7.0.,4.3,CWE-602
CVE-2023-28682,Jenkins Performance Publisher Plugin 8.09 and earlier does not configure its XML parser to prevent XML external entity (XXE) attacks.,8.2,CWE-611
CVE-2022-44736,Auth. (admin+) Stored Cross-Site Scripting (XSS) vulnerability in Chameleon plugin <= 1.4.3 on WordPress.,4.8,CWE-79
CVE-2023-47995,Memory Allocation with Excessive Size Value discovered in BitmapAccess.cpp::FreeImage_AllocateBitmap in FreeImage 3.18.0 allows attackers to cause a denial of service.,6.5,CWE-120
CVE-2023-24150,A command injection vulnerability in the serverIp parameter in the function meshSlaveDlfw of TOTOLINK T8 V4.1.5cu allows attackers to execute arbitrary commands via a crafted MQTT packet.,9.8,CWE-77
CVE-2023-45010,Auth. (admin+) Stored Cross-Site Scripting (XSS) vulnerability in Alex MacArthur Complete Open Graph plugin <= 3.4.5 versions.,5.9,CWE-79
CVE-2024-48841,Network access can be used to execute arbitrary code with elevated privileges.       This issue affects FLXEON 9.3.4 and older.,10.0,CWE-77
CVE-2023-32347, Teltonika’s Remote Management System versions prior to 4.10.0 use device serial numbers and MAC addresses to identify devices from the user perspective for device claiming and from the device perspective for authentication. If an attacker obtained the serial number and MAC address of a device they could authenticate as that device and steal communication credentials of the device. This could allow an attacker to enable arbitrary command execution as root by utilizing management options within the newly registered devices.  ,8.1,CWE-287
CVE-2022-41335,A relative path traversal vulnerability [CWE-23] in Fortinet FortiOS version 7.2.0 through 7.2.2 7.0.0 through 7.0.8 and before 6.4.10 FortiProxy version 7.2.0 through 7.2.1 7.0.0 through 7.0.7 and before 2.0.10 FortiSwitchManager 7.2.0 and before 7.0.0  allows an authenticated attacker to read and write files on the underlying Linux system via crafted HTTP requests.,8.8,CWE-23
CVE-2025-1009,An attacker could have caused a use-after-free via crafted XSLT data leading to a potentially exploitable crash. This vulnerability affects Firefox < 135 Firefox ESR < 115.20 Firefox ESR < 128.7 Thunderbird < 128.7 and Thunderbird < 135.,9.8,CWE-416
CVE-2024-9982,AIM LINE Marketing Platform from Esi Technology does not properly validate a specific query parameter. When the LINE Campaign Module is enabled unauthenticated remote attackers can inject arbitrary FetchXml commands to read modify and delete database content.,9.8,CWE-89
CVE-2024-28185,Judge0 is an open-source online code execution system. The application does not account for symlinks placed inside the sandbox directory which can be leveraged by an attacker to write to arbitrary files and gain code execution outside of the sandbox. When executing a submission Judge0 writes a `run_script` to the sandbox directory. The security issue is that an attacker can create a symbolic link (symlink) at the path `run_script` before this code is executed resulting in the `f.write` writing to an arbitrary file on the unsandboxed system. An attacker can leverage this vulnerability to overwrite scripts on the system and gain code execution outside of the sandbox. ,10.0,CWE-59
CVE-2017-20132,A vulnerability was found in Itech Multi Vendor Script 6.49 and classified as critical. This issue affects some unknown processing of the file /multi-vendor-shopping-script/product-list.php. The manipulation of the argument pl leads to sql injection. The attack may be initiated remotely. The exploit has been disclosed to the public and may be used.,6.3,CWE-89
CVE-2022-36356,Authenticated (admin+) Stored Cross-Site Scripting (XSS) vulnerability in Liam Gladdy / Thirty8 Digital Culture Object plugin <= 4.0.1 at WordPress.,4.8,CWE-79
CVE-2023-32995,A cross-site request forgery (CSRF) vulnerability in Jenkins SAML Single Sign On(SSO) Plugin 2.0.0 and earlier allows attackers to send an HTTP POST request with JSON body containing attacker-specified content to miniOrange's API for sending emails.,8.8,CWE-352
CVE-2024-1449,The Master Slider – Responsive Touch Slider plugin for WordPress is vulnerable to Stored Cross-Site Scripting via the plugin's ms_slide shortcode in all versions up to and including 3.9.5 due to insufficient input sanitization and output escaping on user supplied attributes. This makes it possible for authenticated attackers with contributor-level and above permissions to inject arbitrary web scripts in pages that will execute whenever a user accesses an injected page.,6.4,CWE-79
CVE-2024-9561,A vulnerability classified as critical has been found in D-Link DIR-605L 2.13B01 BETA. This affects the function formSetWAN_Wizard51/formSetWAN_Wizard52. The manipulation of the argument curTime leads to buffer overflow. It is possible to initiate the attack remotely. The exploit has been disclosed to the public and may be used.,8.8,CWE-120
CVE-2024-2965,A Denial-of-Service (DoS) vulnerability exists in the `SitemapLoader` class of the `langchain-ai/langchain` repository affecting all versions. The `parse_sitemap` method responsible for parsing sitemaps and extracting URLs lacks a mechanism to prevent infinite recursion when a sitemap URL refers to the current sitemap itself. This oversight allows for the possibility of an infinite loop leading to a crash by exceeding the maximum recursion depth in Python. This vulnerability can be exploited to occupy server socket/port resources and crash the Python process impacting the availability of services relying on this functionality.,4.7,CWE-674
CVE-2024-21432,Windows Update Stack Elevation of Privilege Vulnerability,7.0,CWE-59
CVE-2021-41849,An issue was discovered in Luna Simo PPR1.180610.011/202001031830. It sends the following Personally Identifiable Information (PII) in plaintext using HTTP to servers located in China: user's list of installed apps and device International Mobile Equipment Identity (IMEI). This PII is transmitted to log.skyroam.com.cn using HTTP independent of whether the user uses the Simo software.,5.5,CWE-200
CVE-2024-52363,IBM InfoSphere Information Server 11.7 could allow a remote attacker to traverse directories on the system. An attacker could send a specially crafted URL request containing dot dot sequences (/../) to view arbitrary files on the system.,6.5,CWE-22
CVE-2023-34193,File Upload vulnerability in Zimbra ZCS 8.8.15 allows an authenticated privileged user to execute arbitrary code and obtain sensitive information via the ClientUploader function.,8.8,CWE-434
CVE-2024-25937, SQL injection vulnerability exists in the script DIAE_tagHandler.ashx.  ,8.8,CWE-89
CVE-2023-0315,Command Injection in GitHub repository froxlor/froxlor prior to 2.0.8.,8.8,CWE-77
CVE-2022-35245,In BIG-IP Versions 16.1.x before 16.1.3.1 15.1.x before 15.1.6.1 and 14.1.x before 14.1.5.1 when a BIG-IP APM access policy is configured on a virtual server undisclosed traffic can cause the Traffic Management Microkernel (TMM) to terminate. Note: Software versions which have reached End of Technical Support (EoTS) are not evaluated.,7.5,CWE-476
CVE-2022-3499,An authenticated attacker could utilize the identical agent and cluster node linking keys to potentially allow for a scenario where unauthorized disclosure of agent logs and data is present.,6.5,CWE-532
CVE-2021-3847,An unauthorized access to the execution of the setuid file with capabilities flaw in the Linux kernel OverlayFS subsystem was found in the way user copying a capable file from a nosuid mount into another mount. A local user could use this flaw to escalate their privileges on the system.,7.8,CWE-281
CVE-2025-21369,Microsoft Digest Authentication Remote Code Execution Vulnerability,8.8,CWE-122
CVE-2023-23379,Microsoft Defender for IoT Elevation of Privilege Vulnerability,7.8,CWE-23
CVE-2025-24661,Deserialization of Untrusted Data vulnerability in MagePeople Team Taxi Booking Manager for WooCommerce allows Object Injection. This issue affects Taxi Booking Manager for WooCommerce: from n/a through 1.1.8.,9.8,CWE-502
CVE-2025-0814,CWE-20: Improper Input Validation vulnerability exists that could cause Denial-of-Service of the network services running on the product when malicious IEC61850-MMS packets are sent to the device. The core functionality of the breaker remains intact during the attack.,5.3,CWE-20
CVE-2025-26883,Missing Authorization vulnerability in bPlugins Animated Text Block allows Exploiting Incorrectly Configured Access Control Security Levels. This issue affects Animated Text Block: from n/a through 1.0.7.,6.5,CWE-862
CVE-2022-3049,Use after free in SplitScreen in Google Chrome on Chrome OS Lacros prior to 105.0.5195.52 allowed a remote attacker who convinced a user to engage in specific UI interactions to potentially exploit heap corruption via a crafted HTML page.,8.8,CWE-362
CVE-2023-48482,Adobe Experience Manager versions 6.5.18 and earlier are affected by a Cross-site Scripting (DOM-based XSS) vulnerability. If a low-privileged attacker is able to convince a victim to visit a URL referencing a vulnerable page malicious JavaScript content may be executed within the context of the victim's browser.,5.4,CWE-79
CVE-2023-33170,ASP.NET and Visual Studio Security Feature Bypass Vulnerability,8.1,CWE-362
CVE-2022-26864,Prior Dell BIOS versions contain an Input Validation vulnerability. A locally authenticated malicious user could potentially exploit this vulnerability by sending malicious input to an SMI in order to bypass security controls in SMM.,6.3,CWE-20
CVE-2023-30353,Shenzen Tenda Technology IP Camera CP3 V11.10.00.2211041355 allows unauthenticated remote code execution via an XML document.,9.8,CWE-77
CVE-2025-1119,The Appointment Booking Calendar — Simply Schedule Appointments Booking Plugin plugin for WordPress is vulnerable to arbitrary shortcode execution in all versions up to and including 1.6.8.5. This is due to the software allowing users to execute an action that does not properly validate a value before running do_shortcode. This makes it possible for unauthenticated attackers to execute arbitrary shortcodes.,7.3,CWE-94
CVE-2023-23455,atm_tc_enqueue in net/sched/sch_atm.c in the Linux kernel through 6.1.4 allows attackers to cause a denial of service because of type confusion (non-negative numbers can sometimes indicate a TC_ACT_SHOT condition rather than valid classification results).,5.5,CWE-843
CVE-2023-27486,xCAT is a toolkit for deployment and administration of computer clusters. In versions prior to 2.16.5 if zones are configured as a mechanism to secure clusters in XCAT it is possible for a local root user from one node to obtain credentials to SSH to any node in any zone except the management node of the default zone. XCAT zones are not enabled by default. Only users that use the optional zone feature are impacted. All versions of xCAT prior to xCAT 2.16.5 are vulnerable. This problem has been fixed in xCAT 2.16.5. Users making use of zones should upgrade to 2.16.5. Users unable to upgrade may mitigate the issue by disabling zones or patching the management node with the fix contained in commit `85149c37f49`.,8.1,CWE-863
CVE-2024-13241,Improper Authorization vulnerability in Drupal Open Social allows Collect Data from Common Resource Locations.This issue affects Open Social: from 0.0.0 before 12.0.5.,9.1,CWE-285
CVE-2023-38054,A BOLA vulnerability in GET PUT DELETE /customers/{customerId} allows a low privileged user to fetch modify or delete a low privileged user (customer). This results in unauthorized access and unauthorized data manipulation.,9.9,CWE-639
CVE-2024-20444,A vulnerability in Cisco Nexus Dashboard Fabric Controller (NDFC) formerly Cisco Data Center Network Manager (DCNM) could allow an authenticated remote attacker with network-admin privileges to perform a command injection attack against an affected device.  &nbsp;  This vulnerability is due to insufficient validation of command arguments. An attacker could exploit this vulnerability by submitting crafted command arguments to a specific REST API endpoint. A successful exploit could allow the attacker to overwrite sensitive files or crash a specific container which would restart on its own causing a low-impact denial of service (DoS) condition.,5.5,CWE-88
CVE-2022-34963,OpenTeknik LLC OSSN OPEN SOURCE SOCIAL NETWORK v6.3 LTS was discovered to contain a stored cross-site scripting (XSS) vulnerability via the News Feed module.,5.4,CWE-79
CVE-2021-21958,A heap-based buffer overflow vulnerability exists in the Hword HwordApp.dll functionality of Hancom Office 2020 11.0.0.2353. A specially-crafted malformed file can lead to memory corruption and potential arbitrary code execution. An attacker can provide a malicious file to trigger this vulnerability.,7.8,CWE-122
CVE-2024-45782,A flaw was found in the HFS filesystem. When reading an HFS volume's name at grub_fs_mount() the HFS filesystem driver performs a strcpy() using the user-provided volume name as input without properly validating the volume name's length. This issue may read to a heap-based out-of-bounds writer impacting grub's sensitive data integrity and eventually leading to a secure boot protection bypass.,6.7,CWE-120
CVE-2024-52374,Unrestricted Upload of File with Dangerous Type vulnerability in DoThatTask Do That Task allows Upload a Web Shell to a Web Server.This issue affects Do That Task: from n/a through 1.5.5.,10.0,CWE-434
CVE-2023-47044,Adobe Media Encoder version 24.0.2 (and earlier) and 23.6 (and earlier) are affected by an Access of Uninitialized Pointer vulnerability that could lead to disclosure of sensitive memory. An attacker could leverage this vulnerability to bypass mitigations such as ASLR. Exploitation of this issue requires user interaction in that a victim must open a malicious file.,5.5,CWE-824
CVE-2024-12257,The CardGate Payments for WooCommerce plugin for WordPress is vulnerable to Reflected Cross-Site Scripting via the 'page' parameter in all versions up to and including 3.2.1 due to insufficient input sanitization and output escaping. This makes it possible for unauthenticated attackers to inject arbitrary web scripts in pages that execute if they can successfully trick a user into performing an action such as clicking on a link.,6.1,CWE-79
CVE-2025-23689,Improper Neutralization of Input During Web Page Generation ('Cross-site Scripting') vulnerability in Poco Blogger Image Import allows Stored XSS.This issue affects Blogger Image Import: from 2.1 through n/a.,7.1,CWE-79
CVE-2022-41937,XWiki Platform is a generic wiki platform offering runtime services for applications built on top of it. The application allows anyone with view access to modify any page of the wiki by importing a crafted XAR package. The problem has been patched in XWiki 14.6RC1 14.6 and 13.10.8. As a workaround setting the right of the page Filter.WebHome and making sure only the main wiki administrators can view the application installed on main wiki or edit the page and apply the changed described in commit fb49b4f.,9.6,CWE-862
CVE-2024-27627,A reflected cross-site scripting (XSS) vulnerability exists in SuperCali version 1.1.0 allowing remote attackers to execute arbitrary JavaScript code via the email parameter in the bad_password.php page.,6.1,CWE-94
