CVE,Description,CVSS3_BaseScore,CWE
CVE-2024-41670,In the module PayPal Official for PrestaShop 7+ releases prior to version 6.4.2 and for PrestaShop 1.6 releases prior to version 3.18.1 a malicious customer can confirm an order even if payment is finally declined by PayPal. A logical weakness during the capture of a payment in case of disabled webhooks can be exploited to create an accepted order. This could allow a threat actor to confirm an order with a fraudulent payment support. Versions 6.4.2 and 3.18.1 contain a patch for the issue. Additionally users enable webhooks and check they are callable.,7.5,CWE-285
CVE-2022-38258,A local file inclusion (LFI) vulnerability in D-Link DIR 819 v1.06 allows attackers to cause a Denial of Service (DoS) or access sensitive server information via manipulation of the getpage parameter in a crafted web request.,8.1,CWE-22
CVE-2024-30405,An Incorrect Calculation of Buffer Size vulnerability in Juniper Networks Junos OS SRX 5000 Series devices using SPC2 line cards while ALGs are enabled allows an attacker sending specific crafted packets to cause a transit traffic Denial of Service (DoS).  Continued receipt and processing of these specific packets will sustain the Denial of Service condition.  This issue affects: Juniper Networks Junos OS SRX 5000 Series with SPC2 with ALGs enabled.   *  All versions earlier than 21.2R3-S7;   *  21.4 versions earlier than 21.4R3-S6;   *  22.1 versions earlier than 22.1R3-S5;   *  22.2 versions earlier than 22.2R3-S3;   *  22.3 versions earlier than 22.3R3-S2;   *  22.4 versions earlier than 22.4R3;   *  23.2 versions earlier than 23.2R2.,7.5,CWE-131
CVE-2025-21097,in OpenHarmony v5.0.2 and prior versions allow a local attacker cause DOS through NULL pointer dereference.,3.3,CWE-476
CVE-2022-22897,A SQL injection vulnerability in the product_all_one_img and image_product parameters of the ApolloTheme AP PageBuilder component through 2.4.4 for PrestaShop allows unauthenticated attackers to exfiltrate database data.,9.8,CWE-89
CVE-2022-23296,Windows Installer Elevation of Privilege Vulnerability,7.8,CWE-269
CVE-2023-4098,It has been identified that the web application does not correctly filter input parameters allowing SQL injections DoS or information disclosure. As a prerequisite it is necessary to log into the application.,8.8,CWE-89
CVE-2025-67639,A cross-site request forgery (CSRF) vulnerability in Jenkins 2.540 and earlier LTS 2.528.2 and earlier allows attackers to trick users into logging in to the attacker's account.,3.5,CWE-352
CVE-2023-53484,In the Linux kernel the following vulnerability has been resolved:  lib: cpu_rmap: Avoid use after free on rmap->obj array entries  When calling irq_set_affinity_notifier() with NULL at the notify argument it will cause freeing of the glue pointer in the corresponding array entry but will leave the pointer in the array. A subsequent call to free_irq_cpu_rmap() will try to free this entry again leading to possible use after free.  Fix that by setting NULL to the array entry and checking that we have non-zero at the array entry when iterating over the array in free_irq_cpu_rmap().  The current code does not suffer from this since there are no cases where irq_set_affinity_notifier(irq NULL) (note the NULL passed for the notify arg) is called followed by a call to free_irq_cpu_rmap() so we don't hit and issue. Subsequent patches in this series excersize this flow hence the required fix.,7.8,CWE-416
CVE-2024-23131,A maliciously crafted STP file when parsed in ASMIMPORT229A.dll ASMKERN228A.dll ASMkern229A.dll or ASMDATAX228A.dll through Autodesk applications can lead to a memory corruption vulnerability by write access violation. This vulnerability in conjunction with other vulnerabilities can lead to code execution in the context of the current process.,7.8,CWE-119
CVE-2022-40935,Online Pet Shop We App v1.0 is vulnerable to SQL Injection via /pet_shop/classes/Master.php?f=delete_categoryid.,7.2,CWE-89
CVE-2025-20218,A vulnerability in the web-based management interface of Cisco Secure Firewall Management Center (FMC) Software could allow an authenticated remote attacker to retrieve sensitive information from an affected device.    This vulnerability is due to insufficient input validation. An attacker could exploit this vulnerability by sending a crafted request to the web-based management interface of an affected device. A successful exploit could allow the attacker to retrieve sensitive information from the affected device.  To exploit this vulnerability the attacker must have valid administrative credentials.,4.9,CWE-643
CVE-2023-0471,Use after free in WebTransport in Google Chrome prior to 109.0.5414.119 allowed a remote attacker to potentially exploit heap corruption via a crafted HTML page. (Chromium security severity: High),8.8,CWE-416
CVE-2022-38205,In some non-default installations of Esri Portal for ArcGIS versions 10.9.1 and below a directory traversal issue may allow a remote unauthenticated attacker to traverse the file system and lead to the disclosure of sensitive data (not customer-published content).,8.6,CWE-23
CVE-2023-34103,Avo is an open source ruby on rails admin panel creation framework. In affected versions some avo fields are vulnerable to Cross Site Scripting (XSS) when rendering html based content. Attackers do need form edit privilege in order to successfully exploit this vulnerability but the results are stored and no specific timing is required. This issue has been addressed in commit `7891c01e` which is expected to be included in the next release of avo. Users are advised to configure CSP headers for their application and to limit untrusted user access as a mitigation.,7.3,CWE-79
CVE-2022-48739,In the Linux kernel the following vulnerability has been resolved:  ASoC: hdmi-codec: Fix OOB memory accesses  Correct size of iec_status array by changing it to the size of status array of the struct snd_aes_iec958. This fixes out-of-bounds slab read accesses made by memcpy() of the hdmi-codec driver. This problem is reported by KASAN.,7.1,CWE-125
CVE-2025-43241,A permissions issue was addressed with additional restrictions. This issue is fixed in macOS Sequoia 15.6 macOS Ventura 13.7.7 macOS Sonoma 14.7.7. An app may be able to read files outside of its sandbox.,5.5,CWE-284
CVE-2025-9576,A vulnerability was identified in seeedstudio ReSpeaker LinkIt7688. Impacted is an unknown function of the file /etc/shadow of the component Administrative Interface. The manipulation leads to use of default credentials. An attack has to be approached locally. A high degree of complexity is needed for the attack. The exploitability is considered difficult. The exploit is publicly available and might be used. The vendor was contacted early about this disclosure but did not respond in any way.,2.5,CWE-1392
CVE-2024-3470,An Improper Privilege Management vulnerability was identified in GitHub Enterprise Server that allowed an attacker to use a deploy key pertaining to an organization to bypass an organization ruleset. An attacker would require access to a valid deploy key for a repository in the organization as well as repository administrator access. This vulnerability affected versions of GitHub Enterprise Server 3.11 to 3.12 and was fixed in versions 3.11.8 and 3.12.2. This vulnerability was reported via the GitHub Bug Bounty program.  ,5.9,CWE-269
CVE-2024-6678,An issue was discovered in GitLab CE/EE affecting all versions starting from 8.14 prior to 17.1.7 starting from 17.2 prior to 17.2.5 and starting from 17.3 prior to 17.3.2 which allows an attacker to trigger a pipeline as an arbitrary user under certain circumstances.,9.9,CWE-290
CVE-2022-3027,The CMS8000 device does not properly control or sanitize the SSID name of a new Wi-Fi access point. A threat actor could create an SSID with a malicious name including non-standard characters that when the device attempts connecting to the malicious SSID the device can be exploited to write arbitrary files or display incorrect information.,5.7,CWE-284
CVE-2022-39265,MyBB is a free and open source forum software. The _Mail Settings_ → Additional Parameters for PHP's mail() function mail_parameters setting value in connection with the configured mail program's options and behavior may allow access to sensitive information and Remote Code Execution (RCE). The vulnerable module requires Admin CP access with the `_Can manage settings?_` permission and may depend on configured file permissions. MyBB 1.8.31 resolves this issue with the commit `0cd318136a`. Users are advised to upgrade. There are no known workarounds for this vulnerability.,7.2,CWE-74
CVE-2023-43340,Cross-site scripting (XSS) vulnerability in evolution v.3.2.3 allows a local attacker to execute arbitrary code via a crafted payload injected into the cmsadmin cmsadminemail cmspassword and cmspasswordconfim parameters,5.2,CWE-79
CVE-2026-24952,Improper Neutralization of Input During Web Page Generation ('Cross-site Scripting') vulnerability in Craig Hewitt Seriously Simple Podcasting seriously-simple-podcasting allows Stored XSS.This issue affects Seriously Simple Podcasting: from n/a through <= 3.14.1.,6.5,CWE-79
CVE-2024-7548,The LearnPress – WordPress LMS Plugin plugin for WordPress is vulnerable to time-based SQL Injection via the 'order' parameter in all versions up to and including 4.2.6.9.3 due to insufficient escaping on the user supplied parameter and lack of sufficient preparation on the existing SQL query.  This makes it possible for authenticated attackers with Contributor-level access and above to append additional SQL queries into already existing queries that can be used to extract sensitive information from the database.,8.8,CWE-89
CVE-2025-10111,A security flaw has been discovered in itsourcecode Student Information Management System 1.0. The affected element is an unknown function of the file /admin/modules/instructor/index.php. The manipulation of the argument ID results in sql injection. The attack can be executed remotely. The exploit has been released to the public and may be exploited.,7.3,CWE-74
CVE-2025-3812,The WPBot Pro Wordpress Chatbot plugin for WordPress is vulnerable to arbitrary file deletion due to insufficient file path validation in the qcld_openai_delete_training_file() function in all versions up to and including 13.6.2. This makes it possible for authenticated attackers with Subscriber-level access and above to delete arbitrary files on the server which can easily lead to remote code execution when the right file is deleted (such as wp-config.php).,8.1,CWE-73
CVE-2023-49999,Tenda W30E V16.01.0.12(4843) was discovered to contain a command injection vulnerability via the function setUmountUSBPartition.,9.8,CWE-787
CVE-2023-23427, Some Honor products are affected by incorrect privilege assignment vulnerability successful exploitation could cause device service exceptions.  ,4.0,CWE-269
CVE-2024-24713,Improper Neutralization of Input During Web Page Generation ('Cross-site Scripting') vulnerability in WP Auto Listings Auto Listings – Car Listings & Car Dealership Plugin for WordPress allows Stored XSS.This issue affects Auto Listings – Car Listings & Car Dealership Plugin for WordPress: from n/a through 2.6.5.  ,6.5,CWE-79
CVE-2024-50462,Improper Neutralization of Input During Web Page Generation (XSS or 'Cross-site Scripting') vulnerability in Fla-shop Interactive World Map allows Stored XSS.This issue affects Interactive World Map: from n/a through 3.4.4.,6.5,CWE-79
CVE-2025-52519,An issue was discovered in the Camera in Samsung Mobile Processor and Wearable Processor Exynos 1330 1380 1480 2400 1580 and 2500. Improper validation of user-space input in the issimian device driver leads to information disclosure and a denial of service.,7.1,CWE-20
CVE-2025-30920,Improper Neutralization of Input During Web Page Generation ('Cross-site Scripting') vulnerability in teastudio.pl WP Posts Carousel allows Stored XSS. This issue affects WP Posts Carousel: from n/a through 1.3.7.,6.5,CWE-79
CVE-2023-3473,A vulnerability which was classified as critical was found in Campcodes Retro Cellphone Online Store 1.0. Affected is an unknown function of the file /admin/edit_product.php. The manipulation of the argument username leads to sql injection. It is possible to launch the attack remotely. The exploit has been disclosed to the public and may be used. The identifier of this vulnerability is VDB-232752.,4.7,CWE-89
CVE-2024-26689,In the Linux kernel the following vulnerability has been resolved:  ceph: prevent use-after-free in encode_cap_msg()  In fs/ceph/caps.c in encode_cap_msg() use after free error was caught by KASAN at this line - 'ceph_buffer_get(arg->xattr_buf);'. This implies before the refcount could be increment here it was freed.  In same file in handle_cap_grant() refcount is decremented by this line - 'ceph_buffer_put(ci->i_xattrs.blob);'. It appears that a race occurred and resource was freed by the latter line before the former line could increment it.  encode_cap_msg() is called by __send_cap() and __send_cap() is called by ceph_check_caps() after calling __prep_cap(). __prep_cap() is where arg->xattr_buf is assigned to ci->i_xattrs.blob. This is the spot where the refcount must be increased to prevent use after free error.,7.8,CWE-416
CVE-2024-9328,A vulnerability was found in SourceCodester Advocate Office Management System 1.0. It has been rated as critical. This issue affects some unknown processing of the file /control/edit_client.php. The manipulation of the argument id leads to sql injection. The attack may be initiated remotely. The exploit has been disclosed to the public and may be used.,6.3,CWE-89
CVE-2024-4569,The Elementor Addon Elements plugin for WordPress is vulnerable to Stored Cross-Site Scripting via the ‘url’ parameter in versions up to and including 1.13.5 due to insufficient input sanitization and output escaping. This makes it possible for authenticated attackers with contributor-level permissions and above to inject arbitrary web scripts in pages that will execute whenever a user accesses an injected page.,6.4,CWE-79
CVE-2022-30337,Cross-Site Request Forgery (CSRF) vulnerability in JoomUnited WP Meta SEO plugin <= 4.4.8 at WordPress allows an attacker to update the social settings.,5.4,CWE-352
CVE-2025-58798,Cross-Site Request Forgery (CSRF) vulnerability in Bjorn Manintveld BCM Duplicate Menu allows Cross Site Request Forgery. This issue affects BCM Duplicate Menu: from n/a through 1.1.2.,4.3,CWE-352
CVE-2024-13732,The Responsive Blocks – WordPress Gutenberg Blocks plugin for WordPress is vulnerable to Stored Cross-Site Scripting via the ‘section_tag’ parameter in all versions up to and including 1.9.9 due to insufficient input sanitization and output escaping. This makes it possible for authenticated attackers with Contributor-level access and above to inject arbitrary web scripts in pages that will execute whenever a user accesses an injected page.,6.4,CWE-79
CVE-2024-41013,In the Linux kernel the following vulnerability has been resolved:  xfs: don't walk off the end of a directory data block  This adds sanity checks for xfs_dir2_data_unused and xfs_dir2_data_entry to make sure don't stray beyond valid memory region. Before patching the loop simply checks that the start offset of the dup and dep is within the range. So in a crafted image if last entry is xfs_dir2_data_unused we can change dup->length to dup->length-1 and leave 1 byte of space. In the next traversal this space will be considered as dup or dep. We may encounter an out of bound read when accessing the fixed members.  In the patch we make sure that the remaining bytes large enough to hold an unused entry before accessing xfs_dir2_data_unused and xfs_dir2_data_unused is XFS_DIR2_DATA_ALIGN byte aligned. We also make sure that the remaining bytes large enough to hold a dirent with a single-byte name before accessing xfs_dir2_data_entry.,7.1,CWE-125
CVE-2025-67818,An issue was discovered in Weaviate OSS before 1.33.4. An attacker with access to insert data into the database can craft an entry name with an absolute path (e.g. /etc/...) or use parent directory traversal (../../..) to escape the restore root when a backup is restored potentially creating or overwriting files in arbitrary locations within the application's privilege scope.,7.2,CWE-22
CVE-2022-34907,An authentication bypass vulnerability exists in FileWave before 14.6.3 and 14.7.x before 14.7.2. Exploitation could allow an unauthenticated actor to gain access to the system with the highest authority possible and gain full control over the FileWave platform.,9.8,CWE-798
CVE-2025-46906,Adobe Experience Manager versions 6.5.22 and earlier are affected by a stored Cross-Site Scripting (XSS) vulnerability that could be abused by a low privileged attacker to inject malicious scripts into vulnerable form fields. Malicious JavaScript may be executed in a victim’s browser when they browse to the page containing the vulnerable field.,5.4,CWE-79
CVE-2023-24009,Auth. (subscriber+) Reflected Cross-site Scripting (XSS) vulnerability in Wpazure Themes Upfrontwp theme <= 1.1 versions.,6.5,CWE-79
CVE-2022-24578,GPAC 1.0.1 is affected by a heap-based buffer overflow in SFS_AddString () at bifs/script_dec.c.,7.8,CWE-787
CVE-2023-46723,lte-pic32-writer is a writer for PIC32 devices. In versions 0.0.1 and prior those who use `sendto.txt` are vulnerable to attackers who known the IMEI reading the sendto.txt. The sendto.txt file can contain the SNS(such as slack and zulip) URL and API key. As of time of publication a patch is not yet available. As workarounds avoid using `sendto.txt` or use `.htaccess` to block access to `sendto.txt`.,8.9,CWE-538
CVE-2025-48314,Improper Neutralization of Input During Web Page Generation ('Cross-site Scripting') vulnerability in salubrio Add Code To Head allows Stored XSS. This issue affects Add Code To Head: from n/a through 1.17.,5.9,CWE-79
CVE-2025-41110,Encrypted WiFi and SSH credentials were found in the Ghost Robotics Vision 60 v0.27.2 APK. This vulnerability allows an attacker to connect to the robot's WiFi and view all its data as it runs on ROS 2 without default authentication. In addition the attacker can connect via SSH and gain full control of the robot which could cause physical damage to the robot itself or its environment.,8.8,CWE-287
CVE-2023-5992,A vulnerability was found in OpenSC where PKCS#1 encryption padding removal is not implemented as side-channel resistant. This issue may result in the potential leak of private data.,5.6,CWE-203
CVE-2023-44219,A local privilege escalation vulnerability in SonicWall Directory Services Connector Windows MSI client 4.1.21 and earlier versions allows a local low-privileged user to gain system privileges through running the recovery feature.,7.8,CWE-269
CVE-2023-36747,Multiple heap-based buffer overflow vulnerabilities exist in the fstReaderIterBlocks2 fstWritex len functionality of GTKWave 3.3.115. A specially crafted .fst file can lead to memory corruption. A victim would need to open a malicious file to trigger these vulnerabilities.This vulnerability concerns the handling of `len` in `fstWritex` when `beg_time` does not match the start of the time table.,7.0,CWE-119
CVE-2025-55310,An issue was discovered in Foxit PDF and Editor for Windows and macOS before 13.2 and 2025 before 2025.2. An attacker able to alter or replace the static HTML files used by the StartPage feature can cause the application to load malicious or compromised content upon startup. This may result in information disclosure unauthorized data access or other security impacts.,7.3,CWE-494
CVE-2025-52035,A vulnerability in NotesCMS and specifically in the page /index.php?route=notes. The manipulation of the title of the service descriptions leads to a stored XSS vulnerability. The issue was confirmed to be present in the source code as of commit 7d821a0f028b0778b245b99ab3d3bff1ac10e2d3 (dated 2024-05-08) and was fixed in commit 95322c5121dbd7070f3bd54f2848079654a0a8ea (dated 2025-03-31). The attack can be launched remotely.,6.1,CWE-79
CVE-2022-38195,There is as reflected cross site scripting issue in Esri ArcGIS Server versions 10.9.1 and below which may allow a remote unauthorized attacker able to convince a user to click on a crafted link which could potentially execute arbitrary JavaScript code in the victim’s browser.,6.1,CWE-79
CVE-2022-32266,DMA attacks on the parameter buffer used by a software SMI handler used by the driver PcdSmmDxe could lead to a TOCTOU attack on the SMI handler and lead to corruption of other ACPI fields and adjacent memory fields. DMA attacks on the parameter buffer used by a software SMI handler used by the driver PcdSmmDxe could lead to a TOCTOU attack on the SMI handler and lead to corruption of other ACPI fields and adjacent memory fields. The attack would require detailed knowledge of the PCD database contents on the current platform. This issue was discovered by Insyde engineering during a security review. This issue is fixed in Kernel 5.3: 05.36.23 Kernel 5.4: 05.44.23 Kernel 5.5: 05.52.23. Kernel 5.2 is unaffected. CWE-787 An issue was discovered in Insyde InsydeH2O with kernel 5.0 through 5.5. DMA attacks on the parameter buffer that is used by a software SMI handler (used by the PcdSmmDxe driver) could lead to a TOCTOU race-condition attack on the SMI handler and lead to corruption of other ACPI fields and adjacent memory fields. The attack would require detailed knowledge of the PCD database contents on the current platform.,6.4,CWE-787
CVE-2024-38411,Memory corruption while registering a buffer from user-space to kernel-space using IOCTL calls.,6.6,CWE-416
CVE-2023-28501,Rocket Software UniData versions prior to 8.2.4 build 3003 and UniVerse versions prior to 11.3.5 build 1001 or 12.2.1 build 2002 suffer from a heap-based buffer overflow in the unirpcd daemon that if successfully exploited can lead to remote code execution as the root user.,9.8,CWE-190
CVE-2025-40905,WWW::OAuth 1.000 and earlier for Perl uses the rand() function as the default source of entropy which is not cryptographically secure for cryptographic functions.,7.3,CWE-338
CVE-2023-49234,An XML external entity (XXE) vulnerability was found in Stilog Visual Planning 8. It allows an authenticated attacker to access local server files and exfiltrate data to an external server.,6.3,CWE-611
CVE-2025-48888,Deno is a JavaScript TypeScript and WebAssembly runtime. Starting in version 1.41.3 and prior to versions 2.1.13 2.2.13 and 2.3.2 `deno run --allow-read --deny-read main.ts` results in allowed even though 'deny' should be stronger. The result is the same with all global unary permissions given as `--allow-* --deny-*`. This only affects a nonsensical combination of flags so there shouldn't be a real impact on the userbase. Users may upgrade to version 2.1.13 2.2.13 or 2.3.2 to receive a patch.,5.3,CWE-863
CVE-2023-39107,An arbitrary file overwrite vulnerability in NoMachine Free Edition and Enterprise Client for macOS before v8.8.1 allows attackers to overwrite root-owned files by using hardlinks.,9.1,CWE-59
CVE-2023-51300,PHPJabbers Hotel Booking System v4.0 is vulnerable to Cross-Site Scripting (XSS) vulnerabilities in the name plugin_sms_api_key plugin_sms_country_code title plugin_sms_api_key parameters.,6.1,CWE-79
CVE-2025-31639,Cross-Site Request Forgery (CSRF) vulnerability in themeton Spare allows Cross Site Request Forgery. This issue affects Spare: from n/a through 1.7.,4.3,CWE-352
CVE-2025-11097,A vulnerability has been found in D-Link DIR-823X 250416. Impacted is an unknown function of the file /goform/set_device_name. The manipulation of the argument mac leads to command injection. The attack is possible to be carried out remotely. The exploit has been disclosed to the public and may be used.,6.3,CWE-74
CVE-2023-39377, SiberianCMS - CWE-434: Unrestricted Upload of File with Dangerous Type - A malicious user with administrative privileges may be able to upload a dangerous filetype via an unspecified method,7.2,CWE-434
CVE-2021-44501,An issue was discovered in FIS GT.M through V7.0-000 (related to the YottaDB code base). Using crafted input an attacker can cause calls to ZRead to crash due to a NULL pointer dereference.,7.5,CWE-476
CVE-2024-31583,Pytorch before version v2.2.0 was discovered to contain a use-after-free vulnerability in torch/csrc/jit/mobile/interpreter.cpp.,7.8,CWE-416
CVE-2025-22004,In the Linux kernel the following vulnerability has been resolved:  net: atm: fix use after free in lec_send()  The ->send() operation frees skb so save the length before calling ->send() to avoid a use after free.,7.8,CWE-416
CVE-2025-4032,A vulnerability was found in inclusionAI AWorld up to 8c257626e648d98d793dd9a1a950c2af4dd84c4e. It has been rated as critical. This issue affects the function subprocess.run/subprocess.Popen of the file AWorld/aworld/virtual_environments/terminals/shell_tool.py. The manipulation leads to os command injection. The attack may be initiated remotely. The complexity of an attack is rather high. The exploitation is known to be difficult. The exploit has been disclosed to the public and may be used. This product does not use versioning. This is why information about affected and unaffected releases are unavailable.,5.0,CWE-77
CVE-2024-32959,Improper Privilege Management vulnerability in Sirv allows Privilege Escalation.This issue affects Sirv: from n/a through 7.2.2.,8.8,CWE-269
CVE-2024-41734,Due to missing authorization check in SAP NetWeaver Application Server ABAP and ABAP Platform an authenticated attacker could call an underlying transaction which leads to disclosure of user related information. There is no impact on integrity or availability.,4.3,CWE-862
