CVE,Description,CVSS3_BaseScore,CWE
CVE-2025-48964,ping in iputils before 20250602 allows a denial of service (application error in adaptive ping mode or incorrect data collection) via a crafted ICMP Echo Reply packet because a zero timestamp can lead to large intermediate values that have an integer overflow when squared during statistics calculations. NOTE: this issue exists because of an incomplete fix for CVE-2025-47268 (that fix was only about timestamp calculations and it did not account for a specific scenario where the original timestamp in the ICMP payload is zero).,6.5,CWE-190
CVE-2022-20411,In avdt_msg_asmbl of avdt_msg.cc there is a possible out of bounds write due to a missing bounds check. This could lead to remote code execution over Bluetooth with no additional execution privileges needed. User interaction is not needed for exploitation.Product: AndroidVersions: Android-10 Android-11 Android-12 Android-12L Android-13Android ID: A-232023771,8.8,CWE-787
CVE-2023-6572,Command Injection in GitHub repository gradio-app/gradio prior to main.,8.1,CWE-77
CVE-2024-42316,In the Linux kernel the following vulnerability has been resolved:  mm/mglru: fix div-by-zero in vmpressure_calc_level()  evict_folios() uses a second pass to reclaim folios that have gone through page writeback and become clean before it finishes the first pass since folio_rotate_reclaimable() cannot handle those folios due to the isolation.  The second pass tries to avoid potential double counting by deducting scan_control->nr_scanned.  However this can result in underflow of nr_scanned under a condition where shrink_folio_list() does not increment nr_scanned i.e. when folio_trylock() fails.  The underflow can cause the divisor i.e. scale=scanned+reclaimed in vmpressure_calc_level() to become zero resulting in the following crash:    [exception RIP: vmpressure_work_fn+101]   process_one_work at ffffffffa3313f2b  Since scan_control->nr_scanned has no established semantics the potential double counting has minimal risks.  Therefore fix the problem by not deducting scan_control->nr_scanned in evict_folios().,5.5,CWE-369
CVE-2022-28655,is_closing_session() allows users to create arbitrary tcp dbus connections,7.1,CWE-770
CVE-2023-51687,Exposure of Sensitive Information to an Unauthorized Actor vulnerability in impleCode Product Catalog Simple.This issue affects Product Catalog Simple: from n/a through 1.7.6.  ,5.3,CWE-200
CVE-2022-25047,The password reset token in CWP v0.9.8.1126 is generated using known or predictable values.,5.9,CWE-330
CVE-2023-25045,Improper Neutralization of Special Elements used in an SQL Command ('SQL Injection') vulnerability in David F. Carr RSVPMaker allows SQL Injection.This issue affects RSVPMaker: from n/a through 9.9.3.  ,6.7,CWE-89
CVE-2024-33786,An arbitrary file upload vulnerability in Zhongcheng Kexin Ticketing Management Platform 20.04 allows attackers to execute arbitrary code via uploading a crafted file.,9.8,CWE-434
CVE-2023-4124,Missing Authorization in GitHub repository answerdev/answer prior to v1.1.1.,6.5,CWE-862
CVE-2025-54486,A stack-based buffer overflow vulnerability exists in the MFER parsing functionality of The Biosig Project libbiosig 3.9.0 and Master Branch (35a819fa). A specially crafted MFER file can lead to arbitrary code execution. An attacker can provide a malicious file to trigger this vulnerability.This vulnerability manifests on line 8824 of biosig.c on the current master branch (35a819fa) when the Tag is 11:                    else if (tag==11)    //0x0B                  {                      // Fs                      if (len>6) fprintf(stderrWarning MFER tag11 incorrect length %i>6\nlen);                      double  fval;                      curPos += ifread(buf1lenhdr);,9.8,CWE-121
CVE-2024-21634,Amazon Ion is a Java implementation of the Ion data notation. Prior to version 1.10.5 a potential denial-of-service issue exists in `ion-java` for applications that use `ion-java` to deserialize Ion text encoded data or deserialize Ion text or binary encoded data into the `IonValue` model and then invoke certain `IonValue` methods on that in-memory representation. An actor could craft Ion data that when loaded by the affected application and/or processed using the `IonValue` model results in a `StackOverflowError` originating from the `ion-java` library. The patch is included in `ion-java` 1.10.5. As a workaround do not load data which originated from an untrusted source or that could have been tampered with.,7.5,CWE-770
CVE-2022-32065,An arbitrary file upload vulnerability in the background management module of RuoYi v4.7.3 and below allows attackers to execute arbitrary code via a crafted HTML file.,5.4,CWE-79
CVE-2024-54355,Cross-Site Request Forgery (CSRF) vulnerability in brandtoss WP Mailster allows Cross Site Request Forgery.This issue affects WP Mailster: from n/a through 1.8.17.0.,4.3,CWE-352
CVE-2021-4201,Missing access control in ForgeRock Access Management 7.1.0 and earlier versions on all platforms allows remote unauthenticated attackers to hijack sessions including potentially admin-level sessions. This issue affects: ForgeRock Access Management 7.1 versions prior to 7.1.1; 6.5 versions prior to 6.5.4; all previous versions.,9.6,CWE-284
CVE-2022-46812,Cross-Site Request Forgery (CSRF) vulnerability in VillaTheme Thank You Page Customizer for WooCommerce – Increase Your Sales plugin <= 1.0.13 versions.,4.3,CWE-352
CVE-2024-12747,A flaw was found in rsync. This vulnerability arises from a race condition during rsync's handling of symbolic links. Rsync's default behavior when encountering symbolic links is to skip them. If an attacker replaced a regular file with a symbolic link at the right time it was possible to bypass the default behavior and traverse symbolic links. Depending on the privileges of the rsync process an attacker could leak sensitive information potentially leading to privilege escalation.,5.6,CWE-362
CVE-2025-1184,A vulnerability was found in pihome-shc PiHome 1.77 and classified as critical. Affected by this issue is some unknown functionality of the file /ajax.php?Ajax=GetModal_MQTTEdit. The manipulation of the argument id leads to sql injection. The attack may be launched remotely. The exploit has been disclosed to the public and may be used.,6.3,CWE-74
CVE-2022-1699,Uncontrolled Resource Consumption in GitHub repository causefx/organizr prior to 2.1.2000. This vulnerability can be abused by doing a DDoS attack for which genuine users will not able to access resources/applications.,7.5,CWE-190
CVE-2023-2010,The Forminator WordPress plugin before 1.24.1 does not use an atomic operation to check whether a user has already voted and then update that information. This leads to a Race Condition that may allow a single user to vote multiple times on a poll.,3.1,CWE-362
CVE-2025-22938,Adtran 411 ONT L80.00.0011.M2 was discovered to contain weak default passwords.,9.8,CWE-1393
CVE-2025-58810,Improper Neutralization of Input During Web Page Generation ('Cross-site Scripting') vulnerability in jimmywb Simple Link List Widget allows Stored XSS. This issue affects Simple Link List Widget: from n/a through 0.3.2.,5.9,CWE-79
CVE-2022-20106,In MM service there is a possible out of bounds write due to a heap-based buffer overflow. This could lead to local escalation of privilege with System execution privileges needed. User interaction is not needed for exploitation. Patch ID: DTV03330460; Issue ID: DTV03330460.,6.7,CWE-787
CVE-2025-25580,yimioa before v2024.07.04 was discovered to contain a SQL injection vulnerability via the listNameBySql() method at /xml/UserMapper.xml.,6.1,CWE-89
CVE-2023-7054,A vulnerability was found in PHPGurukul Online Notes Sharing System 1.0. It has been rated as problematic. This issue affects some unknown processing of the file /user/add-notes.php. The manipulation leads to unrestricted upload. The attack may be initiated remotely. The exploit has been disclosed to the public and may be used. The identifier VDB-248741 was assigned to this vulnerability.,5.5,CWE-434
CVE-2022-46861,Auth. (admin+) Stored Cross-Site Scripting (XSS) vulnerability in Zia Imtiaz Custom Login Page Styler for WordPress plugin <= 6.2 versions.,5.9,CWE-79
CVE-2025-1902,A vulnerability was found in PHPGurukul Student Record System 3.2. It has been declared as critical. This vulnerability affects unknown code of the file /password-recovery.php. The manipulation of the argument emailid leads to sql injection. The attack can be initiated remotely. The exploit has been disclosed to the public and may be used.,7.3,CWE-74
CVE-2024-45755,An issue was discovered in Centreon centreon-dsm-server 24.10.x before 24.10.0 24.04.x before 24.04.3 23.10.x before 23.10.1 23.04.x before 23.04.3 and 22.10.x before 22.10.2. SQL injection can occur in the form to configure Centreon DSM slots. Exploitation is only accessible to authenticated users with high-privileged access.,7.2,CWE-89
CVE-2022-3380,The Customizer Export/Import WordPress plugin before 0.9.5 unserializes the content of an imported file which could lead to PHP object injection issues when an admin imports (intentionally or not) a malicious file and a suitable gadget chain is present on the blog.,7.2,CWE-502
CVE-2025-5833,Pioneer DMH-WT7600NEX Root Filesystem Insufficient Verification of Data Authenticity Vulnerability. This vulnerability allows physically present attackers to bypass authentication on affected installations of Pioneer DMH-WT7600NEX devices. Authentication is not required to exploit this vulnerability.  The specific flaw exists within the configuration of the operating system. The issue results from the lack of properly configured protection for the root file system. An attacker can leverage this vulnerability to bypass authentication on the system. Was ZDI-CAN-26077.,6.8,CWE-345
CVE-2023-20227,A vulnerability in the Layer 2 Tunneling Protocol (L2TP) feature of Cisco IOS XE Software could allow an unauthenticated remote attacker to cause a denial of service (DoS) condition on an affected device.    This vulnerability is due to improper handling of certain L2TP packets. An attacker could exploit this vulnerability by sending crafted L2TP packets to an affected device. A successful exploit could allow the attacker to cause the device to reload unexpectedly resulting in a DoS condition.    Note: Only traffic directed to the affected system can be used to exploit this vulnerability.,8.6,CWE-388
CVE-2023-4120,A vulnerability was found in Byzoro Smart S85F Management Platform up to 20230722 and classified as critical. This issue affects some unknown processing of the file importhtml.php. The manipulation of the argument sql leads to command injection. The attack may be initiated remotely. The exploit has been disclosed to the public and may be used. The associated identifier of this vulnerability is VDB-235967. NOTE: The vendor was contacted early about this disclosure but did not respond in any way.,6.3,CWE-77
CVE-2023-4223,Unrestricted file upload in `/main/inc/ajax/document.ajax.php` in Chamilo LMS <= v1.11.24 allows authenticated attackers with learner role to obtain remote code execution via uploading of PHP files.,8.8,CWE-434
CVE-2023-28027, Dell BIOS contains an improper input validation vulnerability. A local authenticated malicious user with administrator privileges may potentially exploit this vulnerability in order to modify a UEFI variable.  ,5.1,CWE-20
CVE-2022-42159,D-Link COVR 120012021203 v1.08 was discovered to have a predictable seed in a Pseudo-Random Number Generator.,4.3,CWE-335
CVE-2023-31128,NextCloud Cookbook is a recipe library app. Prior to commit a46d9855 on the `master` branch and commit 489bb744 on the `main-0.9.x` branch the `pull-checks.yml` workflow is vulnerable to command injection attacks because of using an untrusted `github.head_ref` field. The `github.head_ref` value is an attacker-controlled value. Assigning the value to `zzz;echo${IFS}hello;#` can lead to command injection. Since the permission is not restricted the attacker has a write-access to the repository. This issue is fixed in commit a46d9855 on the `master` branch and commit 489bb744 on the `main-0.9.x` branch. There is no risk for the user of the app within the NextCloud server. This only affects the main repository and possible forks of it. Those who have forked the NextCloud Cookbook repository should make sure their forks are on the latest version to prevent code injection attacks and similar.,8.1,CWE-78
CVE-2024-36128,Directus is a real-time API and App dashboard for managing SQL database content. Prior to 10.11.2 providing a non-numeric length value to the random string generation utility will create a memory issue breaking the capability to generate random strings platform wide. This creates a denial of service situation where logged in sessions can no longer be refreshed as sessions depend on the capability to generate a random session ID. This vulnerability is fixed in 10.11.2.,7.5,CWE-754
CVE-2024-28421,SQL Injection vulnerability in Razor 0.8.0 allows a remote attacker to escalate privileges via the ChannelModel::updateapk method of the channelmodle.php,9.8,CWE-89
CVE-2018-25040,A vulnerability was found in uTorrent Web. It has been declared as critical. Affected by this vulnerability is an unknown functionality of the component HTTP RPC Server. The manipulation leads to privilege escalation. The attack can be launched remotely. The exploit has been disclosed to the public and may be used. It is recommended to upgrade the affected component.,6.3,CWE-269
CVE-2022-1234,XSS in livehelperchat in GitHub repository livehelperchat/livehelperchat prior to 3.97. This vulnerability has the potential to deface websites result in compromised user accounts and can run malicious code on web pages which can lead to a compromise of the user’s device.,6.1,CWE-79
CVE-2024-27256,IBM MQ Container 3.0.0 3.0.1 3.1.0 through 3.1.3 CD 2.0.0 LTS through 2.0.22 LTS and 2.4.0 through 2.4.8 2.3.0 through 2.3.3 2.2.0 through 2.2.2 uses weaker than expected cryptographic algorithms that could allow an attacker to decrypt highly sensitive information.,5.9,CWE-327
CVE-2021-22825,A CWE-200: Exposure of Sensitive Information to an Unauthorized Actor vulnerability exists that could allow an attacker to access the system with elevated privileges when a privileged account clicks on a malicious URL that compromises the security token. Affected Products: AP7xxxx and AP8xxx with NMC2 (V6.9.6 or earlier) AP7xxx and AP8xxx with NMC3 (V1.1.0.3 or earlier) and APDU9xxx with NMC3 (V1.0.0.28 or earlier),8.0,CWE-200
CVE-2024-44054,Improper Neutralization of Input During Web Page Generation (XSS or 'Cross-site Scripting') vulnerability in CryoutCreations Fluida allows Stored XSS.This issue affects Fluida: from n/a through 1.8.8.,6.5,CWE-79
CVE-2021-44956,Two Heap based buffer overflow vulnerabilities exist in ffjpeg through 01.01.2021. It is similar to CVE-2020-23852. Issues that are in the jfif_decode function at ffjpeg/src/jfif.c (line 552) could cause a Denial of Service by using a crafted jpeg file.,6.5,CWE-787
CVE-2023-37285,An out-of-bounds read was addressed with improved bounds checking. This issue is fixed in iOS 15.7.8 and iPadOS 15.7.8 macOS Big Sur 11.7.9 macOS Monterey 12.6.8 macOS Ventura 13.5. An app may be able to execute arbitrary code with kernel privileges.,9.8,CWE-125
CVE-2022-25429,Tenda AC9 v15.03.2.21 was discovered to contain a buffer overflow via the time parameter in the saveparentcontrolinfo function.,9.8,CWE-787
CVE-2025-4533,A vulnerability classified as problematic was found in JeecgBoot up to 3.8.0. This vulnerability affects the function unzipFile of the file /jeecg-boot/airag/knowledge/doc/import/zip of the component Document Library Upload. The manipulation of the argument File leads to resource consumption. The attack can be initiated remotely. The exploit has been disclosed to the public and may be used.,2.7,CWE-400
CVE-2025-28413,An issue in RUoYi v.4.8.0 allows a remote attacker to escalate privileges via the SysDictTypeController component,9.8,CWE-284
CVE-2024-36620,moby v25.0.0 - v26.0.2 is vulnerable to NULL Pointer Dereference via daemon/images/image_history.go.,6.5,CWE-476
CVE-2023-30642,Improper privilege management vulnerability in Galaxy Themes Service prior to SMR Jul-2023 Release 1 allows local attackers to call privilege function.,6.2,CWE-269
CVE-2023-46088,Auth. (admin+) Stored Cross-Site Scripting (XSS) vulnerability in Mammothology WP Full Stripe Free plugin <= 1.6.1 versions.,5.9,CWE-79
CVE-2024-2390, As a part of Tenable’s vulnerability disclosure program a vulnerability in a Nessus plugin was identified and reported. This vulnerability could allow a malicious actor with sufficient permissions on a scan target to place a binary in a specific filesystem location and abuse the impacted plugin in order to escalate privileges.  ,7.8,CWE-269
CVE-2023-5080,A privilege escalation vulnerability was reported in some Lenovo tablet products that could allow local applications access to device identifiers and system commands.,6.8,CWE-266
CVE-2023-7288,The Paytium: Mollie payment forms & donations plugin for WordPress is vulnerable to unauthorized data modification due to a missing capability check on the update_profile_preference function in versions up to and including 4.3.7. This makes it possible for authenticated attackers with subscriber-level access to change plugin settings.,5.4,CWE-862
CVE-2023-49253,Root user password is hardcoded into the device and cannot be changed in the user interface.  ,9.8,CWE-798
CVE-2024-10629,The GPX Viewer plugin for WordPress is vulnerable to arbitrary file creation due to a missing capability check and file type validation in the gpxv_file_upload() function in all versions up to and including 2.2.8. This makes it possible for authenticated attackers with subscriber-level access and above to create arbitrary files on the affected site's server which may make remote code execution possible.,8.8,CWE-862
CVE-2023-2077,A vulnerability which was classified as problematic has been found in Campcodes Online Traffic Offense Management System 1.0. This issue affects some unknown processing of the file /admin/offenses/view_details.php. The manipulation of the argument id leads to cross site scripting. The attack may be initiated remotely. The exploit has been disclosed to the public and may be used. The associated identifier of this vulnerability is VDB-226055.,3.5,CWE-79
CVE-2021-46850,myVesta Control Panel before 0.9.8-26-43 and Vesta Control Panel before 0.9.8-26 are vulnerable to command injection. An authenticated and remote administrative user can execute arbitrary commands via the v_sftp_license parameter when sending HTTP POST requests to the /edit/server endpoint.,7.2,CWE-88
CVE-2023-25835,There is a stored Cross-site Scripting vulnerability in Esri Portal for ArcGIS Sites versions 11.1 and below that may allow a remote authenticated attacker to create a crafted link that is stored in the site configuration which when clicked could potentially execute arbitrary JavaScript code in the victims browser.  The privileges required to execute this attack are high. The impact to Confidentiality Integrity and Availability are High.,8.4,CWE-79
CVE-2023-36011,Win32k Elevation of Privilege Vulnerability,7.8,CWE-822
CVE-2025-29029,Tenda AC6 v15.03.05.16 was discovered to contain a buffer overflow via the formSetSpeedWan function.,9.8,CWE-787
CVE-2025-50434,A security issue has been identified in Appian Enterprise Business Process Management version 25.3. The vulnerability is related to incorrect access control which under certain conditions could allow unauthorized access to information. NOTE: this has been disputed because the CVE Record information does not originate from the Supplier and the report lacks specificity about why a problem exists how the behavior could be reproduced and whether any action could be taken to resolve the problem.,5.3,CWE-284
CVE-2024-10869,The WordPress Brute Force Protection – Stop Brute Force Attacks plugin for WordPress is vulnerable to Reflected Cross-Site Scripting due to the use of add_query_arg & remove_query_arg without appropriate escaping on the URL in all versions up to and including 2.2.6. This makes it possible for unauthenticated attackers to inject arbitrary web scripts in pages that execute if they can successfully trick a user into performing an action such as clicking on a link.,6.1,CWE-79
CVE-2024-42404,SQL injection vulnerability in Welcart e-Commerce prior to 2.11.2 allows an attacker who can login to the product to obtain or alter the information stored in the database.,8.8,CWE-89
CVE-2024-38207,Microsoft Edge (HTML-based) Memory Corruption Vulnerability,6.3,CWE-843
CVE-2023-27879,Improper access control in firmware for some Intel(R) Optane(TM) SSD products may allow an unauthenticated user to potentially enable information disclosure via physical access.,6.8,CWE-284
CVE-2025-7089,A vulnerability was found in Belkin F9K1122 1.00.33 and classified as critical. This issue affects the function formWanTcpipSetup of the file /goform/formWanTcpipSetup of the component webs. The manipulation of the argument pppUserName leads to stack-based buffer overflow. The attack may be initiated remotely. The exploit has been disclosed to the public and may be used. The vendor was contacted early about this disclosure but did not respond in any way.,8.8,CWE-119
CVE-2025-39567,Improper Neutralization of Input During Web Page Generation ('Cross-site Scripting') vulnerability in Shamalli Web Directory Free allows Reflected XSS. This issue affects Web Directory Free: from n/a through 1.7.8.,7.1,CWE-79
CVE-2024-8413,Cross Site Scripting (XSS) vulnerability through the action parameter in index.php. Affected product codebase  https://github.com/Bioshox/Raspcontrol  and forks such as  https://github.com/harmon25/raspcontrol . An attacker could exploit this vulnerability by sending a specially crafted JavaScript payload to an authenticated user and partially hijacking their session details.  References list,5.4,CWE-79
CVE-2024-34244,libmodbus v3.1.10 is vulnerable to Buffer Overflow via the modbus_write_bits function. This issue can be triggered when the function is fed with specially crafted input which leads to out-of-bounds read and can potentially cause a crash or other unintended behaviors.,7.5,CWE-120
CVE-2024-13806,The The Authors List plugin for WordPress is vulnerable to arbitrary shortcode execution in all versions up to and including 2.0.6. This is due to the software allowing users to execute an action that does not properly validate a value before running do_shortcode. This makes it possible for unauthenticated attackers to execute arbitrary shortcodes.,6.5,CWE-94
CVE-2024-48852,Insertion of Sensitive Information into Log File vulnerability observed in FLEXON. Some information may be improperly disclosed through https access.    This issue affects FLXEON through <= 9.3.4.,9.4,CWE-532
CVE-2025-3482,MedDream PACS Server DICOM File Parsing Stack-based Buffer Overflow Remote Code Execution Vulnerability. This vulnerability allows remote attackers to execute arbitrary code on affected installations of MedDream PACS Server. Authentication is not required to exploit this vulnerability.  The specific flaw exists within the parsing of DICOM files. The issue results from the lack of proper validation of the length of user-supplied data prior to copying it to a fixed-length stack-based buffer. An attacker can leverage this vulnerability to execute code in the context of the service account. Was ZDI-CAN-25826.,7.8,CWE-121
CVE-2022-43249,Libde265 v1.0.8 was discovered to contain a heap-buffer-overflow vulnerability via put_epel_hv_fallback<unsigned short> in fallback-motion.cc. This vulnerability allows attackers to cause a Denial of Service (DoS) via a crafted video file.,6.5,CWE-787
CVE-2022-36019,TensorFlow is an open source platform for machine learning. If `FakeQuantWithMinMaxVarsPerChannel` is given `min` or `max` tensors of a rank other than one it results in a `CHECK` fail that can be used to trigger a denial of service attack. We have patched the issue in GitHub commit 785d67a78a1d533759fcd2f5e8d6ef778de849e0. The fix will be included in TensorFlow 2.10.0. We will also cherrypick this commit on TensorFlow 2.9.1 TensorFlow 2.8.1 and TensorFlow 2.7.2 as these are also affected and still in supported range. There are no known workarounds for this issue.,5.9,CWE-617
CVE-2024-3550,The WP Shortcodes Plugin — Shortcodes Ultimate plugin for WordPress is vulnerable to Stored Cross-Site Scripting via the plugin's shortcode(s) in all versions up to and including 7.1.2 due to insufficient input sanitization and output escaping on user supplied attributes. This makes it possible for authenticated attackers with contributor-level access and above to inject arbitrary web scripts in pages that will execute whenever a user accesses an injected page.,6.4,CWE-79
CVE-2025-8034,Memory safety bugs present in Firefox ESR 115.25 Firefox ESR 128.12 Thunderbird ESR 128.12 Firefox ESR 140.0 Thunderbird ESR 140.0 Firefox 140 and Thunderbird 140. Some of these bugs showed evidence of memory corruption and we presume that with enough effort some of these could have been exploited to run arbitrary code. This vulnerability affects Firefox < 141 Firefox ESR < 115.26 Firefox ESR < 128.13 Firefox ESR < 140.1 Thunderbird < 141 Thunderbird < 128.13 and Thunderbird < 140.1.,8.8,CWE-119
