CVE,Description,CVSS3_BaseScore,CWE
CVE-2023-44466,An issue was discovered in net/ceph/messenger_v2.c in the Linux kernel before 6.4.5. There is an integer signedness error leading to a buffer overflow and remote code execution via HELLO or one of the AUTH frames. This occurs because of an untrusted length taken from a TCP packet in ceph_decode_32.,8.8,CWE-120
CVE-2024-30074,Windows Link Layer Topology Discovery Protocol Remote Code Execution Vulnerability,8.0,CWE-122
CVE-2024-10942,The All-in-One WP Migration and Backup plugin for WordPress is vulnerable to PHP Object Injection in all versions up to and including 7.89 via deserialization of untrusted input in the 'replace_serialized_values' function. This makes it possible for unauthenticated attackers to inject a PHP Object. No known POP chain is present in the vulnerable software. If a POP chain is present via an additional plugin or theme installed on the target system it could allow the attacker to delete arbitrary files retrieve sensitive data or execute code. An administrator must export and restore a backup in order to trigger the exploit.,7.5,CWE-502
CVE-2023-26822,D-Link Go-RT-AC750 revA_v101b03 was discovered to contain a command injection vulnerability via the service parameter at soapcgi.main.,9.8,CWE-77
CVE-2023-2611,Advantech R-SeeNet  versions 2.4.22   is installed with a hidden root-level user that is not available in the  users list. This hidden user has a password that cannot be changed by  users.      ,9.8,CWE-798
CVE-2024-2905,A security vulnerability has been discovered within rpm-ostree pertaining to the /etc/shadow file in default builds having the world-readable bit enabled. This issue arises from the default permissions being set at a higher level than recommended potentially exposing sensitive authentication data to unauthorized access.,6.2,CWE-732
CVE-2025-58686,Improper Neutralization of Special Elements used in an SQL Command ('SQL Injection') vulnerability in quadlayers Perfect Brands for WooCommerce allows SQL Injection. This issue affects Perfect Brands for WooCommerce: from n/a through 3.6.0.,8.5,CWE-89
CVE-2025-22515,Improper Neutralization of Input During Web Page Generation ('Cross-site Scripting') vulnerability in Simon Chuang Show Google Analytics widget allows Stored XSS.This issue affects Show Google Analytics widget: from n/a through 1.5.4.,6.5,CWE-79
CVE-2025-62783,InventoryGui is a library for creating chest GUIs for Bukkit/Spigot plugins. Versions 1.6.1-SNAPSHOT and earlier contain a vulnerability where any plugin using the `GuiStorageElement  can allow item duplication when the experimental Bundle item feature is enabled on the server. The vulnerability is resolved in version 1.6.2-SNAPSHOT.,5.0,CWE-837
CVE-2024-49990,In the Linux kernel the following vulnerability has been resolved:  drm/xe/hdcp: Check GSC structure validity  Sometimes xe_gsc is not initialized when checked at HDCP capability check. Add gsc structure check to avoid null pointer error.,5.5,CWE-908
CVE-2025-26996,Improper Control of Generation of Code ('Code Injection') vulnerability in Fetch Designs Sign-up Sheets allows Code Injection. This issue affects Sign-up Sheets: from n/a through 2.3.0.1.,6.5,CWE-94
CVE-2023-3759,A vulnerability which was classified as critical was found in Intergard SGS 8.7.0. Affected is an unknown function. The manipulation leads to permission issues. It is possible to launch the attack remotely. The exploit has been disclosed to the public and may be used. The identifier of this vulnerability is VDB-234444. NOTE: The vendor was contacted early about this disclosure but did not respond in any way.,6.3,CWE-275
CVE-2024-49380,Plenti a static site generator has an arbitrary file write vulnerability in versions prior to 0.7.2. The `/postLocal` endpoint is vulnerable to an arbitrary file write vulnerability when a plenti user serves their website. This issue may lead to Remote Code Execution. Version 0.7.2 fixes the vulnerability.,7.5,CWE-74
CVE-2023-28670,Jenkins Pipeline Aggregator View Plugin 1.13 and earlier does not escape a variable representing the current view's URL in inline JavaScript resulting in a stored cross-site scripting (XSS) vulnerability exploitable by authenticated attackers with Overall/Read permission.,5.4,CWE-79
CVE-2025-46656,python-markdownify (aka markdownify) before 0.14.1 allows large headline prefixes such as <h9999999> in addition to <h1> through <h6>. This causes memory consumption.,2.9,CWE-1284
CVE-2024-41810,Twisted is an event-based framework for internet applications supporting Python 3.6+. The `twisted.web.util.redirectTo` function contains an HTML injection vulnerability. If application code allows an attacker to control the redirect URL this vulnerability may result in Reflected Cross-Site Scripting (XSS) in the redirect response HTML body. This vulnerability is fixed in 24.7.0rc1.,6.1,CWE-79
CVE-2024-20845,Out-of-bounds write vulnerability while releasing memory in libsavsac.so prior to SMR Apr-2024 Release 1 allows local attacker to execute arbitrary code.,8.4,CWE-787
CVE-2022-24281,A vulnerability has been identified in SINEC NMS (All versions < V1.0.3) SINEMA Server V14 (All versions). A privileged authenticated attacker could execute arbitrary commands in the local database by sending specially crafted requests to the webserver of the affected application.,7.2,CWE-89
CVE-2022-22067,Potential memory leak in modem during the processing of NSA RRC Reconfiguration with invalid Radio Bearer Config in Snapdragon Auto Snapdragon Compute Snapdragon Connectivity Snapdragon Mobile,7.5,CWE-401
CVE-2025-26125,An exposed ioctl in the IMFForceDelete driver of IObit Malware Fighter v12.1.0 allows attackers to arbitrarily delete files and escalate privileges.,7.3,CWE-782
CVE-2025-24845,Improper neutralization of argument delimiters in a command ('Argument Injection') issue exists in Defense Platform Home Edition Ver.3.9.51.x and earlier. If an attacker provides specially crafted data to the specific process of the Windows system where the product is running the system may cause a Blue Screen of Death (BSOD) and as a result cause a denial-of-service (DoS) condition.,6.3,CWE-88
CVE-2025-24766,Improper Control of Filename for Include/Require Statement in PHP Program ('PHP Remote File Inclusion') vulnerability in WP Royal Themes News Magazine X allows PHP Local File Inclusion. This issue affects News Magazine X: from n/a through 1.2.37.,7.5,CWE-98
CVE-2021-33912,libspf2 before 1.2.11 has a four-byte heap-based buffer overflow that might allow remote attackers to execute arbitrary code (via an unauthenticated e-mail message from anywhere on the Internet) with a crafted SPF DNS record because of incorrect sprintf usage in SPF_record_expand_data in spf_expand.c. The vulnerable code may be part of the supply chain of a site's e-mail infrastructure (e.g. with additional configuration Exim can use libspf2; the Postfix web site links to unofficial patches for use of libspf2 with Postfix; older versions of spfquery relied on libspf2) but most often is not.,9.8,CWE-787
CVE-2022-3549,A vulnerability was found in SourceCodester Simple Cold Storage Management System 1.0. It has been rated as problematic. This issue affects some unknown processing of the file /csms/admin/?page=user/manage_user of the component Avatar Handler. The manipulation leads to unrestricted upload. The attack may be initiated remotely. The exploit has been disclosed to the public and may be used. The identifier VDB-211049 was assigned to this vulnerability.,4.7,CWE-266
CVE-2024-8965,The Absolute Reviews plugin for WordPress is vulnerable to Stored Cross-Site Scripting via the 'Name' field of a custom post criteria in all versions up to and including 1.1.3 due to insufficient input sanitization and output escaping. This makes it possible for authenticated attackers with Contributor-level access and above to inject arbitrary web scripts in pages that will execute whenever a user accesses an injected page.,6.4,CWE-79
CVE-2023-0324,A vulnerability was found in SourceCodester Online Tours & Travels Management System 1.0 and classified as critical. Affected by this issue is some unknown functionality of the file admin/page-login.php. The manipulation of the argument email leads to sql injection. The attack may be launched remotely. The exploit has been disclosed to the public and may be used. VDB-218426 is the identifier assigned to this vulnerability.,7.3,CWE-89
CVE-2021-46324,Espruino 2v11.251 was discovered to contain a stack buffer overflow via src/jsvar.c in jsvNewFromString.,7.8,CWE-787
CVE-2025-32112,Cross-Site Request Forgery (CSRF) vulnerability in OTWthemes Sidebar Manager Light allows Cross Site Request Forgery. This issue affects Sidebar Manager Light: from n/a through 1.1.8.,7.1,CWE-352
CVE-2024-10151,The Auto iFrame WordPress plugin before 2.0 does not validate and escape some of its shortcode attributes before outputting them back in a page/post where the shortcode is embed which could allow users with the contributor role and above to perform Stored Cross-Site Scripting attacks.,5.4,CWE-79
CVE-2025-63690,In pig-mesh Pig versions 3.8.2 and below when setting up scheduled tasks in the Quartz management function under the system management module it is possible to execute any Java class with a parameterless constructor and its methods with parameter type String through reflection. At this time the eval method in Tomcat's built-in class jakarta.el.ELProcessor can be used to execute commands leading to a remote code execution vulnerability.,9.1,CWE-470
CVE-2023-5028,A vulnerability which was classified as problematic has been found in China Unicom TEWA-800G 4.16L.04_CT2015_Yueme. Affected by this issue is some unknown functionality. The manipulation leads to information exposure through debug log file. It is possible to launch the attack on the physical device. The complexity of an attack is rather high. The exploitation is known to be difficult. The exploit has been disclosed to the public and may be used. VDB-239870 is the identifier assigned to this vulnerability.,2.0,CWE-534
CVE-2023-45136,XWiki Platform is a generic wiki platform offering runtime services for applications built on top of it. When document names are validated according to a name strategy (disabled by default) XWiki starting in version 12.0-rc-1 and prior to versions 12.10.12 and 15.5-rc-1 is vulnerable to a reflected cross-site scripting attack in the page creation form. This allows an attacker to execute arbitrary actions with the rights of the user opening the malicious link. Depending on the rights of the user this may allow remote code execution and full read and write access to the whole XWiki installation. This has been patched in XWiki 14.10.12 and 15.5-rc-1 by adding appropriate escaping. The vulnerable template file `createinline.vm` is part of XWiki's WAR and can be patched by manually applying the changes from the fix.,9.6,CWE-79
CVE-2024-33148,J2EEFAST v2.7.0 was discovered to contain a SQL injection vulnerability via the sql_filter parameter in the list function.,7.3,CWE-89
CVE-2025-1634,A flaw was found in the quarkus-resteasy extension which causes memory leaks when client requests with low timeouts are made. If a client request times out a buffer is not released correctly leading to increased memory usage and eventual application crash due to OutOfMemoryError.,7.5,CWE-401
CVE-2024-5966,The Grey Opaque theme for WordPress is vulnerable to Stored Cross-Site Scripting via the ‘url’ parameter within the theme's Download-Button shortcode in all versions up to and including 2.0.1 due to insufficient input sanitization and output escaping. This makes it possible for authenticated attackers with Contributor-level access and above to inject arbitrary web scripts in pages that will execute whenever a user accesses an injected page.,6.4,CWE-79
CVE-2020-3538,A vulnerability in a certain REST API endpoint of Cisco&nbsp;Data Center Network Manager (DCNM) Software could allow an authenticated remote attacker to perform a path traversal attack on an affected device.  The vulnerability is due to insufficient path restriction enforcement. An attacker could exploit this vulnerability by sending crafted HTTP requests to an affected device. A successful exploit could allow the attacker to overwrite or list arbitrary files on the affected device.Cisco has released software updates that address this vulnerability. There are no workarounds that address this vulnerability.,4.6,CWE-20
CVE-2023-22652,A Buffer Copy without Checking Size of Input ('Classic Buffer Overflow') vulnerability in openSUSE libeconf leads to DoS via malformed config files. This issue affects libeconf: before 0.5.2.,3.3,CWE-120
CVE-2025-11359,A security vulnerability has been detected in code-projects Simple Banking System 1.0. The affected element is an unknown function of the file /transfermoney.php. The manipulation of the argument ID leads to sql injection. Remote exploitation of the attack is possible. The exploit has been disclosed publicly and may be used.,6.3,CWE-74
CVE-2025-39425,Cross-Site Request Forgery (CSRF) vulnerability in pixelgrade Style Manager allows Cross Site Request Forgery. This issue affects Style Manager: from n/a through 2.2.7.,4.3,CWE-352
CVE-2024-44244,A memory corruption issue was addressed with improved input validation. This issue is fixed in iOS 18.1 and iPadOS 18.1 watchOS 11.1 visionOS 2.1 tvOS 18.1 macOS Sequoia 15.1 Safari 18.1. Processing maliciously crafted web content may lead to an unexpected process crash.,4.3,CWE-787
CVE-2022-0723,Cross-site Scripting (XSS) - Reflected in GitHub repository microweber/microweber prior to 1.2.11.,5.4,CWE-79
CVE-2025-31377,Missing Authorization vulnerability in Asaquzzaman mishu Woo Product Feed For Marketing Channels allows Exploiting Incorrectly Configured Access Control Security Levels. This issue affects Woo Product Feed For Marketing Channels: from n/a through 1.9.0.,7.5,CWE-862
CVE-2024-43337,Cross-Site Request Forgery (CSRF) vulnerability in Brave Brave Popup Builder.This issue affects Brave Popup Builder: from n/a through 0.7.0.,4.3,CWE-352
CVE-2024-3442,A vulnerability classified as critical has been found in SourceCodester Prison Management System 1.0. This affects an unknown part of the file /Employee/delete_leave.php. The manipulation leads to sql injection. It is possible to initiate the attack remotely. The exploit has been disclosed to the public and may be used. The associated identifier of this vulnerability is VDB-259695.,6.3,CWE-89
CVE-2025-59455,In JetBrains TeamCity before 2025.07.2 project isolation bypass was possible due to race condition,4.2,CWE-362
CVE-2021-33845,The Splunk Enterprise REST API allows enumeration of usernames via the lockout error message. The potential vulnerability impacts Splunk Enterprise instances before 8.1.7 when configured to repress verbose login errors.,5.3,CWE-203
CVE-2025-4356,A vulnerability was found in Tenda DAP-1520 1.10B04_BETA02. It has been declared as critical. This vulnerability affects the function mod_graph_auth_uri_handler of the file /storage of the component Authentication Handler. The manipulation leads to stack-based buffer overflow. The attack can be initiated remotely. The exploit has been disclosed to the public and may be used.,8.8,CWE-119
CVE-2024-32141,Cross-Site Request Forgery (CSRF) vulnerability in Libsyn Libsyn Publisher Hub.This issue affects Libsyn Publisher Hub: from n/a through 1.4.4.  ,4.3,CWE-352
CVE-2024-46441,An arbitrary file upload vulnerability in YPay 1.2.0 allows attackers to execute arbitrary code via a ZIP archive to themePutFile in app/common/util/Upload.php (called from app/admin/controller/ypay/Home.php). The file extension of an uncompressed file is not checked.,8.8,CWE-434
CVE-2025-23417,A denial of service vulnerability exists in the Modbus RTU over TCP functionality of Socomec DIRIS Digiware M-70 1.6.9. A specially crafted network packet can lead to denial of service. An attacker can send an unauthenticated packet to trigger this vulnerability.,8.6,CWE-306
CVE-2024-37451,Cross-Site Request Forgery (CSRF) vulnerability in Rara Theme Travel Agency allows Cross Site Request Forgery.This issue affects Travel Agency: from n/a through 1.4.9.,4.3,CWE-352
CVE-2025-1190,A vulnerability has been found in code-projects Job Recruitment 1.0 and classified as problematic. This vulnerability affects unknown code of the file /_parse/load_user-profile.php. The manipulation leads to cross site scripting. The attack can be initiated remotely. Multiple parameters might be affected.,3.5,CWE-79
CVE-2023-26456,Users were able to set an arbitrary product name for OX Guard. The chosen value was not sufficiently sanitized before processing it at the user interface allowing for indirect cross-site scripting attacks. Accounts that were temporarily taken over could be configured to trigger persistent code execution allowing an attacker to build a foothold. Sanitization is in place for product names now. No publicly available exploits are known.  ,5.4,CWE-79
CVE-2025-7765,A vulnerability classified as critical was found in code-projects Online Appointment Booking System 1.0. Affected by this vulnerability is an unknown functionality of the file /admin/addmanagerclinic.php. The manipulation of the argument clinic leads to sql injection. The attack can be launched remotely. The exploit has been disclosed to the public and may be used.,7.3,CWE-74
CVE-2025-30858,Improper Neutralization of Input During Web Page Generation ('Cross-site Scripting') vulnerability in Tribulant Software Snow Storm allows Reflected XSS. This issue affects Snow Storm: from n/a through 1.4.6.,7.1,CWE-79
CVE-2023-43702,Os Commerce is currently susceptible to a Cross-Site Scripting (XSS) vulnerability. This vulnerability allows attackers to inject JS through the tracking_number parameter potentially leading to unauthorized execution of scripts within a user's web browser.,5.4,CWE-79
CVE-2023-48805,In TOTOLINK X6000R V9.4.0cu.852_B20230719 the shttpd file sub_4119A0 function obtains fields from the front-end through Uci_ Set_ The Str function when passed to the CsteSystem function creates a command execution vulnerability.,9.8,CWE-78
CVE-2025-29835,Out-of-bounds read in Windows Routing and Remote Access Service (RRAS) allows an unauthorized attacker to disclose information over a network.,6.5,CWE-125
CVE-2023-40271,In Trusted Firmware-M through TF-Mv1.8.0 for platforms that integrate the CryptoCell accelerator when the CryptoCell PSA Driver software Interface is selected and the Authenticated Encryption with Associated Data Chacha20-Poly1305 algorithm is used with the single-part verification function (defined during the build-time configuration phase) implemented with a dedicated function (i.e. not relying on usage of multipart functions) the buffer comparison during the verification of the authentication tag does not happen on the full 16 bytes but just on the first 4 bytes thus leading to the possibility that unauthenticated payloads might be identified as authentic. This affects TF-Mv1.6.0 TF-Mv1.6.1 TF-Mv1.7.0 and TF-Mv1.8.,7.5,CWE-697
CVE-2022-48711,In the Linux kernel the following vulnerability has been resolved:  tipc: improve size validations for received domain records  The function tipc_mon_rcv() allows a node to receive and process domain_record structs from peer nodes to track their views of the network topology.  This patch verifies that the number of members in a received domain record does not exceed the limit defined by MAX_MON_DOMAIN something that may otherwise lead to a stack overflow.  tipc_mon_rcv() is called from the function tipc_link_proto_rcv() where we are reading a 32 bit message data length field into a uint16.  To avert any risk of bit overflow we add an extra sanity check for this in that function.  We cannot see that happen with the current code but future designers being unaware of this risk may introduce it by allowing delivery of very large (> 64k) sk buffers from the bearer layer.  This potential problem was identified by Eric Dumazet.  This fixes CVE-2022-0435,5.5,CWE-787
CVE-2025-4164,A vulnerability which was classified as critical was found in PHPGurukul Employee Record Management System 1.3. Affected is an unknown function of the file changepassword.php. The manipulation of the argument currentpassword leads to sql injection. It is possible to launch the attack remotely. The exploit has been disclosed to the public and may be used.,7.3,CWE-74
CVE-2022-22285,A vulnerability using PendingIntent in Reminder prior to version 12.2.05.0 in Android R(11.0) and 12.3.02.1000 in Android S(12.0) allows attackers to execute privileged action by hijacking and modifying the intent.,4.4,CWE-94
CVE-2024-31956,An issue was discovered in Samsung Mobile Processor Exynos 2200 Exynos 1480 Exynos 2400. It lacks proper buffer length checking which can result in an Out-of-Bounds Write.,8.4,CWE-787
CVE-2024-2946,The ShopLentor – WooCommerce Builder for Elementor & Gutenberg +12 Modules – All in One Solution (formerly WooLentor) plugin for WordPress is vulnerable to Stored Cross-Site Scripting via the plugin's QR Code Widget in all versions up to and including 2.8.4 due to insufficient input sanitization and output escaping on user supplied attributes. This makes it possible for authenticated attackers with contributor-level access and above to inject arbitrary web scripts in pages that will execute whenever a user accesses an injected page.,6.4,CWE-79
CVE-2025-33064,Heap-based buffer overflow in Windows Routing and Remote Access Service (RRAS) allows an authorized attacker to execute code over a network.,8.8,CWE-122
CVE-2024-37120,Improper Neutralization of Input During Web Page Generation (XSS or 'Cross-site Scripting') vulnerability in Biplob Adhikari Tabs allows Stored XSS.This issue affects Tabs: from n/a through 4.0.6.,5.9,CWE-79
CVE-2023-41299,DoS vulnerability in the PMS module. Successful exploitation of this vulnerability may cause the system to restart.,7.5,CWE-120
CVE-2025-50977,A template injection vulnerability leading to reflected cross-site scripting (XSS) has been identified in version 1.7.1 requiring authenticated admin access for exploitation. The vulnerability exists in the 'r' parameter and allows attackers to inject malicious Angular expressions that execute JavaScript code in the context of the application. The flaw can be exploited through GET requests to the summary endpoint as well as POST requests to specific Wicket interface endpoints though the GET method provides easier weaponization. This vulnerability enables authenticated administrators to execute arbitrary client-side code potentially leading to session hijacking data theft or further privilege escalation attacks.,6.1,CWE-79
CVE-2022-36750,Clinic's Patient Management System v1.0 is vulnerable to SQL injection via /pms/update_user.php?id=.,9.8,CWE-89
CVE-2024-27906,Apache Airflow versions before 2.8.2 has a vulnerability that allows authenticated users to view DAG code and import errors of DAGs they do not have permission to view through the API and the UI.  Users of Apache Airflow are recommended to upgrade to version 2.8.2 or newer to mitigate the risk associated with this vulnerability,5.9,CWE-862
CVE-2025-3845,A vulnerability was found in markparticle WebServer up to 1.0. It has been declared as critical. Affected by this vulnerability is the function Buffer::HasWritten of the file code/buffer/buffer.cpp. The manipulation of the argument writePos_ leads to buffer overflow. The attack can be launched remotely. The exploit has been disclosed to the public and may be used.,7.3,CWE-119
CVE-2024-10394,A local user can bypass the OpenAFS PAG (Process Authentication Group) throttling mechanism in Unix clients allowing the user to create a PAG using an existing id number effectively joining the PAG and letting the user steal the credentials in that PAG.,7.8,CWE-190
CVE-2025-50023,Improper Neutralization of Input During Web Page Generation ('Cross-site Scripting') vulnerability in Chris Coyier CodePen Embed Block allows Stored XSS. This issue affects CodePen Embed Block: from n/a through 1.1.1.,5.9,CWE-79
CVE-2025-8552,A vulnerability classified as problematic has been found in atjiu pybbs up to 6.0.0. This affects an unknown part of the file /admin/tag/list. The manipulation of the argument Name leads to cross site scripting. It is possible to initiate the attack remotely. The exploit has been disclosed to the public and may be used. The identifier of the patch is 2fe4a51afbce0068c291bc1818bbc8f7f3b01a22. It is recommended to apply a patch to fix this issue.,2.4,CWE-79
CVE-2025-55078,In Eclipse ThreadX before version 6.4.3 an attacker can cause a denial of service (crash) by providing a pointer to a reserved or unmapped memory region. Vulnerable system calls had a check of pointers but that check wasn't verifying whether the pointer is outside the module memory region.,5.5,CWE-233
CVE-2024-6458,The WooCommerce Product Table Lite plugin for WordPress is vulnerable to unauthorized post title modification due to a missing capability check on the wcpt_presets__duplicate_preset_to_table function in all versions up to and including 3.5.1. This makes it possible for authenticated attackers with subscriber access and above to change titles of arbitrary posts. Missing sanitization can lead to Stored Cross-Site Scripting when viewed by an admin via the WooCommerce Product Table.,6.4,CWE-862
