CVE,Description,CVSS3_BaseScore,CWE
CVE-2024-47553,A vulnerability has been identified in Siemens SINEC Security Monitor (All versions < V4.9.0). The affected application does not properly validate user input to the ```ssmctl-client``` command.  This could allow an authenticated lowly privileged remote attacker to execute arbitrary code with root privileges on the underlying OS.,9.9,CWE-88
CVE-2022-35449,OTFCC v0.10.4 was discovered to contain a heap-buffer overflow via /release-x64/otfccdump+0x6b0466.,6.5,CWE-787
CVE-2024-45454,Improper Neutralization of Input During Web Page Generation (XSS or 'Cross-site Scripting') vulnerability in Unlimited Elements Unlimited Elements For Elementor (Free Widgets Addons Templates) allows Reflected XSS.This issue affects Unlimited Elements For Elementor (Free Widgets Addons Templates): from n/a through 1.5.121.,7.1,CWE-79
CVE-2024-33999,The referrer URL used by MFA required additional sanitizing rather than being used directly.,9.8,CWE-20
CVE-2020-9250,There is an insufficient authentication vulnerability in some Huawei smart phone. An unauthenticated local attacker can crafts software package to exploit this vulnerability. Due to insufficient verification successful exploitation may impact the service. (Vulnerability ID: HWPSIRT-2019-12302)  This vulnerability has been assigned a Common Vulnerabilities and Exposures (CVE) ID: CVE-2020-9250.,3.3,CWE-287
CVE-2025-3382,A vulnerability has been found in joey-zhou xiaozhi-esp32-server-java up to a14fe8115842ee42ab5c7a51706b8a85db5200b7 and classified as critical. This vulnerability affects the function update of the file /api/user/update. The manipulation of the argument state leads to sql injection. The attack can be initiated remotely. The exploit has been disclosed to the public and may be used. This product is using a rolling release to provide continious delivery. Therefore no version details for affected nor updated releases are available.,6.3,CWE-74
CVE-2023-39493,PDF-XChange Editor exportAsText Exposed Dangerous Method Remote Code Execution Vulnerability. This vulnerability allows remote attackers to execute arbitrary code on affected installations of PDF-XChange Editor. User interaction is required to exploit this vulnerability in that the target must visit a malicious page or open a malicious file.  The specific flaw exists within the exportAsText method. The application exposes a JavaScript interface that allows writing arbitrary files. An attacker can leverage this vulnerability to execute code in the context of the current user. Was ZDI-CAN-19649.,7.8,CWE-749
CVE-2023-5830,A vulnerability classified as critical has been found in ColumbiaSoft Document Locator. This affects an unknown part of the file /api/authentication/login of the component WebTools. The manipulation of the argument Server leads to improper authentication. It is possible to initiate the attack remotely. Upgrading to version 7.2 SP4 and 2021.1 is able to address this issue. It is recommended to upgrade the affected component. The identifier VDB-243729 was assigned to this vulnerability.,7.3,CWE-287
CVE-2025-0300,A vulnerability classified as critical was found in code-projects Online Book Shop 1.0. Affected by this vulnerability is an unknown functionality of the file /subcat.php. The manipulation of the argument cat leads to sql injection. The attack can be launched remotely. The exploit has been disclosed to the public and may be used.,6.3,CWE-74
CVE-2024-38772,Improper Limitation of a Pathname to a Restricted Directory ('Path Traversal') vulnerability in Crocoblock JetWidgets for Elementor and WooCommerce allows PHP Local File Inclusion.This issue affects JetWidgets for Elementor and WooCommerce: from n/a through 1.1.7.,6.5,CWE-22
CVE-2024-33308,An issue in TVS Motor Company Limited TVS Connet Android v.4.5.1 and iOS v.5.0.0 allows a remote attacker to escalate privileges via the Emergency Contact Feature. NOTE: this is disputed as discussed in the msn-official/CVE-Evidence repository.,9.1,CWE-269
CVE-2024-43338,Cross-Site Request Forgery (CSRF) vulnerability in Automattic Inc. Crowdsignal Dashboard – Polls Surveys & more allows Cross Site Request Forgery.This issue affects Crowdsignal Dashboard – Polls Surveys & more: from n/a through 3.1.2.,4.3,CWE-352
CVE-2023-41750,Sensitive information disclosure due to missing authorization. The following products are affected: Acronis Agent (Linux macOS Windows) before build 32047.,5.5,CWE-862
CVE-2021-40763,Adobe Character Animator version 4.4 (and earlier) is affected by a memory corruption vulnerability when parsing a WAF file potentially resulting in arbitrary code execution in the context of the current user. User interaction is required to exploit this vulnerability.,7.8,CWE-788
CVE-2024-53088,In the Linux kernel the following vulnerability has been resolved:  i40e: fix race condition by adding filter's intermediate sync state  Fix a race condition in the i40e driver that leads to MAC/VLAN filters becoming corrupted and leaking. Address the issue that occurs under heavy load when multiple threads are concurrently modifying MAC/VLAN filters by setting mac and port VLAN.  1. Thread T0 allocates a filter in i40e_add_filter() within         i40e_ndo_set_vf_port_vlan(). 2. Thread T1 concurrently frees the filter in __i40e_del_filter() within         i40e_ndo_set_vf_mac(). 3. Subsequently i40e_service_task() calls i40e_sync_vsi_filters() which         refers to the already freed filter memory causing corruption.  Reproduction steps: 1. Spawn multiple VFs. 2. Apply a concurrent heavy load by running parallel operations to change         MAC addresses on the VFs and change port VLANs on the host. 3. Observe errors in dmesg: Error I40E_AQ_RC_ENOSPC adding RX filters on VF XX 	please set promiscuous on manually for VF XX.  Exact code for stable reproduction Intel can't open-source now.  The fix involves implementing a new intermediate filter state I40E_FILTER_NEW_SYNC for the time when a filter is on a tmp_add_list. These filters cannot be deleted from the hash list directly but must be removed using the full process.,4.7,CWE-362
CVE-2024-48944,Server-Side Request Forgery (SSRF) vulnerability in Apache Kylin. Through a kylin server an attacker may forge a request to invoke /kylin/api/xxx/diag api on another internal host and possibly get leaked information. There are two preconditions: 1) The attacker has got admin access to a kylin server; 2) Another internal host has the /kylin/api/xxx/diag api  endpoint open for service.   This issue affects Apache Kylin: from 5.0.0  through   5.0.1.  Users are recommended to upgrade to version 5.0.2 which fixes the issue.,6.5,CWE-918
CVE-2024-34828,Cross-Site Request Forgery (CSRF) vulnerability in Andy Moyle Church Admin.This issue affects Church Admin: from n/a through 4.1.32.  ,4.3,CWE-352
CVE-2025-24277,A parsing issue in the handling of directory paths was addressed with improved path validation. This issue is fixed in macOS Ventura 13.7.5 macOS Sequoia 15.4 macOS Sonoma 14.7.5. An app may be able to gain root privileges.,7.8,CWE-276
CVE-2024-46695,In the Linux kernel the following vulnerability has been resolved:  selinuxsmack: don't bypass permissions check in inode_setsecctx hook  Marek Gresko reports that the root user on an NFS client is able to change the security labels on files on an NFS filesystem that is exported with root squashing enabled.  The end of the kerneldoc comment for __vfs_setxattr_noperm() states:   *  This function requires the caller to lock the inode's i_mutex before it  *  is executed. It also assumes that the caller will make the appropriate  *  permission checks.  nfsd_setattr() does do permissions checking via fh_verify() and nfsd_permission() but those don't do all the same permissions checks that are done by security_inode_setxattr() and its related LSM hooks do.  Since nfsd_setattr() is the only consumer of security_inode_setsecctx() simplest solution appears to be to replace the call to __vfs_setxattr_noperm() with a call to __vfs_setxattr_locked().  This fixes the above issue and has the added benefit of causing nfsd to recall conflicting delegations on a file when a client tries to change its security label.,4.4,CWE-276
CVE-2024-12458,The Smart PopUp Blaster plugin for WordPress is vulnerable to Stored Cross-Site Scripting via the plugin's 'spb-button' shortcode in all versions up to and including 1.4.3 due to insufficient input sanitization and output escaping on user supplied attributes. This makes it possible for authenticated attackers with contributor-level access and above to inject arbitrary web scripts in pages that will execute whenever a user accesses an injected page.,6.4,CWE-79
CVE-2021-40750,Adobe Bridge version 11.1.1 (and earlier) is affected by a Null pointer dereference vulnerability when parsing a specially crafted file. An unauthenticated attacker could leverage this vulnerability to achieve an application denial-of-service in the context of the current user. Exploitation of this issue requires user interaction in that a victim must open a malicious file.,5.5,CWE-476
CVE-2023-21669,Information Disclosure in WLAN HOST while sending DPP action frame to peer with an invalid source address.,8.2,CWE-126
CVE-2023-52149,Cross-Site Request Forgery (CSRF) vulnerability in Wow-Company Floating Button.This issue affects Floating Button: from n/a through 6.0.  ,5.4,CWE-352
CVE-2024-29161,HDF5 through 1.14.3 contains a heap buffer overflow in H5A__attr_release_table resulting in the corruption of the instruction pointer and causing denial of service or potential code execution.,8.8,CWE-122
CVE-2024-7192,A vulnerability which was classified as critical was found in itsourcecode Society Management System 1.0. This affects an unknown part of the file /admin/student.php. The manipulation of the argument image leads to unrestricted upload. It is possible to initiate the attack remotely. The exploit has been disclosed to the public and may be used. The identifier VDB-272613 was assigned to this vulnerability.,6.3,CWE-434
CVE-2024-32477,Deno is a JavaScript TypeScript and WebAssembly runtime with secure defaults. By using ANSI escape sequences and a race between `libc::tcflush(0 libc::TCIFLUSH)` and reading standard input it's possible to manipulate the permission prompt and force it to allow an unsafe action regardless of the user input. Some ANSI escape sequences act as a info request to the master terminal emulator and the terminal emulator sends back the reply in the PTY channel. standard streams also use this channel to send and get data. For example the `\033[6n` sequence requests the current cursor position. These sequences allow us to append data to the standard input of Deno. This vulnerability allows an attacker to bypass Deno permission policy.  This vulnerability is fixed in 1.42.2. ,7.7,CWE-78
CVE-2024-11729,The KiviCare – Clinic & Patient Management System (EHR) plugin for WordPress is vulnerable to SQL Injection via the 'service_list[0][service_id]' parameter of the get_widget_payment_options AJAX action in all versions up to and including 3.6.4 due to insufficient escaping on the user supplied parameter and lack of sufficient preparation on the existing SQL query.  This makes it possible for authenticated attackers with Custom-level access and above to append additional SQL queries into already existing queries that can be used to extract sensitive information from the database.,6.5,CWE-89
CVE-2022-37340,Uncontrolled search path in some Intel(R) QAT drivers for Windows before version 1.6 may allow an authenticated user to potentially enable escalation of privilege via local access.,6.7,CWE-427
CVE-2024-42513,Vulnerability in the OPC UA .NET Standard Stack before 1.5.374.158 allows an unauthorized attacker to bypass application authentication when using HTTPS endpoints.,5.3,CWE-305
CVE-2024-50311,A denial of service (DoS) vulnerability was found in OpenShift. This flaw allows attackers to exploit the GraphQL batching functionality. The vulnerability arises when multiple queries can be sent within a single request enabling an attacker to submit a request containing thousands of aliases in one query. This issue causes excessive resource consumption leading to application unavailability for legitimate users.,6.5,CWE-770
CVE-2022-40679,An improper neutralization of special elements used in an OS command vulnerability [CWE-78] in FortiADC 5.x all versions 6.0 all versions 6.1 all versions 6.2.0 through 6.2.4 7.0.0 through 7.0.3 7.1.0; FortiDDoS 4.x all versions 5.0 all versions 5.1 all versions 5.2 all versions 5.3 all versions 5.4 all versions 5.5 all versions 5.6 all versions and FortiDDoS-F 6.4.0 6.3.0 through 6.3.3 6.2.0 through 6.2.2 6.1.0 through 6.1.4 may allow an authenticated attacker to execute unauthorized commands via specifically crafted arguments to existing commands.,7.8,CWE-78
CVE-2023-4530,Improper Neutralization of Special Elements used in an SQL Command ('SQL Injection') vulnerability in Turna Advertising Administration Panel allows SQL Injection.This issue affects Advertising Administration Panel: before 1.1.  ,9.8,CWE-89
CVE-2024-12493,The Files Download Delay plugin for WordPress is vulnerable to Stored Cross-Site Scripting via the plugin's 'fddwrap' shortcode in all versions up to and including 1.0.9 due to insufficient input sanitization and output escaping on user supplied attributes. This makes it possible for authenticated attackers with contributor-level access and above to inject arbitrary web scripts in pages that will execute whenever a user accesses an injected page.,6.4,CWE-79
CVE-2025-23697,Improper Neutralization of Input During Web Page Generation ('Cross-site Scripting') vulnerability in WebDeal s.r.o. Podčlánková inzerce allows Reflected XSS. This issue affects Podčlánková inzerce: from n/a through 2.4.0.,7.1,CWE-79
CVE-2023-44235,Improper Restriction of Excessive Authentication Attempts vulnerability in Devnath verma WP Captcha allows Functionality Bypass.This issue affects WP Captcha: from n/a through 2.0.0.,5.3,CWE-307
CVE-2022-32175,In AdGuardHome versions v0.95 through v0.108.0-b.13 are vulnerable to Cross-Site Request Forgery (CSRF) in the custom filtering rules functionality. An attacker can persuade an authorized user to follow a malicious link resulting in deleting/modifying the custom filtering rules.,5.4,CWE-352
CVE-2023-42359,SQL injection vulnerability in Exam Form Submission in PHP with Source Code v.1.0 allows a remote attacker to escalate privileges via the val-username parameter in /index.php.,9.8,CWE-89
CVE-2024-39708,An issue was discovered in the Agent in Delinea Privilege Manager (formerly Thycotic Privilege Manager) before 12.0.1096 on Windows. Sometimes a non-administrator user can copy a crafted DLL file to a temporary directory (used by .NET Shadow Copies) such that privilege escalation can occur if the core agent service loads that file.,7.0,CWE-427
CVE-2022-25656,Possible integer overflow and memory corruption due to improper validation of buffer size sent to write to console when computing the payload size in Snapdragon Auto Snapdragon Compute Snapdragon Connectivity Snapdragon Industrial IOT Snapdragon Mobile Snapdragon Wearables,8.4,CWE-190
CVE-2023-5632,In Eclipse Mosquito before and including 2.0.5 establishing a connection to the mosquitto server without sending data causes the EPOLLOUT event to be added which results excessive CPU consumption. This could be used by a malicious actor to perform denial of service type attack. This issue is fixed in 2.0.6   ,7.5,CWE-834
CVE-2022-22302,A clear text storage of sensitive information (CWE-312) vulnerability in both FortiGate version 6.4.0 through 6.4.1 6.2.0 through 6.2.9 and 6.0.0 through 6.0.13 and FortiAuthenticator version 5.5.0 and all versions of 6.1 and 6.0 may allow a local unauthorized party to retrieve the Fortinet private keys used to establish secure communication with both Apple Push Notification and Google Cloud Messaging services via accessing the files on the filesystem.,5.3,CWE-312
CVE-2024-5382,The Master Addons – Free Widgets Hover Effects Toggle Conditions Animations for Elementor plugin for WordPress is vulnerable to unauthorized modification of data due to a missing capability check on the 'ma-template' REST API route in all versions up to and including 2.0.6.1. This makes it possible for unauthenticated attackers to create or modify existing Master Addons templates or make settings modifications related to these templates.,6.5,CWE-862
CVE-2024-32573,Improper Neutralization of Input During Web Page Generation ('Cross-site Scripting') vulnerability in WP Lab WP-Lister Lite for eBay allows Stored XSS.This issue affects WP-Lister Lite for eBay: from n/a through 3.5.11.  ,5.9,CWE-79
CVE-2025-24060,Improper input validation in Windows DWM Core Library allows an authorized attacker to elevate privileges locally.,7.8,CWE-20
CVE-2022-27064,Musical World v1 was discovered to contain an arbitrary file upload vulnerability via uploaded_songs.php. This vulnerability allows attackers to execute arbitrary code via a crafted PHP file.,8.8,CWE-434
CVE-2024-56596,In the Linux kernel the following vulnerability has been resolved:  jfs: fix array-index-out-of-bounds in jfs_readdir  The stbl might contain some invalid values. Added a check to return error code in that case.,7.8,CWE-129
CVE-2021-26727,Multiple command injections and stack-based buffer overflows vulnerabilities in the SubNet_handler_func function of spx_restservice allow an attacker to execute arbitrary code with the same privileges as the server user (root). This issue affects: Lanner Inc IAC-AST2500A standard firmware version 1.10.0.,10.0,CWE-94
CVE-2024-13593,The BMLT Meeting Map plugin for WordPress is vulnerable to Local File Inclusion in all versions up to and including 2.6.0 via the 'bmlt_meeting_map' shortcode. This makes it possible for authenticated attackers with Contributor-level access and above to include and execute arbitrary files on the server allowing the execution of any PHP code in those files. This can be used to bypass access controls obtain sensitive data or achieve code execution in cases where images and other “safe” file types can be uploaded and included.,7.5,CWE-98
CVE-2023-39121,emlog v2.1.9 was discovered to contain a SQL injection vulnerability via the component /admin/user.php.,7.2,CWE-89
CVE-2023-30556,Archery is an open source SQL audit platform. The Archery project contains multiple SQL injection vulnerabilities that may allow an attacker to query the connected databases. Affected versions are subject to SQL injection in the `optimize_sqltuningadvisor` method of `sql_optimize.py`. User input coming from the `db_name` parameter value in `sql_optimize.py` is passed to the `sqltuningadvisor` method in `oracle.py`for execution. To mitigate escape the variables accepted via user input when used in `sql_optimize.py`. Users may also use prepared statements when dealing with SQL as a mitigation for this issue. This issue is also indexed as `GHSL-2022-107`.,6.5,CWE-89
CVE-2023-30638,Atos Unify OpenScape SBC 10 before 10R3.1.3 OpenScape Branch 10 before 10R3.1.2 and OpenScape BCF 10 before 10R10.7.0 allow remote authenticated admins to inject commands.,7.2,CWE-77
CVE-2023-47313,Headwind MDM Web panel 5.22.1 is vulnerable to Directory Traversal. The application uses an API call to move the uploaded temporary file to the file directory during the file upload process. This API call receives two input parameters such as path and localPath. The first one refers to the temporary file with an absolute path without validating it. Attackers may modify this API call by referring to arbitrary files. As a result arbitrary files can be moved to the files directory and so they can be downloaded.,5.4,CWE-22
CVE-2023-37690,Maid Hiring Management System v1.0 was discovered to contain a SQL injection vulnerability in the Search Maid page.,4.8,CWE-79
CVE-2025-24565,Improper Neutralization of Input During Web Page Generation ('Cross-site Scripting') vulnerability in Saleswonder Team Tobias WP2LEADS allows Reflected XSS. This issue affects WP2LEADS: from n/a through 3.3.3.,7.1,CWE-79
CVE-2022-30644,Adobe Illustrator versions 26.0.2 (and earlier) and 25.4.5 (and earlier) are affected by a Use-After-Free vulnerability that could result in arbitrary code execution in the context of the current user. Exploitation of this issue requires user interaction in that a victim must open a malicious file.,7.8,CWE-416
CVE-2023-6381,Improper input validation vulnerability in Newsletter Software SuperMailer affecting version 11.20.0.2204. An attacker could exploit this vulnerability by sending a malicious configuration file (file with SMB extension) to a user via a link or email attachment and persuade the user to open the file with the affected software on the local system. A successful exploit could allow the attacker to crash the application when attempting to load the malicious file.,3.3,CWE-20
CVE-2023-42068,PDF-XChange Editor JB2 File Parsing Out-Of-Bounds Read Information Disclosure Vulnerability. This vulnerability allows remote attackers to disclose sensitive information on affected installations of PDF-XChange Editor. User interaction is required to exploit this vulnerability in that the target must visit a malicious page or open a malicious file.  The specific flaw exists within the parsing of JB2 files. The issue results from the lack of proper validation of user-supplied data which can result in a read past the end of an allocated object. An attacker can leverage this in conjunction with other vulnerabilities to execute arbitrary code in the context of the current process. . Was ZDI-CAN-20985.,5.5,CWE-125
CVE-2021-0189,Use of out-of-range pointer offset in the BIOS firmware for some Intel(R) Processors may allow a privileged user to potentially enable aescalation of privilege via local access.,7.8,CWE-119
CVE-2024-23285,This issue was addressed with improved handling of symlinks. This issue is fixed in macOS Sonoma 14.4. An app may be able to create symlinks to protected regions of the disk.,5.5,CWE-59
CVE-2024-47297,Improper Neutralization of Input During Web Page Generation (XSS or 'Cross-site Scripting') vulnerability in CodePeople CP Polls allows Reflected XSS.This issue affects CP Polls: from n/a through 1.0.74.,7.1,CWE-79
CVE-2024-33877,HDF5 Library through 1.14.3 has a heap-based buffer overflow in H5T__conv_struct_opt in H5Tconv.c.,8.8,CWE-122
CVE-2025-46943,Adobe Experience Manager versions 6.5.22 and earlier are affected by a stored Cross-Site Scripting (XSS) vulnerability that could be abused by a low privileged attacker to inject malicious scripts into vulnerable form fields. Malicious JavaScript may be executed in a victim’s browser when they browse to the page containing the vulnerable field.,5.4,CWE-79
CVE-2022-22079,Denial of service while processing fastboot flash command on mmc due to buffer over read,4.6,CWE-125
CVE-2024-50581,In JetBrains YouTrack before 2024.3.47707 improper HTML sanitization could lead to XSS attack via comment tag,4.6,CWE-79
CVE-2023-25774,A denial-of-service vulnerability exists in the vpnserver ConnectionAccept() functionality of SoftEther VPN 5.02. A set of specially crafted network connections can lead to denial of service. An attacker can send a sequence of malicious packets to trigger this vulnerability.,7.5,CWE-400
CVE-2023-22300,An unauthenticated remote attacker could force all authenticated users such as administrative users to perform unauthorized actions by viewing the logs. This action would also grant the attacker privilege escalation.,6.1,CWE-79
CVE-2022-1463,The Booking Calendar plugin for WordPress is vulnerable to PHP Object Injection via the [bookingflextimeline] shortcode in versions up to and including 9.1. This could be exploited by subscriber-level users and above to call arbitrary PHP objects on a vulnerable site.,8.8,CWE-502
CVE-2022-1078,A vulnerability was found in SourceCodester College Website Management System 1.0. It has been classified as critical. Affected is the file /cwms/admin/?page=articles/view_article/. The manipulation of the argument id with the input ' and (select * from(select(sleep(10)))Avx) and 'abc' = 'abc with an unknown input leads to sql injection. It is possible to launch the attack remotely and without authentication.,7.3,CWE-89
CVE-2024-47390,Improper Neutralization of Input During Web Page Generation (XSS or 'Cross-site Scripting') vulnerability in Jegtheme Jeg Elementor Kit allows Stored XSS.This issue affects Jeg Elementor Kit: from n/a through 2.6.8.,6.5,CWE-79
CVE-2024-45074,IBM webMethods Integration 10.15 could allow an authenticated user to traverse directories on the system. An attacker could send a specially crafted URL request containing dot dot sequences (/../) to view arbitrary files on the system.,6.5,CWE-22
CVE-2022-21769,In CCCI there is a possible out of bounds read due to a missing bounds check. This could lead to local information disclosure with System execution privileges needed. User interaction is not needed for exploitation. Patch ID: ALPS06641673; Issue ID: ALPS06641687.,4.4,CWE-125
CVE-2023-42909,Multiple memory corruption issues were addressed with improved input validation. This issue is fixed in macOS Sonoma 14.2. Processing a maliciously crafted file may lead to unexpected app termination or arbitrary code execution.,7.8,CWE-787
CVE-2022-27107,OrangeHRM 4.10 is vulnerable to Stored XSS in the Share Video section under OrangeBuzz via the GET/POST createVideo[linkAddress] parameter,5.4,CWE-79
