CVE,Description,CVSS3_BaseScore,CWE
CVE-2024-37859,Cross Site Scripting vulnerability in Lost and Found Information System 1.0 allows a remote attacker to escalate privileges via the page parameter to php-lfis/admin/index.php.,6.1,CWE-79
CVE-2023-45001,Improper Neutralization of Special Elements used in an SQL Command ('SQL Injection') vulnerability in Castos Seriously Simple Stats allows SQL Injection.This issue affects Seriously Simple Stats: from n/a through 1.5.0.  ,9.8,CWE-89
CVE-2024-20709,Acrobat Reader T5 (MSFT Edge) versions 120.0.2210.91 and earlier are affected by an Improper Input Validation vulnerability. An unauthenticated attacker could leverage this vulnerability to achieve an application denial-of-service in the context of the current user. Exploitation of this issue requires user interaction in that a victim must open a malicious file.,5.5,CWE-20
CVE-2023-24189,An XML External Entity (XXE) vulnerability in urule v2.1.7 allows attackers to execute arbitrary code via uploading a crafted XML file to /urule/common/saveFile.,9.8,CWE-611
CVE-2025-21779,In the Linux kernel the following vulnerability has been resolved:  KVM: x86: Reject Hyper-V's SEND_IPI hypercalls if local APIC isn't in-kernel  Advertise support for Hyper-V's SEND_IPI and SEND_IPI_EX hypercalls if and only if the local API is emulated/virtualized by KVM and explicitly reject said hypercalls if the local APIC is emulated in userspace i.e. don't rely on userspace to opt-in to KVM_CAP_HYPERV_ENFORCE_CPUID.  Rejecting SEND_IPI and SEND_IPI_EX fixes a NULL-pointer dereference if Hyper-V enlightenments are exposed to the guest without an in-kernel local APIC:    dump_stack+0xbe/0xfd   __kasan_report.cold+0x34/0x84   kasan_report+0x3a/0x50   __apic_accept_irq+0x3a/0x5c0   kvm_hv_send_ipi.isra.0+0x34e/0x820   kvm_hv_hypercall+0x8d9/0x9d0   kvm_emulate_hypercall+0x506/0x7e0   __vmx_handle_exit+0x283/0xb60   vmx_handle_exit+0x1d/0xd0   vcpu_enter_guest+0x16b0/0x24c0   vcpu_run+0xc0/0x550   kvm_arch_vcpu_ioctl_run+0x170/0x6d0   kvm_vcpu_ioctl+0x413/0xb20   __se_sys_ioctl+0x111/0x160   do_syscal1_64+0x30/0x40   entry_SYSCALL_64_after_hwframe+0x67/0xd1  Note checking the sending vCPU is sufficient as the per-VM irqchip_mode can't be modified after vCPUs are created i.e. if one vCPU has an in-kernel local APIC then all vCPUs have an in-kernel local APIC.,5.5,CWE-476
CVE-2025-30901,Improper Control of Filename for Include/Require Statement in PHP Program ('PHP Remote File Inclusion') vulnerability in JoomSky JS Help Desk allows PHP Local File Inclusion. This issue affects JS Help Desk: from n/a through 2.9.2.,8.1,CWE-98
CVE-2024-39882,Delta Electronics CNCSoft-G2 lacks proper validation of user-supplied data which can result in a read past the end of an allocated buffer. If a target visits a malicious page or opens a malicious file an attacker can leverage this vulnerability to execute code in the context of the current process.,8.8,CWE-125
CVE-2024-4812,A flaw was found in the Katello plugin for Foreman where it is possible to store malicious JavaScript code in the Description field of a user. This code can be executed when opening certain pages for example Host Collections.,4.8,CWE-79
CVE-2024-21397,Microsoft Azure File Sync Elevation of Privilege Vulnerability,5.3,CWE-59
CVE-2024-22284,Deserialization of Untrusted Data vulnerability in Thomas Belser Asgaros Forum.This issue affects Asgaros Forum: from n/a through 2.7.2.  ,8.7,CWE-502
CVE-2022-46949,Helmet Store Showroom Site v1.0 was discovered to contain a SQL injection vulnerability via the id parameter at /classes/Master.php?f=delete_helmet.,7.2,CWE-89
CVE-2022-33187,Brocade SANnav before v2.2.1 logs usernames and encoded passwords in  debug-enabled logs. The vulnerability could allow an attacker with admin  privilege to read sensitive information.  ,5.5,CWE-532
CVE-2023-28110,Jumpserver is a popular open source bastion host and Koko is a Jumpserver component that is the Go version of coco refactoring coco's SSH/SFTP service and Web Terminal service. Prior to version 2.28.8 using illegal tokens to connect to a Kubernetes cluster through Koko can result in the execution of dangerous commands that may disrupt the Koko container environment and affect normal usage. The vulnerability has been fixed in v2.28.8.,5.7,CWE-77
CVE-2025-45387,osTicket prior to v1.17.6 and v1.18.2 are vulnerable to Broken Access Control Vulnerability in /scp/ajax.php.,5.4,CWE-79
CVE-2023-26771,Taskcafe 0.3.2 is vulnerable to Cross Site Scripting (XSS). There is a lack of validation in the filetype when uploading a SVG profile picture with a XSS payload on it. An authenticated attacker can exploit this vulnerability by uploading a malicious picture which will trigger the payload when the victim opens the file.,6.5,CWE-79
CVE-2025-4872,A vulnerability which was classified as critical was found in FreeFloat FTP Server 1.0. Affected is an unknown function of the component CCC Command Handler. The manipulation leads to buffer overflow. It is possible to launch the attack remotely. The exploit has been disclosed to the public and may be used.,7.3,CWE-119
CVE-2024-22718,Cross Site Scripting (XSS) vulnerability in Form Tools 3.1.1 allows attackers to run arbitrary code via the client_id parameter in the application URL.,9.6,CWE-79
CVE-2024-13258,Incorrect Authorization vulnerability in Drupal Drupal REST & JSON API Authentication allows Forceful Browsing.This issue affects Drupal REST & JSON API Authentication: from 0.0.0 before 2.0.13.,9.8,CWE-863
CVE-2023-33485,TOTOLINK X5000R V9.1.0u.6118_B20201102 and V9.1.0u.6369_B20230113 contains a post-authentication buffer overflow via parameter sPort/ePort in the addEffect function.,8.8,CWE-787
CVE-2025-32712,Use after free in Windows Win32K - GRFX allows an authorized attacker to elevate privileges locally.,7.8,CWE-416
CVE-2025-24400,Jenkins Eiffel Broadcaster Plugin 2.8.0 through 2.10.2 (both inclusive) uses the credential ID as the cache key during signing operations allowing attackers able to create a credential with the same ID as a legitimate one in a different credentials store to sign an event published to RabbitMQ with the legitimate credentials.,4.3,CWE-863
CVE-2025-27191,Adobe Commerce versions 2.4.7-p4 2.4.6-p9 2.4.5-p11 2.4.4-p12 2.4.8-beta2 and earlier are affected by an Improper Access Control vulnerability that could result in a Security feature bypass. An attacker could leverage this vulnerability to bypass security measures and gain unauthorized access. Exploitation of this issue does not require user interaction.,5.3,CWE-284
CVE-2022-1747,The authentication mechanism used by voters to activate a voting session on the tested version of Dominion Voting Systems ImageCast X is susceptible to forgery. An attacker could leverage this vulnerability to print an arbitrary number of ballots without authorization.,4.6,CWE-346
CVE-2024-45264,A cross-site request forgery (CSRF) vulnerability in the admin panel in SkySystem Arfa-CMS before 5.1.3124 allows remote attackers to add a new administrator leading to escalation of privileges.,8.8,CWE-352
CVE-2025-30424,A logging issue was addressed with improved data redaction. This issue is fixed in macOS Ventura 13.7.5 macOS Sequoia 15.4 macOS Sonoma 14.7.5. Deleting a conversation in Messages may expose user contact information in system logging.,9.8,CWE-200
CVE-2024-46276,cute_png v1.05 was discovered to contain a heap buffer overflow via the cp_chunk() function at cute_png.h.,7.8,CWE-787
CVE-2025-46613,OpenPLC 3 through 64f9c11 has server.cpp Memory Corruption because a thread may access handleConnections arguments after the parent stack frame becomes unavailable.,7.5,CWE-362
CVE-2023-31722,There exists a heap buffer overflow in nasm 2.16.02rc1 (GitHub commit: b952891).,7.8,CWE-787
CVE-2021-22289,Improper Input Validation vulnerability in the project upload mechanism in B&R Automation Studio version >=4.0 may allow an unauthenticated network attacker to execute code.,8.3,CWE-20
CVE-2024-28725,Cross Site Scripting (XSS) vulnerability in YzmCMS 7.0 allows attackers to run arbitrary code via Ads Management Carousel Management and System Settings.,7.1,CWE-79
CVE-2022-44559,The AMS module has a vulnerability of serialization/deserialization mismatch. Successful exploitation of this vulnerability may cause privilege escalation.,9.8,CWE-502
CVE-2023-5406,Server communication with a controller can lead to remote code execution using a specially crafted message from the controller. See Honeywell Security Notification for recommendations on upgrading and versioning.,5.9,CWE-787
CVE-2022-20931,A vulnerability in the version control of Cisco&nbsp;TelePresence CE Software for Cisco&nbsp;Touch 10 Devices could allow an unauthenticated adjacent attacker to install an older version of the software on an affected device.  This vulnerability is due to insufficient version control. An attacker could exploit this vulnerability by installing an older version of Cisco&nbsp;TelePresence CE Software on an affected device. A successful exploit could allow the attacker to take advantage of vulnerabilities in older versions of the software.Cisco&nbsp;has released software updates that address this vulnerability. There are no workarounds that address this vulnerability.,6.5,CWE-527
CVE-2021-32005,Cross-site Scripting (XSS) vulnerability in log view of Secomea SiteManager allows a logged in user to store javascript for later execution. This issue affects: Secomea SiteManager Version 9.6.621421014 and all prior versions.,6.5,CWE-79
CVE-2024-57980,In the Linux kernel the following vulnerability has been resolved:  media: uvcvideo: Fix double free in error path  If the uvc_status_init() function fails to allocate the int_urb it will free the dev->status pointer but doesn't reset the pointer to NULL. This results in the kfree() call in uvc_status_cleanup() trying to double-free the memory. Fix it by resetting the dev->status pointer to NULL after freeing it.  Reviewed by: Ricardo Ribalda <ribalda@chromium.org>,7.8,CWE-415
CVE-2025-47026,Adobe Experience Manager versions 6.5.22 and earlier are affected by a stored Cross-Site Scripting (XSS) vulnerability that could be abused by a low privileged attacker to inject malicious scripts into vulnerable form fields. Malicious JavaScript may be executed in a victim’s browser when they browse to the page containing the vulnerable field.,5.4,CWE-79
CVE-2024-47430,Substance3D - Painter versions 10.1.0 and earlier are affected by an out-of-bounds write vulnerability that could result in arbitrary code execution in the context of the current user. Exploitation of this issue requires user interaction in that a victim must open a malicious file.,7.8,CWE-787
CVE-2022-30597,A flaw was found in moodle where the description user field was not hidden when being set as a hidden user field.,5.3,CWE-472
CVE-2022-28053,Typemill v1.5.3 was discovered to contain an arbitrary file upload vulnerability via the upload function. This vulnerability allows attackers to execute arbitrary code via a crafted PHP file.,8.8,CWE-434
CVE-2024-43723,Adobe Experience Manager versions 6.5.21 and earlier are affected by a DOM-based Cross-Site Scripting (XSS) vulnerability that could be exploited by an attacker to execute arbitrary code in the context of the victim's browser session. By manipulating a DOM element through a crafted URL or user input the attacker can inject malicious scripts that run when the page is rendered. This type of attack requires user interaction as the victim would need to visit a malicious link or page.,5.4,CWE-79
CVE-2024-57881,In the Linux kernel the following vulnerability has been resolved:  mm/page_alloc: don't call pfn_to_page() on possibly non-existent PFN in split_large_buddy()  In split_large_buddy() we might call pfn_to_page() on a PFN that might not exist.  In corner cases such as when freeing the highest pageblock in the last memory section this could result with CONFIG_SPARSEMEM && !CONFIG_SPARSEMEM_EXTREME in __pfn_to_section() returning NULL and and __section_mem_map_addr() dereferencing that NULL pointer.  Let's fix it and avoid doing a pfn_to_page() call for the first iteration where we already have the page.  So far this was found by code inspection but let's just CC stable as the fix is easy.,5.5,CWE-476
CVE-2022-29777,Onlyoffice Document Server v6.0.0 and below and Core 6.1.0.26 and below were discovered to contain a heap overflow via the component DesktopEditor/fontengine/fontconverter/FontFileBase.h.,9.8,CWE-787
CVE-2021-35080,Disabled SMMU from secure side while RPM is assigned a secure stream can lead to information disclosure in Snapdragon Industrial IOT Snapdragon Mobile Snapdragon Wearables,6.5,CWE-200
CVE-2022-36388,Cross-Site Request Forgery (CSRF) vulnerability in YDS Support Ticket System plugin <= 1.0 at WordPress.,5.4,CWE-352
CVE-2022-34570,WAVLINK WN579 X3 M79X3.V5030.191012/M79X3.V5030.191012 contains an information leak which allows attackers to obtain the key information via accessing the messages.txt page.,7.5,CWE-425
CVE-2024-48271,D-Link DSL6740C v6.TR069.20211230 was discovered to use insecure default credentials for Administrator access possibly allowing attackers to bypass authentication and escalate privileges on the device via a bruteforce attack.,8.8,CWE-521
CVE-2022-48554,File before 5.43 has an stack-based buffer over-read in file_copystr in funcs.c. NOTE: File is the name of an Open Source project.,5.5,CWE-125
CVE-2024-30006,Microsoft WDAC OLE DB provider for SQL Server Remote Code Execution Vulnerability,8.8,CWE-416
CVE-2024-47376,Improper Neutralization of Input During Web Page Generation (XSS or 'Cross-site Scripting') vulnerability in Tribulant Slideshow Gallery allows Stored XSS.This issue affects Slideshow Gallery: from n/a through 1.8.3.,5.9,CWE-79
CVE-2023-41704,Processing of CID references at E-Mail can be abused to inject malicious script code that passes the sanitization engine. Malicious script code could be injected to a users sessions when interacting with E-Mails. Please deploy the provided updates and patch releases. CID handing has been improved and resulting content is checked for malicious content. No publicly available exploits are known.,7.1,CWE-79
CVE-2023-6326,The Master Slider – Responsive Touch Slider plugin for WordPress is vulnerable to Cross-Site Request Forgery in all versions up to and including 3.9.3. This is due to missing or incorrect nonce validation on the 'process_bulk_action' function. This makes it possible for unauthenticated attackers to duplicate or delete arbitrary sliders via a forged request granted they can trick a site administrator into performing an action such as clicking on a link.,5.4,CWE-352
CVE-2023-48930,xinhu xinhuoa 2.2.1 contains a File upload vulnerability.,9.8,CWE-434
CVE-2022-24612,An authenticated user can upload an XML file containing an XSS via the ITSM module of EyesOfNetwork 5.3.11 resulting in a stored XSS.,5.4,CWE-79
CVE-2023-51067,An unauthenticated reflected cross-site scripting (XSS) vulnerability in QStar Archive Solutions Release RELEASE_3-0 Build 7 allows attackers to execute arbitrary javascript on a victim's browser via a crafted link.,6.1,CWE-79
CVE-2021-27430,GE UR bootloader binary Version 7.00 7.01 and 7.02 included unused hardcoded credentials. Additionally a user with physical access to the UR IED can interrupt the boot sequence by rebooting the UR.,8.4,CWE-798
CVE-2024-41915,A vulnerability in the web-based management interface of ClearPass Policy Manager could allow an authenticated remote attacker to conduct SQL injection attacks against the ClearPass Policy Manager instance. An attacker could exploit this vulnerability to obtain and modify sensitive information in the underlying database potentially leading to complete compromise of the ClearPass Policy Manager cluster.,7.2,CWE-89
CVE-2022-48791,In the Linux kernel the following vulnerability has been resolved:  scsi: pm8001: Fix use-after-free for aborted TMF sas_task  Currently a use-after-free may occur if a TMF sas_task is aborted before we handle the IO completion in mpi_ssp_completion(). The abort occurs due to timeout.  When the timeout occurs the SAS_TASK_STATE_ABORTED flag is set and the sas_task is freed in pm8001_exec_internal_tmf_task().  However if the I/O completion occurs later the I/O completion still thinks that the sas_task is available. Fix this by clearing the ccb->task if the TMF times out - the I/O completion handler does nothing if this pointer is cleared.,7.8,CWE-416
CVE-2025-45011,A HTML Injection vulnerability was discovered in the foreigner-search.php file of PHPGurukul Park Ticketing Management System v2.0. This vulnerability allows remote attackers to execute arbitrary code via the searchdata POST request parameter.,5.3,CWE-77
CVE-2024-2713,A vulnerability which was classified as critical was found in Campcodes Complete Online DJ Booking System 1.0. Affected is an unknown function of the file /admin/booking-search.php. The manipulation of the argument searchdata leads to sql injection. It is possible to launch the attack remotely. The exploit has been disclosed to the public and may be used. VDB-257466 is the identifier assigned to this vulnerability.,6.3,CWE-89
CVE-2022-3058,Use after free in Sign-In Flow in Google Chrome prior to 105.0.5195.52 allowed a remote attacker who convinced a user to engage in specific UI interactions to potentially exploit heap corruption via crafted UI interaction.,8.8,CWE-416
CVE-2022-35100,SWFTools commit 772e55a2 was discovered to contain a segmentation violation via gfxline_getbbox at /lib/gfxtools.c.,6.5,CWE-125
CVE-2014-125021,A vulnerability was found in FFmpeg 2.0 and classified as problematic. This issue affects the function cmv_process_header. The manipulation leads to memory corruption. The attack may be initiated remotely. It is recommended to apply a patch to fix this issue.,5.3,CWE-119
CVE-2023-41847,Auth. (contributor+) Stored Cross-Site Scripting (XSS) vulnerability in WEN Solutions Notice Bar plugin <= 3.1.0 versions.,6.5,CWE-79
CVE-2024-33260,Jerryscript commit cefd391 was discovered to contain a segmentation violation via the component parser_parse_class at jerry-core/parser/js/js-parser-expr.c,5.1,CWE-284
CVE-2023-50255,Deepin-Compressor is the default archive manager of Deepin Linux OS. Prior to 5.12.21 there's a path traversal vulnerability in deepin-compressor that can be exploited to achieve Remote Command Execution on the target system upon opening crafted archives. Users are advised to update to version 5.12.21 which addresses the issue. There are no known workarounds for this vulnerability. ,9.3,CWE-22
CVE-2022-41264,Due to the unrestricted scope of the RFC function module SAP BASIS - versions 731 740 750 751 752 753 754 755 756 757 789 790 791 allows an authenticated non-administrator attacker to access a system class and execute any of its public methods with parameters provided by the attacker. On successful exploitation the attacker can have full control of the system to which the class belongs causing a high impact on the integrity of the application. ,8.8,CWE-94
CVE-2022-47125,Tenda A15 V15.13.07.13 was discovered to contain a stack overflow via the wrlEn_5g parameter at /goform/WifiBasicSet.,9.8,CWE-787
CVE-2023-41676,An exposure of sensitive information to an unauthorized actor [CWE-200] in FortiSIEM version  7.0.0 and before 6.7.5 may allow an attacker with access to windows agent logs to obtain the windows agent password via searching through the logs.,4.3,CWE-200
CVE-2023-5082,The History Log by click5 WordPress plugin before 1.0.13 does not properly sanitise and escape a parameter before using it in a SQL statement leading to a SQL injection exploitable by admin users when using the Smash Balloon Social Photo Feed plugin alongside it.,7.2,CWE-89
CVE-2023-22581,White Rabbit Switch contains a vulnerability which makes it possible for an attacker to perform system commands under the context of the web application (the default installation makes the webserver run as the root user).,9.8,CWE-20
CVE-2022-28971,Tenda AX1806 v1.0.0.1 was discovered to contain a stack overflow via the list parameter in the function fromSetIpMacBind. This vulnerability allows attackers to cause a Denial of Service (DoS).,7.5,CWE-787
CVE-2023-32313,vm2 is a sandbox that can run untrusted code with Node's built-in modules. In versions 3.9.17 and lower of vm2 it was possible to get a read-write reference to the node `inspect` method and edit options for `console.log`. As a result a threat actor can edit options for the `console.log` command. This vulnerability was patched in the release of version `3.9.18` of `vm2`. Users are advised to upgrade. Users unable to upgrade may make the `inspect` method readonly with `vm.readonly(inspect)` after creating a vm.,5.3,CWE-74
CVE-2023-23981,Auth. (admin+) Stored Cross-Site Scripting (XSS) vulnerability in QuantumCloud Conversational Forms for ChatBot plugin <= 1.1.6 versions.,5.9,CWE-79
CVE-2022-43516,A Firewall Rule which allows all incoming TCP connections to all programs from any source and to all ports is created in Windows Firewall after Zabbix agent installation (MSI),6.5,CWE-16
CVE-2022-30456,Badminton Center Management System 1.0 is vulnerable to Cross Site Scripting (XSS) via /bcms/classes/Master.php?f=save_court_rental.,5.4,CWE-79
CVE-2024-33852,A SQL Injection vulnerability exists in the Downtime component in Centreon Web 24.04.x before 24.04.3 23.10.x before 23.10.13 23.04.x before 23.04.19 and 22.10.x before 22.10.23.,9.1,CWE-89
CVE-2024-21743,Privilege Escalation vulnerability in favethemes Houzez Login Register houzez-login-register.This issue affects Houzez Login Register: from n/a through 3.2.5.,8.8,CWE-266
CVE-2022-30620,On Cellinx Camera with guest enabled attacker with web access can elevate privileges to administrative: 1 to 0 privileges by changing the following cookie values from is_admin showConfig. Administrative Privileges which allows changing various configuration in the camera.,8.2,CWE-565
CVE-2024-20401,A vulnerability in the content scanning and message filtering features of Cisco Secure Email Gateway could allow an unauthenticated remote attacker to overwrite arbitrary files on the underlying operating system.    This vulnerability is due to improper handling of email attachments when file analysis and content filters are enabled. An attacker could exploit this vulnerability by sending an email that contains a crafted attachment through an affected device. A successful exploit could allow the attacker to replace any file on the underlying file system. The attacker could then perform any of the following actions: add users with root privileges modify the device configuration execute arbitrary code or cause a permanent denial of service (DoS) condition on the affected device.    Note: Manual intervention is required to recover from the DoS condition. Customers are advised to contact the Cisco Technical Assistance Center (TAC) to help recover a device in this condition.,9.8,CWE-36
CVE-2023-50165,Pega Platform versions 8.2.1 to Infinity 23.1.0 are affected by an Generated PDF issue that could expose file contents.,8.5,CWE-918
CVE-2021-46595,This vulnerability allows remote attackers to disclose sensitive information on affected installations of Bentley MicroStation CONNECT 10.16.0.80. User interaction is required to exploit this vulnerability in that the target must visit a malicious page or open a malicious file. The specific flaw exists within the parsing of 3DS files. The issue results from the lack of proper validation of user-supplied data which can result in a read past the end of an allocated buffer. An attacker can leverage this in conjunction with other vulnerabilities to execute arbitrary code in the context of the current process. Was ZDI-CAN-15389.,5.5,CWE-125
CVE-2024-35209,A vulnerability has been identified in SINEC Traffic Analyzer (6GK8822-1BG01-0BA0) (All versions < V1.2). The affected web server is allowing HTTP methods like PUT and Delete. This could allow an attacker to modify unauthorized files.,6.2,CWE-749
CVE-2025-6580,A vulnerability classified as critical has been found in SourceCodester Best Salon Management System 1.0. Affected is an unknown function of the component Login. The manipulation of the argument Username leads to sql injection. It is possible to launch the attack remotely. The exploit has been disclosed to the public and may be used.,7.3,CWE-74
CVE-2024-11511,IrfanView XCF Plugin XCF File Parsing Heap-based Buffer Overflow Remote Code Execution Vulnerability. This vulnerability allows remote attackers to execute arbitrary code on affected installations of IrfanView. User interaction is required to exploit this vulnerability in that the target must visit a malicious page or open a malicious file.  The specific flaw exists within the parsing of XCF files. The issue results from the lack of proper validation of the length of user-supplied data prior to copying it to a heap-based buffer. An attacker can leverage this vulnerability to execute code in the context of the current process. Was ZDI-CAN-22735.,7.8,CWE-122
CVE-2024-12163,The goodlayers-core WordPress plugin before 2.1.3 allows users with a subscriber role and above to upload SVGs containing malicious payloads.,6.5,CWE-79
CVE-2024-6638,An integer overflow vulnerability due to improper input validation when reading TDMS files in LabVIEW may result in an infinite loop.  Successful exploitation requires an attacker to provide a user with a specially crafted TDMS file.  This vulnerability affects LabVIEW 2024 Q1 and prior versions.,5.5,CWE-190
