CVE,Description,CVSS3_BaseScore,CWE
CVE-2022-39143,A vulnerability has been identified in Parasolid V33.1 (All versions < V33.1.262) Parasolid V33.1 (All versions >= V33.1.262 < V33.1.263) Parasolid V34.0 (All versions < V34.0.252) Parasolid V34.1 (All versions < V34.1.242) Parasolid V35.0 (All versions < V35.0.161) Parasolid V35.0 (All versions >= V35.0.161 < V35.0.164) Simcenter Femap V2022.1 (All versions < V2022.1.3) Simcenter Femap V2022.2 (All versions < V2022.2.2). The affected application contains an out of bounds write past the end of an allocated buffer while parsing specially crafted X_T files. This could allow an attacker to execute code in the context of the current process. (ZDI-CAN-17493),7.8,CWE-787
CVE-2022-3607,Failure to Sanitize Special Elements into a Different Plane (Special Element Injection) in GitHub repository octoprint/octoprint prior to 1.8.3.,6.0,CWE-75
CVE-2025-20145,A vulnerability in the access control list (ACL) processing in the egress direction of Cisco IOS XR Software could allow an unauthenticated remote attacker to bypass a configured ACL.    This vulnerability exists because certain packets are handled incorrectly when they are received on an ingress interface on one line card and destined out of an egress interface on another line card where the egress ACL is configured. An attacker could exploit this vulnerability by attempting to send traffic through an affected device. A successful exploit could allow the attacker to bypass an egress ACL on the affected device.  For more information about this vulnerability see the  section of this advisory.  Cisco has released software updates that address this vulnerability. There are no workarounds that address this vulnerability.,5.8,CWE-264
CVE-2024-7812,A vulnerability classified as problematic was found in SourceCodester Best House Rental Management System 1.0. This vulnerability affects unknown code of the file /rental_0/rental/ajax.php?action=save_tenant of the component POST Parameter Handler. The manipulation of the argument lastname leads to cross site scripting. The attack can be initiated remotely. The exploit has been disclosed to the public and may be used.,3.5,CWE-79
CVE-2023-48752,Improper Neutralization of Input During Web Page Generation ('Cross-site Scripting') vulnerability in Happyforms Form builder to get in touch with visitors grow your email list and collect payments — Happyforms allows Reflected XSS.This issue affects Form builder to get in touch with visitors grow your email list and collect payments — Happyforms: from n/a through 1.25.9.  ,7.1,CWE-79
CVE-2023-7133,A vulnerability was found in y_project RuoYi 4.7.8. It has been declared as problematic. This vulnerability affects unknown code of the file /login of the component HTTP POST Request Handler. The manipulation of the argument rememberMe with the input falsen3f0m<script>alert(1)</script>p86o0 leads to cross site scripting. The attack can be initiated remotely. The exploit has been disclosed to the public and may be used. The identifier of this vulnerability is VDB-249136.,4.3,CWE-79
CVE-2023-5847, Under certain conditions a low privileged attacker could load a specially crafted file during installation or upgrade to escalate privileges on Windows and Linux hosts.,6.7,CWE-269
CVE-2025-47819,Flock Safety Gunshot Detection devices before 1.3 have an on-chip debug interface with improper access control.,6.4,CWE-1191
CVE-2022-0216,A use-after-free vulnerability was found in the LSI53C895A SCSI Host Bus Adapter emulation of QEMU. The flaw occurs while processing repeated messages to cancel the current SCSI request via the lsi_do_msgout function. This flaw allows a malicious privileged user within the guest to crash the QEMU process on the host resulting in a denial of service.,4.4,CWE-416
CVE-2025-43919,GNU Mailman 2.1.39 as bundled in cPanel (and WHM) allows unauthenticated attackers to read arbitrary files via ../ directory traversal at /mailman/private/mailman (aka the private archive authentication endpoint) via the username parameter. NOTE: multiple third parties report that they are unable to reproduce this regardless of whether cPanel or WHM is used.,5.8,CWE-24
CVE-2023-27823,An authentication bypass in Optoma 1080PSTX C02 allows an attacker to access the administration console without valid credentials.,9.8,CWE-287
CVE-2014-125025,A vulnerability classified as problematic has been found in FFmpeg 2.0. This affects the function decode_pulses. The manipulation leads to memory corruption. It is possible to initiate the attack remotely. It is recommended to apply a patch to fix this issue.,5.3,CWE-119
CVE-2023-3001, A CWE-502: Deserialization of Untrusted Data vulnerability exists in the Dashboard module that could cause an interpretation of malicious payload data potentially leading to remote code execution when an attacker gets the user to open a malicious file.   ,7.8,CWE-502
CVE-2025-27167,Illustrator versions 29.2.1 28.7.4 and earlier are affected by an Untrusted Search Path vulnerability that might allow attackers to execute their own programs access unauthorized data files or modify configuration in unexpected ways. If the application uses a search path to locate critical resources such as programs then an attacker could modify that search path to point to a malicious program which the targeted application would then execute. The problem extends to any type of critical resource that the application trusts.,7.8,CWE-426
CVE-2025-3538,A vulnerability was found in D-Link DI-8100 16.07.26A1. It has been rated as critical. This issue affects the function auth_asp of the file /auth.asp of the component jhttpd. The manipulation of the argument callback leads to stack-based buffer overflow. The attack needs to be approached within the local network. The exploit has been disclosed to the public and may be used.,8.8,CWE-119
CVE-2023-25304,An issue in Prism Launcher up to v6.1 allows attackers to perform a directory traversal via importing a crafted .mrpack file.,7.8,CWE-22
CVE-2023-22863,IBM Robotic Process Automation 20.12.0 through 21.0.2 defaults to HTTP in some RPA commands when the prefix is not explicitly specified in the URL.  This could allow an attacker to obtain sensitive information using man in the middle techniques.  IBM X-Force ID:  244109.,5.9,CWE-319
CVE-2023-24234,A stored cross-site scripting (XSS) vulnerability in the component php-inventory-management-system/brand.php of Inventory Management System v1 allows attackers to execute arbitrary web scripts or HTML via a crafted payload injected into the Brand Name parameter.,4.8,CWE-79
CVE-2024-0237,The EventON WordPress plugin through 4.5.8 EventON WordPress plugin before 2.2.7 do not have authorisation in some AJAX actions allowing unauthenticated users to update virtual events settings such as meeting URL moderator access details etc,5.3,CWE-862
CVE-2023-40645,In Messaging there is a possible missing permission check. This could lead to local information disclosure with no additional execution privileges needed,5.5,CWE-862
CVE-2024-35146,IBM Maximo Application Suite - Monitor Component 8.10.11 8.11.8 and 9.0.0 is vulnerable to cross-site scripting. This vulnerability allows an unauthenticated attacker to embed arbitrary JavaScript code in the Web UI thus altering the intended functionality potentially leading to credentials disclosure within a trusted session.,5.4,CWE-79
CVE-2022-46562,D-Link DIR-882 DIR882A1_FW130B06 DIR-878 DIR_878_FW1.30B08 was discovered to contain a stack overflow via the PSK parameter in the SetQuickVPNSettings module.,7.2,CWE-787
CVE-2024-45989,Monica AI Assistant desktop application v2.3.0 is vulnerable to Exposure of Sensitive Information to an Unauthorized Actor. A prompt injection allows an attacker to modify chatbot answer with an unloaded image that exfiltrates the user's sensitive chat data of the current session to a malicious third-party or attacker-controlled server.,4.0,CWE-77
CVE-2014-125054,A vulnerability classified as critical was found in koroket RedditOnRails. This vulnerability affects unknown code of the component Vote Handler. The manipulation leads to improper access controls. The attack can be initiated remotely. The patch is identified as 7f3c7407d95d532fcc342b00d68d0ea09ca71030. It is recommended to apply a patch to fix this issue. VDB-217594 is the identifier assigned to this vulnerability.,4.3,CWE-284
CVE-2023-27634,Cross-Site Request Forgery (CSRF) vulnerability allows arbitrary file upload in Shingo Intrepidity plugin <= 1.5.1 versions.,8.8,CWE-352
CVE-2025-5682,Improper Neutralization of Input During Web Page Generation ('Cross-site Scripting') vulnerability in Drupal Klaro Cookie & Consent Management allows Cross-Site Scripting (XSS).This issue affects Klaro Cookie & Consent Management: from 0.0.0 before 3.0.7.,4.3,CWE-79
CVE-2024-51132,An XML External Entity (XXE) vulnerability in HAPI FHIR before v6.4.0 allows attackers to access sensitive information or execute arbitrary code via supplying a crafted request containing malicious XML entities.,9.8,CWE-611
CVE-2022-1179,Non-Privilege User Can Created New Rule and Lead to Stored Cross Site Scripting in GitHub repository openemr/openemr prior to 6.0.0.4.,5.4,CWE-79
CVE-2024-22880,Cross Site Scripting vulnerability in Zadarma Zadarma extension v.1.0.11 allows a remote attacker to execute a arbitrary code via a crafted script to the webchat component.,4.7,CWE-79
CVE-2022-30717,Improper caller check in AR Emoji prior to SMR Jun-2022 Release 1 allows untrusted applications to use some camera functions via deeplink.,4.0,CWE-285
CVE-2022-31184,Discourse is the an open source discussion platform. In affected versions an email activation route can be abused to send mass spam emails. A fix has been included in the latest stable beta and tests-passed versions of Discourse which rate limits emails. Users are advised to upgrade. Users unable to upgrade should manually rate limit email.,6.5,CWE-770
CVE-2025-24237,A buffer overflow was addressed with improved bounds checking. This issue is fixed in visionOS 2.4 macOS Ventura 13.7.5 iOS 18.4 and iPadOS 18.4 iPadOS 17.7.6 macOS Sequoia 15.4 macOS Sonoma 14.7.5. An app may be able to cause unexpected system termination.,9.8,CWE-120
CVE-2021-43269,In Code42 app before 8.8.0 eval injection allows an attacker to change a device’s proxy configuration to use a malicious proxy auto-config (PAC) file leading to arbitrary code execution. This affects Incydr Basic Advanced and Gov F1; CrashPlan Cloud; and CrashPlan for Small Business. (Incydr Professional and Enterprise are unaffected.),8.8,CWE-94
CVE-2022-36731,Library Management System v1.0 was discovered to contain a SQL injection vulnerability via the RollNo parameter at /librarian/delstu.php.,9.8,CWE-89
CVE-2014-125108,A vulnerability was found in w3c online-spellchecker-py up to 20140130. It has been rated as problematic. This issue affects some unknown processing of the file spellchecker. The manipulation leads to cross site scripting. The attack may be initiated remotely. The complexity of an attack is rather high. The exploitation is known to be difficult. The identifier of the patch is d6c21fd8187c5db2a50425ff80694149e75d722e. It is recommended to apply a patch to fix this issue. The identifier VDB-248849 was assigned to this vulnerability.,3.1,CWE-79
CVE-2023-34442,Exposure of Sensitive Information to an Unauthorized Actor vulnerability in Apache Software Foundation Apache Camel.This issue affects Apache Camel: from 3.X through <=3.14.8 from 3.18.X through <=3.18.7 from 3.20.X through <= 3.20.5 from 4.X through <= 4.0.0-M3.  Users should upgrade to 3.14.9 3.18.8 3.20.6 or 3.21.0 and for users on Camel 4.x update to 4.0.0-M1 ,3.3,CWE-200
CVE-2025-30877,Missing Authorization vulnerability in fatcatapps Quiz Cat allows Exploiting Incorrectly Configured Access Control Security Levels. This issue affects Quiz Cat: from n/a through 3.0.8.,2.7,CWE-862
CVE-2025-0432,EWON Flexy 202 transmits user credentials in clear text with no encryption when a user is added or user credentials are changed via its webpage.,5.7,CWE-319
CVE-2024-44038,Missing Authorization vulnerability in WP Sunshine Sunshine Photo Cart allows Exploiting Incorrectly Configured Access Control Security Levels.This issue affects Sunshine Photo Cart: from n/a through 3.2.9.,5.3,CWE-862
CVE-2024-10071,A vulnerability classified as critical was found in ESAFENET CDG 5. This vulnerability affects the function actionUpdateEncryptPolicyEdit of the file /com/esafenet/servlet/policy/EncryptPolicyService.java. The manipulation of the argument encryptPolicyId leads to sql injection. The attack can be initiated remotely. The exploit has been disclosed to the public and may be used. The vendor was contacted early about this disclosure but did not respond in any way.,6.3,CWE-89
CVE-2024-21796,Electronic Deliverables Creation Support Tool (Construction Edition) prior to Ver1.0.4 and Electronic Deliverables Creation Support Tool (Design & Survey Edition) prior to Ver1.0.4 improperly restrict XML external entity references (XXE). By processing a specially crafted XML file arbitrary files on the system may be read by an attacker.,5.5,CWE-611
CVE-2025-49278,Improper Control of Filename for Include/Require Statement in PHP Program ('PHP Remote File Inclusion') vulnerability in Unfoldwp Blogty allows PHP Local File Inclusion. This issue affects Blogty: from n/a through 1.0.11.,8.1,CWE-98
CVE-2024-25912,Missing Authorization vulnerability in Skymoonlabs MoveTo.This issue affects MoveTo: from n/a through 6.2.  ,9.8,CWE-862
CVE-2022-29187,Git is a distributed revision control system. Git prior to versions 2.37.1 2.36.2 2.35.4 2.34.4 2.33.4 2.32.3 2.31.4 and 2.30.5 is vulnerable to privilege escalation in all platforms. An unsuspecting user could still be affected by the issue reported in CVE-2022-24765 for example when navigating as root into a shared tmp directory that is owned by them but where an attacker could create a git repository. Versions 2.37.1 2.36.2 2.35.4 2.34.4 2.33.4 2.32.3 2.31.4 and 2.30.5 contain a patch for this issue. The simplest way to avoid being affected by the exploit described in the example is to avoid running git as root (or an Administrator in Windows) and if needed to reduce its use to a minimum. While a generic workaround is not possible a system could be hardened from the exploit described in the example by removing any such repository if it exists already and creating one as root to block any future attacks.,7.8,CWE-282
CVE-2025-32128,Improper Neutralization of Special Elements used in an SQL Command ('SQL Injection') vulnerability in aaronfrey Nearby Locations allows SQL Injection. This issue affects Nearby Locations: from n/a through 1.1.1.,7.6,CWE-89
CVE-2025-23882,Improper Neutralization of Input During Web Page Generation ('Cross-site Scripting') vulnerability in NotFound WP Download Codes allows Reflected XSS. This issue affects WP Download Codes: from n/a through 2.5.4.,7.1,CWE-79
CVE-2024-6767,The WordSurvey plugin for WordPress is vulnerable to Stored Cross-Site Scripting via the ‘sounding_title’ parameter in all versions up to and including 3.2 due to insufficient input sanitization and output escaping. This makes it possible for authenticated attackers with administrator-level access to inject arbitrary web scripts in pages that will execute whenever a user accesses an injected page. This only affects multi-site installations and installations where unfiltered_html has been disabled.,5.5,CWE-79
CVE-2023-5929,A vulnerability was found in Campcodes Simple Student Information System 1.0. It has been classified as critical. This affects an unknown part of the file /admin/students/manage_academic.php. The manipulation of the argument id leads to sql injection. The exploit has been disclosed to the public and may be used. The identifier VDB-244329 was assigned to this vulnerability.,5.5,CWE-89
CVE-2023-3606,A vulnerability was found in TamronOS up to 20230703. It has been classified as critical. This affects an unknown part of the file /api/ping. The manipulation of the argument host leads to os command injection. It is possible to initiate the attack remotely. The exploit has been disclosed to the public and may be used. The associated identifier of this vulnerability is VDB-233475. NOTE: The vendor was contacted early about this disclosure but did not respond in any way.,6.3,CWE-78
CVE-2024-29024,JumpServer is an open source bastion host and an operation and maintenance security audit system. An authenticated user can exploit the Insecure Direct Object Reference (IDOR) vulnerability in the file manager's bulk transfer by manipulating job IDs to upload malicious files  potentially compromising the integrity and security of the system. This vulnerability is fixed in v3.10.6.,4.6,CWE-639
CVE-2022-41428,Bento4 v1.6.0-639 was discovered to contain a heap overflow via the AP4_BitReader::ReadBits function in mp4mux.,8.8,CWE-787
CVE-2022-21223,The package cocoapods-downloader before 1.6.2 are vulnerable to Command Injection via hg argument injection. When calling the download function (when using hg) the url (and/or revision tag branch) is passed to the hg clone command in a way that additional flags can be set. The additional flags can be used to perform a command injection.,8.1,CWE-88
CVE-2025-26919,Improper Neutralization of Input During Web Page Generation ('Cross-site Scripting') vulnerability in tainacan Tainá allows Stored XSS. This issue affects Tainá: from n/a through 0.2.2.,6.5,CWE-79
CVE-2024-11121,A vulnerability classified as critical was found in 上海灵当信息科技有限公司 Lingdang CRM up to 8.6.4.3. Affected by this vulnerability is an unknown functionality of the file /crm/WeiXinApp/marketing/index.php?module=Users&action=getActionList. The manipulation of the argument userid leads to sql injection. The attack can be launched remotely. The exploit has been disclosed to the public and may be used. The vendor was contacted early about this disclosure but did not respond in any way.,6.3,CWE-74
CVE-2023-1647,Improper Access Control in GitHub repository calcom/cal.com prior to 2.7.  ,8.8,CWE-284
CVE-2022-42274,NVIDIA BMC contains a vulnerability in IPMI handler where an authorized attacker can cause a buffer overflow and cause a denial of service or gain code execution.,7.8,CWE-120
CVE-2023-1908,A vulnerability was found in SourceCodester Simple Mobile Comparison Website 1.0. It has been classified as critical. Affected is an unknown function of the file /admin/categories/view_category.php of the component GET Parameter Handler. The manipulation of the argument id leads to sql injection. It is possible to launch the attack remotely. The exploit has been disclosed to the public and may be used. VDB-225150 is the identifier assigned to this vulnerability.,6.3,CWE-89
CVE-2025-21320,Windows Kernel Memory Information Disclosure Vulnerability,5.5,CWE-532
CVE-2022-38231,XPDF commit ffaf11c was discovered to contain a heap-buffer overflow via DCTStream::getChar() at /xpdf/Stream.cc.,7.8,CWE-787
CVE-2024-6147,Poly Plantronics Hub Link Following Local Privilege Escalation Vulnerability. This vulnerability allows local attackers to escalate privileges on affected installations of Poly Plantronics Hub. An attacker must first obtain the ability to execute low-privileged code on the target system in order to exploit this vulnerability.  The specific flaw exists within the Spokes Update Service. By creating a symbolic link an attacker can abuse the service to delete a file. An attacker can leverage this vulnerability to escalate privileges and execute arbitrary code in the context of SYSTEM. Was ZDI-CAN-18271.,7.8,CWE-59
CVE-2024-35119,IBM InfoSphere Information Server 11.7 could allow a remote attacker to obtain sensitive information when a detailed technical error message is returned in a stack trace.  This information could be used in further attacks against the system.  IBM X-Force ID:  290342.,5.3,CWE-209
CVE-2023-51786,An issue was discovered in Lustre versions 2.13.x 2.14.x and 2.15.x before 2.15.4 allows attackers to escalate privileges and obtain sensitive information via Incorrect Access Control.,9.1,CWE-284
CVE-2022-38617,SmartVista SVFE2 v2.2.22 was discovered to contain a SQL injection vulnerability via the voiceAudit:j_id97 parameter at /SVFE2/pages/audit/voiceaudit.jsf.,8.8,CWE-89
CVE-2022-24285,Acer Care Center 4.00.30xx before 4.00.3042 contains a local privilege escalation vulnerability. The user process communicates with a service of system authority called ACCsvc through a named pipe. In this case the Named Pipe is also given Read and Write rights to the general user. In addition the service program does not verify the user when communicating. A thread may exist with a specific command. When the path of the program to be executed is sent there is a local privilege escalation in which the service program executes the path with system privileges.,7.8,CWE-287
CVE-2020-36691,An issue was discovered in the Linux kernel before 5.8. lib/nlattr.c allows attackers to cause a denial of service (unbounded recursion) via a nested Netlink policy with a back reference.,5.5,CWE-674
CVE-2023-33643,H3C Magic R300 version R300-2100MV100R004 was discovered to contain a stack overflow via the AddWlanMacList interface at /goform/aspForm.,7.2,CWE-787
CVE-2023-33592,Lost and Found Information System v1.0 was discovered to contain a SQL injection vulnerability via the component /php-lfis/admin/?page=system_info/contact_information.,9.8,CWE-89
CVE-2023-0124,Delta Electronics DOPSoft versions 4.00.16.22 and prior are vulnerable to an out-of-bounds write which could allow an attacker to remotely execute arbitrary code when a malformed file is introduced to the software.  ,7.8,CWE-787
CVE-2024-39174,A cross-site scripting (XSS) vulnerability in the Publish Article function of yzmcms v7.1 allows attackers to execute arbitrary web scripts or HTML via a crafted payload injected into a published article.,6.1,CWE-79
CVE-2024-26065,Adobe Experience Manager versions 6.5.19 and earlier are affected by a stored Cross-Site Scripting (XSS) vulnerability that could be abused by an attacker to inject malicious scripts into vulnerable form fields. Malicious JavaScript may be executed in a victim’s browser when they browse to the page containing the vulnerable field.,5.4,CWE-79
CVE-2023-30198,Prestashop winbizpayment <= 1.0.2 is vulnerable to Incorrect Access Control via modules/winbizpayment/downloads/download.php.,7.5,CWE-22
CVE-2024-13350,The SearchIQ – The Search Solution plugin for WordPress is vulnerable to Stored Cross-Site Scripting via the plugin's 'siq_searchbox' shortcode in all versions up to and including 4.7 due to insufficient input sanitization and output escaping on user supplied attributes. This makes it possible for authenticated attackers with contributor-level access and above to inject arbitrary web scripts in pages that will execute whenever a user accesses an injected page.,6.4,CWE-79
CVE-2023-39169,The affected devices use publicly available default credentials with administrative privileges.,9.8,CWE-798
CVE-2023-7091,A vulnerability was found in Dreamer CMS 4.1.3. It has been declared as problematic. This vulnerability affects unknown code of the file /upload/uploadFile. The manipulation of the argument file leads to unrestricted upload. The attack can be initiated remotely. The exploit has been disclosed to the public and may be used. VDB-248938 is the identifier assigned to this vulnerability. NOTE: The vendor was contacted early about this disclosure but did not respond in any way.,6.3,CWE-434
CVE-2022-37934,A potential security vulnerability has been identified in HPE OfficeConnect 1820 and 1850 switch series. The vulnerability could be remotely exploited to allow remote directory traversal in HPE OfficeConnect 1820 switch series version PT.02.17 and below HPE OfficeConnect 1850 switch series version PC.01.23 and below and HPE OfficeConnect 1850 (10G aggregator) switch version PO.01.22 and below.  ,6.8,CWE-22
CVE-2024-42166,The function generate_app_certificates in lib/app_certificates.js of FIWARE Keyrock <= 8.4 does not neutralize special elements used in an OS Command properly. This allows an authenticated user with permissions to create applications to execute commands by creating an application with a malicious name.,9.1,CWE-78
CVE-2023-31794,MuPDF v1.21.1 was discovered to contain an infinite recursion in the component pdf_mark_list_push. This vulnerability allows attackers to cause a Denial of Service (DoS) via a crafted PDF file.,5.5,CWE-674
CVE-2025-22465,Reflected XSS in Ivanti Endpoint Manager before version 2024 SU1 or before version 2022 SU7 allows a remote unauthenticated attacker to execute arbitrary javascript in a victim's browser. Unlikely user interaction is required.,6.1,CWE-79
CVE-2022-1062,The th23 Social WordPress plugin through 1.2.0 does not sanitise and escape some of its settings which could allow high privilege users such as admin to perform Cross-Site Scripting attacks even when the unfiltered_html capability is disallowed,4.8,CWE-79
CVE-2022-49024,In the Linux kernel the following vulnerability has been resolved:  can: m_can: pci: add missing m_can_class_free_dev() in probe/remove methods  In m_can_pci_remove() and error handling path of m_can_pci_probe() m_can_class_free_dev() should be called to free resource allocated by m_can_class_allocate_dev() otherwise there will be memleak.,5.5,CWE-401
CVE-2024-6052,Stored XSS in Checkmk before versions 2.3.0p8 2.2.0p29 2.1.0p45 and 2.0.0 (EOL) allows users to execute arbitrary scripts by injecting HTML elements,6.5,CWE-80
