CVE,Description,CVSS3_BaseScore,CWE
CVE-2021-46994,In the Linux kernel the following vulnerability has been resolved:  can: mcp251x: fix resume from sleep before interface was brought up  Since 8ce8c0abcba3 the driver queues work via priv->restart_work when resuming after suspend even when the interface was not previously enabled. This causes a null dereference error as the workqueue is only allocated and initialized in mcp251x_open().  To fix this we move the workqueue init to mcp251x_can_probe() as there is no reason to do it later and repeat it whenever mcp251x_open() is called.  [mkl: fix error handling in mcp251x_stop()],5.5,CWE-476
CVE-2022-23808,An issue was discovered in phpMyAdmin 5.1 before 5.1.2. An attacker can inject malicious code into aspects of the setup script which can allow XSS or HTML injection.,6.1,CWE-79
CVE-2024-4813,A vulnerability classified as critical has been found in Ruijie RG-UAC up to 20240506. Affected is an unknown function of the file /view/networkConfig/physicalInterface/interface_commit.php. The manipulation of the argument name leads to os command injection. It is possible to launch the attack remotely. The exploit has been disclosed to the public and may be used. It is recommended to apply a patch to fix this issue. VDB-263934 is the identifier assigned to this vulnerability. NOTE: The vendor was contacted early about this disclosure but did not respond in any way.,6.3,CWE-78
CVE-2021-45059,Adobe InDesign version 16.4 (and earlier) is affected by a use-after-free vulnerability in the processing of a JPEG2000 file that could lead to disclosure of sensitive memory. An attacker could leverage this vulnerability to bypass mitigations such as ASLR. Exploitation of this issue requires user interaction in that a victim must open a malicious file.,3.3,CWE-416
CVE-2023-46131,Grails is a framework used to build web applications with the Groovy programming language. A specially crafted web request can lead to a JVM crash or denial of service. Any Grails framework application using Grails data binding is vulnerable. This issue has been patched in version 3.3.17 4.1.3 5.3.4 6.1.0. ,6.5,CWE-400
CVE-2024-44572,RELY-PCIe v22.2.1 to v23.1.0 was discovered to contain a command injection vulnerability via the sys_mgmt function.,8.8,CWE-77
CVE-2025-46521,Improper Neutralization of Input During Web Page Generation ('Cross-site Scripting') vulnerability in Silver Muru WS Force Login Page allows Stored XSS. This issue affects WS Force Login Page: from n/a through 3.0.3.,5.9,CWE-79
CVE-2023-26957,onekeyadmin v1.3.9 was discovered to contain an arbitrary file delete vulnerability via the component \admin\controller\plugins.,9.1,CWE-862
CVE-2024-51186,D-Link DIR-820L 1.05b03 was discovered to contain a remote code execution (RCE) vulnerability via the ping_addr parameter in the ping_v4 and ping_v6 functions.,8.0,CWE-77
CVE-2024-0993,A vulnerability was found in Tenda i6 1.0.0.9(3857). It has been classified as critical. Affected is the function formWifiMacFilterGet of the file /goform/WifiMacFilterGet of the component httpd. The manipulation of the argument index leads to stack-based buffer overflow. It is possible to launch the attack remotely. The exploit has been disclosed to the public and may be used. VDB-252258 is the identifier assigned to this vulnerability. NOTE: The vendor was contacted early about this disclosure but did not respond in any way.,7.2,CWE-121
CVE-2024-1712,The Carousel Slider WordPress plugin before 2.2.7 does not sanitise and escape some of its settings which could allow high privilege users such as admin to perform Stored Cross-Site Scripting attacks even when the unfiltered_html capability is disallowed (for example in multisite setup),4.7,CWE-79
CVE-2022-2057,Divide By Zero error in tiffcrop in libtiff 4.4.0 allows attackers to cause a denial-of-service via a crafted tiff file. For users that compile libtiff from sources the fix is available with commit f3a5e010.,5.5,CWE-369
CVE-2023-50707, Through the exploitation of active user sessions an attacker could send custom requests to cause a denial-of-service condition on the device.     ,9.6,CWE-400
CVE-2024-11567,IrfanView DXF File Parsing Out-Of-Bounds Read Remote Code Execution Vulnerability. This vulnerability allows remote attackers to execute arbitrary code on affected installations of IrfanView. User interaction is required to exploit this vulnerability in that the target must visit a malicious page or open a malicious file.  The specific flaw exists within the parsing of DXF files. The issue results from the lack of proper validation of user-supplied data which can result in a read past the end of an allocated buffer. An attacker can leverage this vulnerability to execute code in the context of the current process. Was ZDI-CAN-24871.,7.8,CWE-125
CVE-2023-40728,A vulnerability has been identified in QMS Automotive (All versions < V12.39). The QMS.Mobile module of the affected application stores sensitive application data in an external insecure storage. This could allow an attacker to alter content leading to arbitrary code execution or denial-of-service condition.,7.3,CWE-922
CVE-2024-13470,The Ninja Forms – The Contact Form Builder That Grows With You plugin for WordPress is vulnerable to Stored Cross-Site Scripting via the plugin's shortcode in all versions up to and including 3.8.24 due to insufficient input sanitization and output escaping on user supplied attributes. This makes it possible for authenticated attackers with contributor-level access and above to inject arbitrary web scripts in pages that will execute whenever a user accesses an injected page.,6.4,CWE-79
CVE-2022-42229,Wedding Planner v1.0 is vulnerable to Arbitrary code execution via package_edit.php.,8.8,CWE-434
CVE-2025-22928,OS4ED openSIS v7.0 to v9.1 was discovered to contain a SQL injection vulnerability via the cp_id parameter at /modules/messages/Inbox.php.,9.8,CWE-89
CVE-2022-36249,Shop Beat Solutions (Pty) LTD Shop Beat Media Player 2.5.95 up to 3.2.57 is vulnerable to Bypass 2FA via APIs. For Controlpanel Lite. After login we are directly able to use the bearer token or jsession ID to access the apis instead of entering the 2FA code. Thus leading to bypass of 2FA on API level.,5.4,CWE-288
CVE-2025-6848,A vulnerability which was classified as critical has been found in code-projects Simple Forum 1.0. This issue affects some unknown processing of the file /forum1.php. The manipulation of the argument File leads to unrestricted upload. The attack may be initiated remotely. The exploit has been disclosed to the public and may be used.,6.3,CWE-284
CVE-2023-35031,Atos Unify OpenScape 4000 Assistant V10 R1 before V10 R1.42.0 and V10 R1.34.8 Assistant V10 R0 Manager V10 R1 before V10 R1.42.0 and V10 R1.34.8 and Manager V10 R0 allow command injection by authenticated users aka OSFOURK-24036.,8.8,CWE-77
CVE-2023-26484,KubeVirt is a virtual machine management add-on for Kubernetes. In versions 0.59.0 and prior if a malicious user has taken over a Kubernetes node where virt-handler (the KubeVirt node-daemon) is running the virt-handler service account can be used to modify all node specs. This can be misused to lure-in system-level-privileged components which can for instance read all secrets on the cluster or can exec into pods on other nodes. This way a compromised node can be used to elevate privileges beyond the node until potentially having full privileged access to the whole cluster. The simplest way to exploit this once a user could compromise a specific node is to set with the virt-handler service account all other nodes to unschedulable and simply wait until system-critical components with high privileges appear on its node. No patches are available as of time of publication. As a workaround gatekeeper users can add a webhook which will block the `virt-handler` service account to modify the spec of a node.,8.2,CWE-863
CVE-2022-43967,Concrete CMS (formerly concrete5) below 8.5.10 and between 9.0.0 and 9.1.2 is vulnerable to Reflected XSS in the multilingual report due to un-sanitized output. Remediate by updating to Concrete CMS 9.1.3+ or 8.5.10+.,6.1,CWE-79
CVE-2025-1752,A Denial of Service (DoS) vulnerability has been identified in the KnowledgeBaseWebReader class of the run-llama/llama_index project affecting version ~ latest(v0.12.15). The vulnerability arises due to inappropriate secure coding measures specifically the lack of proper implementation of the max_depth parameter in the get_article_urls function. This allows an attacker to exhaust Python's recursion limit through repeated function calls leading to resource consumption and ultimately crashing the Python process.,7.5,CWE-400
CVE-2023-1634,A vulnerability was found in OTCMS 6.72. It has been classified as critical. Affected is the function UseCurl of the file /admin/info_deal.php of the component URL Parameter Handler. The manipulation leads to server-side request forgery. It is possible to launch the attack remotely. The exploit has been disclosed to the public and may be used. The identifier of this vulnerability is VDB-224016.,6.3,CWE-918
CVE-2025-31856,Missing Authorization vulnerability in brainvireinfo Export All Post Meta allows Accessing Functionality Not Properly Constrained by ACLs. This issue affects Export All Post Meta: from n/a through 1.2.1.,4.3,CWE-862
CVE-2024-35895,In the Linux kernel the following vulnerability has been resolved:  bpf sockmap: Prevent lock inversion deadlock in map delete elem  syzkaller started using corpuses where a BPF tracing program deletes elements from a sockmap/sockhash map. Because BPF tracing programs can be invoked from any interrupt context locks taken during a map_delete_elem operation must be hardirq-safe. Otherwise a deadlock due to lock inversion is possible as reported by lockdep:         CPU0                    CPU1        ----                    ----   lock(&htab->buckets[i].lock);                                local_irq_disable();                                lock(&host->lock);                                lock(&htab->buckets[i].lock);   <Interrupt>     lock(&host->lock);  Locks in sockmap are hardirq-unsafe by design. We expects elements to be deleted from sockmap/sockhash only in task (normal) context with interrupts enabled or in softirq context.  Detect when map_delete_elem operation is invoked from a context which is _not_ hardirq-unsafe that is interrupts are disabled and bail out with an error.  Note that map updates are not affected by this issue. BPF verifier does not allow updating sockmap/sockhash from a BPF tracing program today.,5.5,CWE-667
CVE-2024-7447,The Interactive Contact Form and Multi Step Form Builder with Drag & Drop Editor – Funnelforms Free plugin for WordPress is vulnerable to unauthorized modification of data due to a missing capability check on the 'fnsf_af2_handel_file_upload' function in all versions up to and including 3.7.3.2. This makes it possible for unauthenticated attackers to upload arbitrary media to the site even if no forms exist.,5.3,CWE-862
CVE-2024-23583,An attacker could potentially intercept credentials via the task manager and perform unauthorized access to the Client Deploy Tool on Windows systems.  ,6.7,CWE-522
CVE-2024-33212,Tenda FH1206 V1.2.0.8(8155)_EN was discovered to contain a stack-based buffer overflow vulnerability via the funcpara1 parameter in ip/goform/setcfm.,8.8,CWE-121
CVE-2024-31188,Out-of-bounds Read vulnerability in Open Networking Foundation (ONF) libfluid (libfluid_msg module). This vulnerability is associated with program routine fluid_msg::of13::MultipartReplyTableFeatures::unpack.  This issue affects libfluid: 0.1.0.,6.5,CWE-125
CVE-2022-26851,Dell PowerScale OneFS 8.2.2-9.3.x contains a predictable file name from observable state vulnerability. An unprivileged network attacker could potentially exploit this vulnerability leading to data loss.,9.1,CWE-330
CVE-2022-23004,When computing a shared secret or point multiplication on the NIST P-256 curve using a public key with an X coordinate of zero an error is returned from the library and an invalid unreduced value is written to the output buffer. This may be leveraged by an attacker to cause an error scenario resulting in a limited denial of service for an individual user. The scope of impact cannot extend to other components.,5.3,CWE-703
CVE-2024-7968,Use after free in Autofill in Google Chrome prior to 128.0.6613.84 allowed a remote attacker who had convinced the user to engage in specific UI interactions to potentially exploit heap corruption via a crafted HTML page. (Chromium security severity: High),8.8,CWE-416
CVE-2021-38483,The affected product is vulnerable to misconfigured binaries allowing users on the target PC with SYSTEM level privileges access to overwrite the binary and modify files to gain privilege escalation.,6.0,CWE-732
CVE-2025-30095,VyOS 1.3 through 1.5 (fixed in 1.4.2) or any Debian-based system using dropbear in combination with live-build has the same Dropbear private host keys across different installations. Thus an attacker can conduct active man-in-the-middle attacks against SSH connections if Dropbear is enabled as the SSH daemon. I n VyOS this is not the default configuration for the system SSH daemon but is for the console service. To mitigate this one can run rm -f /etc/dropbear/*key* and/or rm -f /etc/dropbear-initramfs/*key* and then dropbearkey -t rsa -s 4096 -f /etc/dropbear_rsa_host_key and reload the service or reboot the system before using Dropbear as the SSH daemon (this clears out all keys mistakenly built into the release image) or update to the latest version of VyOS 1.4 or 1.5. Note that this vulnerability is not unique to VyOS and may appear in any Debian-based Linux distribution that uses Dropbear in combination with live-build which has a safeguard against this behavior in OpenSSH but no equivalent one for Dropbear.,9.0,CWE-321
CVE-2022-39878,Improper access control vulnerability in Samsung Checkout prior to version 5.0.55.3 allows attackers to access sensitive information via implicit intent broadcast.,4.0,CWE-284
CVE-2022-24915,The absence of filters when loading some sections in the web application of the vulnerable device allows attackers to inject malicious code that will be interpreted when a legitimate user accesses the web section where the information is displayed. Injection can be done on specific parameters. The injected code is executed when a legitimate user attempts to upload copy download or delete an existing configuration (Administrative Services).,8.0,CWE-94
CVE-2024-3944,The WP To Do plugin for WordPress is vulnerable to Stored Cross-Site Scripting via Comment in all versions up to and including 1.3.0 due to insufficient input sanitization and output escaping. This makes it possible for authenticated attackers with administrator-level permissions and above to inject arbitrary web scripts in pages that will execute whenever a user accesses an injected page. This only affects multi-site installations and installations where unfiltered_html has been disabled.,4.4,CWE-79
CVE-2023-25150,Nextcloud office/richdocuments is an office suit for the nextcloud server platform. In affected versions the Collabora integration can be tricked to provide access to any file without proper permission validation. As a result any user with access to Collabora can obtain the content of other users files. It is recommended that the Nextcloud Office App (Collabora Integration) is updated to 7.0.2 (Nextcloud 25) 6.3.2 (Nextcloud 24) 5.0.10 (Nextcloud 23) 4.2.9 (Nextcloud 21-22) or 3.8.7 (Nextcloud 15-20). There are no known workarounds for this issue.,5.8,CWE-284
CVE-2024-47331,Improper Neutralization of Special Elements used in an SQL Command ('SQL Injection') vulnerability in NinjaTeam Multi Step for Contact Form allows SQL Injection.This issue affects Multi Step for Contact Form: from n/a through 2.7.7.,9.3,CWE-89
CVE-2024-42625,FrogCMS v0.9.5 was discovered to contain a Cross-Site Request Forgery (CSRF) vulnerability via /admin/?/layout/add,8.8,CWE-352
CVE-2021-22642,An attacker could use specially crafted invalid Modbus frames to crash the Ovarro TBox system.,7.5,CWE-400
CVE-2023-34735,Property Cloud Platform Management Center 1.0 is vulnerable to error-based SQL injection.,9.8,CWE-89
CVE-2022-45126,Kernel subsystem within OpenHarmony-v3.1.4 and prior versions in kernel_liteos_a has a kernel stack overflow vulnerability when call SysClockGettime. 4 bytes padding data from kernel stack are copied to user space incorrectly and leaked.,4.0,CWE-120
CVE-2022-47210,The default console presented to users over telnet (when enabled) is restricted to a subset of commands. Commands issued at this console however appear to be fed directly into a system call or other similar function. This allows any authenticated user to execute arbitrary commands on the device.,7.8,CWE-78
CVE-2022-31540,The kumardeepak/hin-eng-preprocessing repository through 2019-07-16 on GitHub allows absolute path traversal because the Flask send_file function is used unsafely.,9.3,CWE-22
CVE-2021-28656,Cross-Site Request Forgery (CSRF) vulnerability in Credential page of Apache Zeppelin allows an attacker to submit malicious request.  This issue affects Apache Zeppelin Apache Zeppelin version 0.9.0 and prior versions.,5.4,CWE-352
CVE-2025-5273,All versions of the package mcp-markdownify-server are vulnerable to Files or Directories Accessible to External Parties via the get-markdown-file tool. An attacker can craft a prompt that once accessed by the MCP host will allow it to read arbitrary files from the host running the server.,6.5,CWE-552
CVE-2022-34735,The frame scheduling module has a null pointer dereference vulnerability. Successful exploitation of this vulnerability will affect the kernel availability.,7.5,CWE-476
CVE-2025-29972,Server-Side Request Forgery (SSRF) in Azure allows an authorized attacker to perform spoofing over a network.,9.9,CWE-918
CVE-2021-34193,Stack overflow vulnerability in OpenSC smart card middleware before 0.23 via crafted responses to APDUs.,7.5,CWE-787
CVE-2024-25967,Dell PowerScale OneFS versions 8.2.x through 9.7.0.1 contains an execution with unnecessary privileges vulnerability. A local high privileged attacker could potentially exploit this vulnerability leading to escalation of privileges.,6.7,CWE-250
CVE-2021-41809,SSRF vulnerability in M-Files Server products with versions before 22.1.11017.1 in a preview function allowed making queries from the server with certain document types referencing external entities.,3.5,CWE-918
CVE-2021-34081,OS Command Injection vulnerability in bbultman gitsome through 0.2.3 allows attackers to execute arbitrary commands via a crafted tag name of the target git repository.,8.8,CWE-78
CVE-2021-46588,This vulnerability allows remote attackers to execute arbitrary code on affected installations of Bentley MicroStation CONNECT 10.16.0.80. User interaction is required to exploit this vulnerability in that the target must visit a malicious page or open a malicious file. The specific flaw exists within the parsing of JT files. The issue results from the lack of validating the existence of an object prior to performing operations on the object. An attacker can leverage this vulnerability to execute code in the context of the current process. Was ZDI-CAN-15382.,7.8,CWE-416
CVE-2022-42889,Apache Commons Text performs variable interpolation allowing properties to be dynamically evaluated and expanded. The standard format for interpolation is ${prefix:name} where prefix is used to locate an instance of org.apache.commons.text.lookup.StringLookup that performs the interpolation. Starting with version 1.5 and continuing through 1.9 the set of default Lookup instances included interpolators that could result in arbitrary code execution or contact with remote servers. These lookups are: - script - execute expressions using the JVM script execution engine (javax.script) - dns - resolve dns records - url - load values from urls including from remote servers Applications using the interpolation defaults in the affected versions may be vulnerable to remote code execution or unintentional contact with remote servers if untrusted configuration values are used. Users are recommended to upgrade to Apache Commons Text 1.10.0 which disables the problematic interpolators by default.,9.8,CWE-94
CVE-2024-25143,The Document and Media widget In Liferay Portal 7.2.0 through 7.3.6 and older unsupported versions and Liferay DXP 7.3 before service pack 3 7.2 before fix pack 13 and older unsupported versions does not limit resource consumption when generating a preview image which allows remote authenticated users to cause a denial of service (memory consumption) via crafted PNG images.,6.5,CWE-770
CVE-2023-44387,Gradle is a build tool with a focus on build automation and support for multi-language development. When copying or archiving symlinked files Gradle resolves them but applies the permissions of the symlink itself instead of the permissions of the linked file to the resulting file. This leads to files having too much permissions given that symlinks usually are world readable and writeable. While it is unlikely this results in a direct vulnerability for the impacted build it may open up attack vectors depending on where build artifacts end up being copied to or un-archived. In versions 7.6.3 8.4 and above Gradle will now properly use the permissions of the file pointed at by the symlink to set permissions of the copied or archived file.,3.2,CWE-732
CVE-2024-10205,Authentication Bypass vulnerability in Hitachi Ops Center Analyzer on Linux 64 bit (Hitachi Ops Center Analyzer detail view component) Hitachi Infrastructure Analytics Advisor on Linux 64 bit (Hitachi Data Center Analytics   component  ).This issue affects Hitachi Ops Center Analyzer: from 10.0.0-00 before 11.0.3-00; Hitachi Infrastructure Analytics Advisor: from 2.1.0-00 through 4.4.0-00.,9.4,CWE-306
CVE-2022-41082,Microsoft Exchange Server Remote Code Execution Vulnerability,8.0,CWE-502
CVE-2024-25622,h2o is an HTTP server with support for HTTP/1.x HTTP/2 and HTTP/3. The configuration directives provided by the headers handler allows users to modify the response headers being sent by h2o. The configuration file of h2o has scopes and the inner scopes (e.g. path level) are expected to inherit the configuration defined in outer scopes (e.g. global level). However if a header directive is used in the inner scope all the definition in outer scopes are ignored. This can lead to headers not being modified as expected. Depending on the headers being added or removed unexpectedly this behavior could lead to unexpected client behavior. This vulnerability is fixed in commit 123f5e2b65dcdba8f7ef659a00d24bd1249141be.,3.1,CWE-670
CVE-2022-31762,The AMS module has a vulnerability in input validation. Successful exploitation of this vulnerability may cause privilege escalation.,7.8,CWE-20
CVE-2023-28546,Memory Corruption in SPS Application while exporting public key in sorter TA.,7.8,CWE-120
CVE-2024-35112,IBM Control Center 6.2.1 and 6.3.1   could allow a remote attacker to obtain sensitive information when a detailed technical error message is returned in the browser. This information could be used in further attacks against the system.,5.4,CWE-80
CVE-2022-24135,QingScan 1.3.0 is affected by Cross Site Scripting (XSS) vulnerability in all search functions.,6.1,CWE-79
CVE-2024-20784,Adobe Experience Manager versions 6.5.20 and earlier are affected by a stored Cross-Site Scripting (XSS) vulnerability that could be abused by an attacker to inject malicious scripts into vulnerable form fields. Malicious JavaScript may be executed in a victim’s browser when they browse to the page containing the vulnerable field.,5.4,CWE-79
CVE-2022-3713,A code injection vulnerability allows adjacent attackers to execute code in the Wifi controller of Sophos Firewall releases older than version 19.5 GA.,8.8,CWE-94
CVE-2025-29834,Out-of-bounds read in Microsoft Edge (Chromium-based) allows an unauthorized attacker to execute code over a network.,7.5,CWE-125
CVE-2022-35903,An issue was discovered in Bentley MicroStation before 10.17.0.x and Bentley View before 10.17.0.x. Using an affected version of MicroStation or MicroStation-based application to open a 3DS file containing crafted data can force an out-of-bounds read. Exploitation of these vulnerabilities within the parsing of 3DS files could enable an attacker to read information in the context of the current process.,3.3,CWE-125
CVE-2023-28004,   A CWE-129: Improper validation of an array index vulnerability exists where a specially crafted Ethernet request could result in denial of service or remote code execution.           ,9.8,CWE-129
CVE-2024-1975,If a server hosts a zone containing a KEY Resource Record or a resolver DNSSEC-validates a KEY Resource Record from a DNSSEC-signed domain in cache a client can exhaust resolver CPU resources by sending a stream of SIG(0) signed requests. This issue affects BIND 9 versions 9.0.0 through 9.11.37 9.16.0 through 9.16.50 9.18.0 through 9.18.27 9.19.0 through 9.19.24 9.9.3-S1 through 9.11.37-S1 9.16.8-S1 through 9.16.49-S1 and 9.18.11-S1 through 9.18.27-S1.,7.5,CWE-770
CVE-2024-47157,Some Honor products are affected by incorrect privilege assignment vulnerability successful exploitation could cause device service exceptions.,2.9,CWE-863
CVE-2024-30047,Dynamics 365 Customer Insights Spoofing Vulnerability,7.6,CWE-79
