CVE,Description,CVSS3_BaseScore,CWE
CVE-2025-21850,In the Linux kernel the following vulnerability has been resolved:  nvmet: Fix crash when a namespace is disabled  The namespace percpu counter protects pending I/O and we can only safely diable the namespace once the counter drop to zero. Otherwise we end up with a crash when running blktests/nvme/058 (eg for loop transport):  [ 2352.930426] [  T53909] Oops: general protection fault probably for non-canonical address 0xdffffc0000000005: 0000 [#1] PREEMPT SMP KASAN PTI [ 2352.930431] [  T53909] KASAN: null-ptr-deref in range [0x0000000000000028-0x000000000000002f] [ 2352.930434] [  T53909] CPU: 3 UID: 0 PID: 53909 Comm: kworker/u16:5 Tainted: G        W          6.13.0-rc6 #232 [ 2352.930438] [  T53909] Tainted: [W]=WARN [ 2352.930440] [  T53909] Hardware name: QEMU Standard PC (i440FX + PIIX 1996) BIOS 1.16.3-3.fc41 04/01/2014 [ 2352.930443] [  T53909] Workqueue: nvmet-wq nvme_loop_execute_work [nvme_loop] [ 2352.930449] [  T53909] RIP: 0010:blkcg_set_ioprio+0x44/0x180  as the queue is already torn down when calling submit_bio();  So we need to init the percpu counter in nvmet_ns_enable() and wait for it to drop to zero in nvmet_ns_disable() to avoid having I/O pending after the namespace has been disabled.,5.5,CWE-835
CVE-2023-41917,Inadequate input validation exposes the system to potential remote code execution (RCE) risks. Attackers can exploit this vulnerability by appending shell commands to the Speed-Measurement feature enabling unauthorized code execution.,10.0,CWE-20
CVE-2025-66071,Missing Authorization vulnerability in tychesoftwares Custom Order Numbers for WooCommerce custom-order-numbers-for-woocommerce allows Exploiting Incorrectly Configured Access Control Security Levels.This issue affects Custom Order Numbers for WooCommerce: from n/a through <= 1.11.0.,9.8,CWE-862
CVE-2024-32673,Improper Validation of Array Index vulnerability in Samsung Open Source Walrus Webassembly runtime engine allows a segmentation fault issue.  This issue affects Walrus: before 72c7230f32a0b791355bbdfc78669701024b0956.,5.5,CWE-129
CVE-2025-22448,Insecure inherited permissions for some Intel(R) Simics(R) Package Manager software before version 1.12.0 may allow an authenticated user to potentially enable denial of service via local access.,6.1,CWE-277
CVE-2025-8372,A vulnerability was found in code-projects Exam Form Submission 1.0 and classified as critical. Affected by this issue is some unknown functionality of the file /admin/update_s7.php. The manipulation of the argument credits leads to sql injection. The attack may be launched remotely. The exploit has been disclosed to the public and may be used.,7.3,CWE-74
CVE-2023-51717,Dataiku DSS before 11.4.5 and 12.4.1 has Incorrect Access Control that could lead to a full authentication bypass.,9.8,CWE-287
CVE-2022-45546,Information Disclosure in Authentication Component of ScreenCheck BadgeMaker 2.6.2.0 application allows internal attacker to obtain credentials for authentication via network sniffing.,7.5,CWE-319
CVE-2024-1108,The Plugin Groups plugin for WordPress is vulnerable to unauthorized modification of data due to a missing capability check on the admin_init() function in all versions up to and including 2.0.6. This makes it possible for unauthenticated attackers to change the settings of the plugin which can also cause a denial of service due to a misconfiguration.,6.5,CWE-862
CVE-2022-48355,The Bluetooth module has a heap out-of-bounds read vulnerability. Successful exploitation of this vulnerability can cause the Bluetooth process to crash.,6.5,CWE-787
CVE-2018-25140,FLIR thermal traffic cameras contain an unauthenticated device manipulation vulnerability in their WebSocket implementation that allows attackers to bypass authentication and authorization controls. Attackers can directly modify device configurations access system information and potentially initiate denial of service by sending crafted WebSocket messages without authentication.,7.5,CWE-306
CVE-2025-7415,A vulnerability which was classified as critical has been found in Tenda O3V2 1.0.0.12(3880). This issue affects the function fromTraceroutGet of the file /goform/getTraceroute of the component httpd. The manipulation of the argument dest leads to command injection. The attack may be initiated remotely. The exploit has been disclosed to the public and may be used.,6.3,CWE-74
CVE-2024-20880,Stack-based buffer overflow vulnerability in bootloader prior to SMR Jun-2024 Release 1 allows physical attackers to overwrite memory.,6.4,CWE-787
CVE-2025-9887,The Custom Login And Signup Widget plugin for WordPress is vulnerable to Cross-Site Request Forgery in all versions up to and including 1.0. This is due to missing or incorrect nonce validation in the /frndzk_adminclsw.php file. This makes it possible for unauthenticated attackers to change the email and username settings via a forged request granted they can trick a site administrator into performing an action such as clicking on a link.,4.3,CWE-352
CVE-2024-9762,Tungsten Automation Power PDF OXPS File Parsing Out-Of-Bounds Read Information Disclosure Vulnerability. This vulnerability allows remote attackers to disclose sensitive information on affected installations of Tungsten Automation Power PDF. User interaction is required to exploit this vulnerability in that the target must visit a malicious page or open a malicious file.  The specific flaw exists within the parsing of OXPS files. The issue results from the lack of proper validation of user-supplied data which can result in a read past the end of an allocated object. An attacker can leverage this in conjunction with other vulnerabilities to execute arbitrary code in the context of the current process. Was ZDI-CAN-24478.,3.3,CWE-125
CVE-2023-39930,A first-factor authentication bypass vulnerability exists in the PingFederate with PingID Radius PCV when a MSCHAP authentication request is sent via a maliciously crafted RADIUS client request.,7.5,CWE-288
CVE-2025-46461,Improper Neutralization of Input During Web Page Generation ('Cross-site Scripting') vulnerability in Relentless Apps RRSSB allows DOM-Based XSS. This issue affects RRSSB: from n/a through 1.0.1.,6.5,CWE-79
CVE-2023-47761,Missing Authorization vulnerability in WPDeveloper Simple 301 Redirects by BetterLinks allows Exploiting Incorrectly Configured Access Control Security Levels.This issue affects Simple 301 Redirects by BetterLinks: from n/a through 2.0.7.,4.3,CWE-862
CVE-2024-44553,Tenda AX1806 v1.0.0.1 contains a stack overflow via the iptv.stb.mode parameter in the function formGetIptv.,9.8,CWE-787
CVE-2022-38861,The MPlayer Project mplayer SVN-r38374-13.0.1 is vulnerable to memory corruption via function free_mp_image() of libmpcodecs/mp_image.c.,5.5,CWE-787
CVE-2024-28128,Cross-site scripting vulnerability exists in FitNesse releases prior to 20220319 which may allow a remote unauthenticated attacker to execute an arbitrary script on the web browser of the user who is using the product and accessing a link with a specially crafted certain parameter.,6.1,CWE-79
CVE-2025-25147,Cross-Site Request Forgery (CSRF) vulnerability in Phillip.Gooch Auto SEO allows Stored XSS. This issue affects Auto SEO: from n/a through 2.5.6.,7.1,CWE-352
CVE-2024-50480,Unrestricted Upload of File with Dangerous Type vulnerability in azexo Marketing Automation by AZEXO allows Upload a Web Shell to a Web Server.This issue affects Marketing Automation by AZEXO: from n/a through 1.27.80.,9.9,CWE-434
CVE-2022-38697,In messaging service there is a missing permission check. This could lead to access unexpected provider in contacts service with no additional execution privileges needed.,5.5,CWE-862
CVE-2023-38323,An issue was discovered in OpenNDS before 10.1.3. It fails to sanitize the status path script entry in the configuration file allowing attackers that have direct or indirect access to this file to execute arbitrary OS commands.,9.8,CWE-78
CVE-2020-28611,Multiple code execution vulnerabilities exists in the Nef polygon-parsing functionality of CGAL libcgal CGAL-5.1.1. A specially crafted malformed file can lead to an out-of-bounds read and type confusion which could lead to code execution. An attacker can provide malicious input to trigger any of these vulnerabilities. An oob read vulnerability exists in Nef_S2/SM_io_parser.h SM_io_parser<Decorator_>::read_vertex() set_first_out_edge().,8.8,CWE-129
CVE-2025-11182,Improper Limitation of a Pathname to a Restricted Directory ('Path Traversal') Download of Code Without Integrity Check vulnerability in GTONE ChangeFlow allows Path Traversal.This issue affects ChangeFlow: All versions to v9.0.1.1.,6.5,CWE-22
CVE-2024-42316,In the Linux kernel the following vulnerability has been resolved:  mm/mglru: fix div-by-zero in vmpressure_calc_level()  evict_folios() uses a second pass to reclaim folios that have gone through page writeback and become clean before it finishes the first pass since folio_rotate_reclaimable() cannot handle those folios due to the isolation.  The second pass tries to avoid potential double counting by deducting scan_control->nr_scanned.  However this can result in underflow of nr_scanned under a condition where shrink_folio_list() does not increment nr_scanned i.e. when folio_trylock() fails.  The underflow can cause the divisor i.e. scale=scanned+reclaimed in vmpressure_calc_level() to become zero resulting in the following crash:    [exception RIP: vmpressure_work_fn+101]   process_one_work at ffffffffa3313f2b  Since scan_control->nr_scanned has no established semantics the potential double counting has minimal risks.  Therefore fix the problem by not deducting scan_control->nr_scanned in evict_folios().,5.5,CWE-369
CVE-2023-34260,Kyocera TASKalfa 4053ci printers through 2VG_S000.002.561 allow a denial of service (service outage) via /wlmdeu%2f%2e%2e%2f%2e%2e followed by a directory reference such as %2fetc%00index.htm to try to read the /etc directory.,7.5,CWE-22
CVE-2024-13181,Path Traversal in Ivanti Avalanche before version 6.4.7 allows a remote unauthenticated attacker to bypass authentication. This CVE addresses incomplete fixes from CVE-2024-47010.,7.3,CWE-22
CVE-2024-5789,The Triton Lite theme for WordPress is vulnerable to Stored Cross-Site Scripting via the 'url' attribute within the theme's Button shortcode in all versions up to and including 1.3 due to insufficient input sanitization and output escaping. This makes it possible for authenticated attackers with Contributor-level access and above to inject arbitrary web scripts in pages that will execute whenever a user accesses an injected page.,6.4,CWE-79
CVE-2021-36739,The first name and last name fields of the Apache Pluto 3.1.0 MVCBean JSP portlet maven archetype are vulnerable to Cross-Site Scripting (XSS) attacks.,6.1,CWE-79
CVE-2024-38318,IBM Aspera Shares 1.9.0 through 1.10.0 PL6 is vulnerable to HTML injection. A remote attacker could inject malicious HTML code which when viewed would be executed in the victim's Web browser within the security context of the hosting site.,4.8,CWE-80
CVE-2023-2935,Type Confusion in V8 in Google Chrome prior to 114.0.5735.90 allowed a remote attacker to potentially exploit heap corruption via a crafted HTML page. (Chromium security severity: High),8.8,CWE-843
CVE-2023-2355,Local privilege escalation due to a DLL hijacking vulnerability. The following products are affected: Acronis Snap Deploy (Windows) before build 3900.,7.8,CWE-427
CVE-2022-4235,RushBet version 2022.23.1-b490616d allows a remote attacker to steal customer accounts via use of a malicious application. This is possible because the application exposes an activity and does not properly validate the data it receives.,5.4,CWE-79
CVE-2021-35081,Possible buffer overflow due to improper validation of SSID length received from beacon or probe response during an IBSS session in Snapdragon Auto Snapdragon Compute Snapdragon Connectivity Snapdragon Consumer Electronics Connectivity Snapdragon Industrial IOT Snapdragon Mobile Snapdragon Voice & Music,9.8,CWE-120
CVE-2023-53414,In the Linux kernel the following vulnerability has been resolved:  scsi: snic: Fix memory leak with using debugfs_lookup()  When calling debugfs_lookup() the result must have dput() called on it otherwise the memory will leak over time.  To make things simpler just call debugfs_lookup_and_remove() instead which handles all of the logic at once.,5.5,CWE-401
CVE-2024-9826,A maliciously crafted 3DM file when parsed in atf_api.dll through Autodesk AutoCAD can force a Use-After-Free vulnerability. A malicious actor can leverage this vulnerability to cause a crash write sensitive data or execute arbitrary code in the context of the current process.,7.8,CWE-416
CVE-2023-2666,Allocation of Resources Without Limits or Throttling in GitHub repository froxlor/froxlor prior to 2.0.16.,7.5,CWE-770
CVE-2025-9588,Improper Neutralization of Special Elements used in an OS Command ('OS Command Injection') vulnerability in Iron Mountain Archiving Services Inc. EnVision allows Command Injection.This issue affects enVision: before 250563.,10.0,CWE-78
CVE-2024-42565,ERP commit 44bd04 was discovered to contain a SQL injection vulnerability via the id parameter at /index.php/basedata/contact/delete?action=delete.,9.8,CWE-89
CVE-2024-28188,Jupyter Scheduler is collection of extensions for programming jobs to run now or run on a schedule. The list of conda environments of `jupyter-scheduler` users maybe be exposed potentially revealing information about projects that a specific user may be working on. This vulnerability has been patched in version(s) 1.1.6 1.2.1 1.8.2 and 2.5.2.,5.3,CWE-200
CVE-2025-50024,Improper Neutralization of Input During Web Page Generation ('Cross-site Scripting') vulnerability in Truong Thanh ATP Call Now allows Stored XSS. This issue affects ATP Call Now: from n/a through 1.0.3.,5.9,CWE-79
CVE-2025-8443,A vulnerability was found in code-projects Online Medicine Guide 1.0 and classified as critical. Affected by this issue is some unknown functionality of the file /login.php. The manipulation of the argument uname leads to sql injection. The attack may be launched remotely. The exploit has been disclosed to the public and may be used.,7.3,CWE-74
CVE-2022-49510,In the Linux kernel the following vulnerability has been resolved:  drm/omap: fix NULL but dereferenced coccicheck error  Fix the following coccicheck warning: ./drivers/gpu/drm/omapdrm/omap_overlay.c:89:22-25: ERROR: r_ovl is NULL but dereferenced.  Here should be ovl->idx rather than r_ovl->idx.,5.5,CWE-476
CVE-2024-49116,Windows Remote Desktop Services Remote Code Execution Vulnerability,8.1,CWE-416
CVE-2022-43868,IBM Security Verify Access OIDC Provider could disclose directory information that could aid attackers in further attacks against the system.  IBM X-Force ID:  239445.,5.3,CWE-200
CVE-2022-49041,Buffer copy without checking size of input ('Classic Buffer Overflow') vulnerability in backup task management functionality in Synology Drive Client before 3.4.0-15721 allows local users with administrator privileges to crash the client via unspecified vectors.,4.4,CWE-120
CVE-2024-0131,NVIDIA GPU kernel driver for Windows and Linux contains a vulnerability where a potential user-mode attacker could read  a buffer with an incorrect length. A successful exploit of this vulnerability might lead to denial of service.,4.4,CWE-805
CVE-2024-33631,Improper Neutralization of Input During Web Page Generation ('Cross-site Scripting') vulnerability in Piotnet Piotnet Addons For Elementor Pro allows Stored XSS.This issue affects Piotnet Addons For Elementor Pro: from n/a through 7.1.17.  ,6.5,CWE-79
CVE-2024-33997,Additional sanitizing was required when opening the equation editor to prevent a stored XSS risk when editing another user's equation.,6.1,CWE-79
CVE-2023-31411,A remote unprivileged attacker can modify and access configuration settings on the EventCam App due to the absence of API authentication. The lack of authentication in the API allows the attacker to potentially compromise the functionality of the EventCam App. ,9.8,CWE-306
CVE-2025-23278,NVIDIA Display Driver for Windows and Linux contains a vulnerability where an attacker might cause an improper index validation by issuing a call with crafted parameters. A successful exploit of this vulnerability might lead to data tampering  or denial of service.,7.1,CWE-129
CVE-2025-47664,Server-Side Request Forgery (SSRF) vulnerability in ThimPress WP Pipes allows Server Side Request Forgery. This issue affects WP Pipes: from n/a through 1.4.2.,4.4,CWE-918
CVE-2023-27970,An out-of-bounds write issue was addressed with improved bounds checking. This issue is fixed in iOS 16.4 and iPadOS 16.4. An app may be able to execute arbitrary code with kernel privileges.,7.8,CWE-787
CVE-2023-23279,Canteen Management System 1.0 is vulnerable to SQL Injection via /php_action/getOrderReport.php.,9.8,CWE-89
CVE-2024-3439,A vulnerability was found in SourceCodester Prison Management System 1.0. It has been classified as critical. Affected is an unknown function of the file /Account/login.php. The manipulation leads to sql injection. It is possible to launch the attack remotely. The exploit has been disclosed to the public and may be used. The identifier of this vulnerability is VDB-259692.,7.3,CWE-89
CVE-2022-46364,A SSRF vulnerability in parsing the href attribute of XOP:Include in MTOM requests in versions of Apache CXF before 3.5.5 and 3.4.10 allows an attacker to perform SSRF style attacks on webservices that take at least one parameter of any type. ,9.8,CWE-918
CVE-2022-36896,A missing permission check in Jenkins Compuware Source Code Download for Endevor PDS and ISPW Plugin 2.0.12 and earlier allows attackers with Overall/Read permission to enumerate hosts and ports of Compuware configurations and credentials IDs of credentials stored in Jenkins.,6.5,CWE-862
CVE-2025-43571,Substance3D - Stager versions 3.1.1 and earlier are affected by a Use After Free vulnerability that could result in arbitrary code execution in the context of the current user. Exploitation of this issue requires user interaction in that a victim must open a malicious file.,7.8,CWE-416
CVE-2022-31784,A vulnerability in the management interface of MiVoice Business through 9.3 PR1 and MiVoice Business Express through 8.0 SP3 PR3 could allow an unauthenticated attacker (that has network access to the management interface) to conduct a buffer overflow attack due to insufficient validation of URL parameters. A successful exploit could allow arbitrary code execution.,9.8,CWE-120
CVE-2023-32269,An issue was discovered in the Linux kernel before 6.1.11. In net/netrom/af_netrom.c there is a use-after-free because accept is also allowed for a successfully connected AF_NETROM socket. However in order for an attacker to exploit this the system must have netrom routing configured or the attacker must have the CAP_NET_ADMIN capability.,6.7,CWE-416
CVE-2021-34897,This vulnerability allows remote attackers to execute arbitrary code on affected installations of Bentley View 10.15.0.75. User interaction is required to exploit this vulnerability in that the target must visit a malicious page or open a malicious file. The specific flaw exists within the parsing of DGN files. Crafted data in a DGN file can trigger a write past the end of an allocated buffer. An attacker can leverage this vulnerability to execute code in the context of the current process. Was ZDI-CAN-14864.,7.8,CWE-787
CVE-2025-48961,Local privilege escalation due to insecure folder permissions. The following products are affected: Acronis Cyber Protect 16 (Windows) before build 39938.,7.3,CWE-732
CVE-2024-8242,The MStore API – Create Native Android & iOS Apps On The Cloud plugin for WordPress is vulnerable to arbitrary file uploads due to missing file type validation in the update_user_profile() function in all versions up to and including 4.15.3. This makes it possible for authenticated attackers with subscriber-level access and above to upload arbitrary files (not including PHP files) on the affected site's server which may make remote code execution possible. This can be paired with a registration endpoint for unauthenticated users to exploit the issue.,4.3,CWE-434
CVE-2024-4491,A vulnerability classified as critical was found in Tenda i21 1.0.0.14(4656). This vulnerability affects the function formGetDiagnoseInfo. The manipulation of the argument cmdinput leads to stack-based buffer overflow. The attack can be initiated remotely. The exploit has been disclosed to the public and may be used. The identifier of this vulnerability is VDB-263080. NOTE: The vendor was contacted early about this disclosure but did not respond in any way.,8.8,CWE-121
CVE-2024-29390,Daily Expenses Management System version 1.0 developed by PHP Gurukul contains a time-based blind SQL injection vulnerability in the 'add-expense.php' page. An attacker can exploit the 'item' parameter in a POST request to execute arbitrary SQL commands in the backend database. This can be done by injecting specially crafted SQL queries that make the database perform time-consuming operations thereby confirming the presence of the SQL injection vulnerability based on the delay in the server's response.,7.3,CWE-89
CVE-2023-33319,Unauth. Reflected Cross-Site Scripting (XSS) vulnerability in WooCommerce WooCommerce Follow-Up Emails (AutomateWoo) plugin <= 4.9.40 versions.,7.1,CWE-79
CVE-2022-23668,A remote authenticated server-side request forgery (ssrf) vulnerability was discovered in Aruba ClearPass Policy Manager version(s): 6.10.4 and below 6.9.9 and below 6.8.9-HF2 and below 6.7.x and below. Aruba has released updates to ClearPass Policy Manage that address this security vulnerability.,4.9,CWE-918
CVE-2022-22967,An issue was discovered in SaltStack Salt in versions before 3002.9 3003.5 3004.2. PAM auth fails to reject locked accounts which allows a previously authorized user whose account is locked still run Salt commands when their account is locked. This affects both local shell accounts with an active session and salt-api users that authenticate via PAM eauth.,8.8,CWE-863
CVE-2025-53175,Stack overflow risk when vector images are parsed during file preview Impact: Successful exploitation of this vulnerability may affect the file preview function.,4.0,CWE-121
CVE-2023-20607,In ccu there is a possible memory corruption due to a race condition. This could lead to local escalation of privilege with System execution privileges needed. User interaction is not needed for exploitation. Patch ID: ALPS07512839; Issue ID: ALPS07512839.,6.4,CWE-662
CVE-2024-13859,The Buddyboss Platform plugin for WordPress is vulnerable to Stored Cross-Site Scripting via the ‘bp_nouveau_ajax_media_save’ function in all versions up to and including 2.8.50 due to insufficient input sanitization and output escaping. This makes it possible for authenticated attackers with Subscriber-level access and above to inject arbitrary web scripts in pages that will execute whenever a user accesses an injected page. The vulnerability was partially patched in version 2.8.41.,6.4,CWE-79
CVE-2023-36697,Microsoft Message Queuing (MSMQ) Remote Code Execution Vulnerability,6.8,CWE-20
CVE-2023-36831,An Improper Check or Handling of Exceptional Conditions vulnerability in the UTM (Unified Threat Management) Web-Filtering feature of Juniper Networks Junos OS on SRX Series causes a jbuf memory leak to occur when accessing certain websites eventually leading to a Denial of Service (DoS) condition.  Service restoration is only possible by rebooting the system.  The jbuf memory leak only occurs in SSL Proxy and UTM Web-Filtering configurations.  Other products platforms and configurations are not affected by this vulnerability.  This issue affects Juniper Networks Junos OS on SRX Series: 22.2 versions prior to 22.2R3; 22.3 versions prior to 22.3R2-S1 22.3R3; 22.4 versions prior to 22.4R1-S2 22.4R2.  This issue does not affect Juniper Networks Junos OS versions prior to 22.2R2. ,7.5,CWE-703
CVE-2025-9009,A vulnerability has been found in itsourcecode Online Tour and Travel Management System 1.0. Affected is an unknown function of the file /admin/email_setup.php. The manipulation of the argument Name leads to sql injection. It is possible to launch the attack remotely. The exploit has been disclosed to the public and may be used.,7.3,CWE-74
CVE-2025-5803,Missing Authorization vulnerability in e4jvikwp VikBooking Hotel Booking Engine & PMS vikbooking.This issue affects VikBooking Hotel Booking Engine & PMS: from n/a through <= 1.8.2.,8.8,CWE-862
CVE-2022-49661,In the Linux kernel the following vulnerability has been resolved:  can: gs_usb: gs_usb_open/close(): fix memory leak  The gs_usb driver appears to suffer from a malady common to many USB CAN adapter drivers in that it performs usb_alloc_coherent() to allocate a number of USB request blocks (URBs) for RX and then later relies on usb_kill_anchored_urbs() to free them but this doesn't actually free them. As a result this may be leaking DMA memory that's been used by the driver.  This commit is an adaptation of the techniques found in the esd_usb2 driver where a similar design pattern led to a memory leak. It explicitly frees the RX URBs and their DMA memory via a call to usb_free_coherent(). Since the RX URBs were allocated in the gs_can_open() we remove them in gs_can_close() rather than in the disconnect function as was done in esd_usb2.  For more information see the 928150fad41b (can: esd_usb2: fix memory leak).,5.5,CWE-401
