CVE,Description,CVSS3_BaseScore,CWE
CVE-2024-1689,The WooCommerce Tools plugin for WordPress is vulnerable to unauthorized modification of data due to a missing capability check on the woocommerce_tool_toggle_module() function in all versions up to and including 1.2.9. This makes it possible for authenticated attackers with subscriber-level access and above to deactivate arbitrary plugin modules.,5.3,CWE-862
CVE-2023-33310,Improper Limitation of a Pathname to a Restricted Directory ('Path Traversal') vulnerability in Valiano Unite Gallery Lite allows PHP Local File Inclusion.This issue affects Unite Gallery Lite: from n/a through 1.7.59.,6.0,CWE-22
CVE-2022-45875,Improper validation of script alert plugin parameters in Apache DolphinScheduler to avoid remote command execution vulnerability.  This issue affects Apache DolphinScheduler version 3.0.1 and prior versions; version 3.1.0 and prior versions. This attack can be performed only by authenticated users which can login to DS.,9.8,CWE-20
CVE-2025-20766,In display there is a possible memory corruption due to improper input validation. This could lead to local escalation of privilege if a malicious actor has already obtained the System privilege. User interaction is not needed for exploitation. Patch ID: ALPS10196993; Issue ID: MSV-4820.,7.8,CWE-457
CVE-2025-58370,Roo Code is an AI-powered autonomous coding agent that lives in users' editors. Versions below 3.26.0 contain a vulnerability in the command parsing logic where the Bash parameter expansion and indirect reference were not handled correctly. If the agent was configured to auto-approve execution of certain commands an attacker able to influence prompts could abuse this weakness to execute additional arbitrary commands alongside the intended one. This is fixed in version 3.26.0.,8.1,CWE-78
CVE-2022-1412,The Log WP_Mail WordPress plugin through 0.1 saves sent email in a publicly accessible directory using predictable filenames allowing any unauthenticated visitor to obtain potentially sensitive information like generated passwords.,7.5,CWE-732
CVE-2025-53817,7-Zip is a file archiver with a high compression ratio. 7-Zip supports extracting from Compound Documents. Prior to version 25.0.0 a null pointer dereference in the Compound handler may lead to denial of service. Version 25.0.0 contains a fix cor the issue.,7.5,CWE-476
CVE-2023-22647,An Improper Privilege Management vulnerability in SUSE Rancher allowed standard users to leverage their existing permissions to manipulate Kubernetes secrets in the local  cluster resulting in the secret being deleted but their read-level  permissions to the secret being preserved. When this operation was  followed-up by other specially crafted commands it could result in the  user gaining access to tokens belonging to service accounts in the local cluster.   This issue affects Rancher: from >= 2.6.0 before < 2.6.13 from >= 2.7.0 before < 2.7.4.,9.9,CWE-267
CVE-2023-21021,In isTargetSdkLessThanQOrPrivileged of WifiServiceImpl.java there is a possible way for the guest user to change admin user network settings due to a missing permission check. This could lead to local escalation of privilege with no additional execution privileges needed. User interaction is not needed for exploitation.Product: AndroidVersions: Android-13Android ID: A-255537598,7.8,CWE-862
CVE-2023-6344,Tyler Technologies Court Case Management Plus allows a remote unauthenticated attacker to enumerate directories using the tiffserver/te003.aspx or te004.aspx 'ifolder' parameter. This behavior is related to the use of a deprecated version of Aquaforest TIFF Server possibly 2.x. The vulnerable Aquaforest TIFF Server feature was removed on or around 2023-11-01. Insecure configuration issues in Aquaforest TIFF Server are identified separately as CVE-2023-6352. CVE-2023-6343 is related to or partially caused by CVE-2023-6352. ,5.3,CWE-287
CVE-2025-31457,Cross-Site Request Forgery (CSRF) vulnerability in Aurélien LWS LWS SMS allows Cross Site Request Forgery. This issue affects LWS SMS: from n/a through 2.4.1.,5.4,CWE-352
CVE-2025-34239,Advantech WebAccess/VPN versions prior to 1.1.5 contain a command injection vulnerability in AppManagementController.appUpgradeAction() that allows an authenticated system administrator to execute arbitrary commands as the web server user (www-data) by supplying a crafted uploaded filename.,7.2,CWE-78
CVE-2025-68073,Missing Authorization vulnerability in Ninja Team GDPR CCPA Compliance Support ninja-gdpr-compliance allows Exploiting Incorrectly Configured Access Control Security Levels.This issue affects GDPR CCPA Compliance Support: from n/a through <= 2.7.4.,6.5,CWE-862
CVE-2025-49070,Improper Control of Filename for Include/Require Statement in PHP Program ('PHP Remote File Inclusion') vulnerability in NasaTheme Elessi allows PHP Local File Inclusion. This issue affects Elessi: from n/a through n/a.,7.5,CWE-98
CVE-2022-22819,NXP LPC55S66JBD64 LPC55S66JBD100 LPC55S66JEV98 LPC55S69JBD64 LPC55S69JBD100 and LPC55S69JEV98 microcontrollers (ROM version 1B) have a buffer overflow in parsing SB2 updates before the signature is verified. This can allow an attacker to achieve non-persistent code execution via a crafted unsigned update.,7.8,CWE-120
CVE-2025-6612,A vulnerability was found in code-projects Inventory Management System 1.0. It has been rated as critical. This issue affects some unknown processing of the file /php_action/removeCategories.php. The manipulation of the argument categoriesId leads to sql injection. The attack may be initiated remotely. The exploit has been disclosed to the public and may be used.,7.3,CWE-74
CVE-2024-4721,A vulnerability classified as problematic has been found in Campcodes Complete Web-Based School Management System 1.0. This affects an unknown part of the file /model/add_student_subject.php. The manipulation of the argument index leads to cross site scripting. It is possible to initiate the attack remotely. The exploit has been disclosed to the public and may be used. The associated identifier of this vulnerability is VDB-263799.,3.5,CWE-79
CVE-2024-26579,Deserialization of Untrusted Data vulnerability in Apache InLong.This issue affects Apache InLong: from 1.7.0 through 1.11.0    the attackers can bypass using malicious parameters.  Users are advised to upgrade to Apache InLong's 1.12.0 or cherry-pick [1] [2] to solve it.  [1]  https://github.com/apache/inlong/pull/9694   [2]  https://github.com/apache/inlong/pull/9707,9.8,CWE-502
CVE-2023-38679,A vulnerability has been identified in Tecnomatix Plant Simulation V2201 (All versions < V2201.0008) Tecnomatix Plant Simulation V2302 (All versions < V2302.0002). The affected application contains an out of bounds write past the end of an allocated buffer while parsing a specially crafted SPP file. This could allow an attacker to execute code in the context of the current process. (ZDI-CAN-21106),7.8,CWE-787
CVE-2022-4903,A vulnerability was found in CodenameOne 7.0.70. It has been classified as problematic. Affected is an unknown function. The manipulation leads to use of implicit intent for sensitive communication. It is possible to launch the attack remotely. The complexity of an attack is rather high. The exploitability is told to be difficult. Upgrading to version 7.0.71 is able to address this issue. The patch is identified as dad49c9ef26a598619fc48d2697151a02987d478. It is recommended to upgrade the affected component. VDB-220470 is the identifier assigned to this vulnerability.,5.0,CWE-927
CVE-2025-22800,Missing Authorization vulnerability in Post SMTP Post SMTP allows Exploiting Incorrectly Configured Access Control Security Levels.This issue affects Post SMTP: from n/a through 2.9.11.,4.3,CWE-862
CVE-2023-1241,Cross-site Scripting (XSS) - Stored in GitHub repository answerdev/answer prior to 1.0.6.,5.4,CWE-79
CVE-2025-65290,Aqara Hub devices including Camera Hub G3 4.1.9_0027 Hub M2 4.3.6_0027 and Hub M3 4.3.6_0025 fail to validate server certificates during HTTPS firmware downloads allowing man-in-the-middle attackers to intercept firmware update traffic and potentially serve modified firmware files.,7.4,CWE-295
CVE-2025-31915,Cross-Site Request Forgery (CSRF) vulnerability in kamleshyadav Pixel WordPress Form BuilderPlugin & Autoresponder allows Cross Site Request Forgery. This issue affects Pixel WordPress Form BuilderPlugin & Autoresponder: from n/a through 1.0.2.,5.4,CWE-352
CVE-2024-49266,Improper Neutralization of Input During Web Page Generation (XSS or 'Cross-site Scripting') vulnerability in Thimo Grauerholz WP-Spreadplugin allows Stored XSS.This issue affects WP-Spreadplugin: from n/a through 4.8.9.,5.9,CWE-79
CVE-2023-53125,In the Linux kernel the following vulnerability has been resolved:  net: usb: smsc75xx: Limit packet length to skb->len  Packet length retrieved from skb data may be larger than the actual socket buffer length (up to 9026 bytes). In such case the cloned skb passed up the network stack will leak kernel memory contents.,5.5,CWE-401
CVE-2025-3870,The 1 Decembrie 1918 plugin for WordPress is vulnerable to Cross-Site Request Forgery in all versions up to and including 1.dec.2012. This is due to missing or incorrect nonce validation on the 1-decembrie-1918/1-decembrie-1918.php page. This makes it possible for unauthenticated attackers to update settings and inject malicious web scripts via a forged request granted they can trick a site administrator into performing an action such as clicking on a link.,6.1,CWE-79
CVE-2023-2052,A vulnerability classified as critical was found in Campcodes Advanced Online Voting System 1.0. Affected by this vulnerability is an unknown functionality of the file /admin/ballot_down.php. The manipulation of the argument id leads to sql injection. The attack can be launched remotely. The exploit has been disclosed to the public and may be used. The identifier VDB-225937 was assigned to this vulnerability.,6.3,CWE-89
CVE-2023-5612,An issue has been discovered in GitLab affecting all versions before 16.6.6 16.7 prior to 16.7.4 and 16.8 prior to 16.8.1. It was possible to read the user email address via tags feed although the visibility in the user profile has been disabled.,5.3,CWE-862
CVE-2025-59226,Use after free in Microsoft Office Visio allows an unauthorized attacker to execute code locally.,7.8,CWE-416
CVE-2024-11592,A vulnerability has been found in 1000 Projects Beauty Parlour Management System 1.0 and classified as critical. This vulnerability affects unknown code of the file /admin/about-us.php. The manipulation of the argument pagetitle leads to sql injection. The attack can be initiated remotely. The exploit has been disclosed to the public and may be used.,7.3,CWE-74
CVE-2024-43589,Windows Routing and Remote Access Service (RRAS) Remote Code Execution Vulnerability,8.8,CWE-122
CVE-2025-43984,An issue was discovered on KuWFi GC111 devices (Hardware Version: CPE-LM321_V3.2 Software Version: GC111-GL-LM321_V3.0_20191211). They are vulnerable to unauthenticated /goform/goform_set_cmd_process requests. A crafted POST request using the SSID parameter allows remote attackers to execute arbitrary OS commands with root privileges.,9.8,CWE-78
CVE-2024-27457,Improper check for unusual or exceptional conditions in Intel(R) TDX Module firmware before version 1.5.06 may allow a privileged user to potentially enable information disclosure via local access.,2.5,CWE-754
CVE-2024-2989,A vulnerability which was classified as critical has been found in Tenda FH1203 2.0.1.6. Affected by this issue is the function fromNatStaticSetting of the file /goform/NatStaticSetting. The manipulation of the argument page leads to stack-based buffer overflow. The attack may be launched remotely. The exploit has been disclosed to the public and may be used. VDB-258158 is the identifier assigned to this vulnerability. NOTE: The vendor was contacted early about this disclosure but did not respond in any way.,8.8,CWE-121
CVE-2023-40550,An out-of-bounds read flaw was found in Shim when it tried to validate the SBAT information. This issue may expose sensitive data during the system's boot phase.,5.5,CWE-125
CVE-2023-5139,Potential buffer overflow vulnerability at the following location in the Zephyr STM32 Crypto driver,4.4,CWE-120
CVE-2020-36562,Due to unchecked type assertions maliciously crafted messages can cause panics which may be used as a denial of service vector.,7.5,CWE-617
CVE-2025-4779,lunary-ai/lunary versions prior to 1.9.24 are vulnerable to stored cross-site scripting (XSS). An unauthenticated attacker can inject malicious JavaScript into the `v1/runs/ingest` endpoint by adding an empty `citations` field triggering a code path where `dangerouslySetInnerHTML` is used to render attacker-controlled text. This vulnerability allows the execution of arbitrary JavaScript in the context of the user's browser potentially leading to session hijacking data theft or other malicious actions.,6.1,CWE-79
CVE-2023-50127,Hozard alarm system (Alarmsysteem) v1.0 is vulnerable to Improper Authentication. Commands sent via the SMS functionality are accepted from random phone numbers which allows an attacker to bring the alarm system to a disarmed state from any given phone number.,5.9,CWE-287
CVE-2024-11274,An issue was discovered in GitLab CE/EE affecting all versions starting from 16.1 prior to 17.4.6 starting from 17.5 prior to 17.5.4 and starting from 17.6 prior to 17.6.2 injection of NEL headers in k8s proxy response could lead to session data exfiltration.,8.7,CWE-601
CVE-2023-47558,Improper Neutralization of Special Elements used in an SQL Command ('SQL Injection') vulnerability in Mahlamusa Who Hit The Page – Hit Counter allows SQL Injection.This issue affects Who Hit The Page – Hit Counter: from n/a through 1.4.14.3.  ,7.6,CWE-89
CVE-2025-23763,Missing Authorization vulnerability in Alex Volkov WAH Forms allows Exploiting Incorrectly Configured Access Control Security Levels. This issue affects WAH Forms: from n/a through 1.0.,6.5,CWE-862
CVE-2022-43549,Improper authentication in Veeam Backup for Google Cloud v1.0 and v3.0 allows attackers to bypass authentication mechanisms.,9.8,CWE-287
CVE-2023-32423,A buffer overflow issue was addressed with improved memory handling. This issue is fixed in watchOS 9.5 tvOS 16.5 macOS Ventura 13.4 Safari 16.5 iOS 16.5 and iPadOS 16.5. Processing web content may disclose sensitive information.,6.5,CWE-120
CVE-2024-47046,A vulnerability has been identified in Simcenter Femap V2306 (All versions) Simcenter Femap V2401 (All versions) Simcenter Femap V2406 (All versions). The affected application is vulnerable to memory corruption while parsing specially crafted BDF files. This could allow an attacker to execute code in the context of the current process.,7.8,CWE-119
CVE-2024-6311,The Funnelforms Free plugin for WordPress is vulnerable to arbitrary file uploads due to missing file type validation in the 'af2_add_font' function in all versions up to and including 3.7.3.2. This makes it possible for authenticated attackers with administrator-level and above permissions to upload arbitrary files on the affected site's server which may make remote code execution possible.,7.2,CWE-434
CVE-2024-52474,Improper Neutralization of Special Elements used in an SQL Command ('SQL Injection') vulnerability in LLC «TriIncom» Express Payments Module allows Blind SQL Injection.This issue affects Express Payments Module: from n/a through 1.1.8.,9.3,CWE-89
CVE-2023-40898,Tenda AC8 v4 US_AC8V4.0si_V16.03.34.06_cn was discovered to contain a stack overflow via parameter timeZone at /goform/SetSysTimeCfg.,9.8,CWE-787
CVE-2023-4749,A vulnerability which was classified as critical was found in SourceCodester Inventory Management System 1.0. Affected is an unknown function of the file index.php. The manipulation of the argument page leads to file inclusion. It is possible to launch the attack remotely. The exploit has been disclosed to the public and may be used. VDB-238638 is the identifier assigned to this vulnerability.,6.3,CWE-73
CVE-2025-47547,Improper Neutralization of Input During Web Page Generation ('Cross-site Scripting') vulnerability in SendPulse SendPulse Email Marketing Newsletter allows Stored XSS. This issue affects SendPulse Email Marketing Newsletter: from n/a through 2.1.6.,6.5,CWE-79
CVE-2022-22095,Memory corruption in synx driver due to use-after-free condition in the synx driver due to accessing object handles without acquiring lock in Snapdragon Compute Snapdragon Connectivity Snapdragon Industrial IOT Snapdragon Mobile,8.4,CWE-416
CVE-2025-62994,Insertion of Sensitive Information Into Sent Data vulnerability in WP Messiah WP AI CoPilot ai-co-pilot-for-wp allows Retrieve Embedded Sensitive Data.This issue affects WP AI CoPilot: from n/a through <= 1.2.7.,4.3,CWE-201
CVE-2024-28402,TOTOLINK X2000R before V1.0.0-B20231213.1013 contains a Stored Cross-site scripting (XSS) vulnerability in IP/Port Filtering under the Firewall Page.,5.9,CWE-79
CVE-2025-3069,Inappropriate implementation in Extensions in Google Chrome prior to 135.0.7049.52 allowed a remote attacker to perform privilege escalation via a crafted HTML page. (Chromium security severity: Medium),8.8,CWE-358
CVE-2023-3187,A vulnerability which was classified as critical has been found in PHPGurukul Teachers Record Management System 1.0. Affected by this issue is some unknown functionality of the file /changeimage.php of the component Profile Picture Handler. The manipulation of the argument newpic leads to unrestricted upload. The attack may be launched remotely. The exploit has been disclosed to the public and may be used. The identifier of this vulnerability is VDB-231176.,6.3,CWE-434
CVE-2023-47699,IBM Sterling Secure Proxy 6.0.3 and 6.1.0 is vulnerable to cross-site scripting. This vulnerability allows users to embed arbitrary JavaScript code in the Web UI thus altering the intended functionality potentially leading to credentials disclosure within a trusted session.  IBM X-Force ID:  270974.,6.1,CWE-79
CVE-2024-4308,SQL injection vulnerability in HubBank affecting version 1.0.2. This vulnerability could allow an attacker to send a specially crafted SQL query to the database through different endpoints (/admin/view_users.php?id=1/admin/viewloan-trans.php?id=1/admin/view-deposit.php?id=1/admin/view-domtrans.php?id=1 /admin/delete_cards.php?id=1/admin/view_cards.php?id=1 and  /admin/view_users.php?id=1 id parameter) and retrieve the information stored in the database.,8.1,CWE-89
CVE-2022-41587,Uncaptured exceptions in the home screen module. Successful exploitation of this vulnerability may affect stability.,5.3,CWE-754
CVE-2024-33634,Server-Side Request Forgery (SSRF) vulnerability in Piotnet Piotnet Addons For Elementor Pro.This issue affects Piotnet Addons For Elementor Pro: from n/a through 7.1.17.  ,5.4,CWE-918
CVE-2025-29661,Litepubl CMS <= 7.0.9 is vulnerable to RCE in admin/service/run.,7.2,CWE-94
CVE-2025-32434,PyTorch is a Python package that provides tensor computation with strong GPU acceleration and deep neural networks built on a tape-based autograd system. In version 2.5.1 and prior a Remote Command Execution (RCE) vulnerability exists in PyTorch when loading a model using torch.load with weights_only=True. This issue has been patched in version 2.6.0.,9.8,CWE-502
CVE-2023-32660,Uncontrolled search path in some Intel(R) NUC Kit NUC6i7KYK Thunderbolt(TM) 3 Firmware Update Tool installation software before version 46 may allow an authenticated user to potentially enable escalation of privilege via local access.,6.7,CWE-427
CVE-2025-45764,jsrsasign v11.1.0 was discovered to contain weak encryption. NOTE: this issue has been disputed by a third party who believes that CVE IDs can be assigned for key lengths in specific applications that use a library and should not be assigned to the default key lengths in a library. This dispute is subject to review under CNA rules 4.1.4 4.1.14 and other rules; the dispute tagging is not meant to recommend an outcome for this CVE Record.,3.2,CWE-326
CVE-2023-37173,TOTOLINK A3300R V17.0.0cu.557_B20221024 was discovered to contain a command injection vulnerability via the command parameter in the setTracerouteCfg function.,9.8,CWE-78
CVE-2023-46045,Graphviz 2.36.0 through 9.x before 10.0.1 has an out-of-bounds read via a crafted config6a file. NOTE: exploitability may be uncommon because this file is typically owned by root.,7.8,CWE-125
CVE-2023-29085,An issue was discovered in Samsung Exynos Mobile Processor Automotive Processor and Modem for Exynos Modem 5123 Exynos Modem 5300 Exynos 980 Exynos 1080 Exynos 9110 and Exynos Auto T5123. Memory corruption can occur due to insufficient parameter validation while decoding an SIP status line.,6.8,CWE-787
CVE-2020-36516,An issue was discovered in the Linux kernel through 5.16.11. The mixed IPID assignment method with the hash-based IPID assignment policy allows an off-path attacker to inject data into a victim's TCP session or terminate that session.,5.9,CWE-327
CVE-2023-40617,A reflected cross-site scripting (XSS) vulnerability in OpenKnowledgeMaps Head Start 7 allows remote attackers to execute arbitrary JavaScript in the web browser of a user by including a malicious payload into the 'file' parameter in 'displayPDF.php'.,6.1,CWE-79
CVE-2022-44718,An issue was discovered in NetScout nGeniusONE 6.3.2 build 904. Open Redirection can occur (issue 2 of 2). After successful login an attacker must visit the vulnerable parameter and inject a crafted payload to successfully redirect to an unknown host. The attack vector is Network and the Attack Complexity required is High. Privileges required are administrator User Interaction is required and Scope is unchanged. The user must visit the vulnerable parameter and inject a crafted payload to successfully redirect to an unknown host.,3.5,CWE-601
CVE-2021-42522,There is a Information Disclosure vulnerability in anjuta/plugins/document-manager/anjuta-bookmarks.c. This issue was caused by the incorrect use of libxml2 API. The vendor forgot to call 'g_free()' to release the return value of 'xmlGetProp()'.,7.5,CWE-200
CVE-2023-36490,Improper initialization in some Intel(R) MAS software before version 2.3 may allow an authenticated user to potentially enable denial of service via local access.,5.0,CWE-665
CVE-2020-36617,A vulnerability was found in ewxrjk sftpserver. It has been declared as problematic. Affected by this vulnerability is the function sftp_parse_path of the file parse.c. The manipulation leads to uninitialized pointer. The real existence of this vulnerability is still doubted at the moment. The name of the patch is bf4032f34832ee11d79aa60a226cc018e7ec5eed. It is recommended to apply a patch to fix this issue. The identifier VDB-216205 was assigned to this vulnerability. NOTE: In some deployment models this would be a vulnerability. README specifically warns about avoiding such deployment models.,4.6,CWE-908
CVE-2024-28672,DedeCMS v5.7 was discovered to contain a Cross-Site Request Forgery (CSRF) vulnerability via /dede/media_edit.php.,5.4,CWE-352
CVE-2024-5443,CVE-2024-4320 describes a vulnerability in the parisneo/lollms software specifically within the `ExtensionBuilder().build_extension()` function. The vulnerability arises from the `/mount_extension` endpoint where a path traversal issue allows attackers to navigate beyond the intended directory structure. This is facilitated by the `data.category` and `data.folder` parameters accepting empty strings (``) which due to inadequate input sanitization can lead to the construction of a `package_path` that points to the root directory. Consequently if an attacker can create a `config.yaml` file in a controllable path this path can be appended to the `extensions` list and trigger the execution of `__init__.py` in the current directory leading to remote code execution. The vulnerability affects versions up to 5.9.0 and has been addressed in version 9.8.,9.8,CWE-29
CVE-2024-30479,Authentication Bypass by Spoofing vulnerability in LionScripts IP Blocker Lite allows Functionality Bypass.This issue affects IP Blocker Lite: from n/a through 11.1.1.,5.3,CWE-290
CVE-2024-9793,A vulnerability classified as critical was found in Tenda AC1206 up to 15.03.06.23. This vulnerability affects the function ate_iwpriv_set/ate_ifconfig_set of the file /goform/ate. The manipulation leads to command injection. The attack can be initiated remotely. The exploit has been disclosed to the public and may be used. The vendor was contacted early about this disclosure but did not respond in any way.,6.3,CWE-77
CVE-2024-25016,IBM MQ and IBM MQ Appliance 9.0 9.1 9.2 9.3 LTS and 9.3 CD could allow a remote unauthenticated attacker to cause a denial of service due to incorrect buffering logic.  IBM X-Force ID:  281279.,7.5,CWE-20
CVE-2025-43239,An out-of-bounds access issue was addressed with improved bounds checking. This issue is fixed in macOS Sequoia 15.6 macOS Sonoma 14.7.7 macOS Ventura 13.7.7. Processing a maliciously crafted file may lead to unexpected app termination.,7.1,CWE-125
CVE-2025-64264,Improper Neutralization of Input During Web Page Generation ('Cross-site Scripting') vulnerability in Aman Popup addon for Ninja Forms popup-addon-for-ninja-forms allows Stored XSS.This issue affects Popup addon for Ninja Forms: from n/a through <= 3.5.1.,5.9,CWE-79
CVE-2024-10396,An authenticated user can provide a malformed ACL to the fileserver's StoreACL RPC causing the fileserver to crash possibly expose uninitialized memory and possibly store garbage data in the audit log. Malformed ACLs provided in responses to client FetchACL RPCs can cause client processes to crash and possibly expose uninitialized memory into other ACLs stored on the server.,6.5,CWE-772
