CVE,Description,CVSS3_BaseScore,CWE
CVE-2022-20732,A vulnerability in the configuration file protections of Cisco Virtualized Infrastructure Manager (VIM) could allow an authenticated local attacker to access confidential information and elevate privileges on an affected device. This vulnerability is due to improper access permissions for certain configuration files. An attacker with low-privileged credentials could exploit this vulnerability by accessing an affected device and reading the affected configuration files. A successful exploit could allow the attacker to obtain internal database credentials which the attacker could use to view and modify the contents of the database. The attacker could use this access to the database to elevate privileges on the affected device.,7.8,CWE-284
CVE-2023-30695,Out-of-bounds Write vulnerability in SSHDCPAPP TA prior to &quot;SAMSUNG ELECTONICS CO LTD. - System Hardware Update - 7/13/2023&quot; in Windows Update for Galaxy book Go Galaxy book Go 5G Galaxy book2 Go and Galaxy book2 Pro 360 allows local attacker to execute arbitrary code.,6.7,CWE-787
CVE-2024-52441,Improperly Controlled Modification of Object Prototype Attributes ('Prototype Pollution') vulnerability in Rajesh Thanoch Quick Learn allows Object Injection.This issue affects Quick Learn: from n/a through 1.0.1.,9.8,CWE-1321
CVE-2025-30927,Missing Authorization vulnerability in Wordapp Team Wordapp allows Exploiting Incorrectly Configured Access Control Security Levels. This issue affects Wordapp: from n/a through 1.7.0.,4.3,CWE-862
CVE-2024-38155,Security Center Broker Information Disclosure Vulnerability,5.5,CWE-125
CVE-2021-46640,This vulnerability allows remote attackers to execute arbitrary code on affected installations of Bentley View 10.15.0.75. User interaction is required to exploit this vulnerability in that the target must visit a malicious page or open a malicious file. The specific flaw exists within the parsing of DGN files. Crafted data in a DGN file can trigger a write past the end of an allocated buffer. An attacker can leverage this vulnerability to execute code in the context of the current process. Was ZDI-CAN-15512.,7.8,CWE-787
CVE-2024-53910,An issue was discovered in the server in Veritas Enterprise Vault before 15.2 ZDI-CAN-24336. It allows remote attackers to execute arbitrary code because untrusted data received on a .NET Remoting TCP port is deserialized.,9.8,CWE-502
CVE-2021-39967,There is a Vulnerability of obtaining broadcast information improperly due to improper broadcast permission settings in Smartphones.Successful exploitation of this vulnerability may affect service confidentiality.,7.5,CWE-276
CVE-2021-33139,Improper conditions check in firmware for some Intel(R) Wireless Bluetooth(R) and Killer(TM) Bluetooth(R) products before version 22.100 may allow an authenticated user to potentially enable denial of service via adjacent access.,5.7,CWE-754
CVE-2023-47526,Improper Neutralization of Input During Web Page Generation ('Cross-site Scripting') vulnerability in Chart Builder Team Chartify – WordPress Chart Plugin allows Stored XSS.This issue affects Chartify – WordPress Chart Plugin: from n/a through 2.0.6.  ,5.9,CWE-79
CVE-2024-37883,Nextcloud Deck is a kanban style organization tool aimed at personal planning and project organization for teams integrated with Nextcloud. A user with access to a deck board was able to access comments and attachments of already deleted cards. It is recommended that the Nextcloud Deck app is upgraded to 1.6.6 or 1.7.5 or 1.8.7 or 1.9.6 or 1.11.3 or 1.12.1.,4.3,CWE-284
CVE-2022-31355,Online Ordering System v2.3.2 was discovered to contain a SQL injection vulnerability via /ordering/index.php?q=category&search=.,9.8,CWE-89
CVE-2025-5932,The Homerunner plugin for WordPress is vulnerable to Cross-Site Request Forgery in all versions up to and including 1.0.29. This is due to missing or incorrect nonce validation on the main_settings() function. This makes it possible for unauthenticated attackers to update plugin settings via a forged request granted they can trick a site administrator into performing an action such as clicking on a link.,4.3,CWE-352
CVE-2022-4118,The Bitcoin / AltCoin Payment Gateway for WooCommerce & Multivendor store / shop WordPress plugin through 1.7.1 does not properly sanitise and escape a parameter before using it in a SQL statement leading to a SQL injection exploitable by authenticated users,9.8,CWE-89
CVE-2024-46434,Tenda W18E V16.01.0.8(1625) suffers from authentication bypass in the web management portal allowing an unauthorized remote attacker to gain administrative access by sending a specially crafted HTTP request.,8.8,CWE-287
CVE-2025-47548,Server-Side Request Forgery (SSRF) vulnerability in Varun Dubey Wbcom Designs - Activity Link Preview For BuddyPress allows Server Side Request Forgery. This issue affects Wbcom Designs - Activity Link Preview For BuddyPress: from n/a through 1.4.4.,5.4,CWE-918
CVE-2023-1130,A vulnerability which was classified as critical was found in SourceCodester Computer Parts Sales and Inventory System 1.0. This affects an unknown part of the file processlogin. The manipulation of the argument user leads to sql injection. It is possible to initiate the attack remotely. The exploit has been disclosed to the public and may be used. The identifier VDB-222105 was assigned to this vulnerability.,6.3,CWE-89
CVE-2025-23512,Missing Authorization vulnerability in Team118GROUP Team 118GROUP Agent allows Exploiting Incorrectly Configured Access Control Security Levels. This issue affects Team 118GROUP Agent: from n/a through 1.6.0.,7.5,CWE-862
CVE-2024-10419,A vulnerability was found in code-projects Blood Bank Management System 1.0. It has been rated as problematic. Affected by this issue is some unknown functionality of the file /bloodrequest.php. The manipulation of the argument msg leads to cross site scripting. The attack may be launched remotely. The exploit has been disclosed to the public and may be used.,3.5,CWE-79
CVE-2022-39347,FreeRDP is a free remote desktop protocol library and clients. Affected versions of FreeRDP are missing path canonicalization and base path check for `drive` channel. A malicious server can trick a FreeRDP based client to read files outside the shared directory. This issue has been addressed in version 2.9.0 and all users are advised to upgrade. Users unable to upgrade should not use the `/drive` `/drives` or `+home-drive` redirection switch.,2.6,CWE-22
CVE-2024-22271,In Spring Cloud Function framework versions 4.1.x prior to 4.1.2 4.0.x prior to 4.0.8 an application is vulnerable to a DOS attack when attempting to compose functions with non-existing functions.  Specifically an application is vulnerable when all of the following are true:  User is using Spring Cloud Function Web module  Affected Spring Products and Versions Spring Cloud Function Framework 4.1.0 to 4.1.2 4.0.0 to 4.0.8  References  https://spring.io/security/cve-2022-22979   https://checkmarx.com/blog/spring-function-cloud-dos-cve-2022-22979-and-unintended-function-invocation/  History 2020-01-16: Initial vulnerability report published.,8.2,CWE-20
CVE-2021-0874,In PVRSRVBridgeDevicememHistorySparseChange of the PowerVR kernel driver a missing size check means there is a possible integer overflow that could allow out-of-bounds heap access. This could lead to local escalation of privilege with no additional execution privileges needed. User interaction is not needed for exploitation.Product: AndroidVersions: Android SoCAndroid ID: A-270399633,7.8,CWE-190
CVE-2022-46884,A potential use-after-free vulnerability existed in SVG Images if the Refresh Driver was destroyed at an inopportune time.  This could have lead to memory corruption or a potentially exploitable crash. *Note*: This advisory was added on December 13th 2022 after discovering it was inadvertently left out of the original advisory. The fix was included in the original release of Firefox 106. This vulnerability affects Firefox < 106.,8.8,CWE-416
CVE-2017-20045,A vulnerability was found in Navetti PricePoint 4.6.0.0. It has been declared as critical. This vulnerability affects unknown code. The manipulation leads to cross-site request forgery. The attack can be initiated remotely. The exploit has been disclosed to the public and may be used. Upgrading to version 4.7.0.0 is able to address this issue. It is recommended to upgrade the affected component.,7.3,CWE-352
CVE-2022-49303,In the Linux kernel the following vulnerability has been resolved:  drivers: staging: rtl8192eu: Fix deadlock in rtw_joinbss_event_prehandle  There is a deadlock in rtw_joinbss_event_prehandle() which is shown below:     (Thread 1)                |      (Thread 2)                              | _set_timer() rtw_joinbss_event_prehandle()|  mod_timer()  spin_lock_bh() //(1)        |  (wait a time)  ...                         | rtw_join_timeout_handler()                              |  _rtw_join_timeout_handler()  del_timer_sync()            |   spin_lock_bh() //(2)  (wait timer to stop)        |   ...  We hold pmlmepriv->lock in position (1) of thread 1 and use del_timer_sync() to wait timer to stop but timer handler also need pmlmepriv->lock in position (2) of thread 2. As a result rtw_joinbss_event_prehandle() will block forever.  This patch extracts del_timer_sync() from the protection of spin_lock_bh() which could let timer handler to obtain the needed lock. What`s more we change spin_lock_bh() to spin_lock_irq() in _rtw_join_timeout_handler() in order to prevent deadlock.,5.5,CWE-667
CVE-2025-3066,Use after free in Site Isolation in Google Chrome prior to 135.0.7049.84 allowed a remote attacker to potentially exploit heap corruption via a crafted HTML page. (Chromium security severity: High),8.8,CWE-416
CVE-2022-45897,On Xerox WorkCentre 3550 25.003.03.000 devices an authenticated attacker can view the SMB server settings and can obtain the stored cleartext credentials associated with those settings.,6.5,CWE-312
CVE-2024-46798,In the Linux kernel the following vulnerability has been resolved:  ASoC: dapm: Fix UAF for snd_soc_pcm_runtime object  When using kernel with the following extra config    - CONFIG_KASAN=y   - CONFIG_KASAN_GENERIC=y   - CONFIG_KASAN_INLINE=y   - CONFIG_KASAN_VMALLOC=y   - CONFIG_FRAME_WARN=4096  kernel detects that snd_pcm_suspend_all() access a freed 'snd_soc_pcm_runtime' object when the system is suspended which leads to a use-after-free bug:  [   52.047746] BUG: KASAN: use-after-free in snd_pcm_suspend_all+0x1a8/0x270 [   52.047765] Read of size 1 at addr ffff0000b9434d50 by task systemd-sleep/2330  [   52.047785] Call trace: [   52.047787]  dump_backtrace+0x0/0x3c0 [   52.047794]  show_stack+0x34/0x50 [   52.047797]  dump_stack_lvl+0x68/0x8c [   52.047802]  print_address_description.constprop.0+0x74/0x2c0 [   52.047809]  kasan_report+0x210/0x230 [   52.047815]  __asan_report_load1_noabort+0x3c/0x50 [   52.047820]  snd_pcm_suspend_all+0x1a8/0x270 [   52.047824]  snd_soc_suspend+0x19c/0x4e0  The snd_pcm_sync_stop() has a NULL check on 'substream->runtime' before making any access. So we need to always set 'substream->runtime' to NULL everytime we kfree() it.,7.8,CWE-416
CVE-2022-46814,Cross-Site Request Forgery (CSRF) vulnerability in Pierre Lebedel Kodex Posts likes plugin <= 2.4.3 versions.,4.3,CWE-352
CVE-2022-45858,A use of a weak cryptographic algorithm vulnerability [CWE-327] in FortiNAC 9.4.1 and below 9.2.6 and below 9.1.0 all versions 8.8.0 all versions 8.7.0 all versions may increase the chances of an attacker to have access to sensitive information or to perform man-in-the-middle attacks.,4.2,CWE-327
CVE-2024-48510,Directory Traversal vulnerability in DotNetZip v.1.16.0 and before allows a remote attacker to execute arbitrary code via the src/Zip.Shared/ZipEntry.Extract.cs component NOTE: This vulnerability only affects products that are no longer supported by the maintainer.,9.8,CWE-22
CVE-2022-34253,Adobe Commerce versions 2.4.3-p2 (and earlier) 2.3.7-p3 (and earlier) and 2.4.4 (and earlier) are affected by an XML Injection vulnerability in the Widgets Module. An attacker with admin privileges can trigger a specially crafted script to achieve remote code execution. Exploitation of this issue does not require user interaction.,7.2,CWE-91
CVE-2023-22582,The Danfoss AK-EM100 web applications allow for Reflected Cross-Site Scripting.,9.0,CWE-79
CVE-2024-34029,Mattermost versions 9.5.x <= 9.5.3 9.7.x <= 9.7.1 and 8.1.x <= 8.1.12 fail to perform a proper authorization check in the /api/v4/groups/<group-id>/channels/<channel-id>/link endpoint which allows a user to learn the members of an AD/LDAP group that is linked to a team by adding the group to a channel even if the user has no access to the team.,4.3,CWE-200
CVE-2024-6466,NEC Corporation's WebSAM DeploymentManager v6.0 to v6.80 allows an attacker to reset configurations or restart products via network with X-FRAME-OPTIONS is not specified.,5.3,CWE-1021
CVE-2024-28861,Symfony 1 is a community-driven fork of the 1.x branch of Symfony a PHP framework for web projects. Starting in version 1.1.0 and prior to version 1.5.19 Symfony 1 has a gadget chain due to dangerous deserialization in `sfNamespacedParameterHolder` class that would enable an attacker to get remote code execution if a developer deserializes user input in their project. Version 1.5.19 contains a patch for the issue.,9.8,CWE-502
CVE-2024-2584,Vulnerability in AMSS++ version 4.31 that allows SQL injection through /amssplus/modules/book/main/select_send.php in the 'sd_index' parameter. This vulnerability could allow a remote attacker to send a specially crafted SQL query to the server and retrieve all the information stored in the DB.,8.2,CWE-89
CVE-2023-1278,A vulnerability which was classified as problematic has been found in IBOS up to 4.5.5. Affected by this issue is some unknown functionality of the file mobil/index.php. The manipulation of the argument accesstoken leads to cross site scripting. The attack may be launched remotely. The identifier of this vulnerability is VDB-222608.,3.5,CWE-79
CVE-2023-2211,A vulnerability was found in Campcodes Coffee Shop POS System 1.0 and classified as critical. Affected by this issue is some unknown functionality of the file /admin/categories/manage_category.php. The manipulation of the argument id leads to sql injection. The attack may be launched remotely. The exploit has been disclosed to the public and may be used. The identifier of this vulnerability is VDB-226976.,6.3,CWE-89
CVE-2023-43757,Inadequate encryption strength vulnerability in multiple routers provided by ELECOM CO.LTD. and LOGITEC CORPORATION allows a network-adjacent unauthenticated attacker to guess the encryption key used for wireless LAN communication and intercept the communication. As for the affected products/versions see the information provided by the vendor under [References] section.,6.5,CWE-326
CVE-2018-9477,In the development options section of the Settings app there is a possible authentication bypass due to a missing permission check. This could lead to local escalation of privilege with no additional execution privileges needed. User interaction is needed for exploitation.,7.8,CWE-862
CVE-2025-5741,CWE-22: Improper Limitation of a Pathname to a Restricted Directory ('Path Traversal') vulnerability exists that could cause arbitrary file reads from the charging station. The exploitation of this vulnerability does require an authenticated session of the web server.,4.9,CWE-22
CVE-2024-12936,A vulnerability which was classified as critical has been found in code-projects Simple Admin Panel 1.0. This issue affects some unknown processing of the file catDeleteController.php. The manipulation of the argument record leads to sql injection. The attack may be initiated remotely. The exploit has been disclosed to the public and may be used.,6.3,CWE-74
CVE-2022-49275,In the Linux kernel the following vulnerability has been resolved:  can: m_can: m_can_tx_handler(): fix use after free of skb  can_put_echo_skb() will clone skb then free the skb. Move the can_put_echo_skb() for the m_can version 3.0.x directly before the start of the xmit in hardware similar to the 3.1.x branch.,7.8,CWE-416
CVE-2025-2850,A vulnerability was found in GL.iNet GL-A1300 Slate Plus GL-AR300M16 Shadow GL-AR300M Shadow GL-AR750 Creta GL-AR750S-EXT Slate GL-AX1800 Flint GL-AXT1800 Slate AX GL-B1300 Convexa-B GL-B3000 Marble GL-BE3600 Slate 7 GL-E750 GL-E750V2 Mudi GL-MT300N-V2 Mango GL-MT1300 Beryl GL-MT2500 Brume 2 GL-MT3000 Beryl AX GL-MT6000 Flint 2 GL-SFT1200 Opal GL-X300B Collie GL-X750 Spitz GL-X3000 Spitz AX GL-XE300 Puli and GL-XE3000 Puli AX 4.x. It has been rated as problematic. This issue affects some unknown processing of the component Download Interface. The manipulation leads to improper authorization. It is recommended to upgrade the affected component.,3.5,CWE-266
CVE-2024-47532,RestrictedPython is a restricted execution environment for Python to run untrusted code. A user can gain access to protected (and potentially sensible) information indirectly via AttributeError.obj and the string module. The problem will be fixed in version 7.3. As a workaround If the application does not require access to the module string it can remove it from RestrictedPython.Utilities.utility_builtins or otherwise do not make it available in the restricted execution environment.,6.5,CWE-200
CVE-2022-22265,An improper check or handling of exceptional conditions in NPU driver prior to SMR Jan-2022 Release 1 allows arbitrary memory write and code execution.,5.0,CWE-703
CVE-2024-38873,An issue was discovered in the friendlycaptcha_official (aka Integration of Friendly Captcha) extension before 0.1.4 for TYPO3. The extension fails to check the requirement of the captcha field in submitted form data allowing a remote user to bypass the captcha check. This only affects the captcha integration for the ext:form extension.,5.3,CWE-284
CVE-2023-26076,An issue was discovered in Samsung Mobile Chipset and Baseband Modem Chipset for Exynos 1280 Exynos 2200 Exynos Modem 5123 Exynos Modem 5300 and Exynos Auto T5123. An intra-object overflow in the 5G SM message codec can occur due to insufficient parameter validation when decoding reserved options.,7.6,CWE-120
CVE-2022-1513,A potential vulnerability was reported in Lenovo PCManager prior to version 5.0.10.4191 that may allow code execution when visiting a specially crafted website.,7.3,CWE-78
CVE-2025-46478,Improper Neutralization of Input During Web Page Generation ('Cross-site Scripting') vulnerability in metaloha Dropdown Content allows Stored XSS. This issue affects Dropdown Content: from n/a through 1.0.2.,7.1,CWE-79
CVE-2022-42288,NVIDIA BMC contains a vulnerability in IPMI handler where an unauthorized attacker can use certain oracles to guess a valid BMC username which may lead to an information disclosure.,5.3,CWE-208
CVE-2024-43960,Improper Neutralization of Input During Web Page Generation (XSS or 'Cross-site Scripting') vulnerability in Page Builder Addons Web and WooCommerce Addons for WPBakery Builder allows Stored XSS.This issue affects Web and WooCommerce Addons for WPBakery Builder: from n/a through 1.4.6.,5.9,CWE-79
CVE-2025-25772,A Cross-Site Request Forgery (CSRF) in the component /back/UserController.java of Jspxcms v9.0 to v9.5 allows attackers to arbitrarily add Administrator accounts via a crafted request.,5.1,CWE-352
CVE-2023-25656,notation-go is a collection of libraries for supporting Notation sign verify push and pull of oci artifacts. Prior to version 1.0.0-rc.3 notation-go users will find their application using excessive memory when verifying signatures. The application will be killed and thus availability is impacted. The problem has been patched in the release v1.0.0-rc.3. Some workarounds are available. Users can review their own trust policy file and check if the identity string contains `=#`. Meanwhile users should only put trusted certificates in their trust stores referenced by their own trust policy files and make sure the `authenticity` validation is set to `enforce`.,7.5,CWE-770
CVE-2022-31705,VMware ESXi Workstation and Fusion contain a heap out-of-bounds write vulnerability in the USB 2.0 controller (EHCI). A malicious actor with local administrative privileges on a virtual machine may exploit this issue to execute code as the virtual machine's VMX process running on the host. On ESXi the exploitation is contained within the VMX sandbox whereas on Workstation and Fusion this may lead to code execution on the machine where Workstation or Fusion is installed.,8.2,CWE-787
CVE-2022-33239,Transient DOS due to loop with unreachable exit condition in WLAN firmware while parsing IPV6 extension header. in Snapdragon Auto Snapdragon Compute Snapdragon Connectivity Snapdragon Consumer Electronics Connectivity Snapdragon Consumer IOT Snapdragon Industrial IOT Snapdragon Mobile Snapdragon Voice & Music Snapdragon Wearables Snapdragon Wired Infrastructure and Networking,7.5,CWE-835
CVE-2022-24444,Silverstripe silverstripe/framework through 4.10 allows Session Fixation.,6.5,CWE-384
CVE-2024-25027,IBM Security Verify Access 10.0.6 could disclose sensitive snapshot information due to missing encryption.  IBM X-Force ID:  281607.,6.2,CWE-311
CVE-2022-44750,HCL Domino is susceptible to a stack based buffer overflow vulnerability in lasr.dll in Micro Focus KeyView.  This could allow a remote unauthenticated attacker to crash the application or execute arbitrary code via a crafted Lotus Ami Pro file. This is different from the vulnerability described in CVE-2022-44754.  This vulnerability applies to software previously licensed by IBM. ,9.8,CWE-787
CVE-2022-1722,SSRF in editor's proxy via IPv6 link-local address in GitHub repository jgraph/drawio prior to 18.0.5. SSRF to internal link-local IPv6 addresses,3.3,CWE-918
CVE-2022-3143,wildfly-elytron: possible timing attacks via use of unsafe comparator. A flaw was found in Wildfly-elytron. Wildfly-elytron uses java.util.Arrays.equals in several places which is unsafe and vulnerable to timing attacks. To compare values securely use java.security.MessageDigest.isEqual instead. This flaw allows an attacker to access secure information or impersonate an authed user.,7.4,CWE-203
CVE-2022-3499,An authenticated attacker could utilize the identical agent and cluster node linking keys to potentially allow for a scenario where unauthorized disclosure of agent logs and data is present.,6.5,CWE-532
CVE-2023-38999,A Cross-Site Request Forgery (CSRF) in the System Halt API (/system/halt) of OPNsense Community Edition before 23.7 and Business Edition before 23.4.2 allows attackers to cause a Denial of Service (DoS) via a crafted GET request.,6.5,CWE-352
CVE-2024-8608,Improper Neutralization of Input During Web Page Generation (XSS or 'Cross-site Scripting') vulnerability in Oceanic Software ValeApp allows Stored XSS.This issue affects ValeApp: before v2.0.0.,5.4,CWE-79
CVE-2021-42751,A cross-site scripting (XSS) vulnerability in Rule Engine in ThingsBoard 3.3.1 allows remote attackers (with administrative access) to inject arbitrary JavaScript within the description of a rule node.,4.8,CWE-79
CVE-2024-21367,Microsoft WDAC OLE DB provider for SQL Server Remote Code Execution Vulnerability,8.8,CWE-122
CVE-2023-52308,FPE in paddle.amin in PaddlePaddle before 2.6.0. This flaw can cause a runtime crash and a denial of service.    ,4.7,CWE-369
CVE-2025-6309,A vulnerability classified as critical was found in PHPGurukul Emergency Ambulance Hiring Portal 1.0. Affected by this vulnerability is an unknown functionality of the file /admin/add-ambulance.php. The manipulation of the argument ambregnum leads to sql injection. The attack can be launched remotely. The exploit has been disclosed to the public and may be used.,6.3,CWE-74
CVE-2023-33044,Transient DOS in Data modem while handling TLB control messages from the Network.,7.5,CWE-617
CVE-2024-13778,The Hero Mega Menu - Responsive WordPress Menu Plugin plugin for WordPress is vulnerable to SQL Injection via several functions in all versions up to and including 1.16.5 due to insufficient escaping on the user supplied parameter and lack of sufficient preparation on the existing SQL query.  This makes it possible for authenticated attackers with Subscriber-level access and above to append additional SQL queries into already existing queries that can be used to extract sensitive information from the database.,6.5,CWE-89
CVE-2023-33481,RemoteClinic 2.0 is vulnerable to a time-based blind SQL injection attack in the 'start' GET parameter of patients/index.php.,9.8,CWE-89
CVE-2023-28692,Auth. (admin+) Stored Cross-Site Scripting (XSS) vulnerability in Kevon Adonis WP Abstracts plugin <= 2.6.3 versions.,5.9,CWE-79
CVE-2023-29349,Microsoft ODBC and OLE DB Remote Code Execution Vulnerability,7.8,CWE-191
CVE-2024-49545,InDesign Desktop versions ID19.5 ID18.5.4 and earlier are affected by a Heap-based Buffer Overflow vulnerability that could result in arbitrary code execution in the context of the current user. Exploitation of this issue requires user interaction in that a victim must open a malicious file.,7.8,CWE-122
CVE-2023-6361,A vulnerability has been discovered in Winhex affecting version 16.1 SR-1 and 20.4. This vulnerability consists of a buffer overflow controlling the Structured Exception Handler (SEH) registers. This could allow attackers to execute arbitrary code via a long filename argument.,7.3,CWE-119
CVE-2022-31373,SolarView Compact v6.0 was discovered to contain a cross-site scripting (XSS) vulnerability via the component Solar_AiConf.php.,6.1,CWE-79
