CVE,Description,CVSS3_BaseScore,CWE
CVE-2022-41878,Parse Server is an open source backend that can be deployed to any infrastructure that can run Node.js. In versions prior to 5.3.2 or 4.10.19 keywords that are specified in the Parse Server option `requestKeywordDenylist` can be injected via Cloud Code Webhooks or Triggers. This will result in the keyword being saved to the database bypassing the `requestKeywordDenylist` option. This issue is fixed in versions 4.10.19 and 5.3.2. If upgrade is not possible the following Workarounds may be applied: Configure your firewall to only allow trusted servers to make request to the Parse Server Cloud Code Webhooks API or block the API completely if you are not using the feature.,7.2,CWE-74
CVE-2023-6776,The 3D FlipBook plugin for WordPress is vulnerable to Stored Cross-Site Scripting via the ‘Ready Function’ field in all versions up to and including 1.15.2 due to insufficient input sanitization and output escaping. This makes it possible for authenticated attackers with contributor-level access and above to inject arbitrary web scripts in pages that will execute whenever a user accesses an injected page.,6.4,CWE-79
CVE-2022-45926,An issue was discovered in OpenText Content Suite Platform 22.1 (16.2.19.1803). The endpoint notify.localizeEmailTemplate allows a low-privilege user to evaluate webreports.,8.8,CWE-918
CVE-2025-22335,Improper Neutralization of Input During Web Page Generation ('Cross-site Scripting') vulnerability in Md. Rajib Dewan Opencart Product in WP allows Reflected XSS.This issue affects Opencart Product in WP: from n/a through 1.0.1.,7.1,CWE-79
CVE-2023-4005,Insufficient Session Expiration in GitHub repository fossbilling/fossbilling prior to 0.5.5.,9.8,CWE-613
CVE-2024-3858,It was possible to mutate a JavaScript object so that the JIT could crash while tracing it. This vulnerability affects Firefox < 125.,7.5,CWE-476
CVE-2024-48889,An Improper Neutralization of Special Elements used in an OS Command ('OS Command Injection') vulnerability [CWE-78] in FortiManager version 7.6.0 version 7.4.4 and below version 7.2.7 and below version 7.0.12 and below version 6.4.14 and below and FortiManager Cloud version 7.4.4 and below version 7.2.7 to 7.2.1 version 7.0.12 to 7.0.1 may allow an authenticated remote attacker to execute unauthorized code via FGFM crafted requests.,7.2,CWE-78
CVE-2024-30448,Improper Neutralization of Input During Web Page Generation ('Cross-site Scripting') vulnerability in Supsystic Slider by Supsystic allows Stored XSS.This issue affects Slider by Supsystic: from n/a through 1.8.10.  ,5.9,CWE-79
CVE-2024-44386,Tenda FH1206 V1.2.0.8(8155)_EN contains a Buffer Overflow vulnerability via the function fromSetIpBind.,7.3,CWE-121
CVE-2023-21528,Microsoft SQL Server Remote Code Execution Vulnerability,7.8,CWE-122
CVE-2025-23539,Improper Neutralization of Input During Web Page Generation ('Cross-site Scripting') vulnerability in NotFound Awesome Hooks allows Reflected XSS. This issue affects Awesome Hooks: from n/a through 1.0.1.,7.1,CWE-79
CVE-2024-8037,Vulnerable juju hook tool abstract UNIX domain socket. When combined with an attack of JUJU_CONTEXT_ID any user on the local system with access to the default network namespace may connect to the @/var/lib/juju/agents/unit-xxxx-yyyy/agent.socket and perform actions that are normally reserved to a juju charm.,6.5,CWE-276
CVE-2022-37108,An injection vulnerability in the syslog-ng configuration wizard in Securonix Snypr 6.4 allows an application user with the Manage Ingesters permission to execute arbitrary code on remote ingesters by appending arbitrary text to text files that are executed by the system such as users' crontab files. The patch for this was present in SNYPR version 6.4 Jun 2022 R3_[06170871] but may have been introduced sooner.,8.7,CWE-74
CVE-2021-44465,Improper access control in Odoo Community 13.0 and earlier and Odoo Enterprise 13.0 and earlier allows authenticated attackers to subscribe to receive future notifications and comments related to arbitrary business records in the system via crafted RPC requests.,4.3,CWE-284
CVE-2025-21235,Windows PrintWorkflowUserSvc Elevation of Privilege Vulnerability,7.8,CWE-20
CVE-2022-34705,Windows Defender Credential Guard Elevation of Privilege Vulnerability,7.8,CWE-416
CVE-2023-23401,Windows Media Remote Code Execution Vulnerability,7.8,CWE-681
CVE-2025-7527,A vulnerability was found in Tenda FH1202 1.2.0.14(408). It has been rated as critical. This issue affects the function fromAdvSetWan of the file /goform/AdvSetWan. The manipulation of the argument PPPOEPassword leads to stack-based buffer overflow. The attack may be initiated remotely. The exploit has been disclosed to the public and may be used.,8.8,CWE-119
CVE-2024-36496,The configuration file is encrypted with a static key derived from a  static five-character password which allows an attacker to decrypt this  file. The application hashes this five-character password with  the outdated and broken MD5 algorithm (no salt) and uses the first five  bytes as the key for RC4. The configuration file is then encrypted with  these parameters.,7.5,CWE-798
CVE-2023-26352,Adobe Dimension versions 3.4.7 (and earlier) is affected by an out-of-bounds read vulnerability that could lead to disclosure of sensitive memory. An attacker could leverage this vulnerability to bypass mitigations such as ASLR. Exploitation of this issue requires user interaction in that a victim must open a malicious file.,5.5,CWE-125
CVE-2023-47868,Improper Privilege Management vulnerability in wpForo wpForo Forum allows Privilege Escalation.This issue affects wpForo Forum: from n/a through 2.2.3.,7.3,CWE-269
CVE-2023-25963,Auth. (admin+) Stored Cross-Site Scripting (XSS) vulnerability in JoomSky JS Job Manager plugin <= 2.0.0 versions.,5.9,CWE-79
CVE-2022-28216,SAP BusinessObjects Business Intelligence Platform (BI Workspace) - version 420 is susceptible to a Cross-Site Scripting attack by an unauthenticated attacker due to improper sanitization of the user inputs on the network. On successful exploitation an attacker can access certain reports causing a limited impact on confidentiality of the application data.,6.1,CWE-79
CVE-2023-44434,Kofax Power PDF File Parsing Out-Of-Bounds Read Information Disclosure Vulnerability. This vulnerability allows remote attackers to disclose sensitive information on affected installations of Kofax Power PDF. User interaction is required to exploit this vulnerability in that the target must visit a malicious page or open a malicious file.  The specific flaw exists within the handling of PDF files. The issue results from the lack of proper validation of user-supplied data which can result in a read past the end of an allocated buffer. An attacker can leverage this in conjunction with other vulnerabilities to execute arbitrary code in the context of the current process. Was ZDI-CAN-21979.,5.5,CWE-125
CVE-2024-25654,Insecure permissions for log files of AVSystem Unified Management Platform (UMP) 23.07.0.16567~LTS allow members (with local access to the UMP application server) to access credentials to authenticate to all services and to decrypt sensitive data stored in the database.,5.5,CWE-532
CVE-2022-31043,Guzzle is an open source PHP HTTP client. In affected versions `Authorization` headers on requests are sensitive information. On making a request using the `https` scheme to a server which responds with a redirect to a URI with the `http` scheme we should not forward the `Authorization` header on. This is much the same as to how we don't forward on the header if the host changes. Prior to this fix `https` to `http` downgrades did not result in the `Authorization` header being removed only changes to the host. Affected Guzzle 7 users should upgrade to Guzzle 7.4.4 as soon as possible. Affected users using any earlier series of Guzzle should upgrade to Guzzle 6.5.7 or 7.4.4. Users unable to upgrade may consider an alternative approach which would be to use their own redirect middleware. Alternately users may simply disable redirects all together if redirects are not expected or required.,7.5,CWE-200
CVE-2022-39230,fhir-works-on-aws-authz-smart is an implementation of the authorization interface from the FHIR Works interface. Versions 3.1.1 and 3.1.2 are subject to Exposure of Sensitive Information to an Unauthorized Actor. This issue allows a client of the API to retrieve more information than the client’s OAuth scope permits when making “search-type” requests. This issue would not allow a client to retrieve information about individuals other than those the client was already authorized to access. Users of fhir-works-on-aws-authz-smart 3.1.1 or 3.1.2 should upgrade to version 3.1.3 or higher immediately. Versions 3.1.0 and below are unaffected. There is no workaround for this issue.,6.5,CWE-200
CVE-2024-31282,URL Redirection to Untrusted Site ('Open Redirect') vulnerability in Appcheap.Io App Builder.This issue affects App Builder: from n/a through 3.8.7.  ,4.7,CWE-601
CVE-2023-3717,Improper Neutralization of Special Elements used in an SQL Command ('SQL Injection') vulnerability in Farmakom Remote Administration Console allows SQL Injection.This issue affects Remote Administration Console: before 1.02.  ,9.8,CWE-89
CVE-2022-1465,The WPC Smart Wishlist for WooCommerce WordPress plugin before 2.9.9 does not sanitise and escape a parameter before outputting it back in an attribute via an AJAX action leading to a Reflected Cross-Site Scripting issue.,6.1,CWE-79
CVE-2023-35917,Cross-Site Request Forgery (CSRF) vulnerability in WooCommerce PayPal Payments plugin <= 2.0.4 versions.,4.3,CWE-352
CVE-2024-11744,A vulnerability has been found in 1000 Projects Portfolio Management System MCA 1.0 and classified as critical. Affected by this vulnerability is an unknown functionality of the file /register.php. The manipulation of the argument name leads to sql injection. The attack can be launched remotely. The exploit has been disclosed to the public and may be used. Other parameters might be affected as well.,7.3,CWE-74
CVE-2020-8007,The pwrstudio web application of EV Charger (in the server in Circontrol Raption through 5.6.2) is vulnerable to OS command injection via three fields of the configuration menu for ntpserver0 ntpserver1 and pingip.,9.8,CWE-78
CVE-2025-3192,Versions of the package spatie/browsershot from 0.0.0 are vulnerable to Server-side Request Forgery (SSRF) in the setUrl() function due to a missing restriction on user input enabling attackers to access localhost and list all of its directories.,8.2,CWE-918
CVE-2023-50359,An unchecked return value vulnerability has been reported to affect several QNAP operating system versions. If exploited the vulnerability could allow local authenticated administrators to place the system in a state that could lead to a crash or other unintended behaviors via unspecified vectors.  We have already fixed the vulnerability in the following versions: QTS 5.1.5.2645 build 20240116 and later QuTS hero h5.1.5.2647 build 20240118 and later ,3.4,CWE-252
CVE-2024-50055,In the Linux kernel the following vulnerability has been resolved:  driver core: bus: Fix double free in driver API bus_register()  For bus_register() any error which happens after kset_register() will cause that @priv are freed twice fixed by setting @priv with NULL after the first free.,7.8,CWE-415
CVE-2024-0719,The Tabs Shortcode and Widget WordPress plugin through 1.17 does not validate and escape some of its shortcode attributes before outputting them back in a page/post where the shortcode is embed which could allow users with the contributor role and above to perform Stored Cross-Site Scripting attacks,5.4,CWE-79
CVE-2022-39093,In power management service there is a missing permission check. This could lead to set up power management service with no additional execution privileges needed.,7.8,CWE-862
CVE-2025-22390,An issue was discovered in Optimizely EPiServer.CMS.Core before 12.32.0. A medium-severity vulnerability exists in the CMS due to insufficient enforcement of password complexity requirements. The application permits users to set passwords with a minimum length of 6 characters lacking adequate complexity to resist modern attack techniques such as password spraying or offline password cracking.,7.5,CWE-521
CVE-2024-8359,Visteon Infotainment REFLASH_DDU_FindFile Command Injection Remote Code Execution Vulnerability. This vulnerability allows physically present attackers to execute arbitrary code on affected installations of Visteon Infotainment systems. Authentication is not required to exploit this vulnerability.  The specific flaw exists within the REFLASH_DDU_FindFile function. A crafted software update file can trigger execution of a system call composed from a user-supplied string. An attacker can leverage this vulnerability to execute code in the context of the device. Was ZDI-CAN-23420.,6.8,CWE-78
CVE-2022-27079,Tenda M3 1.10 V1.0.0.12(4856) was discovered to contain a command injection vulnerability via the component /goform/setPicListItem.,9.8,CWE-77
CVE-2025-8100,The Element Pack Elementor Addons and Templates plugin for WordPress is vulnerable to Stored Cross-Site Scripting via the 'marker_content' parameter in versions up to and including 8.1.5 due to insufficient input sanitization and output escaping. This makes it possible for authenticated attackers with contributor-level access and above to inject arbitrary web scripts in pages that will execute whenever a user accesses an injected page.,5.4,CWE-79
CVE-2024-4814,A vulnerability classified as critical was found in Ruijie RG-UAC up to 20240506. Affected by this vulnerability is an unknown functionality of the file /view/networkConfig/RouteConfig/StaticRoute/static_route_edit_commit.php. The manipulation of the argument oldipmask/oldgateway leads to os command injection. The attack can be launched remotely. The exploit has been disclosed to the public and may be used. The associated identifier of this vulnerability is VDB-263935. NOTE: The vendor was contacted early about this disclosure but did not respond in any way.,6.3,CWE-78
CVE-2024-43505,Microsoft Office Visio Remote Code Execution Vulnerability,7.8,CWE-357
CVE-2023-40168,TurboWarp is a desktop application that compiles scratch projects to JavaScript. TurboWarp Desktop versions prior to version 1.8.0 allowed a malicious project or custom extension to read arbitrary files from disk and upload them to a remote server. The only required user interaction is opening the sb3 file or loading the extension. The web version of TurboWarp is not affected. This bug has been addressed in commit `55e07e99b59` after an initial fix which was reverted. Users are advised to upgrade to version 1.8.0 or later. Users unable to upgrade should avoid opening sb3 files or loading extensions from untrusted sources.,7.4,CWE-863
CVE-2022-3711,A post-auth read-only SQL injection vulnerability allows users to read non-sensitive configuration database contents in the User Portal of Sophos Firewall releases older than version 19.5 GA.,4.3,CWE-89
CVE-2022-4600,A vulnerability was found in Shoplazza LifeStyle 1.1. It has been classified as problematic. This affects an unknown part of the file /admin/api/theme-edit/ of the component Product Carousel Handler. The manipulation of the argument Heading/Description leads to cross site scripting. It is possible to initiate the attack remotely. The exploit has been disclosed to the public and may be used. The associated identifier of this vulnerability is VDB-216195.,3.5,CWE-707
CVE-2023-36091,Authentication Bypass vulnerability in D-Link DIR-895 FW102b07 allows remote attackers to gain escalated privileges via via function phpcgi_main in cgibin. NOTE: This vulnerability only affects products that are no longer supported by the maintainer.,9.8,CWE-863
CVE-2025-1883,Out-Of-Bounds Write vulnerability exists in the OBJ file reading procedure in SOLIDWORKS eDrawings on Release SOLIDWORKS Desktop 2025. This vulnerability could allow an attacker to execute arbitrary code while opening a specially crafted OBJÂ file.,7.8,CWE-787
CVE-2023-31763,Weak security in the transmitter of AGShome Smart Alarm v1.0 allows attackers to gain full access to the system via a code replay attack.,7.5,CWE-294
CVE-2023-6467,A vulnerability was found in Thecosy IceCMS 2.0.1. It has been rated as problematic. This issue affects some unknown processing of the file /Websquare/likeClickComment/ of the component Comment Like Handler. The manipulation leads to improper enforcement of a single unique action. The attack may be initiated remotely. The complexity of an attack is rather high. The exploitation is known to be difficult. The exploit has been disclosed to the public and may be used. The identifier VDB-246617 was assigned to this vulnerability.,3.1,CWE-837
CVE-2022-32517,A CWE-1021: Improper Restriction of Rendered UI Layers or Frames vulnerability exists that could cause an adversary to trick the interface user/admin into interacting with the application in an unintended way when the product does not implement restrictions on the ability to render within frames on external addresses. Affected Products: Conext™ ComBox (All Versions),6.5,CWE-1021
CVE-2023-29485,An issue was discovered in Heimdal Thor agent versions 3.4.2 and before on Windows and 2.6.9 and before on macOS allows attackers to bypass network filtering execute arbitrary code and obtain sensitive information via DarkLayer Guard threat prevention module. NOTE: Heimdal disputes the validity of this issue arguing that their DNS Security for Endpoint filters DNS traffic on the endpoint by intercepting system-generated DNS requests. The product was not designed to intercept DNS requests from third-party solutions.,9.8,CWE-306
CVE-2022-37382,This vulnerability allows remote attackers to disclose sensitive information on affected installations of Foxit PDF Reader 11.2.1.53537. User interaction is required to exploit this vulnerability in that the target must visit a malicious page or open a malicious file. The specific flaw exists within the removeIcon method. The issue results from the lack of validating the existence of an object prior to performing operations on the object. An attacker can leverage this in conjunction with other vulnerabilities to execute arbitrary code in the context of the current process. Was ZDI-CAN-17383.,5.5,CWE-416
CVE-2024-37000,A maliciously crafted X_B file when parsed in pskernel.DLL through Autodesk applications can lead to a memory corruption vulnerability by write access violation. This vulnerability in conjunction with other vulnerabilities can lead to code execution in the context of the current process.,7.8,CWE-119
CVE-2025-21319,Windows Kernel Memory Information Disclosure Vulnerability,5.5,CWE-532
CVE-2023-49745,Improper Neutralization of Input During Web Page Generation ('Cross-site Scripting') vulnerability in Spiffy Plugins Spiffy Calendar allows Stored XSS.This issue affects Spiffy Calendar: from n/a through 4.9.5.  ,6.5,CWE-79
CVE-2024-28133, 	 		 		 	 	 		 			 				 					A local low privileged attacker can use an untrusted search path in a CHARX system utility to gain root privileges.     				   			   		   	    				   			   		   	 ,7.8,CWE-426
CVE-2023-36396,Windows Compressed Folder Remote Code Execution Vulnerability,7.8,CWE-41
CVE-2024-45516,An issue was discovered in Zimbra Collaboration (ZCS) 9.0.0 before Patch 43 10.0.x before 10.0.12 10.1.x before 10.1.4 and 8.8.15 before Patch 47. A Cross-Site Scripting (XSS) vulnerability in the Zimbra Classic UI allows attackers to execute arbitrary JavaScript within the user's session potentially leading to unauthorized access to sensitive information. This issue arises from insufficient sanitization of HTML content including malformed <img> tags with embedded JavaScript. The vulnerability is triggered when a user views a specially crafted email in the Classic UI requiring no additional user interaction.,6.1,CWE-79
CVE-2025-5503,A vulnerability which was classified as critical was found in TOTOLINK X15 1.0.0-B20230714.1105. This affects the function formMapReboot of the file /boafrm/formMapReboot. The manipulation of the argument deviceMacAddr leads to stack-based buffer overflow. It is possible to initiate the attack remotely. The exploit has been disclosed to the public and may be used. The vendor was contacted early about this disclosure but did not respond in any way.,8.8,CWE-119
CVE-2023-25967,Cross-Site Request Forgery (CSRF) vulnerability in PeepSo Community by PeepSo plugin <= 6.0.2.0 versions.,4.3,CWE-352
CVE-2025-30326,Photoshop Desktop versions 26.5 25.12.2 and earlier are affected by an Access of Uninitialized Pointer vulnerability that could result in arbitrary code execution in the context of the current user. Exploitation of this issue requires user interaction in that a victim must open a malicious file.,7.8,CWE-824
CVE-2022-26096,Null pointer dereference vulnerability in parser_ispe function in libsimba library prior to SMR Apr-2022 Release 1 allows out of bounds write by remote attacker.,5.9,CWE-476
CVE-2023-26460,Cache Management Service in SAP NetWeaver Application Server for Java - version 7.50 does not perform any authentication checks for functionalities that require user identity  ,5.3,CWE-284
CVE-2023-45871,An issue was discovered in drivers/net/ethernet/intel/igb/igb_main.c in the IGB driver in the Linux kernel before 6.5.3. A buffer size may not be adequate for frames larger than the MTU.,7.5,CWE-131
CVE-2023-36537,Improper privilege management in Zoom Rooms for Windows before version 5.14.5 may allow an authenticated user to enable an escalation of privilege via local access.,7.3,CWE-354
CVE-2022-44743,Auth. (author+) Stored Cross-Site Scripting (XSS) vulnerability in BlueGlass Jobs for WordPress plugin <= 2.5.11.2 versions.,6.5,CWE-79
CVE-2025-4706,A vulnerability was found in projectworlds Online Examination System 1.0. It has been declared as critical. This vulnerability affects unknown code of the file /Procedure3b_yearwiseVisit.php. The manipulation of the argument Visit_year leads to sql injection. The attack can be initiated remotely. The exploit has been disclosed to the public and may be used.,7.3,CWE-74
CVE-2025-36576,Dell Wyse Management Suite versions prior to WMS 5.2 contain a Cross-Site Request Forgery (CSRF) vulnerability. A high privileged attacker with remote access could potentially exploit this vulnerability leading to Server-side request forgery.,2.7,CWE-352
CVE-2024-45515,An issue was discovered in Zimbra Collaboration (ZCS) through 10.1. A Cross-Site Scripting (XSS) vulnerability exists in Zimbra webmail due to insufficient validation of the content type metadata when importing files into the briefcase. Attackers can exploit this issue by crafting a file with manipulated metadata allowing them to bypass content type checks and execute arbitrary JavaScript within the victim's session.,6.1,CWE-79
CVE-2024-53934,The com.windymob.callscreen.ringtone.callcolor.colorphone (aka Color Phone Call Screen Themes) application through 1.1.2 for Android enables any application (with no permissions) to place phone calls without user interaction by sending a crafted intent via the com.frovis.androidbase.call.DialerActivity component.,7.7,CWE-281
CVE-2024-50262,In the Linux kernel the following vulnerability has been resolved:  bpf: Fix out-of-bounds write in trie_get_next_key()  trie_get_next_key() allocates a node stack with size trie->max_prefixlen while it writes (trie->max_prefixlen + 1) nodes to the stack when it has full paths from the root to leaves. For example consider a trie with max_prefixlen is 8 and the nodes with key 0x00/0 0x00/1 0x00/2 ... 0x00/8 inserted. Subsequent calls to trie_get_next_key with _key with .prefixlen = 8 make 9 nodes be written on the node stack with size 8.,7.8,CWE-787
CVE-2024-20742,Substance3D - Painter versions 9.1.1 and earlier are affected by an out-of-bounds read vulnerability when parsing a crafted file which could result in a read past the end of an allocated memory structure. An attacker could leverage this vulnerability to execute code in the context of the current user. Exploitation of this issue requires user interaction in that a victim must open a malicious file.,7.8,CWE-125
CVE-2022-38490,An issue was discovered in EasyVista 2020.2.125.3 and 2022.1.109.0.03. Some parameters allow SQL injection. Version 2022.1.110.1.02 corrects this issue.,9.6,CWE-89
CVE-2025-46929,Adobe Experience Manager versions 6.5.22 and earlier are affected by a stored Cross-Site Scripting (XSS) vulnerability that could be abused by a low privileged attacker to inject malicious scripts into vulnerable form fields. Malicious JavaScript may be executed in a victim’s browser when they browse to the page containing the vulnerable field.,5.4,CWE-79
CVE-2022-38282,JFinal CMS 5.1.0 is vulnerable to SQL Injection via /admin/videoalbum/list.,7.2,CWE-89
CVE-2025-0809,The Link Fixer plugin for WordPress is vulnerable to Stored Cross-Site Scripting via broken links in all versions up to and including 3.4 due to insufficient input sanitization and output escaping. This makes it possible for unauthenticated attackers to inject arbitrary web scripts in pages that will execute whenever a user accesses an injected page.,7.2,CWE-79
CVE-2024-6998,Use after free in User Education in Google Chrome prior to 127.0.6533.72 allowed a remote attacker who convinced a user to engage in specific UI gestures to potentially exploit heap corruption via a crafted HTML page. (Chromium security severity: Medium),8.8,CWE-416
CVE-2022-30301,A path traversal vulnerability [CWE-22] in FortiAP-U CLI 6.2.0 through 6.2.3 6.0.0 through 6.0.4 5.4.0 through 5.4.6 may allow an admin user to delete and access unauthorized files and data via specifically crafted CLI commands.,7.8,CWE-22
