CVE,Description,CVSS3_BaseScore,CWE
CVE-2023-4892,Teedy v1.11 has a vulnerability in its text editor that allows events  to be executed in HTML tags that an attacker could manipulate. Thanks  to this it is possible to execute malicious JavaScript in the webapp.    ,5.7,CWE-79
CVE-2023-6709,Improper Neutralization of Special Elements Used in a Template Engine in GitHub repository mlflow/mlflow prior to 2.9.2.,8.8,CWE-1336
CVE-2024-2237,The Premium Addons PRO plugin for WordPress is vulnerable to Stored Cross-Site Scripting via the Global Badge module in all versions up to and including 2.9.12 due to insufficient input sanitization and output escaping. This makes it possible for authenticated attackers with contributor-level access and above to inject arbitrary web scripts in pages that will execute whenever a user accesses an injected page.,6.4,CWE-79
CVE-2022-35250,A privilege escalation vulnerability exists in Rocket.chat <v5 which made it possible to elevate privileges for any authenticated user to view Direct messages without appropriate permissions.,4.3,CWE-732
CVE-2023-30996,IBM Cognos Analytics 11.1.7 11.2.4 and 12.0.0 could be vulnerable to information leakage due to unverified sources in messages sent between Windows objects of different origins.  IBM X-Force ID:  254290.,5.3,CWE-346
CVE-2024-2127,The Page Builder: Pagelayer – Drag and Drop website builder plugin for WordPress is vulnerable to Stored Cross-Site Scripting via custom attributes in all versions up to and including 1.8.3 due to insufficient input sanitization and output escaping. This makes it possible for authenticated attackers with contributor-level and above permissions to inject arbitrary web scripts in pages that will execute whenever a user accesses an injected page.,6.4,CWE-79
CVE-2024-31684,Incorrect access control in the fingerprint authentication mechanism of Bitdefender Mobile Security v4.11.3-gms allows attackers to bypass fingerprint authentication due to the use of a deprecated API.,3.5,CWE-306
CVE-2024-0685,The Ninja Forms Contact Form – The Drag and Drop Form Builder for WordPress plugin for WordPress is vulnerable to Second Order SQL Injection via the email address value submitted through forms in all versions up to and including 3.7.1 due to insufficient escaping on the user supplied parameter and lack of sufficient preparation on the existing SQL query.  This makes it possible for unauthenticated attackers to inject SQL in their email address that will append additional into the already existing query when an administrator triggers a personal data export.,5.9,CWE-89
CVE-2024-3655,Use After Free vulnerability in Arm Ltd Bifrost GPU Kernel Driver Arm Ltd Valhall GPU Kernel Driver Arm Ltd Arm 5th Gen GPU Architecture Kernel Driver allows a local non-privileged user to make improper GPU memory processing operations to gain access to already freed memory.This issue affects Bifrost GPU Kernel Driver: from r43p0 through r49p0; Valhall GPU Kernel Driver: from r43p0 through r49p0; Arm 5th Gen GPU Architecture Kernel Driver: from r43p0 through r49p0.,7.8,CWE-416
CVE-2022-25590,SurveyKing v0.2.0 was discovered to retain users' session cookies after logout allowing attackers to login to the system and access data using the browser cache when the user exits the application.,6.5,CWE-613
CVE-2023-44300,   Dell DM5500 5.14.0.0 contain a Plain-text Password Storage Vulnerability in the appliance. A local attacker with privileges could potentially exploit this vulnerability leading to the disclosure of certain service credentials. The attacker may be able to use the exposed credentials to access the vulnerable application with privileges of the compromised account.    ,5.5,CWE-256
CVE-2022-46438,A cross-site scripting (XSS) vulnerability in the /admin/article_category.php component of DouPHP v1.7 20221118 allows attackers to execute arbitrary web scripts or HTML via a crafted payload injected into the description parameter.,5.4,CWE-79
CVE-2021-3987,An improper access control vulnerability exists in janeczku/calibre-web. The affected version allows users without public shelf permissions to create public shelves. The vulnerability is due to the `create_shelf` method in `shelf.py` not verifying if the user has the necessary permissions to create a public shelf. This issue can lead to unauthorized actions being performed by users.,4.3,CWE-284
CVE-2024-50599,A reflected Cross-Site Scripting (XSS) vulnerability has been identified in Zimbra Collaboration Suite (ZCS) 8.8.15 affecting one of the webmail calendar endpoints. This arises from improper handling of user-supplied input allowing an attacker to inject malicious code that is reflected back in the HTML response.,6.1,CWE-79
CVE-2024-4894,ITPison OMICARD EDM  fails to properly filter specific URL parameter allowing unauthenticated remote attackers to modify the parameters and conduct Server-Side Request Forgery (SSRF) attacks. This vulnerability enables attackers to probe internal network information.,5.3,CWE-918
CVE-2023-38955,ZKTeco BioAccess IVS v3.3.1 allows unauthenticated attackers to obtain sensitive information about all managed devices including their IP addresses and device names.,7.5,CWE-668
CVE-2024-38371,authentik is an open-source Identity Provider. Access restrictions assigned to an application were not checked when using the OAuth2 Device code flow. This could potentially allow users without the correct authorization to get OAuth tokens for an application and access it. This issue has been patched in version(s) 2024.6.0 2024.2.4 and 2024.4.3.,8.6,CWE-284
CVE-2024-32436,Cross-Site Request Forgery (CSRF) vulnerability in Codemenschen Gift Vouchers.This issue affects Gift Vouchers: from n/a through 4.4.0.  ,4.3,CWE-352
CVE-2024-57908,In the Linux kernel the following vulnerability has been resolved:  iio: imu: kmx61: fix information leak in triggered buffer  The 'buffer' local array is used to push data to user space from a triggered buffer but it does not set values for inactive channels as it only uses iio_for_each_active_channel() to assign new values.  Initialize the array to zero before using it to avoid pushing uninitialized information to userspace.,7.1,CWE-908
CVE-2022-28219,Cewolf in Zoho ManageEngine ADAudit Plus before 7060 is vulnerable to an unauthenticated XXE attack that leads to Remote Code Execution.,9.8,CWE-611
CVE-2024-35718,Improper Neutralization of Input During Web Page Generation (XSS or 'Cross-site Scripting') vulnerability in Tribulant Newsletters allows Reflected XSS.This issue affects Newsletters: from n/a through 4.9.5.,7.1,CWE-79
CVE-2024-51932,Improper Neutralization of Input During Web Page Generation ('Cross-site Scripting') vulnerability in Saif Bin-Alam Kings Tab Slider allows DOM-Based XSS.This issue affects Kings Tab Slider: from n/a through 1.0.,6.5,CWE-79
CVE-2022-32300,YoudianCMS v9.5.0 was discovered to contain a SQL injection vulnerability via the MailSendID parameter at /App/Lib/Action/Admin/MailAction.class.php.,8.8,CWE-89
CVE-2023-0679,A vulnerability was found in SourceCodester Canteen Management System 1.0. It has been rated as critical. Affected by this issue is some unknown functionality of the file removeUser.php. The manipulation of the argument id leads to sql injection. The attack may be launched remotely. The complexity of an attack is rather high. The exploitation is known to be difficult. The exploit has been disclosed to the public and may be used. The identifier of this vulnerability is VDB-220220.,5.0,CWE-89
CVE-2023-35703,Multiple stack-based buffer overflow vulnerabilities exist in the FST LEB128 varint functionality of GTKWave 3.3.115. A specially crafted .fst file can lead to arbitrary code execution. A victim would need to open a malicious file to trigger these vulnerabilities.This vulnerability concerns the fstReaderVarint64 function.,7.8,CWE-121
CVE-2023-36676,Missing Authorization vulnerability in Brainstorm Force Spectra.This issue affects Spectra: from n/a through 2.6.6.,5.4,CWE-862
CVE-2023-47024,Cross-Site Request Forgery (CSRF) in NCR Terminal Handler v.1.5.1 leads to a one-click account takeover. This is achieved by exploiting multiple vulnerabilities including an undisclosed function in the WSDL that has weak security controls and can accept custom content types.,8.8,CWE-352
CVE-2023-29774,Dreamer CMS 3.0.1 is vulnerable to stored Cross Site Scripting (XSS).,5.4,CWE-79
CVE-2021-34940,This vulnerability allows remote attackers to execute arbitrary code on affected installations of Bentley View 10.15.0.75. User interaction is required to exploit this vulnerability in that the target must visit a malicious page or open a malicious file. The specific flaw exists within the parsing of JT files. Crafted data in a JT file can trigger a write past the end of an allocated buffer. An attacker can leverage this vulnerability to execute code in the context of the current process. Was ZDI-CAN-15039.,7.8,CWE-787
CVE-2024-27477,In Leantime 3.0.6 a Cross-Site Scripting vulnerability exists within the ticket creation and modification functionality allowing attackers to inject malicious JavaScript code into the title field of tickets (also known as to-dos). This stored XSS vulnerability can be exploited to perform Server-Side Request Forgery (SSRF) attacks.,6.1,CWE-79
CVE-2023-47568,A SQL injection vulnerability has been reported to affect several QNAP operating system versions. If exploited the vulnerability could allow authenticated users to inject malicious code via a network.  We have already fixed the vulnerability in the following versions: QTS 5.1.5.2645 build 20240116 and later QTS 4.5.4.2627 build 20231225 and later QuTS hero h5.1.5.2647 build 20240118 and later QuTS hero h4.5.4.2626 build 20231225 and later QuTScloud c5.1.5.2651 and later ,8.8,CWE-89
CVE-2023-47832,Missing Authorization vulnerability in searchiq SearchIQ allows Exploiting Incorrectly Configured Access Control Security Levels.This issue affects SearchIQ: from n/a through 4.4.,5.3,CWE-862
CVE-2023-5890,Cross-site Scripting (XSS) - Stored in GitHub repository pkp/pkp-lib prior to 3.3.0-16.,5.4,CWE-79
CVE-2023-32497,Auth. (admin+) Stored Cross-Site Scripting (XSS) vulnerability in Supersoju Block Referer Spam plugin <= 1.1.9.4 versions.,5.1,CWE-79
CVE-2023-6452,Improper Neutralization of Input During Web Page Generation ('Cross-site Scripting') vulnerability in Forcepoint Web Security (Transaction Viewer) allows Stored XSS.      The  Forcepoint Web Security portal allows administrators to generate  detailed reports on user requests made through the Web proxy. It has  been determined that the user agent field in the Transaction Viewer is  vulnerable to a persistent Cross-Site Scripting (XSS) vulnerability  which can be exploited by any user who can route traffic through the  Forcepoint Web proxy.  This  vulnerability enables unauthorized attackers to execute JavaScript  within the browser context of a Forcepoint administrator thereby  allowing them to perform actions on the administrator's behalf. Such a  breach could lead to unauthorized access or modifications posing a  significant security risk.       This issue affects Web Security: before 8.5.6.,9.6,CWE-79
CVE-2024-6743,AguardNet's Space Management System does not properly validate user input allowing unauthenticated remote attackers to inject arbitrary SQL commands to read modify and delete database contents.,9.8,CWE-89
CVE-2024-42160,In the Linux kernel the following vulnerability has been resolved:  f2fs: check validation of fault attrs in f2fs_build_fault_attr()  - It missed to check validation of fault attrs in parse_options() let's fix to add check condition in f2fs_build_fault_attr(). - Use f2fs_build_fault_attr() in __sbi_store() to clean up code.,7.8,CWE-754
CVE-2025-23193,SAP NetWeaver Server ABAP allows an unauthenticated attacker to exploit a vulnerability that causes the server to respond differently based on the existence of a specified user potentially revealing sensitive information. This issue does not enable data modification and has no impact on server availability.,5.3,CWE-204
CVE-2025-1899,A vulnerability has been found in Tenda TX3 16.03.13.11_multi and classified as critical. Affected by this vulnerability is an unknown functionality of the file /goform/setPptpUserList. The manipulation of the argument list leads to buffer overflow. The attack can be launched remotely. The exploit has been disclosed to the public and may be used.,6.5,CWE-119
CVE-2022-34875,This vulnerability allows remote attackers to disclose sensitive information on affected installations of Foxit PDF Reader 11.2.1.53537. User interaction is required to exploit this vulnerability in that the target must visit a malicious page or open a malicious file. The specific flaw exists within the handling of ADBC objects. By performing actions in JavaScript an attacker can trigger a read past the end of an allocated object. An attacker can leverage this in conjunction with other vulnerabilities to execute arbitrary code in the context of the current process. Was ZDI-CAN-16981.,3.3,CWE-125
CVE-2024-3445,A vulnerability was found in SourceCodester Laundry Management System 1.0. It has been declared as critical. This vulnerability affects unknown code of the file /karyawan/laporan_filter. The manipulation of the argument data_karyawan leads to sql injection. The attack can be initiated remotely. The exploit has been disclosed to the public and may be used. VDB-259702 is the identifier assigned to this vulnerability.,6.3,CWE-89
CVE-2024-28229,In JetBrains YouTrack before 2024.1.25893 user without appropriate permissions could restore issues and articles,6.5,CWE-863
CVE-2022-0815,Improper access control vulnerability in McAfee WebAdvisor Chrome and Edge browser extensions up to 8.1.0.1895 allows a remote attacker to gain access to McAfee WebAdvisor settings and other details about the user’s system. This could lead to unexpected behaviors including; settings being changed fingerprinting of the system leading to targeted scams and not triggering the malicious software if McAfee software is detected.,6.5,CWE-668
CVE-2024-23108,An improper neutralization of special elements used in an os command ('os command injection') in Fortinet FortiSIEM version 7.1.0 through 7.1.1 and 7.0.0 through 7.0.2 and 6.7.0 through 6.7.8 and 6.6.0 through 6.6.3 and 6.5.0 through 6.5.2 and 6.4.0 through 6.4.2 allows attacker to execute unauthorized code or commands via via crafted API requests.,10.0,CWE-78
CVE-2023-27997,A heap-based buffer overflow vulnerability [CWE-122] in FortiOS version 7.2.4 and below version 7.0.11 and below version 6.4.12 and below version 6.0.16 and below and FortiProxy version 7.2.3 and below version 7.0.9 and below version 2.0.12 and below version 1.2 all versions version 1.1 all versions SSL-VPN may allow a remote attacker to execute arbitrary code or commands via specifically crafted requests.,9.8,CWE-122
CVE-2024-3532,A vulnerability classified as problematic has been found in Campcodes Complete Online Student Management System 1.0. Affected is an unknown function of the file attendance_view.php. The manipulation of the argument FirstRecord leads to cross site scripting. It is possible to launch the attack remotely. The exploit has been disclosed to the public and may be used. VDB-259902 is the identifier assigned to this vulnerability.,3.5,CWE-79
CVE-2023-2754,The Cloudflare WARP client for Windows assigns loopback IPv4 addresses for the DNS Servers since WARP acts as local DNS server that performs DNS queries in a secure manner however if a user is connected to WARP over an IPv6-capable network te WARP client did not assign loopback IPv6 addresses but Unique Local Addresses which under certain conditions could point towards unknown devices in the same local network which enables an Attacker to view DNS queries made by the device.   ,7.4,CWE-319
CVE-2023-51281,Cross Site Scripting vulnerability in Customer Support System v.1.0 allows a remote attacker to escalate privileges via a crafted script firstname lastname middlename contact and address parameters.,5.4,CWE-79
CVE-2024-30632,Tenda FH1205 v2.0.0.7(775) has a stack overflow vulnerability in the security_5g parameter from formWifiBasicSet function.,6.5,CWE-121
CVE-2024-31414,The Eaton Foreseer software provides users the capability to customize the dashboard in WebView pages. However the input fields for this feature in the Eaton Foreseer software lacked proper input sanitization on the server-side which could lead to injection and execution of malicious scripts when abused by bad actors.,6.7,CWE-79
CVE-2022-46179,LiuOS is a small Python project meant to imitate the functions of a regular operating system. Version 0.1.0 and prior of LiuOS allow an attacker to set the GITHUB_ACTIONS environment variable to anything other than null or true and skip authentication checks. This issue is patched in the latest commit (c658b4f3e57258acf5f6207a90c2f2169698ae22) by requiring the var to be set to true causing a test script to run instead of being able to login. A potential workaround is to check for the GITHUB_ACTIONS environment variable and set it to  (no quotes) to null the variable and force credential checks.,9.2,CWE-639
CVE-2023-41983,The issue was addressed with improved memory handling. This issue is fixed in macOS Sonoma 14.1 Safari 17.1 iOS 16.7.2 and iPadOS 16.7.2 iOS 17.1 and iPadOS 17.1. Processing web content may lead to a denial-of-service.,6.5,CWE-119
CVE-2022-41591,The backup module has a path traversal vulnerability. Successful exploitation of this vulnerability causes unauthorized access to other system files.,7.5,CWE-22
CVE-2023-45681,stb_vorbis is a single file MIT licensed library for processing ogg vorbis files. A crafted file may trigger memory write past an allocated heap buffer in `start_decoder`. The root cause is a potential integer overflow in `sizeof(char*) * (f->comment_list_length)` which may make `setup_malloc` allocate less memory than required. Since there is another integer overflow an attacker may overflow it too to force `setup_malloc` to return 0 and make the exploit more reliable. This issue may lead to code execution.,7.3,CWE-787
CVE-2023-42800,Moonlight-common-c contains the core GameStream client code shared between Moonlight clients. Moonlight-common-c is vulnerable to buffer overflow starting in commit 50c0a51b10ecc5b3415ea78c21d96d679e2288f9 due to unmitigated usage of unsafe C functions and improper bounds checking. A malicious game streaming server could exploit a buffer overflow vulnerability to crash a moonlight client or achieve remote code execution (RCE) on the client (with insufficient exploit mitigations or if mitigations can be bypassed). The bug was addressed in commit 24750d4b748fefa03d09fcfd6d45056faca354e0.,8.8,CWE-120
CVE-2021-44568,Two heap-overflow vulnerabilities exist in openSUSE/libsolv libsolv through 13 Dec 2020 in the decisionmap variable via the resolve_dependencies function at src/solver.c (line 1940 & line 1995) which could cause a remote Denial of Service.,6.5,CWE-787
CVE-2022-20303,In ContentService there is a possible way to determine if an account is on the device without GET_ACCOUNTS permission due to a missing permission check. This could lead to local information disclosure with User execution privileges needed. User interaction is not needed for exploitation.Product: AndroidVersions: Android-13Android ID: A-200573021,5.5,CWE-862
CVE-2024-12330,The WP Database Backup – Unlimited Database & Files Backup by Backup for WP plugin for WordPress is vulnerable to Sensitive Information Exposure in all versions up to and including 7.3 via publicly accessible back-up files. This makes it possible for unauthenticated attackers to extract sensitive data including all information stored in the database.,7.5,CWE-530
CVE-2022-38200,A cross site scripting vulnerability exists in some map service configurations of ArcGIS Server versions 10.8.1 and 10.7.1. Specifically crafted web requests can execute arbitrary JavaScript in the context of the victim's browser.,6.1,CWE-79
CVE-2023-5333,Mattermost fails to deduplicate input IDs allowing a simple user to cause the application to consume excessive resources and possibly crash by sending a specially crafted request to /api/v4/users/ids with multiple identical IDs.   ,4.3,CWE-400
CVE-2021-33632,Time-of-check Time-of-use (TOCTOU) Race Condition vulnerability in openEuler iSulad on Linux allows Leveraging Time-of-Check and Time-of-Use (TOCTOU) Race Conditions. This vulnerability is associated with program files https://gitee.Com/openeuler/iSulad/blob/master/src/cmd/isulad/main.C.  This issue affects iSulad: 2.0.18-13 from 2.1.4-1 through 2.1.4-2.  ,7.0,CWE-367
CVE-2023-20524,An attacker with a compromised ASP could possibly send malformed commands to an ASP on another CPU resulting in an out of bounds write potentially leading to a loss a loss of integrity.        ,7.5,CWE-787
CVE-2022-48888,In the Linux kernel the following vulnerability has been resolved:  drm/msm/dpu: Fix memory leak in msm_mdss_parse_data_bus_icc_path  of_icc_get() alloc resources for path1 we should release it when not need anymore. Early return when IS_ERR_OR_NULL(path0) may leak path1. Defer getting path1 to fix this.  Patchwork: https://patchwork.freedesktop.org/patch/514264/,5.5,CWE-401
CVE-2023-1118,A flaw use after free in the Linux kernel integrated infrared receiver/transceiver driver was found in the way user detaching rc device. A local user could use this flaw to crash the system or potentially escalate their privileges on the system.,7.8,CWE-416
CVE-2022-24402,The TETRA TEA1 keystream generator implements a key register initialization function that compresses the 80-bit key to only 32 bits for usage during the keystream generation phase which is insufficient to safeguard against exhaustive search attacks.,8.8,CWE-334
CVE-2022-40068,Tenda AC21 V16.03.08.15 is vulnerable to Buffer Overflow via /bin/httpd function: formSetQosBand.,7.5,CWE-787
CVE-2023-41792,Cross-Site Request Forgery (CSRF) vulnerability in Pandora FMS on all allows Cross-Site Scripting (XSS). This vulnerability allowed Javascript code to be executed in the SNMP Trap Editor. This issue affects Pandora FMS: from 700 through 773.,5.9,CWE-352
CVE-2023-49850,Missing Authorization vulnerability in Ashish Ajani WP Simple HTML Sitemap allows Exploiting Incorrectly Configured Access Control Security Levels.This issue affects WP Simple HTML Sitemap: from n/a through 2.7.,5.3,CWE-862
CVE-2025-0866,The Legoeso PDF Manager plugin for WordPress is vulnerable to time-based SQL Injection via the ‘checkedVals’ parameter in all versions up to and including 1.2.2 due to insufficient escaping on the user supplied parameter and lack of sufficient preparation on the existing SQL query.  This makes it possible for authenticated attackers with Author-level access and above to append additional SQL queries into already existing queries that can be used to extract sensitive information from the database.,6.5,CWE-89
CVE-2024-37547,Improper Limitation of a Pathname to a Restricted Directory ('Path Traversal') vulnerability in Livemesh Livemesh Addons for Elementor.This issue affects Livemesh Addons for Elementor: from n/a through 8.4.0.,6.5,CWE-22
CVE-2023-48464,Adobe Experience Manager versions 6.5.18 and earlier are affected by a Cross-site Scripting (DOM-based XSS) vulnerability. If a low-privileged attacker is able to convince a victim to visit a URL referencing a vulnerable page malicious JavaScript content may be executed within the context of the victim's browser.,5.4,CWE-79
CVE-2024-32689,Missing Authorization vulnerability in GenialSouls WP Social Comments.This issue affects WP Social Comments: from n/a through 1.7.3.  ,4.3,CWE-862
CVE-2023-2694,A vulnerability was found in SourceCodester Online Exam System 1.0. It has been classified as critical. This affects an unknown part of the file /dosen/data of the component POST Parameter Handler. The manipulation of the argument columns[1][data] leads to sql injection. It is possible to initiate the attack remotely. The exploit has been disclosed to the public and may be used. The associated identifier of this vulnerability is VDB-228975.,6.3,CWE-89
CVE-2024-12984,A vulnerability classified as problematic has been found in Amcrest IP2M-841B IP2M-841W IPC-IP2M-841B IPC-IP3M-943B IPC-IP3M-943S IPC-IP3M-HX2B and IPC-IPM-721S up to 20241211. This affects an unknown part of the file /web_caps/webCapsConfig of the component Web Interface. The manipulation leads to information disclosure. It is possible to initiate the attack remotely. The exploit has been disclosed to the public and may be used. The vendor was contacted early about this disclosure but did not respond in any way.,5.3,CWE-200
CVE-2021-44880,D-Link devices DIR_878 DIR_878_FW1.30B08_Hotfix_02 and DIR_882 DIR_882_FW1.30B06_Hotfix_02 were discovered to contain a command injection vulnerability in the system function. This vulnerability allows attackers to execute arbitrary commands via a crafted HNAP1 POST request.,9.8,CWE-77
CVE-2024-53752,Improper Neutralization of Input During Web Page Generation ('Cross-site Scripting') vulnerability in Berg Informatik Stripe Donation allows Stored XSS.This issue affects Stripe Donation: from n/a through 1.2.5.,6.5,CWE-79
