CVE,Description,CVSS3_BaseScore,CWE
CVE-2024-35967,In the Linux kernel the following vulnerability has been resolved:  Bluetooth: SCO: Fix not validating setsockopt user input  syzbot reported sco_sock_setsockopt() is copying data without checking user input length.  BUG: KASAN: slab-out-of-bounds in copy_from_sockptr_offset include/linux/sockptr.h:49 [inline] BUG: KASAN: slab-out-of-bounds in copy_from_sockptr include/linux/sockptr.h:55 [inline] BUG: KASAN: slab-out-of-bounds in sco_sock_setsockopt+0xc0b/0xf90 net/bluetooth/sco.c:893 Read of size 4 at addr ffff88805f7b15a3 by task syz-executor.5/12578,7.1,CWE-125
CVE-2024-53743,Improper Neutralization of Input During Web Page Generation ('Cross-site Scripting') vulnerability in FlickDevs Countdown Timer for Elementor allows Stored XSS.This issue affects Countdown Timer for Elementor: from n/a through 1.3.6.,6.5,CWE-79
CVE-2025-12499,The Rich Shortcodes for Google Reviews plugin for WordPress is vulnerable to Stored Cross-Site Scripting via the contents of a Google Review in all versions up to and including 6.8 due to insufficient input sanitization and output escaping. This makes it possible for unauthenticated attackers to inject arbitrary web scripts in pages that will execute whenever a user accesses an injected page. NOTE: This vulnerability was partially patched in version 6.6.2.,7.2,CWE-79
CVE-2025-53658,Jenkins Applitools Eyes Plugin 1.16.5 and earlier does not escape the Applitools URL on the build page resulting in a stored cross-site scripting (XSS) vulnerability exploitable by attackers with Item/Configure permission.,5.4,CWE-79
CVE-2022-40758,A Buffer Access with Incorrect Length Value vulnerablity in the TEE_CipherUpdate function in Samsung mTower through 0.3.0 allows a trusted application to trigger a Denial of Service (DoS) by invoking the function TEE_CipherUpdate with an excessive size value of srcLen.,7.5,CWE-119
CVE-2025-2009,The Newsletters plugin for WordPress is vulnerable to Stored Cross-Site Scripting via the logging functionality in all versions up to and including 4.9.9.7 due to insufficient input sanitization and output escaping. This makes it possible for unauthenticated attackers to inject arbitrary web scripts in pages that will execute whenever a user accesses an injected page.,7.2,CWE-79
CVE-2023-44351,Adobe ColdFusion versions 2023.5 (and earlier) and 2021.11 (and earlier) are affected by an Deserialization of Untrusted Data vulnerability that could result in Arbitrary code execution. Exploitation of this issue does not require user interaction.,9.8,CWE-502
CVE-2023-1114,Missing Authorization vulnerability in Eskom e-Belediye allows Information Elicitation.This issue affects e-Belediye: from 1.0.0.95 before 1.0.0.100.  ,9.8,CWE-862
CVE-2023-40487,Maxon Cinema 4D SKP File Parsing Use-After-Free Remote Code Execution Vulnerability. This vulnerability allows remote attackers to execute arbitrary code on affected installations of Maxon Cinema 4D. User interaction is required to exploit this vulnerability in that the target must visit a malicious page or open a malicious file.  The specific flaw exists within the parsing of SKP files. The issue results from the lack of validating the existence of an object prior to performing operations on the object. An attacker can leverage this vulnerability to execute code in the context of the current process. Was ZDI-CAN-21435.,7.8,CWE-416
CVE-2024-50521,Improper Neutralization of Input During Web Page Generation ('Cross-site Scripting') vulnerability in alleythemes Alley Elementor Widget allows DOM-Based XSS.This issue affects Alley Elementor Widget: from n/a through 1.0.7.,6.5,CWE-79
CVE-2024-45107,Acrobat Reader versions 20.005.30636 24.002.20964 24.001.30123 24.002.20991 and earlier are affected by a Use After Free vulnerability that could lead to disclosure of sensitive memory. An attacker could leverage this vulnerability to bypass mitigations such as ASLR. Exploitation of this issue requires user interaction in that a victim must open a malicious file.,5.5,CWE-416
CVE-2024-9308,An open redirect vulnerability in haotian-liu/llava version v1.2.0 (LLaVA-1.6) allows a remote unauthenticated attacker to redirect users to arbitrary websites via a specially crafted URL. This can be exploited for phishing attacks malware distribution and credential theft.,6.1,CWE-601
CVE-2024-47967,Improper resource initialization handling in firmware of some Solidigm DC Products may allow an attacker to potentially enable denial of service.,4.4,CWE-770
CVE-2024-48542,Incorrect access control in the firmware update and download processes of Yamaha Headphones Controller v1.6.7 allows attackers to access sensitive information by analyzing the code and data within the APK file.,8.4,CWE-863
CVE-2025-9806,A vulnerability was determined in Tenda F1202 1.2.0.9/1.2.0.14/1.2.0.20. Impacted is an unknown function of the file /etc_ro/shadow of the component Administrative Interface. This manipulation with the input Fireitup causes hard-coded credentials. The attack can only be executed locally. A high degree of complexity is needed for the attack. The exploitability is considered difficult. The exploit has been publicly disclosed and may be utilized.,1.9,CWE-259
CVE-2024-0303,A vulnerability which was classified as critical was found in Youke365 up to 1.5.3. Affected is an unknown function of the file /app/api/controller/caiji.php of the component Parameter Handler. The manipulation of the argument url leads to server-side request forgery. It is possible to launch the attack remotely. The exploit has been disclosed to the public and may be used. VDB-249870 is the identifier assigned to this vulnerability.,6.3,CWE-918
CVE-2024-2822,A vulnerability which was classified as problematic was found in DedeCMS 5.7. This affects an unknown part of the file /src/dede/vote_edit.php. The manipulation of the argument aid leads to cross-site request forgery. It is possible to initiate the attack remotely. The exploit has been disclosed to the public and may be used. The identifier VDB-257709 was assigned to this vulnerability. NOTE: The vendor was contacted early about this disclosure but did not respond in any way.,4.3,CWE-352
CVE-2025-70299,A heap overflow in the avi_parse_input_file() function of GPAC v2.4.0 allows attackers to cause a Denial of Service (DoS) via a crafted AVI file.,6.5,CWE-122
CVE-2024-10630,A race condition in Ivanti Application Control Engine before version 10.14.4.0 allows a local authenticated attacker to bypass the application blocking functionality.,7.8,CWE-366
CVE-2021-47483,In the Linux kernel the following vulnerability has been resolved:  regmap: Fix possible double-free in regcache_rbtree_exit()  In regcache_rbtree_insert_to_block() when 'present' realloc failed the 'blk' which is supposed to assign to 'rbnode->block' will be freed so 'rbnode->block' points a freed memory in the error handling path of regcache_rbtree_init() 'rbnode->block' will be freed again in regcache_rbtree_exit() KASAN will report double-free as follows:  BUG: KASAN: double-free or invalid-free in kfree+0xce/0x390 Call Trace:  slab_free_freelist_hook+0x10d/0x240  kfree+0xce/0x390  regcache_rbtree_exit+0x15d/0x1a0  regcache_rbtree_init+0x224/0x2c0  regcache_init+0x88d/0x1310  __regmap_init+0x3151/0x4a80  __devm_regmap_init+0x7d/0x100  madera_spi_probe+0x10f/0x333 [madera_spi]  spi_probe+0x183/0x210  really_probe+0x285/0xc30  To fix this moving up the assignment of rbnode->block to immediately after the reallocation has succeeded so that the data structure stays valid even if the second reallocation fails.,7.8,CWE-415
CVE-2025-20279,A vulnerability in the web-based management interface of Cisco Unified CCX could allow an authenticated remote attacker to conduct a stored XSS attack on an affected system. To exploit this vulnerability the attacker must have valid administrative credentials.    This vulnerability is due to improper sanitization of user input to the web-based management interface. An attacker could exploit this vulnerability by submitting a malicious script through the interface. A successful exploit could allow the attacker to conduct a stored XSS attack on the affected system.,4.8,CWE-79
CVE-2022-25908,All versions of the package create-choo-electron are vulnerable to Command Injection via the devInstall  function due to improper user-input sanitization.  ,7.4,CWE-78
CVE-2025-22992,A SQL Injection vulnerability exists in the /feed/insert.json endpoint of the Emoncms project >= 11.6.9. The vulnerability is caused by improper handling of user-supplied input in the data query parameter allowing attackers to execute arbitrary SQL commands under specific conditions.,9.8,CWE-89
CVE-2024-46060,Anaconda3 macOS installers before 2024.06-1 contain a local privilege escalation vulnerability when installed outside the user's home directory. During installation world-writable files are created and executed with root privileges. This allows a local low-privileged user to inject arbitrary commands leading to code execution as the root user.,7.8,CWE-77
CVE-2023-4203,Advantech EKI-1524 EKI-1522 EKI-1521 devices through 1.21 are affected by a Stored Cross-Site Scripting vulnerability which can be triggered by authenticated users in the ping tool of the web-interface.,9.0,CWE-79
CVE-2025-24639,Insertion of Sensitive Information Into Sent Data vulnerability in GREYS Korea for WooCommerce allows Retrieve Embedded Sensitive Data. This issue affects Korea for WooCommerce: from n/a through 1.1.11.,6.5,CWE-201
CVE-2023-32840,In modem CCCI there is a possible out of bounds write due to a missing bounds check. This could lead to local escalation of privilege with System execution privileges needed. User interaction may be also needed for exploitation Patch ID: MOLY01138425; Issue ID: MOLY01138425 (MSV-862).,6.5,CWE-787
CVE-2024-48769,An issue in BURG-WCHTER KG de.burgwachter.keyapp.app 4.5.0 allows a remote attacker to obtain sensitve information via the firmware update process.,9.1,CWE-863
CVE-2024-45615,A vulnerability was found in OpenSC OpenSC tools PKCS#11 module minidriver and CTK.  The problem is missing  initialization of variables expected to be initialized (as arguments to other functions etc.).,3.9,CWE-457
CVE-2019-25256,VideoFlow Digital Video Protection DVP 2.10 contains an authenticated directory traversal vulnerability that allows attackers to access arbitrary system files through unvalidated 'ID' parameters. Attackers can exploit multiple Perl scripts like downloadsys.pl to read sensitive files by manipulating directory path traversal in download requests.,6.5,CWE-22
CVE-2022-0693,The Master Elements WordPress plugin through 8.0 does not validate and escape the meta_ids parameter of its remove_post_meta_condition AJAX action (available to both unauthenticated and authenticated users) before using it in a SQL statement leading to an unauthenticated SQL Injection,9.8,CWE-89
CVE-2024-5026,The CM Tooltip Glossary WordPress plugin before 4.3.4 does not sanitise and escape some of its settings which could allow high privilege users such as admin to perform Stored Cross-Site Scripting attacks even when the unfiltered_html capability is disallowed (for example in multisite setup),4.8,CWE-79
CVE-2023-44157,Local privilege escalation due to insecure folder permissions. The following products are affected: Acronis Cyber Protect 15 (Windows) before build 35979.,7.8,CWE-276
CVE-2024-24777,A cross-site request forgery (CSRF) vulnerability exists in the Web Application functionality of the LevelOne WBR-6012 R0.40e6. A specially crafted HTTP request can lead to unauthorized access. An attacker can stage a malicious web page to trigger this vulnerability.,8.8,CWE-352
CVE-2024-46452,A Host Header injection vulnerability in the password reset function of VigyBag Open Source Online Shop commit 3f0e21b allows attackers to redirect victim users to a malicious site via a crafted URL.,6.1,CWE-74
CVE-2025-8152,The WP CTA – Call To Action Plugin Sticky CTA Sticky Buttons plugin for WordPress is vulnerable to unauthorized modification of data due to a missing capability check on the 'update_cta_status' and 'change_sticky_sidebar_name' functions in all versions up to and including 1.7.0. This makes it possible for unauthenticated attackers to update the status of a sticky and update the name displayed in the back-end WP CTA Dashboard.,5.3,CWE-862
CVE-2025-45585,Multiple stored cross-site scripting (XSS) vulnerabilities in Audi UTR 2.0 Universal Traffic Recorder 2.0 allows attackers to execute arbitrary web scripts or HTML via injecting a crafted payload into the wifi_sta_ssid or wifi_ap_ssid parameters.,5.4,CWE-79
CVE-2022-48261,There is a misinterpretation of input vulnerability in BiSheng-WNM FW 3.0.0.325. Successful exploitation of this vulnerability may cause the printer service to be abnormal.,7.5,CWE-436
CVE-2025-33204,NVIDIA NeMo Framework for all platforms contains a vulnerability in the NLP and LLM components where malicious data created by an attacker could cause code injection. A successful exploit of this vulnerability may lead to code execution escalation of privileges information disclosure and data tampering.,7.8,CWE-94
CVE-2023-40957,A SQL injection vulnerability in Didotech srl Engineering & Lifecycle Management (aka pdm) v.14.0 v.15.0 and v.16.0 fixed in pdm-14.0.1.0.0 pdm-15.0.1.0.0 and pdm-16.0.1.0.0 allows a remote authenticated attacker to execute arbitrary code via the request parameter in models/base_client.py component.,8.8,CWE-89
CVE-2023-7269,The ArtPlacer Widget WordPress plugin before 2.21.2 does not have CSRF check in some places and is missing sanitisation as well as escaping which could allow attackers to make logged in admin add Stored XSS payloads via a CSRF attack,7.5,CWE-352
CVE-2025-30908,Cross-Site Request Forgery (CSRF) vulnerability in Shamalli Web Directory Free allows Stored XSS. This issue affects Web Directory Free: from n/a through 1.7.6.,7.1,CWE-352
CVE-2022-26514,Delta Electronics DIAEnergie (All versions prior to 1.8.02.004) has a blind SQL injection vulnerability that exists in DIAE_tagHandler.ashx. This allows an attacker to inject arbitrary SQL queries retrieve and modify database contents and execute system commands.,9.8,CWE-89
CVE-2024-4147,In lunary-ai/lunary version 1.2.13 an insufficient granularity of access control vulnerability allows users to delete prompts created in other organizations through ID manipulation. The vulnerability stems from the application's failure to validate the ownership of the prompt before deletion only checking if the user has permissions to delete such resources without verifying if it belongs to the user's project or organization. As a result users can remove prompts not owned by their organization or project leading to legitimate users being unable to access the removed prompts and causing information inconsistencies.,6.5,CWE-1220
CVE-2025-4147,A vulnerability has been found in Netgear EX6200 1.0.3.94 and classified as critical. Affected by this vulnerability is the function sub_47F7C. The manipulation of the argument host leads to buffer overflow. The attack can be launched remotely. The vendor was contacted early about this disclosure but did not respond in any way.,8.8,CWE-119
CVE-2025-21188,Azure Network Watcher VM Extension Elevation of Privilege Vulnerability,6.0,CWE-59
CVE-2024-27051,In the Linux kernel the following vulnerability has been resolved:  cpufreq: brcmstb-avs-cpufreq: add check for cpufreq_cpu_get's return value  cpufreq_cpu_get may return NULL. To avoid NULL-dereference check it and return 0 in case of error.  Found by Linux Verification Center (linuxtesting.org) with SVACE.,5.5,CWE-476
CVE-2022-28133,Jenkins Bitbucket Server Integration Plugin 3.1.0 and earlier does not limit URL schemes for callback URLs on OAuth consumers resulting in a stored cross-site scripting (XSS) vulnerability exploitable by attackers able to create BitBucket Server consumers.,5.4,CWE-79
CVE-2022-40644,This vulnerability allows remote attackers to execute arbitrary code on affected installations of Ansys SpaceClaim 2022 R1. User interaction is required to exploit this vulnerability in that the target must visit a malicious page or open a malicious file. The specific flaw exists within the parsing of X_B files. The issue results from the lack of proper validation of user-supplied data which can result in a write past the end of an allocated data structure. An attacker can leverage this vulnerability to execute code in the context of the current process. Was ZDI-CAN-17408.,7.8,CWE-787
CVE-2022-39091,In power management service there is a missing permission check. This could lead to set up power management service with no additional execution privileges needed.,7.8,CWE-862
CVE-2024-29944,An attacker was able to inject an event handler into a privileged object that would allow arbitrary JavaScript execution in the parent process. Note: This vulnerability affects Desktop Firefox only it does not affect mobile versions of Firefox. This vulnerability affects Firefox < 124.0.1 and Firefox ESR < 115.9.1.,8.4,CWE-830
CVE-2024-4443,The Business Directory Plugin – Easy Listing Directories for WordPress plugin for WordPress is vulnerable to time-based SQL Injection via the ‘listingfields’ parameter in all versions up to and including 6.4.2 due to insufficient escaping on the user supplied parameter and lack of sufficient preparation on the existing SQL query.  This makes it possible for unauthenticated attackers to append additional SQL queries into already existing queries that can be used to extract sensitive information from the database.,9.8,CWE-89
CVE-2024-20079,In gnss service there is a possible out of bounds write due to improper input validation. This could lead to local escalation of privilege with System execution privileges needed. User interaction is not needed for exploitation. Patch ID: ALPS08044040; Issue ID: MSV-1491.,6.7,CWE-787
CVE-2025-21601,An Improper Following of Specification by Caller vulnerability in web management (J-Web Captive Portal 802.1X Juniper Secure Connect (JSC) of Juniper Networks Junos OS on SRX Series EX Series MX240 MX480 MX960 QFX5120 Series allows an unauthenticated network-based attacker sending genuine traffic targeted to the device to cause the CPU to climb until the device becomes unresponsive.   Continuous receipt of these packets will create a sustained Denial of Service (DoS) condition.     This issue affects Junos OS:       *  All versions before 21.4R3-S9   *  from 22.2 before 22.2R3-S5   *  from 22.4 before 22.4R3-S4   *  from 23.2 before 23.2R2-S3   *  from 23.4 before 23.4R2-S3   *  from 24.2 before 24.2R1-S1 24.2R2.   An indicator of compromise is to review the CPU % of the httpd process in the CLI: e.g.   show system processes extensive | match httpd  PID nobody       52    0    20M    191M select   2   0:01   80.00% httpd{httpd} <<<<< the percentage of httpd usage if high may be an indicator,7.5,CWE-573
CVE-2023-35814,DevExpress before 23.1.3 does not properly protect XtraReport serialized data in ASP.NET web forms.,3.5,CWE-502
CVE-2023-48598,Adobe Experience Manager versions 6.5.18 and earlier are affected by a stored Cross-Site Scripting (XSS) vulnerability that could be abused by a low-privileged attacker to inject malicious scripts into vulnerable form fields. Malicious JavaScript may be executed in a victim’s browser when they browse to the page containing the vulnerable field.,5.4,CWE-79
CVE-2024-37629,SummerNote v0.9.1 is vulnerable to Cross Site Scripting (XSS) via the Code View Function.,6.1,CWE-79
CVE-2022-1637,Inappropriate implementation in Web Contents in Google Chrome prior to 101.0.4951.64 allowed a remote attacker to leak cross-origin data via a crafted HTML page.,4.3,CWE-668
CVE-2022-38250,Nagios XI v5.8.6 was discovered to contain a SQL injection vulnerability via the mib_name parameter at the Manage MIBs page.,9.8,CWE-89
CVE-2024-27515,Osclass 5.1.2 is vulnerable to SQL Injection.,7.2,CWE-89
CVE-2025-38393,In the Linux kernel the following vulnerability has been resolved:  NFSv4/pNFS: Fix a race to wake on NFS_LAYOUT_DRAIN  We found a few different systems hung up in writeback waiting on the same page lock and one task waiting on the NFS_LAYOUT_DRAIN bit in pnfs_update_layout() however the pnfs_layout_hdr's plh_outstanding count was zero.  It seems most likely that this is another race between the waiter and waker similar to commit ed0172af5d6f (SUNRPC: Fix a race to wake a sync task). Fix it up by applying the advised barrier.,4.7,CWE-362
CVE-2025-6073,Stack-based Buffer Overflow vulnerability in ABB RMC-100 ABB RMC-100 LITE.  When the REST interface is enabled by the user and an attacker gains access to the control network and user/password broker authentication is enabled and CVE-2025-6074 is exploited the attacker can overflow the buffer for username or password.     This issue affects RMC-100: from 2105457-043 through 2105457-045; RMC-100 LITE: from 2106229-015 through 2106229-016.,7.5,CWE-121
CVE-2024-9397,A missing delay in directory upload UI could have made it possible for an attacker to trick a user into granting permission via clickjacking. This vulnerability affects Firefox < 131 Firefox ESR < 128.3 Thunderbird < 128.3 and Thunderbird < 131.,6.1,CWE-1021
CVE-2023-4733,Use After Free in GitHub repository vim/vim prior to 9.0.1840.,7.8,CWE-416
CVE-2025-48141,Improper Neutralization of Special Elements used in an SQL Command ('SQL Injection') vulnerability in Alex Zaytseff Multi CryptoCurrency Payments allows SQL Injection. This issue affects Multi CryptoCurrency Payments: from n/a through 2.0.3.,9.3,CWE-89
CVE-2025-4542,A vulnerability which was classified as problematic has been found in Freeebird Hotel 酒店管理系统 API up to 1.2. Affected by this issue is some unknown functionality of the file /src/main/java/cn/mafangui/hotel/tool/SessionInterceptor.java. The manipulation leads to permissive cross-domain policy with untrusted domains. The attack may be launched remotely. The complexity of an attack is rather high. The exploitation is known to be difficult. The exploit has been disclosed to the public and may be used.,3.1,CWE-346
CVE-2025-25878,A vulnerability was found in ITSourcecode Simple ChatBox up to 1.0. This vulnerability affects unknown code of the file /del.php. The attack can use SQL injection to obtain sensitive data.,3.8,CWE-89
CVE-2024-45710,SolarWinds Platform is susceptible to an Uncontrolled Search Path Element Local Privilege Escalation vulnerability. This requires a low privilege account and local access to the affected node machine.,7.8,CWE-427
CVE-2024-38600,In the Linux kernel the following vulnerability has been resolved:  ALSA: Fix deadlocks with kctl removals at disconnection  In snd_card_disconnect() we set card->shutdown flag at the beginning call callbacks and do sync for card->power_ref_sleep waiters at the end.  The callback may delete a kctl element and this can lead to a deadlock when the device was in the suspended state.  Namely:  * A process waits for the power up at snd_power_ref_and_wait() in   snd_ctl_info() or read/write() inside card->controls_rwsem.  * The system gets disconnected meanwhile and the driver tries to   delete a kctl via snd_ctl_remove*(); it tries to take   card->controls_rwsem again but this is already locked by the   above.  Since the sleeper isn't woken up this deadlocks.  An easy fix is to wake up sleepers before processing the driver disconnect callbacks but right after setting the card->shutdown flag. Then all sleepers will abort immediately and the code flows again.  So basically this patch moves the wait_event() call at the right timing.  While we're at it just to be sure call wait_event_all() instead of wait_event() although we don't use exclusive events on this queue for now.,5.5,CWE-667
CVE-2021-34925,This vulnerability allows remote attackers to execute arbitrary code on affected installations of Bentley View 10.15.0.75. User interaction is required to exploit this vulnerability in that the target must visit a malicious page or open a malicious file. The specific flaw exists within the parsing of JT files. The issue results from the lack of proper validation of the length of user-supplied data prior to copying it to a stack-based buffer. An attacker can leverage this vulnerability to execute code in the context of the current process. Was ZDI-CAN-14903.,7.8,CWE-121
CVE-2024-25567, Path traversal attack is possible and write outside of the intended directory and may access sensitive information. If a file name is specified that already exists on the file system then the original file will be overwritten.  ,8.1,CWE-22
CVE-2012-10003,A vulnerability which was classified as problematic has been found in ahmyi RivetTracker. This issue affects some unknown processing. The manipulation of the argument $_SERVER['PHP_SELF'] leads to cross site scripting. The attack may be initiated remotely. The patch is named f053c5cc2bc44269b0496b5f275e349928a92ef9. It is recommended to apply a patch to fix this issue. The associated identifier of this vulnerability is VDB-217271.,3.5,CWE-79
CVE-2024-20846,Out-of-bounds write vulnerability while decoding hcr of libsavsac.so prior to SMR Apr-2024 Release 1 allows local attacker to execute arbitrary code.,5.9,CWE-787
