CVE,Description,CVSS3_BaseScore,CWE
CVE-2023-43641,libcue provides an API for parsing and extracting data from CUE sheets. Versions 2.2.1 and prior are vulnerable to out-of-bounds array access. A user of the GNOME desktop environment can be exploited by downloading a cue sheet from a malicious webpage. Because the file is saved to `~/Downloads` it is then automatically scanned by tracker-miners. And because it has a .cue filename extension tracker-miners use libcue to parse the file. The file exploits the vulnerability in libcue to gain code execution. This issue is patched in version 2.3.0.,8.8,CWE-787
CVE-2023-5114,The idbbee plugin for WordPress is vulnerable to Stored Cross-Site Scripting via the plugin's 'idbbee' shortcode in versions up to and including 1.0 due to insufficient input sanitization and output escaping on user supplied attributes. This makes it possible for authenticated attackers with contributor-level permissions and above to inject arbitrary web scripts in pages that will execute whenever a user accesses an injected page.,5.4,CWE-79
CVE-2025-49481,Improper Resource Shutdown or Release vulnerability in ASR180x 、ASR190x in router modules allows Resource Leak Exposure. This vulnerability is associated with program files router/phonebook/pbwork-queue.C.  This issue affects Falcon_Linux、Kestrel、Lapwing_Linux: before v1536.,5.4,CWE-404
CVE-2025-60500,QDocs Smart School Management System 7.1 allows authenticated users with roles such as accountant or admin to bypass file type restrictions in the media upload feature by abusing the alternate YouTube URL option. This logic flaw permits uploading of arbitrary PHP files which are stored in a web-accessible directory.,7.2,CWE-434
CVE-2023-50990,Tenda i29 v1.0 V1.0.0.5 was discovered to contain a buffer overflow via the rebootTime parameter in the sysScheduleRebootSet function.,9.8,CWE-787
CVE-2023-53112,In the Linux kernel the following vulnerability has been resolved:  drm/i915/sseu: fix max_subslices array-index-out-of-bounds access  It seems that commit bc3c5e0809ae (drm/i915/sseu: Don't try to store EU mask internally in UAPI format) exposed a potential out-of-bounds access reported by UBSAN as following on a laptop with a gen 11 i915 card:    UBSAN: array-index-out-of-bounds in drivers/gpu/drm/i915/gt/intel_sseu.c:65:27   index 6 is out of range for type 'u16 [6]'   CPU: 2 PID: 165 Comm: systemd-udevd Not tainted 6.2.0-9-generic #9-Ubuntu   Hardware name: Dell Inc. XPS 13 9300/077Y9N BIOS 1.11.0 03/22/2022   Call Trace:    <TASK>    show_stack+0x4e/0x61    dump_stack_lvl+0x4a/0x6f    dump_stack+0x10/0x18    ubsan_epilogue+0x9/0x3a    __ubsan_handle_out_of_bounds.cold+0x42/0x47    gen11_compute_sseu_info+0x121/0x130 [i915]    intel_sseu_info_init+0x15d/0x2b0 [i915]    intel_gt_init_mmio+0x23/0x40 [i915]    i915_driver_mmio_probe+0x129/0x400 [i915]    ? intel_gt_probe_all+0x91/0x2e0 [i915]    i915_driver_probe+0xe1/0x3f0 [i915]    ? drm_privacy_screen_get+0x16d/0x190 [drm]    ? acpi_dev_found+0x64/0x80    i915_pci_probe+0xac/0x1b0 [i915]    ...  According to the definition of sseu_dev_info eu_mask->hsw is limited to a maximum of GEN_MAX_SS_PER_HSW_SLICE (6) sub-slices but gen11_sseu_info_init() can potentially set 8 sub-slices in the !IS_JSL_EHL(gt->i915) case.  Fix this by reserving up to 8 slots for max_subslices in the eu_mask struct.  (cherry picked from commit 3cba09a6ac86ea1d456909626eb2685596c07822),7.1,CWE-125
CVE-2023-3356,The Subscribers Text Counter WordPress plugin before 1.7.1 does not have CSRF check in place when updating its settings which could allow attackers to make a logged in admin change them via a CSRF attack which also lead to Stored Cross-Site Scripting due to the lack of sanitisation and escaping,4.3,CWE-352
CVE-2025-63938,Tinyproxy through 1.11.2 contains an integer overflow vulnerability in the strip_return_port() function within src/reqs.c.,6.5,CWE-190
CVE-2025-34195,Vasion Print (formerly PrinterLogic) Virtual Appliance Host versions prior to 1.0.735 and Application prior to 20.0.1330 (Windows client deployments) contain a remote code execution vulnerability during driver installation caused by unquoted program paths. The PrinterInstallerClient driver-installation component launches programs using an unquoted path under C:\Program Files (x86)\Printer Properties Pro\Printer Installer. Because the path is unquoted the operating system may execute a program located at a short-path location such as C:\Program.exe before the intended binaries in the quoted path. If an attacker can place or cause a program to exist at that location it will be executed with the privileges of the installer process (which may be elevated) enabling arbitrary code execution and potential privilege escalation. This weakness can be used to achieve remote code execution and full compromise of affected Windows endpoints. This vulnerability has been identified by the vendor as: V-2022-006 — Driver Upload Security.,9.8,CWE-434
CVE-2024-23612,An improper error handling vulnerability in LabVIEW may result in remote code execution.  Successful exploitation requires an attacker to provide a user with a specially crafted VI.  This vulnerability affects LabVIEW 2024 Q1 and prior versions.,7.8,CWE-1285
CVE-2023-46491,ZenTao Biz version 4.1.3 and before has a Cross Site Scripting (XSS) vulnerability in the Version Library.,6.1,CWE-79
CVE-2024-4519,A vulnerability was found in Campcodes Complete Web-Based School Management System 1.0. It has been rated as problematic. This issue affects some unknown processing of the file /view/teacher_salary_details3.php. The manipulation of the argument month leads to cross site scripting. The attack may be initiated remotely. The exploit has been disclosed to the public and may be used. The associated identifier of this vulnerability is VDB-263123.,3.5,CWE-79
CVE-2024-39680,Cooked is a recipe plugin for WordPress. The Cooked plugin for WordPress is vulnerable to Cross-Site Request Forgery (CSRF) in versions up to and including 1.7.15.4 due to missing or incorrect nonce validation on the AJAX action handler. This vulnerability could allow an attacker to trick users into performing an action they didn't intend to perform under their current authentication. This issue has been addressed in release version 1.8.0. Users are advised to upgrade. There are no known workarounds for this vulnerability.,5.4,CWE-352
CVE-2024-52815,Synapse is an open-source Matrix homeserver. Synapse versions before 1.120.1 fail to properly validate invites received over federation. This vulnerability allows a malicious server to send a specially crafted invite that disrupts the invited user's /sync functionality. Synapse 1.120.1 rejects such invalid invites received over federation and restores the ability to sync for affected users.,5.3,CWE-20
CVE-2025-4514,A vulnerability which was classified as critical has been found in Zhengzhou Jiuhua Electronic Technology mayicms up to 5.8E. Affected by this issue is some unknown functionality of the file /javascript.php. The manipulation of the argument Value leads to sql injection. The attack may be launched remotely. The exploit has been disclosed to the public and may be used.,6.3,CWE-74
CVE-2020-23586,A vulnerability found in OPTILINK OP-XT71000N Hardware Version: V2.2  Firmware Version: OP_V3.3.1-191028 allows an unauthenticated remote attacker to conduct a cross-site request forgery (CSRF) attack to Add Network Traffic Control Type Rule.,4.3,CWE-352
CVE-2022-38021,Connected User Experiences and Telemetry Elevation of Privilege Vulnerability,7.0,CWE-362
CVE-2023-37218, Tadiran Telecom Aeonix - CWE-22 Improper Limitation of a Pathname to a Restricted Directory ('Path Traversal'),7.5,CWE-22
CVE-2023-4166,A vulnerability has been found in Tongda OA and classified as critical. This vulnerability affects unknown code of the file general/system/seal_manage/dianju/delete_log.php. The manipulation of the argument DELETE_STR leads to sql injection. The exploit has been disclosed to the public and may be used. Upgrading to version 11.10 is able to address this issue. It is recommended to upgrade the affected component. VDB-236182 is the identifier assigned to this vulnerability. NOTE: The vendor was contacted early about this disclosure but did not respond in any way.,5.5,CWE-89
CVE-2023-27913,A maliciously crafted X_B file when parsed through Autodesk® AutoCAD® 2023 can be used to cause an Integer Overflow. A malicious actor can leverage this vulnerability to cause a crash or read sensitive data or execute arbitrary code in the context of the current process.,7.8,CWE-190
CVE-2022-34485,Mozilla developers Bryce Seager van Dyk and the Mozilla Fuzzing Team reported potential vulnerabilities present in Firefox 101. Some of these bugs showed evidence of memory corruption and we presume that with enough effort some of these could have been exploited to run arbitrary code. This vulnerability affects Firefox < 102.,9.8,CWE-787
CVE-2022-32210,`Undici.ProxyAgent` never verifies the remote server's certificate and always exposes all request & response data to the proxy. This unexpectedly means that proxies can MitM all HTTPS traffic and if the proxy's URL is HTTP then it also means that nominally HTTPS requests are actually sent via plain-text HTTP between Undici and the proxy server.,6.5,CWE-295
CVE-2023-27559,IBM Db2 for Linux UNIX and Windows (includes Db2 Connect Server) 10.5 11.1 and 11.5 is vulnerable to a denial of service as the server may crash when using a specially crafted subquery.  IBM X-Force ID:  249196.,5.3,CWE-20
CVE-2025-57624,A DLL hijacking vulnerability in CYRISMA Agent before 444 allows local users to escalate privileges and execute arbitrary code via multiple DLLs.,7.8,CWE-427
CVE-2025-21934,In the Linux kernel the following vulnerability has been resolved:  rapidio: fix an API misues when rio_add_net() fails  rio_add_net() calls device_register() and fails when device_register() fails.  Thus put_device() should be used rather than kfree().  Add mport->net = NULL; to avoid a use after free issue.,7.8,CWE-416
CVE-2020-29050,SphinxSearch in Sphinx Technologies Sphinx through 3.1.1 allows directory traversal (in conjunction with CVE-2019-14511) because the mysql client can be used for CALL SNIPPETS and load_file operations on a full pathname (e.g. a file in the /etc directory). NOTE: this is unrelated to CMUSphinx.,7.5,CWE-22
CVE-2024-13660,The Responsive Flickr Slideshow plugin for WordPress is vulnerable to Stored Cross-Site Scripting via the plugin's 'fshow' shortcode in all versions up to and including 2.6.1 due to insufficient input sanitization and output escaping on user supplied attributes. This makes it possible for authenticated attackers with contributor-level access and above to inject arbitrary web scripts in pages that will execute whenever a user accesses an injected page.,6.4,CWE-79
CVE-2024-39428,In trusty service there is a possible out of bounds write due to a missing bounds check. This could lead to local denial of service with System execution privileges needed,6.8,CWE-787
CVE-2025-13248,A weakness has been identified in SourceCodester Patients Waiting Area Queue Management System 1.0. The impacted element is an unknown function of the file /php/api_patient_schedule.php. This manipulation of the argument appointmentID causes sql injection. The attack can be initiated remotely. The exploit has been made available to the public and could be exploited.,7.3,CWE-74
CVE-2022-42245,Dreamer CMS 4.0.01 is vulnerable to SQL Injection.,9.8,CWE-89
CVE-2024-0275,A vulnerability was found in Kashipara Food Management System up to 1.0. It has been rated as critical. Affected by this issue is some unknown functionality of the file item_edit_submit.php. The manipulation of the argument id leads to sql injection. The attack may be launched remotely. The exploit has been disclosed to the public and may be used. VDB-249830 is the identifier assigned to this vulnerability.,6.3,CWE-89
CVE-2024-7484,The CRM Perks Forms plugin for WordPress is vulnerable to arbitrary file uploads due to insufficient file validation on the 'handle_uploaded_files' function in versions up to and including 1.1.3. This makes it possible for authenticated attackers with administrator-level capabilities or above to upload arbitrary files on the affected site's server which may make remote code execution possible.,7.2,CWE-434
CVE-2024-41254,An issue was discovered in litestream v0.3.13. The usage of the ssh.InsecureIgnoreHostKey() disables host key verification possibly allowing attackers to obtain sensitive information via a man-in-the-middle attack.,5.3,CWE-347
CVE-2025-5174,A vulnerability was found in erdogant pypickle up to 1.1.5 and classified as problematic. Affected by this issue is the function load of the file pypickle/pypickle.py. The manipulation leads to deserialization. Local access is required to approach this attack. The exploit has been disclosed to the public and may be used. Upgrading to version 2.0.0 is able to address this issue. The patch is identified as 14b4cae704a0bb4eb6723e238f25382d847a1917. It is recommended to upgrade the affected component.,5.3,CWE-20
CVE-2025-58785,Missing Authorization vulnerability in jbhovik Ray Enterprise Translation allows Exploiting Incorrectly Configured Access Control Security Levels. This issue affects Ray Enterprise Translation: from n/a through 1.7.1.,5.4,CWE-862
CVE-2024-5331,The Breakdance plugin for WordPress is vulnerable to unauthorized access of data in all versions up to and including 1.7.2. This makes it possible for authenticated attackers with Contributor-level access and above to export form submissions.,4.3,CWE-284
CVE-2025-9686,A security flaw has been discovered in Portabilis i-Educar up to 2.10. This issue affects some unknown processing of the file /module/AreaConhecimento/edit of the component Listagem de áreas de conhecimento Page. Performing manipulation of the argument ID results in sql injection. The attack is possible to be carried out remotely. The exploit has been released to the public and may be exploited.,6.3,CWE-74
CVE-2023-52137,The [`tj-actions/verify-changed-files`](https://github.com/tj-actions/verify-changed-files) action allows for command injection in changed filenames allowing an attacker to execute arbitrary code and potentially leak secrets. The [`verify-changed-files`](https://github.com/tj-actions/verify-changed-files) workflow returns the list of files changed within a workflow execution. This could potentially allow filenames that contain special characters such as `;` which can be used by an attacker to take over the [GitHub Runner](https://docs.github.com/en/actions/using-github-hosted-runners/about-github-hosted-runners) if the output value is used in a raw fashion (thus being directly replaced before execution) inside a `run` block. By running custom commands an attacker may be able to steal secrets such as `GITHUB_TOKEN` if triggered on other events than `pull_request`.  This has been patched in versions [17](https://github.com/tj-actions/verify-changed-files/releases/tag/v17) and [17.0.0](https://github.com/tj-actions/verify-changed-files/releases/tag/v17.0.0) by enabling `safe_output` by default and returning filename paths escaping special characters for bash environments.,7.7,CWE-20
CVE-2025-23271,NVIDIA CUDA Toolkit for all platforms contains a vulnerability in the nvdisasm binary where a user may cause an out-of-bounds read by passing a malformed ELF file to nvdisasm. A successful exploit of this vulnerability may lead to a partial denial of service.,3.3,CWE-125
CVE-2025-13169,A security vulnerability has been detected in code-projects Simple Online Hotel Reservation System 1.0. This vulnerability affects unknown code of the file /add_query_reserve.php. Such manipulation of the argument room_id leads to sql injection. The attack can be executed remotely. The exploit has been disclosed publicly and may be used.,7.3,CWE-74
CVE-2022-38716,Cross-Site Request Forgery (CSRF) vulnerability in StylemixThemes Motors – Car Dealer Classifieds & Listing plugin <= 1.4.4 versions.,5.4,CWE-352
CVE-2022-36776,IBM Cloud Pak for Security (CP4S) 1.10.0.0 79and 1.10.2.0 is vulnerable to cross-site scripting. This vulnerability allows users to embed arbitrary JavaScript code in the Web UI thus altering the intended functionality potentially leading to credentials disclosure within a trusted session.  IBM X-Force ID:  233663.,5.4,CWE-79
CVE-2025-24985,Integer overflow or wraparound in Windows Fast FAT Driver allows an unauthorized attacker to execute code locally.,7.8,CWE-122
CVE-2024-45287,A malicious value of size in a structure of packed libnv can cause an integer overflow leading to the allocation of a smaller buffer than required for the parsed data.,7.5,CWE-131
CVE-2023-6027,A critical flaw has been identified in elijaa/phpmemcachedadmin affecting version 1.3.0 specifically related to a stored XSS vulnerability. This vulnerability allows malicious actors to insert a carefully crafted JavaScript payload. The issue arises from improper encoding of user-controlled entries in the /pmcadmin/configure.php parameter.,6.1,CWE-79
CVE-2024-38807,Applications that use spring-boot-loader or spring-boot-loader-classic and contain custom code that performs signature verification of nested jar files may be vulnerable to signature forgery where content that appears to have been signed by one signer has in fact been signed by another.,6.3,CWE-290
CVE-2025-53584,Deserialization of Untrusted Data vulnerability in emarket-design WP Ticket Customer Service Software & Support Ticket System allows Object Injection. This issue affects WP Ticket Customer Service Software & Support Ticket System: from n/a through 6.0.2.,8.1,CWE-502
CVE-2022-22960,VMware Workspace ONE Access Identity Manager and vRealize Automation contain a privilege escalation vulnerability due to improper permissions in support scripts. A malicious actor with local access can escalate privileges to 'root'.,7.8,CWE-732
CVE-2024-24696,Improper input validation in Zoom Desktop Client for Windows Zoom VDI Client for Windows and Zoom Meeting SDK for Windows may allow an authenticated user to conduct a disclosure of information via network access.  ,6.8,CWE-20
CVE-2022-23728,Attacker can reset the device with AT Command in the process of rebooting the device. The LG ID is LVE-SMP-210011.,6.1,CWE-684
CVE-2025-2572,In WhatsUp Gold versions released before 2024.0.3 a   database manipulation   vulnerability allows an unauthenticated attacker to modify the contents of WhatsUp.dbo.WrlsMacAddressGroup.,5.6,CWE-287
CVE-2025-58240,Improper Neutralization of Input During Web Page Generation ('Cross-site Scripting') vulnerability in Michel - xiligroup dev xili-tidy-tags allows Stored XSS. This issue affects xili-tidy-tags: from n/a through 1.12.06.,6.5,CWE-79
CVE-2022-3662,A vulnerability was found in Axiomatic Bento4. It has been declared as critical. This vulnerability affects the function GetOffset of the file Ap4Sample.h of the component mp42hls. The manipulation leads to use after free. The attack can be initiated remotely. The exploit has been disclosed to the public and may be used. VDB-212002 is the identifier assigned to this vulnerability.,7.3,CWE-119
CVE-2023-42658, Archive command in Chef InSpec prior to 4.56.58 and 5.22.29 allow local command execution via maliciously crafted profile.,8.8,CWE-94
CVE-2025-1101,A CWE-204 Observable Response Discrepancy in the login page in Q-Free MaxTime less than or equal to version 2.11.0 allows an unauthenticated remote attacker to enumerate valid usernames via crafted HTTP requests.,5.3,CWE-204
CVE-2025-56162,YOSHOP 2.0 suffers from an unauthenticated SQL injection in the goodsIds parameter of the /api/goods/listByIds endpoint. The getListByIds function concatenates user input into orderRaw('field(goods_id ...)') allowing attackers to: (a) enumerate or modify database data including dumping admin password hashes; (b) write web-shell files or invoke xp_cmdshell leading to remote code execution on servers configured with sufficient DB privileges.,6.5,CWE-89
CVE-2023-31916,Jerryscript 3.0 (commit 1a2c047) was discovered to contain an Assertion Failure via the jmem_heap_finalize at jerry-core/jmem/jmem-heap.c.,5.5,CWE-617
CVE-2022-4100,The WP Cerber Security plugin for WordPress is vulnerable to IP Protection bypass in versions up to and including 9.4 due to the plugin improperly checking for a visitor's IP address. This makes it possible for an attacker whose IP address has been blocked to bypass this control by setting the X-Forwarded-For: HTTP header to an IP Address that hasn't been blocked.,5.3,CWE-693
CVE-2023-51594,BlueZ OBEX Library Out-Of-Bounds Read Information Disclosure Vulnerability. This vulnerability allows network-adjacent attackers to disclose sensitive information on affected installations of BlueZ. User interaction is required to exploit this vulnerability in that the target must connect to a malicious Bluetooth device.  The specific flaw exists within the handling of OBEX protocol parameters. The issue results from the lack of proper validation of user-supplied data which can result in a read past the end of an allocated buffer. An attacker can leverage this in conjunction with other vulnerabilities to execute arbitrary code in the context of root. Was ZDI-CAN-20937.,5.7,CWE-125
CVE-2025-25679,Tenda i12 V1.0.0.10(3805) was discovered to contain a buffer overflow via the index parameter in the formWifiMacFilterSet function.,8.0,CWE-121
CVE-2022-39032,Smart eVision has an improper privilege management vulnerability. A remote attacker with general user privilege can exploit this vulnerability to escalate to administrator privilege and then perform arbitrary system command or disrupt service.,8.8,CWE-269
CVE-2022-33154,The schema (aka Embedding schema.org vocabulary) extension before 1.13.1 and 2.x before 2.5.1 for TYPO3 allows XSS.,5.4,CWE-79
CVE-2024-44871,An arbitrary file upload vulnerability in the component /admin/index.php of moziloCMS v3.0 allows attackers to execute arbitrary code via uploading a crafted file.,7.2,CWE-434
CVE-2023-39533,go-libp2p is the Go implementation of the libp2p Networking Stack. Prior to versions 0.27.8 0.28.2 and 0.29.1 malicious peer can use large RSA keys to run a resource exhaustion attack & force a node to spend time doing signature verification of the large key. This vulnerability is present in the core/crypto module of go-libp2p and can occur during the Noise handshake and the libp2p x509 extension verification step. To prevent this attack go-libp2p versions 0.27.8 0.28.2 and 0.29.1 restrict RSA keys to <= 8192 bits. To protect one's application it is necessary to update to these patch releases and to use the updated Go compiler in 1.20.7 or 1.19.12. There are no known workarounds for this issue.,7.5,CWE-770
CVE-2023-31748,Insecure permissions in MobileTrans v4.0.11 allows attackers to escalate privileges to local admin via replacing the executable file.,7.8,CWE-732
CVE-2024-23959,Autel MaxiCharger AC Elite Business C50 BLE AppChargingControl Stack-based Buffer Overflow Remote Code Execution Vulnerability. This vulnerability allows network-adjacent attackers to execute arbitrary code on affected installations of Autel MaxiCharger AC Elite Business C50 charging stations. Although authentication is required to exploit this vulnerability the existing authentication mechanism can be bypassed.  The specific flaw exists within the handling of the AppChargingControl BLE command. The issue results from the lack of proper validation of the length of user-supplied data prior to copying it to a fixed-length stack-based buffer. An attacker can leverage this vulnerability to execute code in the context of the device.  Was ZDI-CAN-23194,8.0,CWE-121
CVE-2023-35381,Windows Fax Service Remote Code Execution Vulnerability,8.8,CWE-190
CVE-2021-31650,A SQL injection vulnerability in Sourcecodester Online Grading System 1.0 allows remote attackers to execute arbitrary SQL commands via the uname parameter.,9.8,CWE-89
CVE-2024-7918,The Pocket Widget WordPress plugin through 0.1.3 does not sanitise and escape some of its settings which could allow high privilege users such as admin to perform Stored Cross-Site Scripting attacks even when the unfiltered_html capability is disallowed (for example in multisite setup).,4.8,CWE-79
CVE-2021-20304,A flaw was found in OpenEXR's hufDecode functionality. This flaw allows an attacker who can pass a crafted file to be processed by OpenEXR to trigger an undefined right shift error. The highest threat from this vulnerability is to system availability.,7.5,CWE-190
CVE-2024-10135,A vulnerability was found in ESAFENET CDG 5. It has been classified as critical. This affects the function actionDelNetSecConfig of the file /com/esafenet/servlet/netSec/NetSecConfigService.java. The manipulation of the argument id leads to sql injection. It is possible to initiate the attack remotely. The exploit has been disclosed to the public and may be used. The vendor was contacted early about this disclosure but did not respond in any way.,6.3,CWE-89
CVE-2022-31802,In CODESYS Gateway Server V2 for versions prior to V2.3.9.38 only a part of the the specified password is been compared to the real CODESYS Gateway password. An attacker may perform authentication by specifying a small password that matches the corresponding part of the longer real CODESYS Gateway password.,9.8,CWE-187
