CVE,Description,CVSS3_BaseScore,CWE
CVE-2024-50466,Cross-Site Request Forgery (CSRF) vulnerability in DarkMySite DarkMySite – Advanced Dark Mode Plugin for WordPress darkmysite allows Cross Site Request Forgery.This issue affects DarkMySite – Advanced Dark Mode Plugin for WordPress: from n/a through 1.2.8.,4.3,CWE-352
CVE-2023-38041,A logged in user may elevate its permissions by abusing a Time-of-Check to Time-of-Use (TOCTOU) race condition. When a particular process flow is initiated an attacker can exploit this condition to gain unauthorized elevated privileges on the affected system.,7.0,CWE-367
CVE-2025-26772,Improper Neutralization of Input During Web Page Generation ('Cross-site Scripting') vulnerability in Detheme DethemeKit For Elementor allows Stored XSS. This issue affects DethemeKit For Elementor: from n/a through 2.1.8.,6.5,CWE-79
CVE-2023-26205,An improper access control vulnerability [CWE-284] in FortiADC automation feature 7.1.0 through 7.1.2 7.0 all versions 6.2 all versions 6.1 all versions may allow an authenticated low-privileged attacker to escalate their privileges to super_admin via a specific crafted configuration of fabric automation CLI script.,8.1,CWE-284
CVE-2023-33118,Memory corruption while processing Listen Sound Model client payload buffer when there is a request for Listen Sound session get parameter from ST HAL.,7.8,CWE-416
CVE-2022-4274,A vulnerability which was classified as critical was found in House Rental System. Affected is an unknown function of the file /view-property.php. The manipulation of the argument property_id leads to sql injection. It is possible to launch the attack remotely. The exploit has been disclosed to the public and may be used. VDB-214770 is the identifier assigned to this vulnerability.,6.3,CWE-707
CVE-2022-2732,Missing Authorization in GitHub repository openemr/openemr prior to 7.0.0.1.  ,8.3,CWE-862
CVE-2022-28855,Adobe InDesign versions 16.4.2 (and earlier) and 17.3 (and earlier) are affected by an out-of-bounds read vulnerability that could lead to disclosure of sensitive memory. An attacker could leverage this vulnerability to bypass mitigations such as ASLR. Exploitation of this issue requires user interaction in that a victim must open a malicious file.,5.5,CWE-125
CVE-2024-11246,A vulnerability which was classified as problematic was found in code-projects Farmacia 1.0. Affected is an unknown function of the file /adicionar-cliente.php. The manipulation of the argument nome/cpf/dataNascimento leads to cross site scripting. It is possible to launch the attack remotely. The exploit has been disclosed to the public and may be used. The initial researcher advisory mentions the parameter nome to be affected. But further inspection indicates that other parameters might be affected as well.,3.5,CWE-79
CVE-2023-23775,Multiple improper neutralization of special elements used in SQL commands ('SQL Injection') vulnerabilities [CWE-89] in FortiSOAR 7.2.0 and before 7.0.3 may allow an authenticated attacker to execute unauthorized code or commands via specifically crafted strings parameters.,6.5,CWE-89
CVE-2023-0696,Type confusion in V8 in Google Chrome prior to 110.0.5481.77 allowed a remote attacker to potentially exploit heap corruption via a crafted HTML page. (Chromium security severity: High),8.8,CWE-843
CVE-2024-7537,oFono QMI SMS Handling Out-Of-Bounds Read Information Disclosure Vulnerability. This vulnerability allows local attackers to disclose sensitive information on affected installations of oFono. Authentication is not required to exploit this vulnerability.  The specific flaw exists within the processing of SMS message lists. The issue results from the lack of proper validation of user-supplied data which can result in a read past the end of an allocated buffer. An attacker can leverage this in conjunction with other vulnerabilities to execute arbitrary code in the context of root. Was ZDI-CAN-23157.,5.5,CWE-125
CVE-2018-9426,In  RsaKeyPairGenerator::getNumberOfIterations of RSAKeyPairGenerator.java an incorrect implementation could cause weak RSA key pairs being generated. This could lead to crypto vulnerability with no additional execution privileges needed. User interaction is not needed for exploitation. Bulletin Fix: The fix is designed to correctly implement the key generation according to FIPS standard.,7.5,CWE-331
CVE-2022-29235,BigBlueButton is an open source web conferencing system. Starting in version 2.2 and prior to versions 2.3.18 and 2.4-rc-6 an attacker who is able to obtain the meeting identifier for a meeting on a server can find information related to an external video being shared like the current timestamp and play/pause. The problem has been patched in versions 2.3.18 and 2.4-rc-6 by modifying the stream to send the data only for users in the meeting. There are currently no known workarounds.,5.3,CWE-200
CVE-2024-6848,The Post and Page Builder by BoldGrid – Visual Drag and Drop Editor plugin for WordPress is vulnerable to Stored Cross-Site Scripting via file uploads in all versions up to and including 1.26.6 due to insufficient input sanitization and output escaping affecting the boldgrid_canvas_image AJAX endpoint. This makes it possible for authenticated attackers with Contributor-level access and above to inject arbitrary web scripts in pages that will execute whenever a user accesses the SVG file.,6.4,CWE-79
CVE-2024-49644,Incorrect Privilege Assignment vulnerability in AllAccessible Team Accessibility by AllAccessible allows Privilege Escalation.This issue affects Accessibility by AllAccessible: from n/a through 1.3.4.,8.8,CWE-266
CVE-2024-35858,In the Linux kernel the following vulnerability has been resolved:  net: bcmasp: fix memory leak when bringing down interface  When bringing down the TX rings we flush the rings but forget to reclaimed the flushed packets. This leads to a memory leak since we do not free the dma mapped buffers. This also leads to tx control block corruption when bringing down the interface for power management.,5.5,CWE-401
CVE-2022-46656,Insecure inherited permissions for the Intel(R) NUC Pro Software Suite before version 2.0.0.3 may allow an authenticated user to potentially enable escalation of privilege via local access.,6.7,CWE-277
CVE-2025-3816,A vulnerability classified as critical was found in westboy CicadasCMS 2.0. This vulnerability affects unknown code of the file /system/schedule/save of the component Scheduled Task Handler. The manipulation leads to os command injection. The attack can be initiated remotely. The exploit has been disclosed to the public and may be used.,4.7,CWE-77
CVE-2023-25865,Adobe Substance 3D Stager versions 2.0.0 (and earlier) are affected by an Improper Input Validation vulnerability that could result in arbitrary code execution in the context of the current user. Exploitation of this issue requires user interaction in that a victim must open a malicious file.,7.8,CWE-20
CVE-2025-30372,Emlog is an open source website building system. Emlog Pro versions pro-2.5.7 and pro-2.5.8 contain an SQL injection vulnerability. `search_controller.php` does not use addslashes after urldecode allowing the preceeding addslashes to be bypassed by URL double encoding. This could result in potential leakage of sensitive information from the user database. Version pro-2.5.9 fixes the issue.,9.8,CWE-89
CVE-2023-36392,DHCP Server Service Denial of Service Vulnerability,7.5,CWE-126
CVE-2025-20186,A vulnerability in the web-based management interface of the Wireless LAN Controller feature of Cisco IOS XE Software could allow an authenticated remote attacker with a lobby ambassador user account to perform a command injection attack against an affected device.    This vulnerability is due to insufficient input validation. An attacker could exploit this vulnerability by sending crafted input to the web-based management interface. A successful exploit could allow the attacker to execute arbitrary Cisco IOS XE Software CLI commands with privilege level 15.    Note: This vulnerability is exploitable only if the attacker obtains the credentials for a lobby ambassador account. This account is not configured by default.,8.8,CWE-78
CVE-2024-13631,The Om Stripe WordPress plugin through 02.00.00 does not sanitise and escape a parameter before outputting it back in the page leading to a Reflected Cross-Site Scripting which could be used against high privilege users such as admin.,7.1,CWE-79
CVE-2024-53806,Missing Authorization vulnerability in WpMaspik Maspik – Spam blacklist allows Exploiting Incorrectly Configured Access Control Security Levels.This issue affects Maspik – Spam blacklist: from n/a through 2.2.7.,5.4,CWE-862
CVE-2023-48271,Authentication Bypass by Spoofing vulnerability in yonifre Maspik – Spam blacklist allows Accessing Functionality Not Properly Constrained by ACLs.This issue affects Maspik – Spam blacklist: from n/a through 0.10.3.,5.3,CWE-290
CVE-2020-25835,A potential vulnerability has been identified in Micro Focus ArcSight Management Center. The vulnerability could be remotely exploited resulting in stored Cross-Site Scripting (XSS). ,5.9,CWE-79
CVE-2022-37342,Authenticated (admin+) Stored Cross-Site Scripting (XSS) vulnerability Add Shortcodes Actions And Filters plugin <= 2.0.9 at WordPress.,4.8,CWE-79
CVE-2022-0309,Inappropriate implementation in Autofill in Google Chrome prior to 97.0.4692.99 allowed a remote attacker to bypass navigation restrictions via a crafted HTML page.,6.5,CWE-863
CVE-2023-31124,c-ares is an asynchronous resolver library. When cross-compiling c-ares and using the autotools build system CARES_RANDOM_FILE will not be set as seen when cross compiling aarch64 android.  This will downgrade to using rand() as a fallback which could allow an attacker to take advantage of the lack of entropy by not using a CSPRNG. This issue was patched in version 1.19.1.,3.7,CWE-330
CVE-2021-40595,SQL injection vulnerability in Sourcecodester Online Leave Management System v1 by oretnom23 allows attackers to execute arbitrary SQL commands via the username parameter to /leave_system/classes/Login.php.,9.8,CWE-89
CVE-2022-26844,Insufficiently protected credentials in the installation binaries for Intel(R) SEAPI in all versions may allow an authenticated user to potentially enable escalation of privilege via local access.,7.8,CWE-522
CVE-2024-21871,Improper input validation in UEFI firmware for some Intel(R) Processors may allow a privileged user to potentially enable escalation of privilege via local access.,7.5,CWE-20
CVE-2023-2095,A vulnerability was found in SourceCodester Vehicle Service Management System 1.0 and classified as critical. This issue affects some unknown processing of the file /admin/maintenance/manage_category.php. The manipulation of the argument id leads to sql injection. The attack may be initiated remotely. The exploit has been disclosed to the public and may be used. The associated identifier of this vulnerability is VDB-226103.,6.3,CWE-89
CVE-2023-47689,Missing Authorization vulnerability in Toast Plugins Animator allows Exploiting Incorrectly Configured Access Control Security Levels.This issue affects Animator: from n/a through 3.0.10.,6.5,CWE-862
CVE-2025-48277,Improper Neutralization of Input During Web Page Generation ('Cross-site Scripting') vulnerability in Stylemix Cost Calculator Builder allows Stored XSS. This issue affects Cost Calculator Builder: from n/a through 3.2.74.,5.9,CWE-79
CVE-2025-6367,A vulnerability was found in D-Link DIR-619L 2.06B01. It has been declared as critical. This vulnerability affects unknown code of the file /goform/formSetDomainFilter. The manipulation of the argument curTime/sched_name_%d/url_%d leads to stack-based buffer overflow. The attack can be initiated remotely. The exploit has been disclosed to the public and may be used. This vulnerability only affects products that are no longer supported by the maintainer.,8.8,CWE-119
CVE-2023-20830,In gps there is a possible out of bounds write due to a missing bounds check. This could lead to local escalation of privilege with System execution privileges needed. User interaction is not needed for exploitation. Patch ID: ALPS08014144; Issue ID: ALPS08014156.,6.7,CWE-787
CVE-2021-46351,There is an Assertion 'local_tza == ecma_date_local_time_zone_adjustment (date_value)' failed at /jerry-core/ecma/builtin-objects/ecma-builtin-date-prototype.c(ecma_builtin_date_prototype_dispatch_set):421 in JerryScript 3.0.0.,5.5,CWE-617
CVE-2023-48830,Shuttle Booking Software 2.0 is vulnerable to CSV Injection in the Languages section via an export.,8.8,CWE-74
CVE-2024-38188,Azure Network Watcher VM Agent Elevation of Privilege Vulnerability,7.1,CWE-59
CVE-2023-46058,Cross Site Scripting (XSS) vulnerability in Geeklog-Core geeklog v.2.2.2 allows a remote attacker to execute arbitrary code via a crafted payload to the grp_desc parameter of the admin/group.php component.,4.8,CWE-79
CVE-2023-33966,Deno is a runtime for JavaScript and TypeScript. In deno 1.34.0 and deno_runtime 0.114.0 outbound HTTP requests made using the built-in `node:http` or `node:https` modules are incorrectly not checked against the network permission allow list (`--allow-net`). Dependencies relying on these built-in modules are subject to the vulnerability too. Users of Deno versions prior to 1.34.0 are unaffected. Deno Deploy users are unaffected. This problem has been patched in Deno v1.34.1 and deno_runtime 0.114.1 and all users are recommended to update to this version. No workaround is available for this issue. ,8.6,CWE-269
CVE-2025-25167,Missing Authorization vulnerability in blackandwhitedigital BookPress – For Book Authors allows Exploiting Incorrectly Configured Access Control Security Levels. This issue affects BookPress – For Book Authors: from n/a through 1.2.7.,8.2,CWE-862
CVE-2022-1865,Use after free in Bookmarks in Google Chrome prior to 102.0.5005.61 allowed an attacker who convinced a user to install a malicious extension to potentially exploit heap corruption via a crafted Chrome Extension and specific user interaction.,8.8,CWE-416
CVE-2023-48776,Missing Authorization vulnerability in Thomas Scholl canvasio3D Light allows Exploiting Incorrectly Configured Access Control Security Levels.This issue affects canvasio3D Light: from n/a through 2.5.0.,5.4,CWE-862
CVE-2023-29160,Stack-based buffer overflow vulnerability exists in FRENIC RHC Loader v1.1.0.3. If a user opens a specially crafted FNE file sensitive information on the system where the affected product is installed may be disclosed or arbitrary code may be executed.,7.8,CWE-787
CVE-2024-22440, A potential security vulnerability has been identified in HPE Compute Scale-up Server 3200 server. This vulnerability could cause disclosure of sensitive information in log files.  ,6.8,CWE-532
CVE-2024-9093,A vulnerability classified as critical has been found in SourceCodester Profile Registration without Reload Refresh 1.0. This affects an unknown part of the file del.php of the component GET Parameter Handler. The manipulation of the argument list leads to sql injection. It is possible to initiate the attack remotely. The exploit has been disclosed to the public and may be used.,6.3,CWE-89
CVE-2024-0485,A vulnerability which was classified as critical was found in code-projects Fighting Cock Information System 1.0. Affected is an unknown function of the file admin/pages/tables/add_con.php. The manipulation of the argument id leads to sql injection. It is possible to launch the attack remotely. The exploit has been disclosed to the public and may be used. VDB-250590 is the identifier assigned to this vulnerability.,6.3,CWE-89
CVE-2022-29246,Azure RTOS USBX is a USB host device and on-the-go (OTG) embedded stack. Prior to version 6.1.11 he USBX DFU UPLOAD functionality may be utilized to introduce a buffer overflow resulting in overwrite of memory contents. In particular cases this may allow an attacker to bypass security features or execute arbitrary code. The implementation of `ux_device_class_dfu_control_request` function does not assure that a buffer overflow will not occur during handling of the DFU UPLOAD command. When an attacker issues the `UX_SLAVE_CLASS_DFU_COMMAND_UPLOAD` control transfer request with `wLenght` larger than the buffer size (`UX_SLAVE_REQUEST_CONTROL_MAX_LENGTH` 256 bytes) depending on the actual implementation of `dfu -> ux_slave_class_dfu_read` a buffer overflow may occur. In example `ux_slave_class_dfu_read` may read 4096 bytes (or more up to 65k) to a 256 byte buffer ultimately resulting in an overflow. Furthermore in case an attacker has some control over the read flash memory this may result in execution of arbitrary code and platform compromise. A fix for this issue has been included in USBX release 6.1.11. As a workaround align request and buffer size to assure that buffer boundaries are respected.,9.8,CWE-120
CVE-2022-1445,Stored Cross Site Scripting vulnerability in the checked_out_to parameter in GitHub repository snipe/snipe-it prior to 5.4.3. The vulnerability is capable of stolen the user Cookie.,5.4,CWE-79
CVE-2025-2291,Password can be used past expiry in PgBouncer due to auth_query not taking into account Postgres its VALID UNTIL value which allows an attacker to log in with an already expired password,8.1,CWE-324
CVE-2022-24248,RiteCMS version 3.1.0 and below suffers from an arbitrary file deletion via path traversal vulnerability in Admin Panel. Exploiting the vulnerability allows an authenticated attacker to delete any file in the web root (along with any other file on the server that the PHP process user has the proper permissions to delete). Furthermore an attacker might leverage the capability of arbitrary file deletion to circumvent certain web server security mechanisms such as deleting .htaccess file that would deactivate those security constraints.,6.5,CWE-22
CVE-2025-27167,Illustrator versions 29.2.1 28.7.4 and earlier are affected by an Untrusted Search Path vulnerability that might allow attackers to execute their own programs access unauthorized data files or modify configuration in unexpected ways. If the application uses a search path to locate critical resources such as programs then an attacker could modify that search path to point to a malicious program which the targeted application would then execute. The problem extends to any type of critical resource that the application trusts.,7.8,CWE-426
CVE-2024-6177,Improper Neutralization of Input During Web Page Generation (XSS or 'Cross-site Scripting') vulnerability in LG Electronics SuperSign CMS allows Reflected XSS. This issue affects SuperSign CMS: from 4.1.3 before < 4.3.1.,6.1,CWE-79
CVE-2023-40058,Sensitive data was added to our public-facing knowledgebase that if exploited could be used to access components of Access Rights Manager (ARM) if the threat actor is in the same environment.          ,6.5,CWE-200
CVE-2022-28552,Cscms 4.1 is vulnerable to SQL Injection. Log into the background open the song module create a new song delete it to the recycle bin and SQL injection security problems will occur when emptying the recycle bin.,8.8,CWE-89
CVE-2021-27476,A vulnerability exists in the SaveConfigFile function of the RACompare Service which may allow for OS command injection. This vulnerability may allow a remote unauthenticated attacker to execute arbitrary commands in Rockwell Automation FactoryTalk AssetCentre v10.00 and earlier.,10.0,CWE-78
CVE-2023-43712,Os Commerce is currently susceptible to a Cross-Site Scripting (XSS) vulnerability. This vulnerability allows attackers to inject JS through the access_levels_name parameter potentially leading to unauthorized execution of scripts within a user's web browser.,5.4,CWE-79
CVE-2024-7235,AVG AntiVirus Free Link Following Denial-of-Service Vulnerability. This vulnerability allows local attackers to create a denial-of-service condition on affected installations of AVG AntiVirus Free. An attacker must first obtain the ability to execute low-privileged code on the target system in order to exploit this vulnerability.  The specific flaw exists within the AVG Service. By creating a symbolic link an attacker can abuse the service to create a folder. An attacker can leverage this vulnerability to create a denial-of-service condition on the system. . Was ZDI-CAN-22803.,5.5,CWE-59
CVE-2022-30061,ftcms <=2.1 was discovered to be vulnerable to directory traversal attacks via the parameter tp.,6.5,CWE-22
CVE-2024-37930,Exposure of Sensitive Information to an Unauthorized Actor Missing Authorization vulnerability in ThemeSphere SmartMag allows Excavation Accessing Functionality Not Properly Constrained by ACLs.This issue affects SmartMag: from n/a through 9.3.0.,5.3,CWE-200
CVE-2025-24967,reNgine is an automated reconnaissance framework for web applications. A stored cross-site scripting (XSS) vulnerability exists in the admin panel's user management functionality. An attacker can exploit this issue by injecting malicious payloads into the username field during user creation. This vulnerability allows unauthorized script execution whenever the admin views or interacts with the affected user entry posing a significant risk to sensitive admin functionalities. This issue affects all versions up to and including 2.20. Users are advised to monitor the project for future releases which address this issue. There are no known workarounds.,5.4,CWE-79
CVE-2024-42610,Pligg CMS v2.0.2 was discovered to contain a Cross-Site Request Forgery (CSRF) vulnerability via /admin/admin_backup.php?dobackup=files,8.8,CWE-352
CVE-2023-34637,A stored cross-site scripting (XSS) vulnerability in IsarNet AG IsarFlow v5.23 allows authenticated attackers to execute arbitrary web scripts or HTML via injecting a crafted payload into the dashboard title parameter in the IsarFlow Portal.,5.4,CWE-79
CVE-2023-31294,CSV Injection vulnerability in Sesami Cash Point & Transport Optimizer (CPTO) version 6.3.8.6 (#718) allows remote attackers to obtain sensitive information via the Delivery Name field.,7.5,CWE-1236
CVE-2022-46536,Tenda F1203 V2.0.1.6 was discovered to contain a buffer overflow via the limitSpeedUp parameter at /goform/SetClientState.,7.5,CWE-120
CVE-2022-33887,A maliciously crafted PDF file when parsed through Autodesk AutoCAD 2023 causes an unhandled exception. An attacker can leverage this vulnerability to cause a crash or read sensitive data or execute arbitrary code in the context of the current process.,7.8,CWE-755
CVE-2024-31807,TOTOLINK EX200 V4.0.3c.7646_B20201211 was discovered to contain a remote code execution (RCE) vulnerability via the hostTime parameter in the NTPSyncWithHost function.,9.8,CWE-94
CVE-2024-33028,Memory corruption as fence object may still be accessed in timeline destruct after isync fence is released.,8.4,CWE-416
CVE-2023-46068,Auth. (admin+) Stored Cross-Site Scripting (XSS) vulnerability in XQueue GmbH Maileon for WordPress plugin <= 2.16.0 versions.,5.9,CWE-79
CVE-2024-29218,Out-of-bounds write vulnerability exists in KV STUDIO Ver.11.64 and earlier KV REPLAY VIEWER Ver.2.64 and earlier and VT5-WX15/WX12 Ver.6.02 and earlier which may lead to information disclosure or arbitrary code execution by having a user of the affected product open a specially crafted file.,8.8,CWE-787
CVE-2024-8329,6SHR system from Gether Technology does not properly validate the specific page parameter allowing remote attackers with regular privilege to inject SQL command to read modify and delete database contents.,8.8,CWE-89
CVE-2024-32462,Flatpak is a system for building distributing and running sandboxed desktop applications on Linux. in versions before 1.10.9 1.12.9 1.14.6 and 1.15.8 a malicious or compromised Flatpak app could execute arbitrary code outside its sandbox. Normally the `--command` argument of `flatpak run` expects to be given a command to run in the specified Flatpak app optionally along with some arguments. However it is possible to instead pass `bwrap` arguments to `--command=` such as `--bind`. It's possible to pass an arbitrary `commandline` to the portal interface `org.freedesktop.portal.Background.RequestBackground` from within a Flatpak app. When this is converted into a `--command` and arguments it achieves the same effect of passing arguments directly to `bwrap` and thus can be used for a sandbox escape. The solution is to pass the `--` argument to `bwrap` which makes it stop processing options. This has been supported since bubblewrap 0.3.0. All supported versions of Flatpak require at least that version of bubblewrap. xdg-desktop-portal version 1.18.4 will mitigate this vulnerability by only allowing Flatpak apps to create .desktop files for commands that do not start with --. The vulnerability is patched in 1.15.8 1.10.9 1.12.9 and 1.14.6.,8.4,CWE-88
CVE-2024-4146,In lunary-ai/lunary version v1.2.13 an incorrect authorization vulnerability exists that allows unauthorized users to access and manipulate projects within an organization they should not have access to. Specifically the vulnerability is located in the `checkProjectAccess` method within the authorization middleware which fails to adequately verify if a user has the correct permissions to access a specific project. Instead it only checks if the user is part of the organization owning the project overlooking the necessary check against the `account_project` table for explicit project access rights. This flaw enables attackers to gain complete control over all resources within a project including the ability to create update read and delete any resource compromising the privacy and security of sensitive information.,9.8,CWE-863
CVE-2024-12301,The JSP Store Locator WordPress plugin through 1.0 does not have CSRF checks in some places which could allow attackers to make logged in users perform unwanted actions via CSRF attacks.,6.5,CWE-352
