CVE,Description,CVSS3_BaseScore,CWE
CVE-2023-6857,When resolving a symlink a race may occur where the buffer passed to `readlink` may actually be smaller than necessary.  *This bug only affects Firefox on Unix-based operating systems (Android Linux MacOS). Windows is unaffected.* This vulnerability affects Firefox ESR < 115.6 Thunderbird < 115.6 and Firefox < 121.,5.3,CWE-362
CVE-2022-23818,Insufficient input validation on the model specific register: VM_HSAVE_PA may potentially lead to loss of SEV-SNP guest memory integrity.                         ,7.5,CWE-20
CVE-2022-0088,Cross-Site Request Forgery (CSRF) in GitHub repository yourls/yourls prior to 1.8.3.,7.4,CWE-352
CVE-2022-0384,The Video Conferencing with Zoom WordPress plugin before 3.8.17 does not have authorisation in its vczapi_get_wp_users AJAX action allowing any authenticated users such as subscriber to download the list of email addresses registered on the blog,4.3,CWE-200
CVE-2022-27496,Cross-site scripting vulnerability in Zero-channel BBS Plus v0.7.4 and earlier allows a remote attacker to inject an arbitrary script via unspecified vectors.,6.1,CWE-79
CVE-2023-39999,Exposure of Sensitive Information to an Unauthorized Actor in WordPress from 6.3 through 6.3.1 from 6.2 through 6.2.2 from 6.1 through 6.13 from 6.0 through 6.0.5 from 5.9 through 5.9.7 from 5.8 through 5.8.7 from 5.7 through 5.7.9 from 5.6 through 5.6.11 from 5.5 through 5.5.12 from 5.4 through 5.4.13 from 5.3 through 5.3.15 from 5.2 through 5.2.18 from 5.1 through 5.1.16 from 5.0 through 5.0.19 from 4.9 through 4.9.23 from 4.8 through 4.8.22 from 4.7 through 4.7.26 from 4.6 through 4.6.26 from 4.5 through 4.5.29 from 4.4 through 4.4.30 from 4.3 through 4.3.31 from 4.2 through 4.2.35 from 4.1 through 4.1.38.,4.3,CWE-200
CVE-2025-5121,An issue has been discovered in GitLab CE/EE affecting all versions from 17.11 before 17.11.4 and 18.0 before 18.0.2. A missing authorization check may have allowed compliance frameworks to be applied to projects outside the compliance framework's group.,8.5,CWE-862
CVE-2022-4242,The WP Google Review Slider WordPress plugin before 11.6 does not sanitise and escape some of its settings which could allow high privilege users such as admin to perform Stored Cross-Site Scripting attacks even when the unfiltered_html capability is disallowed (for example in multisite setup).,4.8,CWE-79
CVE-2025-24350,A vulnerability in the “Certificates and Keys” functionality of the web application of ctrlX OS allows a remote authenticated (low-privileged) attacker to write arbitrary certificates in arbitrary file system paths via a crafted HTTP request.,7.1,CWE-23
CVE-2025-37880,In the Linux kernel the following vulnerability has been resolved:  um: work around sched_yield not yielding in time-travel mode  sched_yield by a userspace may not actually cause scheduling in time-travel mode as no time has passed. In the case seen it appears to be a badly implemented userspace spinlock in ASAN. Unfortunately with time-travel it causes an extreme slowdown or even deadlock depending on the kernel configuration (CONFIG_UML_MAX_USERSPACE_ITERATIONS).  Work around it by accounting time to the process whenever it executes a sched_yield syscall.,5.5,CWE-667
CVE-2022-30476,Tenda AC Series Router AC18_V15.03.05.19(6318) was discovered to contain a stack-based buffer overflow in the httpd module when handling /goform/SetFirewallCfg request.,9.8,CWE-787
CVE-2024-36987,In Splunk Enterprise versions below 9.2.2 9.1.5 and 9.0.10 and Splunk Cloud Platform versions below 9.1.2312.200 an authenticated low-privileged user who does not hold the admin or power Splunk roles could upload a file with an arbitrary extension using the indexing/preview REST endpoint.,4.3,CWE-434
CVE-2024-35849,In the Linux kernel the following vulnerability has been resolved:  btrfs: fix information leak in btrfs_ioctl_logical_to_ino()  Syzbot reported the following information leak for in btrfs_ioctl_logical_to_ino():    BUG: KMSAN: kernel-infoleak in instrument_copy_to_user include/linux/instrumented.h:114 [inline]   BUG: KMSAN: kernel-infoleak in _copy_to_user+0xbc/0x110 lib/usercopy.c:40    instrument_copy_to_user include/linux/instrumented.h:114 [inline]    _copy_to_user+0xbc/0x110 lib/usercopy.c:40    copy_to_user include/linux/uaccess.h:191 [inline]    btrfs_ioctl_logical_to_ino+0x440/0x750 fs/btrfs/ioctl.c:3499    btrfs_ioctl+0x714/0x1260    vfs_ioctl fs/ioctl.c:51 [inline]    __do_sys_ioctl fs/ioctl.c:904 [inline]    __se_sys_ioctl+0x261/0x450 fs/ioctl.c:890    __x64_sys_ioctl+0x96/0xe0 fs/ioctl.c:890    x64_sys_call+0x1883/0x3b50 arch/x86/include/generated/asm/syscalls_64.h:17    do_syscall_x64 arch/x86/entry/common.c:52 [inline]    do_syscall_64+0xcf/0x1e0 arch/x86/entry/common.c:83    entry_SYSCALL_64_after_hwframe+0x77/0x7f    Uninit was created at:    __kmalloc_large_node+0x231/0x370 mm/slub.c:3921    __do_kmalloc_node mm/slub.c:3954 [inline]    __kmalloc_node+0xb07/0x1060 mm/slub.c:3973    kmalloc_node include/linux/slab.h:648 [inline]    kvmalloc_node+0xc0/0x2d0 mm/util.c:634    kvmalloc include/linux/slab.h:766 [inline]    init_data_container+0x49/0x1e0 fs/btrfs/backref.c:2779    btrfs_ioctl_logical_to_ino+0x17c/0x750 fs/btrfs/ioctl.c:3480    btrfs_ioctl+0x714/0x1260    vfs_ioctl fs/ioctl.c:51 [inline]    __do_sys_ioctl fs/ioctl.c:904 [inline]    __se_sys_ioctl+0x261/0x450 fs/ioctl.c:890    __x64_sys_ioctl+0x96/0xe0 fs/ioctl.c:890    x64_sys_call+0x1883/0x3b50 arch/x86/include/generated/asm/syscalls_64.h:17    do_syscall_x64 arch/x86/entry/common.c:52 [inline]    do_syscall_64+0xcf/0x1e0 arch/x86/entry/common.c:83    entry_SYSCALL_64_after_hwframe+0x77/0x7f    Bytes 40-65535 of 65536 are uninitialized   Memory access of size 65536 starts at ffff888045a40000  This happens because we're copying a 'struct btrfs_data_container' back to user-space. This btrfs_data_container is allocated in 'init_data_container()' via kvmalloc() which does not zero-fill the memory.  Fix this by using kvzalloc() which zeroes out the memory on allocation.,7.1,CWE-908
CVE-2023-31148,An Improper Input Validation vulnerability   in the Schweitzer Engineering Laboratories Real-Time Automation Controller (SEL RTAC) Web Interface could allow a remote authenticated attacker to execute arbitrary code. See SEL Service Bulletin dated 2022-11-15 for more details.   ,9.1,CWE-20
CVE-2025-28981,Cross-Site Request Forgery (CSRF) vulnerability in Soli WP Mail Options allows Stored XSS. This issue affects WP Mail Options: from n/a through 0.2.3.,7.1,CWE-352
CVE-2024-51588,Improper Neutralization of Input During Web Page Generation (XSS or 'Cross-site Scripting') vulnerability in Themehat Super Addons for Elementor allows DOM-Based XSS.This issue affects Super Addons for Elementor: from n/a through 1.0.,6.5,CWE-79
CVE-2024-12687,Deserialization of Untrusted Data vulnerability in PlexTrac (Runbooks modules) which allows Object Injection and arbitrary file writes.  This issue affects PlexTrac: from 1.61.3 before 2.8.1.,9.8,CWE-502
CVE-2025-7766,Lantronix Provisioning Manager is vulnerable to XML external entity attacks in configuration files supplied by network devices leading to unauthenticated remote code execution on hosts with Provisioning Manager installed.,8.0,CWE-611
CVE-2025-6821,A vulnerability was found in code-projects Inventory Management System 1.0. It has been classified as critical. This affects an unknown part of the file /php_action/createOrder.php. The manipulation leads to sql injection. It is possible to initiate the attack remotely. The exploit has been disclosed to the public and may be used.,7.3,CWE-74
CVE-2025-59950,FreshRSS is a free self-hostable RSS aggregator. In versions 1.26.3 and below due to a bypass of double clickjacking protection (confirmation dialog) it is possible to trick the admin into clicking the Promote button in another user's management page after the admin double clicks on a button inside an attacker-controlled website. A successful attack can allow the attacker to promote themselves to admin and log into other users' accounts; the attacker has to know the specific instance URL they're targeting. This issue is fixed in version 1.27.0.,6.7,CWE-1021
CVE-2025-23425,Improper Neutralization of Input During Web Page Generation ('Cross-site Scripting') vulnerability in marekki Marekkis Watermark allows Reflected XSS. This issue affects Marekkis Watermark: from n/a through 0.9.4.,7.1,CWE-79
CVE-2023-24393,Auth. (editor+) Stored Cross-Site Scripting (XSS) vulnerability in Sk. Abul Hasan Animated Number Counters plugin <= 1.6 versions.,6.5,CWE-79
CVE-2024-3890,The Happy Addons for Elementor plugin for WordPress is vulnerable to Stored Cross-Site Scripting via the Calendly widget in all versions up to and including 3.10.5 due to insufficient input sanitization and output escaping on user supplied attributes. This makes it possible for authenticated attackers with contributor-level access and above to inject arbitrary web scripts in pages that will execute whenever a user accesses an injected page.,6.4,CWE-79
CVE-2024-9773,An issue was discovered in GitLab EE affecting all versions starting from 14.9 before 17.8.6 all versions starting from 17.9 before 17.8.3 all versions starting from 17.10 before 17.10.1. An input validation issue in the Harbor registry integration could have allowed a maintainer to add malicious code to the CLI commands shown in the UI.,3.7,CWE-77
CVE-2024-26058,Adobe Experience Manager versions 6.5.20 and earlier Answer: are affected by a DOM-based Cross-Site Scripting (XSS) vulnerability. This vulnerability could allow an attacker to execute arbitrary JavaScript code in the context of the victim's browser session. Exploitation of this issue requires user interaction such as convincing a victim to click on a specially crafted link.,5.4,CWE-79
CVE-2023-35065,Improper Neutralization of Special Elements used in an SQL Command ('SQL Injection') vulnerability in Osoft Paint Production Management allows SQL Injection.This issue affects Paint Production Management: before 2.1.  ,9.8,CWE-89
CVE-2023-7317,Nagios XI versions prior to 2024R1 contain a missing access control vulnerability via the Web SSH Terminal. A remote low-privileged attacker could access or interact with the terminal interface without sufficient authorization potentially allowing unauthorized command execution or disclosure of sensitive information.,8.8,CWE-862
CVE-2022-37706,enlightenment_sys in Enlightenment before 0.25.4 allows local users to gain privileges because it is setuid root and the system library function mishandles pathnames that begin with a /dev/.. substring.,7.8,CWE-269
CVE-2023-31582,jose4j before v0.9.3 allows attackers to set a low iteration count of 1000 or less.,7.5,CWE-331
CVE-2025-27426,Malicious websites utilizing a server-side redirect to an internal error page could result in a spoofed website URL This vulnerability affects Firefox for iOS < 136.,5.4,CWE-601
CVE-2022-22553,Dell EMC AppSync versions 3.9 to 4.3 contain an Improper Restriction of Excessive Authentication Attempts Vulnerability that can be exploited from UI and CLI. An adjacent unauthenticated attacker could potentially exploit this vulnerability leading to password brute-forcing. Account takeover is possible if weak passwords are used by users.,8.1,CWE-307
CVE-2024-7346,Host name validation for TLS certificates is bypassed when the installed OpenEdge default certificates are used to perform the TLS handshake for a networked connection.  This has been corrected so that default certificates are no longer capable of overriding host name validation and will need to be replaced where full TLS certificate validation is needed for network security.  The existing certificates should be replaced with CA-signed certificates from a recognized certificate authority that contain the necessary information to support host name validation.,7.2,CWE-297
CVE-2025-2287,A local code execution vulnerability exists in the Rockwell Automation Arena®  due to an uninitialized pointer. The flaw is result of improper validation of user-supplied data.  If exploited a threat actor can disclose information and execute arbitrary code on the system. To exploit the vulnerability a legitimate user must open a malicious DOE file.,7.8,CWE-457
CVE-2022-2848,This vulnerability allows remote attackers to execute arbitrary code on affected installations of Kepware KEPServerEX 6.11.718.0. Authentication is not required to exploit this vulnerability. The specific flaw exists within the handling of text encoding conversions. The issue results from the lack of proper validation of the length of user-supplied data prior to copying it to a heap-based buffer. An attacker can leverage this vulnerability to execute code in the context of SYSTEM. Was ZDI-CAN-16486.,9.1,CWE-122
CVE-2025-4512,A vulnerability classified as problematic has been found in Inetum IODAS 7.2-LTS.4.1-JDK7/7.2-RC3.2-JDK7. Affected is an unknown function of the file /astre/iodasweb/app.jsp. The manipulation of the argument action leads to cross site scripting. It is possible to launch the attack remotely. The exploit has been disclosed to the public and may be used. The vendor was contacted early about this disclosure but did not respond in any way.,4.3,CWE-79
CVE-2025-24630,Improper Neutralization of Input During Web Page Generation ('Cross-site Scripting') vulnerability in MantraBrain Sikshya LMS allows Reflected XSS. This issue affects Sikshya LMS: from n/a through 0.0.21.,7.1,CWE-79
CVE-2025-22839,Insufficient granularity of access control in the OOB-MSM for some Intel(R) Xeon(R) 6 Scalable processors may allow a privileged user to potentially enable escalation of privilege via adjacent access.,7.5,CWE-1220
CVE-2023-30755,A vulnerability has been identified in SIMATIC CP 1242-7 V2 (incl. SIPLUS variants) (All versions < V3.5.20) SIMATIC CP 1243-1 (incl. SIPLUS variants) (All versions < V3.5.20) SIMATIC CP 1243-1 DNP3 (incl. SIPLUS variants) (All versions < V3.5.20) SIMATIC CP 1243-1 IEC (incl. SIPLUS variants) (All versions < V3.5.20) SIMATIC CP 1243-7 LTE (All versions < V3.5.20) SIMATIC CP 1243-8 IRC (6GK7243-8RX30-0XE0) (All versions < V3.5.20) SIMATIC HMI Comfort Panels (incl. SIPLUS variants) (All versions) SIMATIC IPC DiagBase (All versions) SIMATIC IPC DiagMonitor (All versions) SIMATIC WinCC Runtime Advanced (All versions) SIPLUS TIM 1531 IRC (6AG1543-1MX00-7XE0) (All versions < V2.4.8) TIM 1531 IRC (6GK7543-1MX00-0XE0) (All versions < V2.4.8). The web server of the affected devices do not properly handle the shutdown or reboot request which could lead to the clean up of certain resources.     This could allow a remote attacker with elevated privileges to cause a denial of service condition in the system.,4.4,CWE-476
CVE-2023-37860,In PHOENIX CONTACTs WP 6xxx series web panels in versions prior to 4.0.10 a remote unauthenticated attacker can obtain the r/w community string of the SNMPv2 daemon. ,7.5,CWE-862
CVE-2025-8977,The Simple Download Monitor plugin for WordPress is vulnerable to time-based SQL Injection via the order parameter in all versions up to and including 3.9.33 due to insufficient escaping on the user supplied parameter and lack of sufficient preparation on the existing SQL query.  This makes it possible for authenticated attackers with Contributor-level access and above and permissions granted by an Administrator to append additional SQL queries into already existing queries that can be used to extract sensitive information from the database.,6.5,CWE-89
CVE-2024-2861,The ProfilePress plugin for WordPress is vulnerable to Stored Cross-Site Scripting via the ProfilePress User Panel widget in all versions up to and including 4.15.8 due to insufficient input sanitization and output escaping on user supplied attributes. This makes it possible for authenticated attackers with contributor-level access and above to inject arbitrary web scripts in pages that will execute whenever a user accesses an injected page.,6.4,CWE-79
CVE-2025-65887,A division-by-zero vulnerability in the flow.floor_divide() component of OneFlow v0.9.0 allows attackers to cause a Denial of Service (DoS) via a crafted input tensor with zero.,6.5,CWE-369
CVE-2025-9652,A vulnerability was determined in Portabilis i-Educar up to 2.10. Affected is an unknown function of the file /intranet/educar_transferencia_tipo_cad.php of the component Cadastrar tipo de transferência Page. This manipulation of the argument nm_tipo/desc_tipo causes cross site scripting. It is possible to initiate the attack remotely. The exploit has been publicly disclosed and may be utilized.,3.5,CWE-79
CVE-2025-58586,For failed login attempts the application returns different error messages depending on whether the login failed due to an incorrect password or a non-existing username. This allows an attacker to guess usernames until they find an existing one.,5.3,CWE-204
CVE-2024-43704,Software installed and run as a non-privileged user may conduct improper GPU system calls to gain access to the graphics buffers of a parent process.,8.4,CWE-668
CVE-2022-26722,A memory initialization issue was addressed. This issue is fixed in Security Update 2022-004 Catalina macOS Monterey 12.4 macOS Big Sur 11.6.6. A malicious application may be able to gain root privileges.,7.8,CWE-665
CVE-2022-45929,Northern.tech Mender 3.3.x before 3.3.2 3.5.x before 3.5.0 and 3.6.x before 3.6.0 has Incorrect Access Control and allows users to change their roles and could allow privilege escalation from a low-privileged read-only user to a high-privileged user.,8.8,CWE-284
CVE-2023-28231,DHCP Server Service Remote Code Execution Vulnerability,8.8,CWE-122
CVE-2024-52437,Missing Authentication for Critical Function vulnerability in Saul Morales Pacheco Banner System allows Privilege Escalation.This issue affects Banner System: from n/a through 1.0.0.,8.8,CWE-306
CVE-2024-40932,In the Linux kernel the following vulnerability has been resolved:  drm/exynos/vidi: fix memory leak in .get_modes()  The duplicated EDID is never freed. Fix it.,5.5,CWE-401
CVE-2024-44068,An issue was discovered in the m2m scaler driver in Samsung Mobile Processor and Wearable Processor Exynos 9820 9825 980 990 850and W920. A Use-After-Free in the mobile processor leads to privilege escalation.,8.1,CWE-416
CVE-2023-52464,In the Linux kernel the following vulnerability has been resolved:  EDAC/thunderx: Fix possible out-of-bounds string access  Enabling -Wstringop-overflow globally exposes a warning for a common bug in the usage of strncat():    drivers/edac/thunderx_edac.c: In function 'thunderx_ocx_com_threaded_isr':   drivers/edac/thunderx_edac.c:1136:17: error: 'strncat' specified bound 1024 equals destination size [-Werror=stringop-overflow=]    1136 |                 strncat(msg other OCX_MESSAGE_SIZE);         |                 ^~~~~~~~~~~~~~~~~~~~~~~~~~~~~~~~~~~~~    ...    1145 |                                 strncat(msg other OCX_MESSAGE_SIZE);    ...    1150 |                                 strncat(msg other OCX_MESSAGE_SIZE);     ...  Apparently the author of this driver expected strncat() to behave the way that strlcat() does which uses the size of the destination buffer as its third argument rather than the length of the source buffer. The result is that there is no check on the size of the allocated buffer.  Change it to strlcat().    [ bp: Trim compiler output fixup commit message. ],7.8,CWE-119
CVE-2024-10175,The Pricing Tables For WPBakery Page Builder (formerly Visual Composer) plugin for WordPress is vulnerable to Stored Cross-Site Scripting via the plugin's wdo_pricing_tables shortcode in all versions up to and including 1.4 due to insufficient input sanitization and output escaping on user supplied attributes. This makes it possible for authenticated attackers with contributor-level access and above to inject arbitrary web scripts in pages that will execute whenever a user accesses an injected page.,6.4,CWE-79
CVE-2023-24467,Possible Command Injection    in iManager GET parameter has been discovered in OpenText™ iManager 3.2.6.0000.,8.8,CWE-77
CVE-2025-1187,A vulnerability classified as critical was found in code-projects Police FIR Record Management System 1.0. Affected by this vulnerability is an unknown functionality of the component Delete Record Handler. The manipulation leads to stack-based buffer overflow. Attacking locally is a requirement. The exploit has been disclosed to the public and may be used.,5.3,CWE-119
CVE-2025-8712,Missing authorization in Ivanti Connect Secure before 22.7R2.9 or 22.8R2 Ivanti Policy Secure before 22.7R1.6 Ivanti ZTA Gateway before 22.8R2.3-723 and Ivanti Neurons for Secure Access before 22.8R1.4 (Fix deployed on 02-Aug-2025) allows a remote authenticated attacker with read-only admin privileges to configure restricted settings.,5.4,CWE-862
CVE-2024-55060,A cross-site scripting (XSS) vulnerability in the component index.php of Rafed CMS Website v1.44 allows attackers to execute arbitrary web scripts or HTML via a crafted payload.,6.1,CWE-79
CVE-2025-7597,A vulnerability classified as critical has been found in Tenda AX1803 1.0.0.1. Affected is the function formSetMacFilterCfg of the file /goform/setMacFilterCfg. The manipulation of the argument deviceList leads to stack-based buffer overflow. It is possible to launch the attack remotely. The exploit has been disclosed to the public and may be used.,8.8,CWE-119
CVE-2023-21473,Improper input validation with Exynos Fastboot USB Interface prior to SMR Apr-2023 Release 1 allows a physical attacker to execute arbitrary code in bootloader.,6.8,CWE-20
CVE-2024-13012,A vulnerability which was classified as problematic has been found in code-projects Hostel Management System 1.0. This issue affects some unknown processing of the file /admin/registration.php. The manipulation of the argument fname/mname/lname leads to cross site scripting. The attack may be initiated remotely.,3.5,CWE-79
CVE-2024-0287,A vulnerability was found in Kashipara Food Management System 1.0. It has been rated as critical. Affected by this issue is some unknown functionality of the file itemBillPdf.php. The manipulation of the argument printid leads to sql injection. The attack may be launched remotely. The exploit has been disclosed to the public and may be used. The identifier of this vulnerability is VDB-249848.,6.3,CWE-89
CVE-2025-69228,AIOHTTP is an asynchronous HTTP client/server framework for asyncio and Python. Versions 3.13.2 and below allow a request to be crafted in such a way that an AIOHTTP server's memory fills up uncontrollably during processing. If an application includes a handler that uses the Request.post() method an attacker may be able to freeze the server by exhausting the memory. This issue is fixed in version 3.13.3.,7.5,CWE-770
CVE-2022-46733,Sewio’s Real-Time Location System (RTLS) Studio version 2.0.0 up to and including version 2.6.2 is vulnerable to cross-site scripting in its backup services. An attacker could take advantage of this vulnerability to execute arbitrary commands.  ,6.3,CWE-79
CVE-2026-1084,The Cookie consent for developers plugin for WordPress is vulnerable to Stored Cross-Site Scripting via multiple settings fields in all versions up to and including 1.7.1 due to insufficient input sanitization and output escaping. This makes it possible for authenticated attackers with administrator-level access and above to inject arbitrary web scripts in pages that will execute whenever a user accesses an injected page. This only affects multi-site installations and installations where unfiltered_html has been disabled.,4.4,CWE-79
CVE-2025-11440,A vulnerability was determined in JhumanJ OpnForm up to 1.9.3. Impacted is an unknown function of the file /edit. Executing manipulation can lead to improper access controls. The attack can be executed remotely. The exploit has been publicly disclosed and may be utilized. This patch is called b15e29021d326be127193a5dbbd528c4e37e6324. Applying a patch is advised to resolve this issue.,4.3,CWE-266
CVE-2025-66913,JimuReport thru version 2.1.3 is vulnerable to remote code execution when processing user-controlled H2 JDBC URLs. The application passes the attacker-supplied JDBC URL directly to the H2 driver allowing the use of certain directives to execute arbitrary Java code. A different vulnerability than CVE-2025-10770.,9.8,CWE-94
CVE-2024-43474,Microsoft SQL Server Information Disclosure Vulnerability,7.6,CWE-170
CVE-2024-9973,A vulnerability was found in SourceCodester Online Eyewear Shop 1.0. It has been classified as critical. Affected is an unknown function of the file /admin/?page=reports of the component Report Viewing Page. The manipulation of the argument date leads to sql injection. It is possible to launch the attack remotely. The exploit has been disclosed to the public and may be used.,6.3,CWE-89
CVE-2025-54670,Improper Neutralization of Input During Web Page Generation ('Cross-site Scripting') vulnerability in bobbingwide oik allows Reflected XSS. This issue affects oik: from n/a through 4.15.2.,7.1,CWE-79
CVE-2025-0593,The vulnerability may allow a remote low priviledged attacker to run arbitrary shell commands by using lower-level functions to interact with the device.,8.8,CWE-77
CVE-2025-29208,CodeZips Gym Management System v1.0 is vulnerable to SQL injection in the name parameter within /dashboard/admin/deleteroutine.php.,6.5,CWE-89
CVE-2025-42974,Due to missing authorization check an attacker authenticated as a non-administrative user could call a remote-enabled function module. This could enable access to information normally restricted resulting in low impact on confidentiality. There is no impact on integrity or availability.,4.3,CWE-862
CVE-2024-25811,An access control issue in Dreamer CMS v4.0.1 allows attackers to download backup files and leak sensitive information.,6.5,CWE-284
