CVE,Description,CVSS3_BaseScore,CWE
CVE-2025-24838,Improper privilege management for some Intel(R) CIP software before version WIN_DCA_2.4.0.11001 within Ring 3: User Applications may allow an escalation of privilege. Unprivileged software adversary with an authenticated user combined with a low complexity attack may enable escalation of privilege. This result may potentially occur via network access when attack requirements are present without special internal knowledge and requires no user interaction. The potential vulnerability may impact the confidentiality (high) integrity (high) and availability (high) of the vulnerable system resulting in subsequent system confidentiality (none) integrity (none) and availability (none) impacts.,8.8,CWE-269
CVE-2022-20717,A vulnerability in the NETCONF process of Cisco SD-WAN vEdge Routers could allow an authenticated local attacker to cause an affected device to run out of memory resulting in a denial of service (DoS) condition. This vulnerability is due to insufficient memory management when an affected device receives large amounts of traffic. An attacker could exploit this vulnerability by sending malicious traffic to an affected device. A successful exploit could allow the attacker to cause the device to crash resulting in a DoS condition.,5.5,CWE-789
CVE-2024-20713,Adobe Substance 3D Stager versions 2.1.3 and earlier are affected by an out-of-bounds read vulnerability that could lead to disclosure of sensitive memory. An attacker could leverage this vulnerability to bypass mitigations such as ASLR. Exploitation of this issue requires user interaction in that a victim must open a malicious file.,5.5,CWE-125
CVE-2022-28307,This vulnerability allows remote attackers to execute arbitrary code on affected installations of Bentley View 10.16.02.022. User interaction is required to exploit this vulnerability in that the target must visit a malicious page or open a malicious file. The specific flaw exists within the parsing of DXF files. Crafted data in a DXF file can trigger a read past the end of an allocated buffer. An attacker can leverage this vulnerability to execute code in the context of the current process. Was ZDI-CAN-16306.,7.8,CWE-125
CVE-2025-67715,Weblate is a web based localization tool. In versions prior to 5.15 it was possible to retrieve user notification settings or list all users via API. Version 5.15 fixes the issue.,4.3,CWE-284
CVE-2024-57775,JFinalOA before v2025.01.01 was discovered to contain a SQL injection vulnerability via the component getWorkFlowHis?insid.,8.8,CWE-89
CVE-2025-4715,A vulnerability was found in Campcodes Sales and Inventory System 1.0. It has been declared as critical. Affected by this vulnerability is an unknown functionality of the file /pages/view_application.php. The manipulation of the argument cid leads to sql injection. The attack can be launched remotely. The exploit has been disclosed to the public and may be used.,7.3,CWE-74
CVE-2024-53736,Cross-Site Request Forgery (CSRF) vulnerability in Jason Grim Custom Shortcode Sidebars allows Stored XSS.This issue affects Custom Shortcode Sidebars: from n/a through 1.2.,7.1,CWE-352
CVE-2022-32814,A type confusion issue was addressed with improved state handling. This issue is fixed in watchOS 8.7 tvOS 15.6 iOS 15.6 and iPadOS 15.6 macOS Monterey 12.5. An app may be able to execute arbitrary code with kernel privileges.,7.8,CWE-843
CVE-2025-49342,Cross-Site Request Forgery (CSRF) vulnerability in Wolfgang Häfelinger Custom Style allows Stored XSS.This issue affects Custom Style: from n/a through 1.0.,7.1,CWE-352
CVE-2025-54110,Integer overflow or wraparound in Windows Kernel allows an authorized attacker to elevate privileges locally.,8.8,CWE-190
CVE-2026-22284,Dell SmartFabric OS10 Software versions prior to 10.5.6.12 contains an Improper Neutralization of Special Elements used in a Command ('Command Injection') vulnerability. A high privileged attacker with remote access could potentially exploit this vulnerability leading to Command execution.,6.6,CWE-77
CVE-2022-40615, IBM Sterling Partner Engagement Manager 6.1 6.2 and 6.2.1 is vulnerable to SQL injection. A remote attacker could send specially crafted SQL statements which could allow the attacker to view add modify or delete information in the back-end database. IBM X-Force ID: 236208.  ,6.3,CWE-89
CVE-2024-36582,alexbinary object-deep-assign 1.0.11 is vulnerable to Prototype Pollution via the extend() method of Module.deepAssign (/src/index.js),9.8,CWE-1321
CVE-2022-32358,Product Show Room Site v1.0 is vulnerable to SQL Injection via /psrs/classes/Master.php?f=delete_inquiry.,7.2,CWE-89
CVE-2025-10232,A weakness has been identified in 299ko up to 2.0.0. Affected by this issue is the function getSentDir/delete of the file plugin/filemanager/controllers/FileManagerAPIController.php. Executing manipulation can lead to path traversal. It is possible to launch the attack remotely. The exploit has been made available to the public and could be exploited. The vendor was contacted early about this disclosure but did not respond in any way.,5.4,CWE-22
CVE-2022-35114,SWFTools commit 772e55a2 was discovered to contain a segmentation violation via extractFrame at /readers/swf.c.,5.5,CWE-125
CVE-2022-3789,A vulnerability has been found in Tim Campus Confession Wall and classified as critical. Affected by this vulnerability is an unknown functionality of the file share.php. The manipulation of the argument post_id leads to sql injection. The exploit has been disclosed to the public and may be used. The associated identifier of this vulnerability is VDB-212611.,5.5,CWE-707
CVE-2022-3923,The ActiveCampaign for WooCommerce WordPress plugin before 1.9.8 does not have authorisation check when cleaning up its error logs via an AJAX action which could allow any authenticated users such as subscriber to call it and remove error logs.,4.3,CWE-862
CVE-2021-4428,A vulnerability has been found in what3words Autosuggest Plugin up to 4.0.0 on WordPress and classified as problematic. Affected by this vulnerability is the function enqueue_scripts of the file w3w-autosuggest/public/class-w3w-autosuggest-public.php of the component Setting Handler. The manipulation leads to information disclosure. The attack can be launched remotely. Upgrading to version 4.0.1 is able to address this issue. The patch is named dd59cbac5f86057d6a73b87007c08b8bfa0c32ac. It is recommended to upgrade the affected component. The associated identifier of this vulnerability is VDB-234247.,2.7,CWE-200
CVE-2024-8022,A vulnerability was found in Genexis Tilgin Home Gateway 322_AS0500-03_05_13_05. It has been rated as problematic. This issue affects some unknown processing of the file /vood/cgi-bin/vood_view.cgi?lang=EN&act=user/spec_conf&sessionId=86213915328111654515&user=A&message2user=Account%20updated. The manipulation of the argument Phone Number leads to cross site scripting. The attack may be initiated remotely. The exploit has been disclosed to the public and may be used. NOTE: The vendor was contacted early about this disclosure but did not respond in any way.,3.5,CWE-79
CVE-2024-2972,The Floating Chat Widget: Contact Chat Icons WhatsApp Telegram Chat Line Messenger WeChat Email SMS Call Button  WordPress plugin before 3.1.9 does not sanitise and escape some of its settings which could allow high privilege users such as admin to perform Stored Cross-Site Scripting attacks even when the unfiltered_html capability is disallowed (for example in multisite setup),3.8,CWE-79
CVE-2025-42910,Due to missing verification of file type or content SAP Supplier Relationship Management allows an authenticated attacker to upload arbitrary files. These files could include executables which might be downloaded and executed by the user which could host malware. On successful exploitation an attacker could cause high impact on confidentiality integrity and availability of the application.,9.0,CWE-434
CVE-2023-22572, Dell PowerScale OneFS 9.1.0.x-9.4.0.x contain an insertion of sensitive information into log file vulnerability in change password api. A low privilege local attacker could potentially exploit this vulnerability leading to system takeover.  ,7.8,CWE-532
CVE-2023-23005,In the Linux kernel before 6.2 mm/memory-tiers.c misinterprets the alloc_memory_type return value (expects it to be NULL in the error case whereas it is actually an error pointer). NOTE: this is disputed by third parties because there are no realistic cases in which a user can cause the alloc_memory_type error case to be reached.,5.5,CWE-476
CVE-2023-49701,Memory Corruption in SIM management while USIMPhase2init  ,7.2,CWE-119
CVE-2024-12452,The Ziggeo plugin for WordPress is vulnerable to Stored Cross-Site Scripting via the plugin's 'ziggeo_event' shortcode in all versions up to and including 3.1 due to insufficient input sanitization and output escaping on user supplied attributes. This makes it possible for authenticated attackers with contributor-level access and above to inject arbitrary web scripts in pages that will execute whenever a user accesses an injected page.,6.4,CWE-79
CVE-2025-3842,A vulnerability was found in panhainan DS-Java 1.0 and classified as critical. This issue affects the function uploadUserPic.action of the file src/com/phn/action/FileUpload.java. The manipulation of the argument fileUpload leads to code injection. The attack may be initiated remotely. The exploit has been disclosed to the public and may be used.,6.3,CWE-74
CVE-2025-69356,Improper Control of Filename for Include/Require Statement in PHP Program ('PHP Remote File Inclusion') vulnerability in CodexThemes TheGem Theme Elements (for Elementor) thegem-elements-elementor allows PHP Local File Inclusion.This issue affects TheGem Theme Elements (for Elementor): from n/a through <= 5.11.0.,7.5,CWE-98
CVE-2022-2145,Cloudflare WARP client for Windows (up to v. 2022.5.309.0) allowed creation of mount points from its ProgramData folder. During installation of the WARP client it was possible to escalate privileges and overwrite SYSTEM protected files.,5.8,CWE-20
CVE-2022-28440,An arbitrary file upload vulnerability in UCMS v1.6 allows attackers to execute arbitrary code via a crafted PHP file.,8.8,CWE-434
CVE-2025-11235,Unverified Password Change vulnerability in Progress MOVEit Transfer on Windows (REST API modules).This issue affects MOVEit Transfer: from 2023.1.0 before 2023.1.3 from 2023.0.0 before 2023.0.8 from 2022.1.0 before 2022.1.11 from 2022.0.0 before 2022.0.10.,3.7,CWE-620
CVE-2024-30535,Improper Neutralization of Special Elements used in an SQL Command ('SQL Injection') vulnerability in WhiteStudio Easy Form Builder.This issue affects Easy Form Builder: from n/a through 3.7.4.  ,8.5,CWE-89
CVE-2025-47658,Unrestricted Upload of File with Dangerous Type vulnerability in ELEXtensions ELEX WordPress HelpDesk & Customer Ticketing System allows Upload a Web Shell to a Web Server. This issue affects ELEX WordPress HelpDesk & Customer Ticketing System: from n/a through 3.2.7.,9.9,CWE-434
CVE-2025-47761,An Exposed IOCTL with Insufficient Access Control vulnerability [CWE-782] vulnerability in Fortinet FortiClientWindows 7.4.0 through 7.4.3 FortiClientWindows 7.2.0 through 7.2.9 may allow an authenticated local user to execute unauthorized code via fortips driver.  Success of the attack would require bypassing the Windows memory protections such as Heap integrity and HSP. In addition it requires a valid and running VPN IPSec connection.,7.8,CWE-782
CVE-2023-28358,A vulnerability has been discovered in Rocket.Chat where a markdown parsing issue in the Search Messages feature allows the insertion of malicious tags. This can be exploited on servers with content security policy disabled possible leading to some issues attacks like account takeover.,6.1,CWE-79
CVE-2025-2977,A vulnerability was found in GFI KerioConnect 10.0.6. It has been declared as problematic. Affected by this vulnerability is an unknown functionality of the component PDF File Handler. The manipulation leads to cross site scripting. The attack can be launched remotely. The exploit has been disclosed to the public and may be used. The vendor was contacted early about this disclosure but did not respond in any way.,3.5,CWE-79
CVE-2024-53697,An out-of-bounds write vulnerability has been reported to affect several QNAP operating system versions. If exploited the vulnerability could allow remote attackers who have gained administrator access to modify or corrupt memory.  We have already fixed the vulnerability in the following versions: QTS 5.2.3.3006 build 20250108 and later QuTS hero h5.2.3.3006 build 20250108 and later,7.2,CWE-787
CVE-2022-20554,In removeEventHubDevice of InputDevice.cpp there is a possible OOB read due to a use after free. This could lead to local escalation of privilege with System execution privileges needed. User interaction is not needed for exploitation.Product: AndroidVersions: Android-13Android ID: A-245770596,6.7,CWE-416
CVE-2022-49750,In the Linux kernel the following vulnerability has been resolved:  cpufreq: CPPC: Add u64 casts to avoid overflowing  The fields of the _CPC object are unsigned 32-bits values. To avoid overflows while using _CPC's values add 'u64' casts.,5.5,CWE-190
CVE-2022-22893,Jerryscript 3.0.0 was discovered to contain a stack overflow via vm_loop.lto_priv.304 in /jerry-core/vm/vm.c.,7.8,CWE-787
CVE-2024-11090,The Membership Plugin – Restrict Content plugin for WordPress is vulnerable to Sensitive Information Exposure in all versions up to and including 3.2.13 via the WordPress core search feature. This makes it possible for unauthenticated attackers to extract sensitive data from posts that have been restricted to higher-level roles such as administrator.,5.3,CWE-200
CVE-2024-37427,Missing Authorization vulnerability in Arraytics Timetics allows Exploiting Incorrectly Configured Access Control Security Levels.This issue affects Timetics: from n/a through 1.0.21.,5.3,CWE-862
CVE-2023-24883,Microsoft PostScript and PCL6 Class Printer Driver Information Disclosure Vulnerability,6.5,CWE-126
CVE-2026-24322,SAP Solution Tools Plug-In (ST-PI) contains a function module that does not perform the necessary authorization checks for authenticated users allowing sensitive information to be disclosed. This vulnerability has a high impact on confidentiality and does not affect integrity or availability.,7.7,CWE-862
CVE-2024-36158,Adobe Experience Manager versions 6.5.20 and earlier are affected by a stored Cross-Site Scripting (XSS) vulnerability that could be abused by an attacker to inject malicious scripts into vulnerable form fields. Malicious JavaScript may be executed in a victim’s browser when they browse to the page containing the vulnerable field.,5.4,CWE-79
CVE-2024-13241,Improper Authorization vulnerability in Drupal Open Social allows Collect Data from Common Resource Locations.This issue affects Open Social: from 0.0.0 before 12.0.5.,9.1,CWE-285
CVE-2022-26205,Marky commit 3686565726c65756e was discovered to contain a remote code execution (RCE) vulnerability via the Display text fields. This vulnerability allows attackers to execute arbitrary code via injection of a crafted payload.,9.8,CWE-74
CVE-2024-11256,A vulnerability was found in 1000 Projects Portfolio Management System MCA 1.0 and classified as critical. This issue affects some unknown processing of the file /login.php. The manipulation of the argument username leads to sql injection. The attack may be initiated remotely. The exploit has been disclosed to the public and may be used.,7.3,CWE-74
CVE-2022-28382,An issue was discovered in certain Verbatim drives through 2022-03-31. Due to the use of an insecure encryption AES mode (Electronic Codebook aka ECB) an attacker may be able to extract information even from encrypted data for example by observing repeating byte patterns. The firmware of the USB-to-SATA bridge controller INIC-3637EN uses AES-256 with the ECB mode. This operation mode of block ciphers (e.g. AES) always encrypts identical plaintext data in this case blocks of 16 bytes to identical ciphertext data. For some data for instance bitmap images the lack of the cryptographic property called diffusion within ECB can leak sensitive information even in encrypted data. Thus the use of the ECB operation mode can put the confidentiality of specific information at risk even in an encrypted form. This affects Keypad Secure USB 3.2 Gen 1 Drive Part Number #49428 Store 'n' Go Secure Portable HDD GD25LK01-3637-C VER4.0 Executive Fingerprint Secure SSD GDMSFE01-INI3637-C VER1.1 and Fingerprint Secure Portable Hard Drive Part Number #53650.,7.5,CWE-327
CVE-2023-52714,Vulnerability of defects introduced in the design process in the hwnff module. Impact: Successful exploitation of this vulnerability may affect service confidentiality.,7.5,CWE-657
CVE-2023-32323,Synapse is an open-source Matrix homeserver written and maintained by the Matrix.org Foundation. A malicious user on a Synapse homeserver X with permission to create certain state events can disable outbound federation from X to an arbitrary homeserver Y. Synapse instances with federation disabled are not affected. In versions of Synapse up to and including 1.73 Synapse did not limit the size of `invite_room_state` meaning that it was possible to create an arbitrarily large invite event. Synapse 1.74 refuses to create oversized `invite_room_state` fields. Server operators should upgrade to Synapse 1.74 or newer urgently.,5.0,CWE-20
CVE-2025-50902,Cross Site Request Forgery (CSRF) vulnerability in old-peanut Open-Shop (aka old-peanut/wechat_applet__open_source) thru 1.0.0 allows attackers to gain sensitive information via crafted HTTP Post message.,8.8,CWE-352
CVE-2024-31168,Out-of-bounds Read vulnerability in Open Networking Foundation (ONF) libfluid (libfluid_msg module). This vulnerability is associated with program routine fluid_msg::EchoCommon::unpack.  This issue affects libfluid: 0.1.0.,6.5,CWE-125
CVE-2023-29201,XWiki Commons are technical libraries common to several other top level XWiki projects. The restricted mode of the HTML cleaner in XWiki introduced in version 4.2-milestone-1 only escaped `<script>` and `<style>`-tags but neither attributes that can be used to inject scripts nor other dangerous HTML tags like `<iframe>`. As a consequence any code relying on this restricted mode for security is vulnerable to JavaScript injection (cross-site scripting/XSS). When a privileged user with programming rights visits such a comment in XWiki the malicious JavaScript code is executed in the context of the user session. This allows server-side code execution with programming rights impacting the confidentiality integrity and availability of the XWiki instance. This problem has been patched in XWiki 14.6 RC1 with the introduction of a filter with allowed HTML elements and attributes that is enabled in restricted mode. There are no known workarounds apart from upgrading to a version including the fix.,9.0,CWE-79
CVE-2023-52536,In faceid service there is a possible out of bounds read due to a missing bounds check. This could lead to local denial of service with System execution privileges needed,4.4,CWE-125
CVE-2023-6381,Improper input validation vulnerability in Newsletter Software SuperMailer affecting version 11.20.0.2204. An attacker could exploit this vulnerability by sending a malicious configuration file (file with SMB extension) to a user via a link or email attachment and persuade the user to open the file with the affected software on the local system. A successful exploit could allow the attacker to crash the application when attempting to load the malicious file.,3.3,CWE-20
CVE-2024-1559,The Link Library plugin for WordPress is vulnerable to Stored Cross-Site Scripting via the 'll_reciprocal' parameter in all versions up to and including 7.6 due to insufficient input sanitization and output escaping. This makes it possible for unauthenticated attackers to inject arbitrary web scripts in pages that will execute whenever a user accesses an injected page.,6.5,CWE-79
CVE-2024-45085,IBM WebSphere Application Server 8.5 is vulnerable to a denial of service under certain configurations caused by an unexpected specially crafted request. A remote attacker could exploit this vulnerability to cause an error resulting in a denial of service.,5.9,CWE-754
CVE-2020-20588,File upload vulnerability in function upload in action/Core.class.php in zhimengzhe iBarn 1.5 allows remote attackers to run arbitrary code via avatar upload to index.php.,8.8,CWE-434
CVE-2025-14722,A vulnerability was determined in vion707 DMadmin up to 3403cafdb42537a648c30bf8cbc8148ec60437d1. This impacts the function Add of the file Admin/Controller/AddonsController.class.php of the component Backend. Executing manipulation can lead to cross site scripting. The attack can be executed remotely. The exploit has been publicly disclosed and may be utilized. This product implements a rolling release for ongoing delivery which means version information for affected or updated releases is unavailable. The vendor was contacted early about this disclosure but did not respond in any way.,2.4,CWE-79
CVE-2023-39939,SQL injection vulnerability in LuxCal Web Calendar prior to 5.2.3M (MySQL version) and LuxCal Web Calendar prior to 5.2.3L (SQLite version) allows a remote unauthenticated attacker to execute arbitrary queries against the database and obtain or alter the information in it.,9.1,CWE-89
CVE-2025-3726,A vulnerability was found in PCMan FTP Server 2.0.7. It has been rated as critical. Affected by this issue is some unknown functionality of the component CD Command Handler. The manipulation leads to buffer overflow. The attack may be launched remotely. The exploit has been disclosed to the public and may be used.,7.3,CWE-119
CVE-2023-28074,Dell BSAFE Crypto-C Micro Edition version 4.1.5 and Dell BSAFE Micro Edition Suite versions 4.0 through 4.6.1 and version 5.0 contains an Out-of-bounds Read vulnerability. An unauthenticated attacker with local access could potentially exploit this vulnerability leading to Information exposure.,6.2,CWE-125
CVE-2024-1594,A path traversal vulnerability exists in the mlflow/mlflow repository specifically within the handling of the `artifact_location` parameter when creating an experiment. Attackers can exploit this vulnerability by using a fragment component `#` in the artifact location URI to read arbitrary files on the server in the context of the server's process. This issue is similar to CVE-2023-6909 but utilizes a different component of the URI to achieve the same effect. ,7.5,CWE-22
CVE-2025-32834,A vulnerability has been identified in TeleControl Server Basic (All versions < V3.1.2.2). The affected application is vulnerable to SQL injection through the internally used 'UpdateConnectionVariablesWithImport' method. This could allow an authenticated remote attacker to bypass authorization controls to read from and write to the application's database and execute code with NT AUTHORITY\NetworkService permissions. A successful attack requires the attacker to be able to access port 8000 on a system where a vulnerable version of the affected application is executed on.,8.8,CWE-89
CVE-2025-24936,The web application allows user input to pass unfiltered to a command executed on the underlying operating system. The vulnerable component is bound to the network stack and the set of possible attackers extends up to and including the entire Internet.  An attacker with low privileged access to the application has the potential to execute commands on the operating system under the context of the webserver.,9.0,CWE-78
CVE-2026-22258,Suricata is a network IDS IPS and NSM engine. Prior to versions 8.0.3 and 7.0.14 crafted DCERPC traffic can cause Suricata to expand a buffer w/o limits leading to memory exhaustion and the process getting killed. While reported for DCERPC over UDP it is believed that DCERPC over TCP and SMB are also vulnerable. DCERPC/TCP in the default configuration should not be vulnerable as the default stream depth is limited to 1MiB. Versions 8.0.3 and 7.0.14 contain a patch. Some workarounds are available. For DCERPC/UDP disable the parser. For DCERPC/TCP the `stream.reassembly.depth` setting will limit the amount of data that can be buffered. For DCERPC/SMB the `stream.reassembly.depth` can be used as well but is set to unlimited by default. Imposing a limit here may lead to loss of visibility in SMB.,7.5,CWE-400
CVE-2023-28673,A missing permission check in Jenkins OctoPerf Load Testing Plugin Plugin 4.5.2 and earlier allows attackers with Overall/Read permission to enumerate credentials IDs of credentials stored in Jenkins.,4.3,CWE-862
CVE-2025-48754,In the memory_pages crate 0.1.0 for Rust division by zero can occur.,2.9,CWE-369
CVE-2022-30331,The User-Defined Functions (UDF) feature in TigerGraph 3.6.0 allows installation of a query (in the GSQL query language) without proper validation. Consequently an attacker can execute arbitrary C++ code. NOTE: the vendor's position is GSQL was behaving as expected.,8.8,CWE-20
CVE-2023-38702,Knowage is an open source analytics and business intelligence suite. Starting in the 6.x.x branch and prior to version 8.1.8 the endpoint `/knowage/restful-services/dossier/importTemplateFile` allows authenticated users to upload `template file` on the server but does not need any authorization to be reached. When the JSP file is uploaded the attacker just needs to connect to `/knowageqbeengine/foo.jsp` to gain code execution on the server. By exploiting this vulnerability an attacker with low privileges can upload a JSP file to the `knowageqbeengine` directory and gain code execution capability on the server. This issue has been patched in Knowage version 8.1.8.,9.9,CWE-22
