CVE,Description,CVSS3_BaseScore,CWE
CVE-2025-21787,In the Linux kernel the following vulnerability has been resolved:  team: better TEAM_OPTION_TYPE_STRING validation  syzbot reported following splat [1]  Make sure user-provided data contains one nul byte.  [1]  BUG: KMSAN: uninit-value in string_nocheck lib/vsprintf.c:633 [inline]  BUG: KMSAN: uninit-value in string+0x3ec/0x5f0 lib/vsprintf.c:714   string_nocheck lib/vsprintf.c:633 [inline]   string+0x3ec/0x5f0 lib/vsprintf.c:714   vsnprintf+0xa5d/0x1960 lib/vsprintf.c:2843   __request_module+0x252/0x9f0 kernel/module/kmod.c:149   team_mode_get drivers/net/team/team_core.c:480 [inline]   team_change_mode drivers/net/team/team_core.c:607 [inline]   team_mode_option_set+0x437/0x970 drivers/net/team/team_core.c:1401   team_option_set drivers/net/team/team_core.c:375 [inline]   team_nl_options_set_doit+0x1339/0x1f90 drivers/net/team/team_core.c:2662   genl_family_rcv_msg_doit net/netlink/genetlink.c:1115 [inline]   genl_family_rcv_msg net/netlink/genetlink.c:1195 [inline]   genl_rcv_msg+0x1214/0x12c0 net/netlink/genetlink.c:1210   netlink_rcv_skb+0x375/0x650 net/netlink/af_netlink.c:2543   genl_rcv+0x40/0x60 net/netlink/genetlink.c:1219   netlink_unicast_kernel net/netlink/af_netlink.c:1322 [inline]   netlink_unicast+0xf52/0x1260 net/netlink/af_netlink.c:1348   netlink_sendmsg+0x10da/0x11e0 net/netlink/af_netlink.c:1892   sock_sendmsg_nosec net/socket.c:718 [inline]   __sock_sendmsg+0x30f/0x380 net/socket.c:733   ____sys_sendmsg+0x877/0xb60 net/socket.c:2573   ___sys_sendmsg+0x28d/0x3c0 net/socket.c:2627   __sys_sendmsg net/socket.c:2659 [inline]   __do_sys_sendmsg net/socket.c:2664 [inline]   __se_sys_sendmsg net/socket.c:2662 [inline]   __x64_sys_sendmsg+0x212/0x3c0 net/socket.c:2662   x64_sys_call+0x2ed6/0x3c30 arch/x86/include/generated/asm/syscalls_64.h:47   do_syscall_x64 arch/x86/entry/common.c:52 [inline]   do_syscall_64+0xcd/0x1e0 arch/x86/entry/common.c:83  entry_SYSCALL_64_after_hwframe+0x77/0x7f,5.5,CWE-908
CVE-2023-25937, Dell BIOS contains an improper input validation vulnerability. A local authenticated malicious user with administrator privileges may potentially exploit this vulnerability in order to modify a UEFI variable.  ,5.1,CWE-20
CVE-2022-28303,This vulnerability allows remote attackers to execute arbitrary code on affected installations of Bentley View 10.16.02.022. User interaction is required to exploit this vulnerability in that the target must visit a malicious page or open a malicious file. The specific flaw exists within the parsing of SKP files. The issue results from the lack of validating the existence of an object prior to performing operations on the object. An attacker can leverage this vulnerability to execute code in the context of the current process. Was ZDI-CAN-16280.,7.8,CWE-416
CVE-2023-38250,Adobe Commerce versions 2.4.7-beta1 (and earlier) 2.4.6-p2 (and earlier) 2.4.5-p4 (and earlier) and 2.4.4-p5 (and earlier) are affected by an Improper Neutralization of Special Elements used in an SQL Command ('SQL Injection') vulnerability that could lead in arbitrary code execution by an admin-privilege authenticated attacker. Exploitation of this issue does not require user interaction and attack complexity is high as it requires knowledge of tooling beyond just using the UI.,8.0,CWE-89
CVE-2025-27374,An issue was discovered in the Secure Boot component in Samsung Mobile Processor and Wearable Processor Exynos 9820 9825 980 990 850 1080 1280 2200 1330 1380 1480 2400. The lack of a length check leads to out-of-bounds writes.,5.3,CWE-787
CVE-2023-51607,Kofax Power PDF PNG File Parsing Out-Of-Bounds Read Information Disclosure Vulnerability. This vulnerability allows remote attackers to disclose sensitive information on affected installations of Kofax Power PDF. User interaction is required to exploit this vulnerability in that the target must visit a malicious page or open a malicious file.  The specific flaw exists within the parsing of PNG files. The issue results from the lack of proper validation of user-supplied data which can result in a read past the end of an allocated object. An attacker can leverage this in conjunction with other vulnerabilities to execute arbitrary code in the context of the current process. Was ZDI-CAN-21829.,5.5,CWE-125
CVE-2023-2478,An issue has been discovered in GitLab CE/EE affecting all versions starting from 15.4 before 15.9.7 all versions starting from 15.10 before 15.10.6 all versions starting from 15.11 before 15.11.2. Under certain conditions a malicious unauthorized GitLab user may use a GraphQL endpoint to attach a malicious runner to any project.,9.6,CWE-732
CVE-2025-36463,Multiple out-of-bounds read and write vulnerabilities exist in the ControlVault WBDI Driver Broadcom Storage Adapter functionality of Dell ControlVault3 prior to 5.15.14.19 and Dell ControlVault3 Plus prior to 6.2.36.47. A specially crafted WinBioControlUnit call can lead to memory corruption. An attacker can issue an api call to trigger this vulnerability. This vulnerability is triggered when submitting a `WinBioControlUnit` call to the StorageAdapter with the ControlCode 4 (`WBIO_USH_ADD_RECORD`) and with an invalid   `SendBufferSize`.,7.3,CWE-805
CVE-2018-25030,A vulnerability classified as problematic has been found in Mirmay Secure Private Browser and File Manager up to 2.5. Affected is the Auto Lock. A race condition leads to a local authentication bypass. The exploit has been disclosed to the public and may be used.,3.3,CWE-287
CVE-2024-12752,Foxit PDF Reader AcroForm Memory Corruption Remote Code Execution Vulnerability. This vulnerability allows remote attackers to execute arbitrary code on affected installations of Foxit PDF Reader. User interaction is required to exploit this vulnerability in that the target must visit a malicious page or open a malicious file.  The specific flaw exists within the handling of AcroForms. The issue results from the lack of proper validation of user-supplied data which can result in a memory corruption condition. An attacker can leverage this vulnerability to execute code in the context of the current process. Was ZDI-CAN-25345.,7.8,CWE-119
CVE-2025-20353,A vulnerability in the web-based management interface of Cisco Catalyst Center could allow an unauthenticated remote attacker to conduct a cross-site scripting (XSS) attack against a user of the interface of an affected device.    This vulnerability is due to insufficient validation of user input. An attacker could exploit this vulnerability by persuading a user of the web-based management interface to click a crafted link. A successful exploit could allow the attacker to execute arbitrary script code in the context of the affected interface or access sensitive browser-based information.,6.1,CWE-79
CVE-2023-40197,Auth. (contributor+) Stored Cross-Site Scripting (XSS) vulnerability in Devaldi Ltd flowpaper plugin <= 1.9.9 versions.,6.5,CWE-79
CVE-2021-25047,The 10Web Social Photo Feed WordPress plugin before 1.4.29 was affected by a reflected Cross-Site Scripting (XSS) vulnerability in the wdi_apply_changes admin page allowing an attacker to perform such attack against any logged in users,6.1,CWE-79
CVE-2025-68435,Zerobyte is a backup automation tool Zerobyte versions prior to 0.18.5 and 0.19.0 contain an authentication bypass vulnerability where authentication middleware is not properly applied to API endpoints. This results in certain API endpoints being accessible without valid session credentials. This is dangerous for those who have exposed Zerobyte to be used outside of their internal network. A fix has been applied in both version 0.19.0 and 0.18.5. If immediate upgrade is not possible restrict network access to the Zerobyte instance to trusted networks only using firewall rules or network segmentation. This is only a temporary mitigation; upgrading is strongly recommended.,9.1,CWE-305
CVE-2024-43335,Improper Neutralization of Input During Web Page Generation (XSS or 'Cross-site Scripting') vulnerability in CyberChimps Responsive Blocks – WordPress Gutenberg Blocks allows Stored XSS.This issue affects Responsive Blocks – WordPress Gutenberg Blocks: from n/a through 1.8.8.,6.5,CWE-79
CVE-2025-64254,Missing Authorization vulnerability in Ronald Huereca Photo Block photo-block allows Exploiting Incorrectly Configured Access Control Security Levels.This issue affects Photo Block: from n/a through <= 1.5.1.,8.8,CWE-862
CVE-2022-45459,Sensitive information disclosure due to insecure registry permissions. The following products are affected: Acronis Agent (Windows) before build 30025 Acronis Cyber Protect 15 (Windows) before build 30984.,7.5,CWE-200
CVE-2023-37312,D-Link DAP-2622 DDP Set Device Info Device Name Stack-based Buffer Overflow Remote Code Execution Vulnerability. This vulnerability allows network-adjacent attackers to execute arbitrary code on affected installations of D-Link DAP-2622 routers. Authentication is not required to exploit this vulnerability.  The specific flaw exists within the DDP service. The issue results from the lack of proper validation of the length of user-supplied data prior to copying it to a fixed-length stack-based buffer. An attacker can leverage this vulnerability to execute code in the context of root. . Was ZDI-CAN-20089.,8.8,CWE-121
CVE-2025-30451,This issue was addressed with improved redaction of sensitive information. This issue is fixed in macOS Sequoia 15.4. An app may be able to access sensitive user data.,5.5,CWE-200
CVE-2024-2564,A vulnerability was found in PandaXGO PandaX up to 20240310 and classified as critical. This issue affects the function ExportUser of the file /apps/system/api/user.go. The manipulation of the argument filename leads to path traversal: '../filedir'. The attack may be initiated remotely. The exploit has been disclosed to the public and may be used. The associated identifier of this vulnerability is VDB-257063.,6.3,CWE-24
CVE-2025-11669,Zohocorp ManageEngine PAM360 versions before 8202; Password Manager Pro versions before 13221; Access Manager Plus versions prior to 4401 are vulnerable to an authorization issue in the initiate remote session functionality.,8.1,CWE-862
CVE-2025-45585,Multiple stored cross-site scripting (XSS) vulnerabilities in Audi UTR 2.0 Universal Traffic Recorder 2.0 allows attackers to execute arbitrary web scripts or HTML via injecting a crafted payload into the wifi_sta_ssid or wifi_ap_ssid parameters.,5.4,CWE-79
CVE-2023-41128,Improper Neutralization of Input During Web Page Generation ('Cross-site Scripting') vulnerability in Iqonic Design WP Roadmap – Product Feedback Board allows Stored XSS.This issue affects WP Roadmap – Product Feedback Board: from n/a through 1.0.8.  ,5.9,CWE-79
CVE-2025-0955,The VidoRev Extensions plugin for WordPress is vulnerable to unauthorized access due to a missing capability check on the 'vidorev_import_single_video' AJAX action in all versions up to and including 2.9.9.9.9.9.5. This makes it possible for unauthenticated attackers to import arbitrary youtube videos.,5.3,CWE-862
CVE-2023-50831,Improper Neutralization of Input During Web Page Generation ('Cross-site Scripting') vulnerability in VillaTheme CURCY – Multi Currency for WooCommerce allows Stored XSS.This issue affects CURCY – Multi Currency for WooCommerce: from n/a through 2.2.0.  ,6.5,CWE-79
CVE-2023-24195,Online Food Ordering System v2 was discovered to contain a cross-site scripting (XSS) vulnerability via the page parameter in index.php.,6.1,CWE-79
CVE-2023-0696,Type confusion in V8 in Google Chrome prior to 110.0.5481.77 allowed a remote attacker to potentially exploit heap corruption via a crafted HTML page. (Chromium security severity: High),8.8,CWE-843
CVE-2025-62688,An incorrect permission assignment for a critical resource vulnerability was discovered in Productivity Suite software version 4.4.1.19. The vulnerability allows an attacker with low-privileged credentials to change their role gaining full control access to the project.,7.1,CWE-732
CVE-2025-5559,The TimeZoneCalculator plugin for WordPress is vulnerable to Stored Cross-Site Scripting via the plugin's 'timezonecalculator_output' shortcode in all versions up to and including 3.37 due to insufficient input sanitization and output escaping on user supplied attributes. This makes it possible for authenticated attackers with contributor-level access and above to inject arbitrary web scripts in pages that will execute whenever a user accesses an injected page.,6.4,CWE-79
CVE-2024-50269,In the Linux kernel the following vulnerability has been resolved:  usb: musb: sunxi: Fix accessing an released usb phy  Commit 6ed05c68cbca (usb: musb: sunxi: Explicitly release USB PHY on exit) will cause that usb phy @glue->xceiv is accessed after released.  1) register platform driver @sunxi_musb_driver // get the usb phy @glue->xceiv sunxi_musb_probe() -> devm_usb_get_phy().  2) register and unregister platform driver @musb_driver musb_probe() -> sunxi_musb_init() use the phy here //the phy is released here musb_remove() -> sunxi_musb_exit() -> devm_usb_put_phy()  3) register @musb_driver again musb_probe() -> sunxi_musb_init() use the phy here but the phy has been released at 2). ...  Fixed by reverting the commit namely removing devm_usb_put_phy() from sunxi_musb_exit().,7.8,CWE-416
CVE-2025-21549,Vulnerability in the Oracle WebLogic Server product of Oracle Fusion Middleware (component: Core).   The supported version that is affected is 14.1.1.0.0. Easily exploitable vulnerability allows unauthenticated attacker with network access via HTTP/2 to compromise Oracle WebLogic Server.  Successful attacks of this vulnerability can result in unauthorized ability to cause a hang or frequently repeatable crash (complete DOS) of Oracle WebLogic Server. CVSS 3.1 Base Score 7.5 (Availability impacts).  CVSS Vector: (CVSS:3.1/AV:N/AC:L/PR:N/UI:N/S:U/C:N/I:N/A:H).,7.5,CWE-400
CVE-2025-48551,In multiple locations there is a possible leak of an image across the Android User isolation boundary due to a confused deputy. This could lead to local information disclosure with no additional execution privileges needed. User interaction is needed for exploitation.,5.0,CWE-441
CVE-2024-10953,An authenticated data.all user is able to perform mutating UPDATE operations on persisted Notification records in data.all for group notifications that their user is not a member of.,4.3,CWE-863
CVE-2021-4294,A vulnerability was found in OpenShift OSIN. It has been classified as problematic. This affects the function ClientSecretMatches/CheckClientSecret. The manipulation of the argument secret leads to observable timing discrepancy. The name of the patch is 8612686d6dda34ae9ef6b5a974e4b7accb4fea29. It is recommended to apply a patch to fix this issue. The associated identifier of this vulnerability is VDB-216987.,2.6,CWE-208
CVE-2024-25407,SteVe v3.6.0 was discovered to use predictable transaction ID's when receiving a StartTransaction request. This vulnerability can allow attackers to cause a Denial of Service (DoS) by using the predicted transaction ID's to terminate other transactions.,7.5,CWE-331
CVE-2023-38403,iperf3 before 3.14 allows peers to cause an integer overflow and heap corruption via a crafted length field.,7.5,CWE-190
CVE-2022-31019,Vapor is a server-side Swift HTTP web framework. When using automatic content decoding an attacker can craft a request body that can make the server crash with the following request: `curl -d array[_0][0][array][_0][0][array]$(for f in $(seq 1100); do echo -n '[_0][0][array]'; done)[string][_0]=hello%20world http://localhost:8080/foo`. The issue is unbounded attacker controlled stack growth which will at some point lead to a stack overflow and a process crash. This issue has been fixed in version 4.61.1.,7.5,CWE-120
CVE-2022-21697,Jupyter Server Proxy is a Jupyter notebook server extension to proxy web services. Versions of Jupyter Server Proxy prior to 3.2.1 are vulnerable to Server-Side Request Forgery (SSRF). Any user deploying Jupyter Server or Notebook with jupyter-proxy-server extension enabled is affected. A lack of input validation allows authenticated clients to proxy requests to other hosts bypassing the `allowed_hosts` check. Because authentication is required which already grants permissions to make the same requests via kernel or terminal execution this is considered low to moderate severity. Users may upgrade to version 3.2.1 to receive a patch or as a workaround install the patch manually.,6.3,CWE-918
CVE-2025-20933,Out-of-bounds read in parsing bmp image in Samsung Notes prior to version 4.4.26.71 allows local attackers to read out-of-bounds memory.,5.5,CWE-125
CVE-2024-56544,In the Linux kernel the following vulnerability has been resolved:  udmabuf: change folios array from kmalloc to kvmalloc  When PAGE_SIZE 4096 MAX_PAGE_ORDER 10 64bit machine page_alloc only support 4MB. If above this trigger this warn and return NULL.  udmabuf can change size limit if change it to 3072(3GB) and then alloc 3GB udmabuf will fail create.  [ 4080.876581] ------------[ cut here ]------------ [ 4080.876843] WARNING: CPU: 3 PID: 2015 at mm/page_alloc.c:4556 __alloc_pages+0x2c8/0x350 [ 4080.878839] RIP: 0010:__alloc_pages+0x2c8/0x350 [ 4080.879470] Call Trace: [ 4080.879473]  <TASK> [ 4080.879473]  ? __alloc_pages+0x2c8/0x350 [ 4080.879475]  ? __warn.cold+0x8e/0xe8 [ 4080.880647]  ? __alloc_pages+0x2c8/0x350 [ 4080.880909]  ? report_bug+0xff/0x140 [ 4080.881175]  ? handle_bug+0x3c/0x80 [ 4080.881556]  ? exc_invalid_op+0x17/0x70 [ 4080.881559]  ? asm_exc_invalid_op+0x1a/0x20 [ 4080.882077]  ? udmabuf_create+0x131/0x400  Because MAX_PAGE_ORDER kmalloc can max alloc 4096 * (1 << 10) 4MB memory each array entry is pointer(8byte) so can save 524288 pages(2GB).  Further more costly order(order 3) may not be guaranteed that it can be applied for due to fragmentation.  This patch change udmabuf array use kvmalloc_array this can fallback alloc into vmalloc which can guarantee allocation for any size and does not affect the performance of kmalloc allocations.,5.5,CWE-476
CVE-2025-4113,A vulnerability was found in PHPGurukul Curfew e-Pass Management System 1.0. It has been rated as critical. This issue affects some unknown processing of the file /admin/edit-pass-detail.php. The manipulation of the argument editid leads to sql injection. The attack may be initiated remotely. The exploit has been disclosed to the public and may be used.,6.3,CWE-74
CVE-2023-43455,An issue in TOTOLINK X6000R V9.4.0cu.652_B20230116 and V9.4.0cu.852_B20230719 allows a remote attacker to execute arbitrary code via the command parameter of the setting/setTracerouteCfg component.,9.8,CWE-77
CVE-2025-49380,Deserialization of Untrusted Data vulnerability in wpinstinct WooCommerce Vehicle Parts Finder woo-vehicle-parts-finder allows Object Injection.This issue affects WooCommerce Vehicle Parts Finder: from n/a through <= 3.7.,5.3,CWE-502
CVE-2023-39357,Cacti is an open source operational monitoring and fault management framework. A defect in the sql_save function was discovered. When the column type is numeric the sql_save function directly utilizes user input. Many files and functions calling the sql_save function do not perform prior validation of user input leading to the existence of multiple SQL injection vulnerabilities in Cacti. This allows authenticated users to exploit these SQL injection vulnerabilities to perform privilege escalation and remote code execution. This issue has been addressed in version 1.2.25. Users are advised to upgrade. There are no known workarounds for this vulnerability.,8.8,CWE-20
CVE-2025-9297,A vulnerability was detected in Tenda i22 1.0.0.3(4687). This impacts the function formWeixinAuthInfoGet of the file /goform/wxportalauth. Performing manipulation of the argument Type results in stack-based buffer overflow. The attack can be initiated remotely. The exploit is now public and may be used.,8.8,CWE-119
CVE-2021-45423,A Buffer Overflow vulnerabilityexists in Pev 0.81 via the pe_exports function from exports.c.. The array offsets_to_Names is dynamically allocated on the stack using exp->NumberOfFunctions as its size. However the loop uses exp->NumberOfNames to iterate over it and set its components value. Therefore the loop code assumes that exp->NumberOfFunctions is greater than ordinal at each iteration. This can lead to arbitrary code execution.,9.8,CWE-120
CVE-2025-25156,Cross-Site Request Forgery (CSRF) vulnerability in Stanko Metodiev Quote Comments allows Stored XSS. This issue affects Quote Comments: from n/a through 2.2.1.,7.1,CWE-352
CVE-2022-31990,Badminton Center Management System v1.0 is vulnerable to SQL Injection via bcms/classes/Master.php?f=delete_product.,9.8,CWE-89
CVE-2026-21874,NiceGUI is a Python-based UI framework. From versions v2.10.0 to 3.4.1 an unauthenticated attacker can exhaust Redis connections by repeatedly opening and closing browser tabs on any NiceGUI application using Redis-backed storage. Connections are never released leading to service degradation when Redis hits its connection limit. NiceGUI continues accepting new connections - errors are logged but the app stays up with broken storage functionality. This issue has been patched in version 3.5.0.,5.3,CWE-772
CVE-2023-52690,In the Linux kernel the following vulnerability has been resolved:  powerpc/powernv: Add a null pointer check to scom_debug_init_one()  kasprintf() returns a pointer to dynamically allocated memory which can be NULL upon failure. Add a null pointer check and release 'ent' to avoid memory leaks.,5.5,CWE-476
CVE-2024-8960,The Cowidgets – Elementor Addons plugin for WordPress is vulnerable to Stored Cross-Site Scripting via SVG File uploads in all versions up to and including 1.2.0 due to insufficient input sanitization and output escaping. This makes it possible for authenticated attackers with Author-level access and above to inject arbitrary web scripts in pages that will execute whenever a user accesses the SVG file.,6.4,CWE-79
CVE-2021-45864,tsMuxer git-c6a0277 was discovered to contain a segmentation fault via DTSStreamReader::findFrame in dtsStreamReader.cpp.,5.5,CWE-125
CVE-2020-15340,Zyxel CloudCNM SecuManager 3.1.0 and 3.1.1 has a hardcoded opt/axess/AXAssets/default_axess/axess/TR69/Handlers/turbolink/sshkeys/id_rsa SSH key.,7.5,CWE-311
CVE-2023-40660,A flaw was found in OpenSC packages that allow a potential PIN bypass. When a token/card is authenticated by one process it can perform cryptographic operations in other processes when an empty zero-length pin is passed. This issue poses a security risk particularly for OS logon/screen unlock and for small permanently connected tokens to computers. Additionally the token can internally track login status. This flaw allows an attacker to gain unauthorized access carry out malicious actions or compromise the system without the user's awareness.,6.6,CWE-287
CVE-2021-3982,Linux distributions using CAP_SYS_NICE for gnome-shell may be exposed to a privilege escalation issue. An attacker with low privilege permissions may take advantage of the way CAP_SYS_NICE is currently implemented and eventually load code to increase its process scheduler priority leading to possible DoS of other services running in the same machine.,5.5,CWE-273
CVE-2023-2156,A flaw was found in the networking subsystem of the Linux kernel within the handling of the RPL protocol. This issue results from the lack of proper handling of user-supplied data which can lead to an assertion failure. This may allow an unauthenticated remote attacker to create a denial of service condition on the system.,7.5,CWE-617
CVE-2024-4228,Improper Neutralization of Special Elements used in an SQL Command ('SQL Injection') CWE - 200 - Exposure of Sensitive Information to an Unauthorized Actor CWE - 522 - Insufficiently Protected Credentials vulnerability in Magarsus Consultancy SSO (Single Sign On) allows SQL Injection.This issue affects SSO (Single Sign On): from 1.0 before 1.1.,9.8,CWE-89
CVE-2024-13370,The Youzify – BuddyPress Community User Profile Social Network & Membership Plugin for WordPress plugin for WordPress is vulnerable to unauthorized access due to a missing capability check on the save_addon_key_license() function in all versions up to and including 1.3.2. This makes it possible for authenticated attackers with Subscriber-level access and above to update arbitrary options to a value of a valid license key.,6.5,CWE-862
CVE-2022-3042,Use after free in PhoneHub in Google Chrome on Chrome OS prior to 105.0.5195.52 allowed a remote attacker to potentially exploit heap corruption via a crafted HTML page.,8.8,CWE-362
CVE-2025-10819,A security vulnerability has been detected in fuyang_lipengjun platform 1.0. This issue affects the function UserCouponController of the file /usercoupon/queryAll. The manipulation leads to improper authorization. Remote exploitation of the attack is possible. The exploit has been disclosed publicly and may be used.,4.3,CWE-266
CVE-2025-26921,Deserialization of Untrusted Data vulnerability in magepeopleteam Booking and Rental Manager allows Object Injection. This issue affects Booking and Rental Manager: from n/a through 2.2.6.,8.8,CWE-502
CVE-2024-33274,Directory Traversal vulnerability in FME Modules customfields v.2.2.7 and before allows a remote attacker to obtain sensitive information via the Custom Checkout Fields Add Custom Fields to Checkout parameter of the ajax.php,7.5,CWE-22
CVE-2023-50990,Tenda i29 v1.0 V1.0.0.5 was discovered to contain a buffer overflow via the rebootTime parameter in the sysScheduleRebootSet function.,9.8,CWE-787
