CVE,Description,CVSS3_BaseScore,CWE
CVE-2024-10475,The Responsive Contact Form Builder & Lead Generation Plugin WordPress plugin before 1.9.8 does not sanitise and escape some of its settings which could allow high privilege users such as admin to perform Stored Cross-Site Scripting attacks even when the unfiltered_html capability is disallowed (for example in multisite setup).,4.8,CWE-79
CVE-2022-23507,Tendermint is a high-performance blockchain consensus engine for Byzantine fault tolerant applications. Versions prior to 0.28.0 contain a potential attack via Improper Verification of Cryptographic Signature affecting anyone using the tendermint-light-client and related packages to perform light client verification (e.g. IBC-rs Hermes). The light client does not check that the chain IDs of the trusted and untrusted headers match resulting in a possible attack vector where someone who finds a header from an untrusted chain that satisfies all other verification conditions (e.g. enough overlapping validator signatures) could fool a light client. The attack vector is currently theoretical and no proof-of-concept exists yet to exploit it on live networks. This issue is patched in version 0.28.0. There are no workarounds.,5.4,CWE-347
CVE-2021-28544,Apache Subversion SVN authz protected copyfrom paths regression Subversion servers reveal 'copyfrom' paths that should be hidden according to configured path-based authorization (authz) rules. When a node has been copied from a protected location users with access to the copy can see the 'copyfrom' path of the original. This also reveals the fact that the node was copied. Only the 'copyfrom' path is revealed; not its contents. Both httpd and svnserve servers are vulnerable.,4.3,CWE-200
CVE-2023-5627,A vulnerability has been identified in NPort 6000 Series making the authentication mechanism vulnerable. This vulnerability arises from the incorrect implementation of sensitive information protection potentially allowing malicious users to gain unauthorized access to the web service.  ,7.5,CWE-257
CVE-2024-38729,Cross-Site Request Forgery (CSRF) vulnerability in MBE Worldwide S.p.A. MBE eShip allows Cross Site Request Forgery.This issue affects MBE eShip: from n/a through 2.1.2.,5.4,CWE-352
CVE-2024-30197,Improper Neutralization of Input During Web Page Generation ('Cross-site Scripting') vulnerability in Andy Moyle Church Admin allows Stored XSS.This issue affects Church Admin: from n/a through 4.0.26.  ,6.5,CWE-79
CVE-2025-7465,A vulnerability classified as critical was found in Tenda FH1201 1.2.0.14. Affected by this vulnerability is the function fromRouteStatic of the file /goform/fromRouteStatic of the component HTTP POST Request Handler. The manipulation of the argument page leads to buffer overflow. The attack can be launched remotely. The exploit has been disclosed to the public and may be used.,8.8,CWE-119
CVE-2021-47360,In the Linux kernel the following vulnerability has been resolved:  binder: make sure fd closes complete  During BC_FREE_BUFFER processing the BINDER_TYPE_FDA object cleanup may close 1 or more fds. The close operations are completed using the task work mechanism -- which means the thread needs to return to userspace or the file object may never be dereferenced -- which can lead to hung processes.  Force the binder thread back to userspace if an fd is closed during BC_FREE_BUFFER handling.,5.5,CWE-252
CVE-2023-1702,Cross-site Scripting (XSS) - Generic in GitHub repository pimcore/pimcore prior to 10.5.20.,5.4,CWE-79
CVE-2025-22818,Improper Neutralization of Input During Web Page Generation ('Cross-site Scripting') vulnerability in S3Bubble S3Player – WooCommerce & Elementor Integration allows Stored XSS.This issue affects S3Player – WooCommerce & Elementor Integration: from n/a through 4.2.1.,6.5,CWE-79
CVE-2023-25831,There is a reflected XSS vulnerability in Esri Portal for ArcGIS versions 10.9.1and below which may allow a remote unauthenticated attacker to create a crafted link which when clicked could potentially execute arbitrary JavaScript code in the victim’s browser.,6.1,CWE-79
CVE-2023-37758,D-LINK DIR-815 v1.01 was discovered to contain a buffer overflow via the component /web/captcha.cgi.,7.5,CWE-120
CVE-2023-34392, A Missing Authentication for Critical Function vulnerability in the Schweitzer Engineering Laboratories SEL-5037 SEL Grid Configurator could allow an attacker to run arbitrary commands on managed devices by an authorized device operator.      See Instruction Manual Appendix A and Appendix E dated 20230615 for more details.   This issue affects SEL-5037 SEL Grid Configurator: before 4.5.0.20.  ,8.2,CWE-306
CVE-2023-47225,Missing Authorization vulnerability in KaizenCoders Short URL allows Exploiting Incorrectly Configured Access Control Security Levels.This issue affects Short URL: from n/a through 1.6.8.,5.4,CWE-862
CVE-2025-7619,BatchSignCS a background Windows application developed by WellChoose has an Arbitrary File Write vulnerability. If a user visits a malicious website while the application is running remote attackers can write arbitrary files to any path and potentially lead to arbitrary code execution.,8.8,CWE-23
CVE-2023-25166,formula is a math and string formula parser. In versions prior to 3.0.1 crafted user-provided strings to formula's parser might lead to polynomial execution time and a denial of service. Users should upgrade to 3.0.1+. There are no known workarounds for this vulnerability.,5.5,CWE-1333
CVE-2025-31359,A directory traversal vulnerability exists in the PVMP package unpacking functionality of Parallels Desktop for Mac version 20.2.2 (55879). This vulnerability can be exploited by an attacker to write to arbitrary files potentially leading to privilege escalation.,8.8,CWE-22
CVE-2025-47655,Cross-Site Request Forgery (CSRF) vulnerability in themarketer2023 theMarketer allows Stored XSS. This issue affects theMarketer: from n/a through 1.4.7.,7.1,CWE-352
CVE-2025-10307,The Backuply – Backup Restore Migrate and Clone plugin for WordPress is vulnerable to arbitrary file deletion due to insufficient file path validation in the delete backup functionality in all versions up to and including 1.4.8. This makes it possible for authenticated attackers with Administrator-level access and above to delete arbitrary files on the server which can easily lead to remote code execution when the right file is deleted (such as wp-config.php).,6.5,CWE-22
CVE-2022-31528,The bonn-activity-maps/bam_annotation_tool repository through 2021-08-31 on GitHub allows absolute path traversal because the Flask send_file function is used unsafely.,9.3,CWE-22
CVE-2022-41232,A cross-site request forgery (CSRF) vulnerability in Jenkins Build-Publisher Plugin 1.22 and earlier allows attackers to replace any config.xml file on the Jenkins controller file system with an empty file by providing a crafted file name to an API endpoint.,8.0,CWE-352
CVE-2025-25005,Improper input validation in Microsoft Exchange Server allows an authorized attacker to perform tampering over a network.,6.5,CWE-20
CVE-2024-33471,An issue in the Sensor Settings of AVTECH Room Alert 4E v4.4.0 allows attackers to gain access to SMTP credentials in plaintext via a crafted AJAX request. NOTE: This vulnerability only affects products that are no longer supported by the maintainer.,7.2,CWE-312
CVE-2022-32367,Product Show Room Site v1.0 is vulnerable to SQL Injection via /psrs/admin/?page=inquiries/view_inquiry&id=.,7.2,CWE-89
CVE-2017-20115,A vulnerability was found in TrueConf Server 4.3.7 and classified as problematic. This issue affects some unknown processing of the file /admin/conferences/list/. The manipulation of the argument sort leads to basic cross site scripting (Reflected). The attack may be initiated remotely. The exploit has been disclosed to the public and may be used.,3.5,CWE-80
CVE-2025-2979,A vulnerability classified as problematic has been found in WCMS 11. This affects an unknown part of the file /index.php?anonymous/setregister of the component Registration. The manipulation of the argument Username leads to cross site scripting. It is possible to initiate the attack remotely. The exploit has been disclosed to the public and may be used. The vendor was contacted early about this disclosure but did not respond in any way.,2.4,CWE-79
CVE-2025-6637,A maliciously crafted PRT file when parsed through certain Autodesk products can force an Out-of-Bounds Write vulnerability. A malicious actor may leverage this vulnerability to cause a crash cause data corruption or execute arbitrary code in the context of the current process.,7.8,CWE-787
CVE-2023-6272,The Theme My Login 2FA WordPress plugin before 1.2 does not rate limit 2FA validation attempts which may allow an attacker to brute-force all possibilities which shouldn't be too long as the 2FA codes are 6 digits.,9.8,CWE-307
CVE-2024-45751,tgt (aka Linux target framework) before 1.0.93 attempts to achieve entropy by calling rand without srand. The PRNG seed is always 1 and thus the sequence of challenges is always identical.,5.9,CWE-338
CVE-2022-39090,In power management service there is a missing permission check. This could lead to set up power management service with no additional execution privileges needed.,7.8,CWE-862
CVE-2023-24811,Misskey is an open source decentralized social media platform. In versions prior to 13.3.2 the URL preview function is subject to a cross site scripting vulnerability due to insufficient URL validation. Arbitrary JavaScript is executed when a malicious URL is loaded in the `View in Player` or `View in Window` preview. This has been fixed in version 13.3.2. Users are advised to upgrade. Users unable to upgrade should avoid usage of the `View in Player` or `View in Window` functions. ,7.1,CWE-79
CVE-2025-21232,Windows Digital Media Elevation of Privilege Vulnerability,6.6,CWE-125
CVE-2024-32464,Action Text brings rich text content and editing to Rails. Instances of ActionText::Attachable::ContentAttachment included within a rich_text_area tag could potentially contain unsanitized HTML. This vulnerability is fixed in 7.1.3.4 and 7.2.0.beta2.,6.1,CWE-79
CVE-2023-53077,In the Linux kernel the following vulnerability has been resolved:  drm/amd/display: fix shift-out-of-bounds in CalculateVMAndRowBytes  [WHY] When PTEBufferSizeInRequests is zero UBSAN reports the following warning because dml_log2 returns an unexpected negative value:    shift exponent 4294966273 is too large for 32-bit type 'int'  [HOW]  In the case PTEBufferSizeInRequests is zero skip the dml_log2() and assign the result directly.,7.8,CWE-787
CVE-2025-24250,This issue was addressed with improved access restrictions. This issue is fixed in macOS Ventura 13.7.5 macOS Sequoia 15.4 macOS Sonoma 14.7.5. A malicious app acting as a HTTPS proxy could get access to sensitive user data.,9.8,CWE-200
CVE-2022-20949,A vulnerability in the management web server of Cisco Firepower Threat Defense (FTD) Software could allow an authenticated remote attacker with high privileges to execute configuration commands on an affected system.    This vulnerability exists because access to HTTPS endpoints is not properly restricted on an affected device. An attacker could exploit this vulnerability by sending specific messages to the affected HTTPS handler. A successful exploit could allow the attacker to perform configuration changes on the affected system which should be configured and managed only through Cisco Firepower Management Center (FMC) Software.,6.5,CWE-399
CVE-2023-40490,Maxon Cinema 4D SKP File Parsing Use-After-Free Remote Code Execution Vulnerability. This vulnerability allows remote attackers to execute arbitrary code on affected installations of Maxon Cinema 4D. User interaction is required to exploit this vulnerability in that the target must visit a malicious page or open a malicious file.  The specific flaw exists within the parsing of SKP files. The issue results from the lack of validating the existence of an object prior to performing operations on the object. An attacker can leverage this vulnerability to execute code in the context of the current process. Was ZDI-CAN-21438.,7.8,CWE-416
CVE-2022-27406,FreeType commit 22a0cccb4d9d002f33c1ba7a4b36812c7d4f46b5 was discovered to contain a segmentation violation via the function FT_Request_Size.,7.5,CWE-125
CVE-2024-25662,Oxygen XML Web Author v26.0.0 and older and Oxygen Content Fusion v6.1 and older are vulnerable to Cross-Site Scripting (XSS) for malicious URLs.,6.1,CWE-79
CVE-2025-54853,A reflected cross-site scripting (xss) vulnerability exists in the modifyUser functionality of MedDream PACS Premium 7.3.6.870. A specially crafted malicious URL can lead to arbitrary javascript code execution. An attacker can provide a crafted URL to trigger this vulnerability.,6.1,CWE-79
CVE-2023-45650,Cross-Site Request Forgery (CSRF) vulnerability in Fla-shop.Com HTML5 Maps plugin <= 1.7.1.4 versions.,4.3,CWE-352
CVE-2023-5378,Improper Input Validation vulnerability in  MegaBIP and already unsupported SmodBIP software allows for Stored XSS.This issue affects SmodBIP in all versions and MegaBIP in versions up to 4.36.2. MegaBIP 5.08 was tested and is not vulnerable. A precise range of vulnerable versions remains unknown.,8.8,CWE-79
CVE-2025-23887,Improper Neutralization of Input During Web Page Generation ('Cross-site Scripting') vulnerability in Scott Allan Wallick Blog Summary allows Stored XSS.This issue affects Blog Summary: from n/a through 0.1.2 β.,6.5,CWE-79
CVE-2026-24323,The BSP applications allow an unauthenticated user to inject malicious script content via user-controlled URL parameters that are not sufficiently sanitized. When a victim accesses a crafted URL the injected script is executed in the victim�s browser leading to a low impact on confidentiality and integrity and no impact on the availability of the application.,6.1,CWE-601
CVE-2022-35244,A format string injection vulnerability exists in the XCMD getVarHA functionality of abode systems inc. iota All-In-One Security Kit 6.9X and 6.9Z. A specially-crafted XCMD can lead to memory corruption information disclosure and denial of service. An attacker can send a malicious XML payload to trigger this vulnerability.,9.8,CWE-134
CVE-2017-20178,** UNSUPPORTED WHEN ASSIGNED ** A vulnerability was found in Codiad 2.8.0. It has been rated as problematic. Affected by this issue is the function saveJSON of the file components/install/process.php. The manipulation of the argument data leads to information disclosure. The attack may be launched remotely. The complexity of an attack is rather high. The exploitation is known to be difficult. Upgrading to version 2.8.1 is able to address this issue. The patch is identified as 517119de673e62547ee472a730be0604f44342b5. It is recommended to upgrade the affected component. VDB-221498 is the identifier assigned to this vulnerability. NOTE: This vulnerability only affects products that are no longer supported by the maintainer.,3.1,CWE-200
CVE-2025-41078,Weaknesses in the authorization mechanisms of Viafirma Documents v3.7.129 allow an authenticated user without privileges to list and access other user data use user creation modification and deletion features and escalate privileges by impersonating other users of the application in the generation and signing of documents.,8.1,CWE-863
CVE-2024-9362,An unauthenticated directory traversal vulnerability exists in Polyaxon affecting the latest version. This vulnerability allows an attacker to retrieve directory information and file contents from the server without proper authorization leading to sensitive information disclosure. The issue enables access to system directories such as `/etc` potentially resulting in significant security risks.,7.5,CWE-22
CVE-2024-0371,The Views for WPForms – Display & Edit WPForms Entries on your site frontend plugin for WordPress is vulnerable to unauthorized modification of data due to a missing capability check on the 'create_view' function in all versions up to and including 3.2.2. This makes it possible for authenticated attackers with subscriber access and above to create form views.,4.3,CWE-862
CVE-2024-6871,G DATA Total Security Incorrect Permission Assignment Local Privilege Escalation Vulnerability. This vulnerability allows local attackers to escalate privileges on affected installations of G DATA Total Security. An attacker must first obtain the ability to execute low-privileged code on the target system in order to exploit this vulnerability.  The specific flaw exists within the handling of autostart tasks. The issue results from incorrect permissions set on folders. An attacker can leverage this vulnerability to escalate privileges and execute arbitrary code in the context of SYSTEM. Was ZDI-CAN-22629.,7.8,CWE-732
CVE-2024-49026,Microsoft Excel Remote Code Execution Vulnerability,7.8,CWE-77
CVE-2023-0321,Campbell Scientific dataloggers CR6 CR300 CR800 CR1000 and CR3000 may allow an attacker to download configuration files which may contain sensitive information about the internal network. From factory defaults the mentioned datalogges have HTTP and PakBus enabled. The devices with the default configuration allow this situation via the PakBus port. The exploitation of this vulnerability may allow an attacker to download modify and upload new configuration files.,9.1,CWE-200
CVE-2025-50891,The server-side backend for Adform Site Tracking before 2025-08-28 allows attackers to inject HTML or execute arbitrary code via cookie hijacking. NOTE: a customer does not need to take any action to update locally installed software (such as Adform Site Tracking 1.1).,7.2,CWE-79
CVE-2024-32736,A sql injection vulnerability exists in CyberPower PowerPanel Enterprise prior to v2.8.3. An unauthenticated remote attacker can leak sensitive information via the query_utask_verbose function within MCUDBHelper. ,7.5,CWE-89
CVE-2022-47360,In log service there is a missing permission check. This could lead to local denial of service in log service.,5.5,CWE-476
CVE-2022-37818,Tenda AX1803 v1.0.0.1 was discovered to contain a stack overflow via the list parameter at the function formSetQosBand.,7.8,CWE-787
CVE-2022-3661,Insufficient data validation in Extensions in Google Chrome prior to 107.0.5304.62 allowed a remote attacker who had compromised the renderer process to leak cross-origin data via a crafted Chrome extension. (Chromium security severity: Low),4.3,CWE-20
CVE-2025-8033,The JavaScript engine did not handle closed generators correctly and it was possible to resume them leading to a nullptr deref. This vulnerability affects Firefox < 141 Firefox ESR < 115.26 Firefox ESR < 128.13 Firefox ESR < 140.1 Thunderbird < 141 Thunderbird < 128.13 and Thunderbird < 140.1.,6.5,CWE-476
CVE-2025-27453,The HttpOnly flag is set to false on the PHPSESSION cookie. Therefore the cookie can be accessed by other sources such as JavaScript.,5.3,CWE-1004
CVE-2026-1938,The YayMail – WooCommerce Email Customizer plugin for WordPress is vulnerable to unauthorized license key deletion due to a missing authorization check on the `/yaymail-license/v1/license/delete` REST endpoint in versions up to and including 4.3.2. This makes it possible for authenticated attackers with Shop Manager-level access and above to delete the plugin's license key via the '/yaymail-license/v1/license/delete' endpoint granted they can obtain the REST API nonce.,5.3,CWE-862
CVE-2023-39252, Dell SCG Policy Manager 5.16.00.14  contains a broken cryptographic algorithm vulnerability. A remote unauthenticated attacker may potentially exploit this vulnerability by performing MitM attacks and let attackers obtain sensitive information.  ,5.9,CWE-327
CVE-2025-26681,Use after free in Windows Win32K - GRFX allows an authorized attacker to elevate privileges locally.,6.7,CWE-416
CVE-2023-0519,Cross-site Scripting (XSS) - Stored in GitHub repository modoboa/modoboa prior to 2.0.4.,5.4,CWE-79
CVE-2024-53822,Unrestricted Upload of File with Dangerous Type vulnerability in Genetech Pie Register Premium.This issue affects Pie Register Premium: from n/a before 3.8.3.3.,10.0,CWE-434
CVE-2025-10323,A vulnerability was found in Wavlink WL-WN578W2 221110. The impacted element is the function sub_409184 of the file /wizard_rep.shtml. The manipulation of the argument sel_EncrypTyp results in command injection. The attack may be performed from remote. The exploit has been made public and could be used. The vendor was contacted early about this disclosure but did not respond in any way.,7.3,CWE-74
CVE-2024-54291,Improper Limitation of a Pathname to a Restricted Directory ('Path Traversal') vulnerability in NotFound PluginPass allows Manipulating Web Input to File System Calls. This issue affects PluginPass: from n/a through 0.9.10.,8.6,CWE-22
CVE-2024-26296,Vulnerabilities in the ClearPass Policy Manager web-based management interface allow remote authenticated users to run arbitrary commands on the underlying host. A successful exploit could allow an attacker to execute arbitrary commands as root on the underlying operating system leading to complete system compromise.  ,7.2,CWE-77
CVE-2025-12426,The Quiz Maker plugin for WordPress is vulnerable to Sensitive Information Exposure in all versions up to and including 6.7.0.80. This is due to the plugin exposing quiz answers through the ays_quiz_check_answer AJAX action without proper authorization checks. The endpoint only validates a nonce but that same nonce is publicly available to all site visitors via the quiz_maker_ajax_public localized script data. This makes it possible for unauthenticated attackers to extract sensitive data including quiz answers for any quiz question.,5.3,CWE-200
CVE-2022-27860,Cross-Site Request Forgery (CSRF) leading to Cross-Site Scripting (XSS) in Shea Bunge's Footer Text plugin <= 2.0.3 on WordPress.,6.1,CWE-79
CVE-2023-22421,Out-of-bounds read vulnerability exists in Kostac PLC Programming Software (Former name: Koyo PLC Programming Software) Version 1.6.9.0 and earlier. The insufficient buffer size for the PLC program instructions leads to out-of-bounds read. As a result opening a specially crafted project file may lead to information disclosure and/or arbitrary code execution.,7.8,CWE-125
CVE-2023-36509,Missing Authorization vulnerability in Suresh Chand CHP Ads Block Detector allows Exploiting Incorrectly Configured Access Control Security Levels.This issue affects CHP Ads Block Detector: from n/a through 3.9.5.,5.4,CWE-862
CVE-2025-14539,The The Shortcode Ajax plugin for WordPress is vulnerable to arbitrary shortcode execution in all versions up to and including 1.0. This is due to the software allowing users to execute an action that does not properly validate a value before running do_shortcode. This makes it possible for unauthenticated attackers to execute arbitrary shortcodes.,5.4,CWE-94
CVE-2025-64845,Adobe Experience Manager versions 6.5.23 and earlier are affected by a stored Cross-Site Scripting (XSS) vulnerability that could be abused by a low privileged attacker to inject malicious scripts into vulnerable form fields. Malicious JavaScript may be executed in a victim’s browser when they browse to the page containing the vulnerable field.,5.4,CWE-79
CVE-2022-39155,A vulnerability has been identified in Parasolid V33.1 (All versions < V33.1.262) Parasolid V33.1 (All versions >= V33.1.262 < V33.1.263) Parasolid V34.0 (All versions < V34.0.252) Parasolid V34.1 (All versions < V34.1.242) Parasolid V35.0 (All versions < V35.0.161) Parasolid V35.0 (All versions >= V35.0.161 < V35.0.164) Simcenter Femap V2022.1 (All versions < V2022.1.3) Simcenter Femap V2022.2 (All versions < V2022.2.2). The affected application contains an out of bounds write past the end of an allocated buffer while parsing specially crafted X_T files. This could allow an attacker to execute code in the context of the current process. (ZDI-CAN-18192),7.8,CWE-787
CVE-2023-24381,Auth. (admin+) Stored Cross-Site Scripting (XSS) vulnerability in NsThemes Advanced Social Pixel plugin <= 2.1.1 versions.,5.9,CWE-79
CVE-2022-45808,SQL Injection vulnerability in LearnPress – WordPress LMS Plugin <= 4.1.7.3.2 versions.,9.9,CWE-89
CVE-2025-9680,A vulnerability was detected in O2OA up to 10.0-410. This impacts an unknown function of the file /x_portal_assemble_designer/jaxrs/page of the component Personal Profile Page. Performing manipulation results in cross site scripting. The attack can be initiated remotely. The exploit is now public and may be used. The vendor replied in the GitHub issue (translated from simplified Chinese): This issue will be fixed in the new version.,3.5,CWE-79
CVE-2024-35194,Minder is a software supply chain security platform. Prior to version 0.0.50 Minder engine is susceptible to a denial of service from memory exhaustion that can be triggered from maliciously created templates. Minder engine uses templating to generate strings for various use cases such as URLs messages for pull requests descriptions for advisories. In some cases can the user control both the template and the params for it and in a subset of these cases Minder reads the generated template entirely into memory. When Minders templating meets both of these conditions an attacker is able to generate large enough templates that Minder will exhaust memory and crash. This vulnerability is fixed in 0.0.50.,5.3,CWE-400
CVE-2024-6770,The Lifetime free Drag & Drop Contact Form Builder for WordPress VForm plugin for WordPress is vulnerable to Stored Cross-Site Scripting in all versions up to and including 2.1.5 due to insufficient input sanitization and output escaping. This makes it possible for unauthenticated attackers to inject arbitrary web scripts in pages that will execute whenever a user accesses an injected page.,7.2,CWE-79
