CVE,Description,CVSS3_BaseScore,CWE
CVE-2023-4718,The Font Awesome 4 Menus plugin for WordPress is vulnerable to Stored Cross-Site Scripting via the 'fa' and 'fa-stack' shortcodes in versions up to and including 4.7.0 due to insufficient input sanitization and output escaping on user supplied attributes. This makes it possible for authenticated attackers with contributor-level and above permissions to inject arbitrary web scripts in pages that will execute whenever a user accesses an injected page.,6.4,CWE-79
CVE-2023-5556,Cross-site Scripting (XSS) - Reflected in GitHub repository structurizr/onpremises prior to 3194.,6.1,CWE-79
CVE-2025-2847,A vulnerability which was classified as critical has been found in Codezips Gym Management System 1.0. This issue affects some unknown processing of the file /dashboard/admin/over_month.php. The manipulation of the argument mm leads to sql injection. The attack may be initiated remotely. The exploit has been disclosed to the public and may be used.,6.3,CWE-74
CVE-2021-45928,libjxl b02d6b9 as used in libvips 8.11 through 8.11.2 and other products has an out-of-bounds write in jxl::ModularFrameDecoder::DecodeGroup (called from jxl::FrameDecoder::ProcessACGroup and jxl::ThreadPool::RunCallState<jxl::FrameDecoder::ProcessSections).,5.5,CWE-787
CVE-2023-33720,mp4v2 v2.1.2 was discovered to contain a memory leak via the class MP4BytesProperty.,6.5,CWE-400
CVE-2025-49241,Missing Authorization vulnerability in bobbingwide oik allows Exploiting Incorrectly Configured Access Control Security Levels. This issue affects oik: from n/a through 4.15.1.,5.3,CWE-862
CVE-2024-8500,The WP Shortcodes Plugin — Shortcodes Ultimate plugin for WordPress is vulnerable to Stored Cross-Site Scripting via the several parameters in all versions up to and including 7.2.2 due to insufficient input sanitization and output escaping. This makes it possible for authenticated attackers with Contributor-level access and above to inject arbitrary web scripts in pages that will execute whenever a user accesses an injected page.,5.4,CWE-79
CVE-2023-0247,Uncontrolled Search Path Element in GitHub repository bits-and-blooms/bloom prior to 3.3.1.,7.8,CWE-427
CVE-2025-32026,Element Web is a Matrix web client built using the Matrix React SDK. Element Web starting from version 1.11.16 up to version 1.11.96 can be configured to load Element Call from an external URL. Under certain conditions the external page is able to get access to the media encryption keys used for an Element Call call. Version 1.11.97 fixes the problem.,3.8,CWE-497
CVE-2024-42337,CyberArk -  CWE-200: Exposure of Sensitive Information to an Unauthorized Actor,4.3,CWE-200
CVE-2024-3010,A vulnerability was found in Tenda FH1205 2.0.0.7(775) and classified as critical. Affected by this issue is the function formSetCfm of the file /goform/setcfm. The manipulation of the argument funcpara1 leads to stack-based buffer overflow. The attack may be launched remotely. The exploit has been disclosed to the public and may be used. The identifier of this vulnerability is VDB-258296. NOTE: The vendor was contacted early about this disclosure but did not respond in any way.,8.8,CWE-121
CVE-2023-32189,Insecure handling of ssh keys used to bootstrap clients allows local attackers to potentially gain access to the keys,5.9,CWE-639
CVE-2024-34560,Improper Neutralization of Input During Web Page Generation ('Cross-site Scripting') vulnerability in GOMO gee Search Plus allows Stored XSS.This issue affects gee Search Plus: from n/a through 1.4.4.  ,5.9,CWE-79
CVE-2023-48225,Laf is a cloud development platform. Prior to version 1.0.0-beta.13 the control of LAF app enV is not strict enough and in certain scenarios of privatization environment it may lead to sensitive information leakage in secret and configmap. In ES6 syntax if an obj directly references another obj the name of the obj itself will be used as the key and the entire object structure will be integrated intact. When constructing the deployment instance of the app env was found from the database and directly inserted into the template resulting in controllability here. Sensitive information in the secret and configmap can be read through the k8s envFrom field. In a privatization environment when `namespaceConf. fixed` is marked it may lead to the leakage of sensitive information in the system. As of time of publication it is unclear whether any patches or workarounds exist.,8.9,CWE-200
CVE-2025-1022,Versions of the package spatie/browsershot before 5.0.5 are vulnerable to Improper Input Validation in the setHtml function invoked by Browsershot::html() which can be bypassed by omitting the slashes in the file URI (e.g. file:../../../../etc/passwd). This is due to missing validations of the user input that should be blocking file URI schemes (e.g. file:// and file:/) in the HTML content.,8.2,CWE-20
CVE-2023-37352,Kofax Power PDF JPG File Parsing Out-Of-Bounds Read Information Disclosure Vulnerability. This vulnerability allows remote attackers to disclose sensitive information on affected installations of Kofax Power PDF. User interaction is required to exploit this vulnerability in that the target must visit a malicious page or open a malicious file.  The specific flaw exists within the parsing of JPG files. The issue results from the lack of proper validation of user-supplied data which can result in a read past the end of an allocated buffer. An attacker can leverage this in conjunction with other vulnerabilities to execute arbitrary code in the context of the current process. Was ZDI-CAN-20454.,5.5,CWE-125
CVE-2023-5832,Improper Input Validation in GitHub repository mintplex-labs/anything-llm prior to 0.1.0.,9.1,CWE-20
CVE-2023-0904,A vulnerability was found in SourceCodester Employee Task Management System 1.0. It has been rated as critical. This issue affects some unknown processing of the file task-details.php. The manipulation of the argument task_id leads to sql injection. The attack may be initiated remotely. The exploit has been disclosed to the public and may be used. The identifier VDB-221453 was assigned to this vulnerability.,6.3,CWE-89
CVE-2022-39002,Double free vulnerability in the storage module. Successful exploitation of this vulnerability will cause the memory to be freed twice.,9.8,CWE-415
CVE-2024-20457,A vulnerability in the logging component of Cisco Unified Communications Manager IM &amp; Presence Service (Unified CM IM&amp;P) could allow an authenticated remote attacker to view sensitive information in clear text on an affected system.    This vulnerability is due to the storage of unencrypted credentials in certain logs. An attacker could exploit this vulnerability by accessing the logs on an affected system and obtaining credentials that they may not normally have access to. A successful exploit could allow the attacker to access sensitive information from the device.,6.5,CWE-200
CVE-2023-25708,Cross-Site Request Forgery (CSRF) vulnerability in Rextheme WP VR – 360 Panorama and Virtual Tour Builder For WordPress plugin <= 8.2.7 versions.,4.3,CWE-352
CVE-2023-28065, Dell Command | Update Dell Update and Alienware Update versions 4.8.0 and prior contain an Insecure Operation on Windows Junction / Mount Point vulnerability. A local malicious user could potentially exploit this vulnerability leading to privilege escalation.  ,6.7,CWE-1386
CVE-2024-33180,Tenda AC18 V15.03.3.10_EN was discovered to contain a stack-based buffer overflow vulnerability via the deviceId parameter at ip/goform/saveParentControlInfo.,9.8,CWE-787
CVE-2025-27127,A vulnerability has been identified in TIA Project-Server (All versions < V2.1.1) TIA Project-Server V17 (All versions) Totally Integrated Automation Portal (TIA Portal) V17 (All versions) Totally Integrated Automation Portal (TIA Portal) V18 (All versions) Totally Integrated Automation Portal (TIA Portal) V19 (All versions < V19 Update 4) Totally Integrated Automation Portal (TIA Portal) V20 (All versions < V20 Update 3). The affected application improperly handles uploaded projects in the document root. This could allow an attacker with contributor privileges to cause denial of service by uploading a malicious project.,4.3,CWE-434
CVE-2024-22189,quic-go is an implementation of the QUIC protocol in Go. Prior to version 0.42.0 an attacker can cause its peer to run out of memory sending a large number of `NEW_CONNECTION_ID` frames that retire old connection IDs. The receiver is supposed to respond to each retirement frame with a `RETIRE_CONNECTION_ID` frame. The attacker can prevent the receiver from sending out (the vast majority of) these `RETIRE_CONNECTION_ID` frames by collapsing the peers congestion window (by selectively acknowledging received packets) and by manipulating the peer's RTT estimate. Version 0.42.0 contains a patch for the issue. No known workarounds are available.,7.5,CWE-770
CVE-2023-44325,Adobe Animate versions 23.0.2 (and earlier) is affected by an out-of-bounds read vulnerability that could lead to disclosure of sensitive memory. An attacker could leverage this vulnerability to bypass mitigations such as ASLR. Exploitation of this issue requires user interaction in that a victim must open a malicious file.,5.5,CWE-125
CVE-2025-23725,Improper Neutralization of Input During Web Page Generation ('Cross-site Scripting') vulnerability in TaskMeister Accessibility Task Manager allows Reflected XSS. This issue affects Accessibility Task Manager: from n/a through 1.2.1.,7.1,CWE-79
CVE-2014-125104,A vulnerability was found in VaultPress Plugin up to 1.6.0 on WordPress. It has been declared as critical. Affected by this vulnerability is the function protect_aioseo_ajax of the file class.vaultpress-hotfixes.php of the component MailPoet Plugin. The manipulation leads to unrestricted upload. The attack can be launched remotely. Upgrading to version 1.6.1 is able to address this issue. The patch is named e3b92b14edca6291c5f998d54c90cbe98a1fb0e3. It is recommended to upgrade the affected component. The associated identifier of this vulnerability is VDB-230263.,6.3,CWE-434
CVE-2023-29114,System logs could be accessed through web management application due to a lack of access control.   An attacker can obtain the following sensitive information:  •     Wi-Fi access point credentials to which the EV charger can connect.  •     APN web address and credentials.  •     IPSEC credentials.  •     Web interface access credentials for user and admin accounts.  •     JuiceBox system components (software installed model firmware version etc.).  •     C2G configuration details.  •     Internal IP addresses.  •     OTA firmware update configurations (DNS servers).  All the credentials are stored in logs in an unencrypted plaintext format.,5.7,CWE-200
CVE-2021-47333,In the Linux kernel the following vulnerability has been resolved:  misc: alcor_pci: fix null-ptr-deref when there is no PCI bridge  There is an issue with the ASPM(optional) capability checking function. A device might be attached to root complex directly in this case bus->self(bridge) will be NULL thus priv->parent_pdev is NULL. Since alcor_pci_init_check_aspm(priv->parent_pdev) checks the PCI link's ASPM capability and populate parent_cap_off which will be used later by alcor_pci_aspm_ctrl() to dynamically turn on/off device what we can do here is to avoid checking the capability if we are on the root complex. This will make pdev_cap_off 0 and alcor_pci_aspm_ctrl() will simply return when bring called effectively disable ASPM for the device.  [    1.246492] BUG: kernel NULL pointer dereference address: 00000000000000c0 [    1.248731] RIP: 0010:pci_read_config_byte+0x5/0x40 [    1.253998] Call Trace: [    1.254131]  ? alcor_pci_find_cap_offset.isra.0+0x3a/0x100 [alcor_pci] [    1.254476]  alcor_pci_probe+0x169/0x2d5 [alcor_pci],5.5,CWE-476
CVE-2022-2010,Out of bounds read in compositing in Google Chrome prior to 102.0.5005.115 allowed a remote attacker who had compromised the renderer process to potentially perform a sandbox escape via a crafted HTML page.,9.3,CWE-125
CVE-2025-2334,A vulnerability classified as problematic has been found in 274056675 springboot-openai-chatgpt e84f6f5. This affects the function deleteChat of the file /api/mjkj-chat/chat/ai/delete/chat of the component Chat History Handler. The manipulation of the argument chatListId leads to improper access controls. It is possible to initiate the attack remotely. The exploit has been disclosed to the public and may be used.,5.4,CWE-266
CVE-2025-39348,Deserialization of Untrusted Data vulnerability in ThemeGoods Grand Restaurant WordPress allows Object Injection.This issue affects Grand Restaurant WordPress: from n/a through 7.0.,9.8,CWE-502
CVE-2025-44893,FW-WGS-804HPT v1.305b241111 was discovered to contain a stack overflow via the ruleNamekey parameter in the web_acl_mgmt_Rules_Apply_post function.,9.8,CWE-121
CVE-2024-37163,SkyScrape is a GUI Dashboard for AWS Infrastructure and Managing Resources and Usage Costs.  SkyScrape's API requests are currently unsecured HTTP requests leading to potential vulnerabilities for the user's temporary credentials and data.  This affects version 1.0.0.,6.4,CWE-319
CVE-2022-31145,FlyteAdmin is the control plane for Flyte responsible for managing entities and administering workflow executions. In versions 1.1.30 and prior authenticated users using an external identity provider can continue to use Access Tokens and ID Tokens even after they expire. Users who use FlyteAdmin as the OAuth2 Authorization Server are unaffected by this issue. A patch is available on the `master` branch of the repository. As a workaround rotating signing keys immediately will invalidate all open sessions and force all users to attempt to obtain new tokens. Those who use this workaround should continue to rotate keys until FlyteAdmin has been upgraded and hide FlyteAdmin deployment ingress URL from the internet.,6.5,CWE-613
CVE-2022-48670,In the Linux kernel the following vulnerability has been resolved:  peci: cpu: Fix use-after-free in adev_release()  When auxiliary_device_add() returns an error auxiliary_device_uninit() is called which causes refcount for device to be decremented and .release callback will be triggered.  Because adev_release() re-calls auxiliary_device_uninit() it will cause use-after-free: [ 1269.455172] WARNING: CPU: 0 PID: 14267 at lib/refcount.c:28 refcount_warn_saturate+0x110/0x15 [ 1269.464007] refcount_t: underflow; use-after-free.,7.8,CWE-416
CVE-2024-41350,bjyadmin commit a560fd5 is vulnerable to Cross Site Scripting (XSS) via Public/statics/umeditor1_2_3/php/imageUp.php,6.1,CWE-79
CVE-2025-27339,Cross-Site Request Forgery (CSRF) vulnerability in Will Anderson Minimum Password Strength allows Cross Site Request Forgery. This issue affects Minimum Password Strength: from n/a through 1.2.0.,4.3,CWE-352
CVE-2024-30435,Improper Neutralization of Input During Web Page Generation ('Cross-site Scripting') vulnerability in POSIMYTH The Plus Blocks for Block Editor | Gutenberg allows Reflected XSS.This issue affects The Plus Blocks for Block Editor | Gutenberg: from n/a through 3.2.5.  ,7.1,CWE-79
CVE-2023-23696, Dell Command Intel vPro Out of Band versions prior to 4.3.1 contain an Improper Authorization vulnerability. A locally authenticated malicious users could potentially exploit this vulnerability in order to write arbitrary files to the system.  ,7.0,CWE-285
CVE-2023-3584,Mattermost fails to properly check the authorization of POST /api/v4/teams when passing a team override scheme ID in the request allowing an authenticated attacker with knowledge of a Team Override Scheme ID to create a new team with said team override scheme.  ,3.1,CWE-863
CVE-2023-45287,Before Go 1.20 the RSA based TLS key exchanges used the math/big library which is not constant time. RSA blinding was applied to prevent timing attacks but analysis shows this may not have been fully effective. In particular it appears as if the removal of PKCS#1 padding may leak timing information which in turn could be used to recover session key bits. In Go 1.20 the crypto/tls library switched to a fully constant time RSA implementation which we do not believe exhibits any timing side channels.,7.5,CWE-203
CVE-2024-7132,The Page Builder Gutenberg Blocks  WordPress plugin before 3.1.13 does not escape the content of post embed via one of its block which could allow users with the capability to publish posts (editor and admin by default) to perform Stored Cross-Site Scripting attacks even when the unfiltered_html capability is disallowed (for example in multisite setup),4.8,CWE-79
CVE-2024-52381,Improper Control of Filename for Include/Require Statement in PHP Program ('PHP Remote File Inclusion') vulnerability in Shoaib Rehmat ZIJ KART allows PHP Local File Inclusion.This issue affects ZIJ KART: from n/a through 1.1.,8.1,CWE-98
CVE-2024-22428, Dell iDRAC Service Module versions 5.2.0.0 and prior contain an Incorrect Default Permissions vulnerability. It may allow a local unprivileged user to escalate privileges and execute arbitrary code on the affected system. Dell recommends customers upgrade at the earliest opportunity.  ,7.0,CWE-276
CVE-2023-46534,TP-LINK TL-WR886N V7.0_3.0.14_Build_221115_Rel.56908n.bin was discovered to contain a stack overflow via the function modifyAccPwdRegister.,9.8,CWE-787
CVE-2023-52118,Improper Neutralization of Input During Web Page Generation ('Cross-site Scripting') vulnerability in WP Event Manager WP User Profile Avatar allows Stored XSS.This issue affects WP User Profile Avatar: from n/a through 1.0.  ,6.5,CWE-79
CVE-2024-47870,Gradio is an open-source Python package designed for quick prototyping. This vulnerability involves a **race condition** in the `update_root_in_config` function allowing an attacker to modify the `root` URL used by the Gradio frontend to communicate with the backend. By exploiting this flaw an attacker can redirect user traffic to a malicious server. This could lead to the interception of sensitive data such as authentication credentials or uploaded files. This impacts all users who connect to a Gradio server especially those exposed to the internet where malicious actors could exploit this race condition. Users are advised to upgrade to `gradio>=5` to address this issue. There are no known workarounds for this issue.,8.1,CWE-362
CVE-2022-45063,xterm before 375 allows code execution via font ops e.g. because an OSC 50 response may have Ctrl-g and therefore lead to command execution within the vi line-editing mode of Zsh. NOTE: font ops are not allowed in the xterm default configurations of some Linux distributions.,9.8,CWE-77
CVE-2023-27518,Buffer overflow vulnerability in the multiple setting pages of SolarView Compact SV-CPT-MC310 versions prior to Ver.8.10 and SV-CPT-MC310F versions prior to Ver.8.10 allows a remote authenticated attacker to execute arbitrary code.,8.8,CWE-120
CVE-2023-28215,A buffer overflow issue was addressed with improved memory handling. This issue is fixed in macOS Ventura 13.3. An app may be able to cause unexpected system termination or write kernel memory.,7.8,CWE-120
CVE-2023-24134,Jensen of Scandinavia Eagle 1200AC V15.03.06.33_en was discovered to contain a stack overflow via the wepkey3 parameter at /goform/WifiBasicSet.,6.5,CWE-787
CVE-2022-24327,In JetBrains Hub before 2021.1.13890 integration with JetBrains Account exposed an API key with excessive permissions.,7.5,CWE-732
CVE-2023-22919,The post-authentication command injection vulnerability in the Zyxel NBG6604 firmware version V1.01(ABIR.0)C0 could allow an authenticated attacker to execute some OS commands remotely by sending a crafted HTTP request.,8.8,CWE-78
CVE-2022-32242,When a user opens manipulated Radiance Picture (.hdr hdr.x3d) files received from untrusted sources in SAP 3D Visual Enterprise Viewer the application crashes and becomes temporarily unavailable to the user until restart of the application.,5.5,CWE-20
CVE-2023-41848,Missing Authorization vulnerability in Majeed Raza Carousel Slider allows Exploiting Incorrectly Configured Access Control Security Levels.This issue affects Carousel Slider: from n/a through 2.2.2.,5.3,CWE-862
CVE-2023-48457,Adobe Experience Manager versions 6.5.18 and earlier are affected by a Cross-site Scripting (DOM-based XSS) vulnerability. If a low-privileged attacker is able to convince a victim to visit a URL referencing a vulnerable page malicious JavaScript content may be executed within the context of the victim's browser.,5.4,CWE-79
CVE-2025-25667,Tenda AC8V4 V16.03.34.06 was discovered to contain a stack overflow via the urls parameter in the function get_parentControl_list_Info.,9.8,CWE-120
CVE-2021-47620,In the Linux kernel the following vulnerability has been resolved:  Bluetooth: refactor malicious adv data check  Check for out-of-bound read was being performed at the end of while num_reports loop and would fill journal with false positives. Added check to beginning of loop processing so that it doesn't get checked after ptr has been advanced.,5.5,CWE-125
CVE-2022-34283,A vulnerability has been identified in PADS Standard/Plus Viewer (All versions). The affected application is vulnerable to an out of bounds read past the end of an allocated buffer when parsing PCB files. An attacker could leverage this vulnerability to leak information in the context of the current process. (FG-VD-22-048),5.5,CWE-125
CVE-2023-20131,Multiple vulnerabilities in the web-based management interface of Cisco Prime Infrastructure and Cisco Evolved Programmable Network Manager (EPNM) could allow a remote attacker to obtain privileged information and conduct cross-site scripting (XSS) and cross-site request forgery (CSRF) attacks. For more information about these vulnerabilities see the Details section of this advisory.,6.5,CWE-27
CVE-2025-27202,Animate versions 24.0.7 23.0.10 and earlier are affected by an out-of-bounds read vulnerability that could lead to disclosure of sensitive memory. An attacker could leverage this vulnerability to bypass mitigations such as ASLR. Exploitation of this issue requires user interaction in that a victim must open a malicious file.,5.5,CWE-125
CVE-2023-47248,Deserialization of untrusted data in IPC and Parquet readers in PyArrow versions 0.14.0 to 14.0.0 allows arbitrary code execution. An application is vulnerable if it reads Arrow IPC Feather or Parquet data from untrusted sources (for example user-supplied input files).  This vulnerability only affects PyArrow not other Apache Arrow implementations or bindings.  It is recommended that users of PyArrow upgrade to 14.0.1. Similarly it is recommended that downstream libraries upgrade their dependency requirements to PyArrow 14.0.1 or later. PyPI packages are already available and we hope that conda-forge packages will be available soon.  If it is not possible to upgrade we provide a separate package `pyarrow-hotfix` that disables the vulnerability on older PyArrow versions. See  https://pypi.org/project/pyarrow-hotfix/  for instructions.,9.8,CWE-502
CVE-2024-20254,Multiple vulnerabilities in Cisco Expressway Series and Cisco TelePresence Video Communication Server (VCS) could allow an unauthenticated remote attacker to conduct cross-site request forgery (CSRF) attacks that perform arbitrary actions on an affected device.     Note: Cisco Expressway Series refers to Cisco Expressway Control (Expressway-C) devices and Cisco Expressway Edge (Expressway-E) devices.    For more information about these vulnerabilities see the Details [#details] section of this advisory.,9.6,CWE-352
CVE-2022-24971,This vulnerability allows remote attackers to execute arbitrary code on affected installations of Foxit PDF Reader 11.1.0.52543. User interaction is required to exploit this vulnerability in that the target must visit a malicious page or open a malicious file. The specific flaw exists within the parsing of JPEG2000 images. The issue results from the lack of proper validation of user-supplied data which can result in a read past the end of an allocated structure. An attacker can leverage this vulnerability to execute code in the context of the current process. Was ZDI-CAN-15812.,8.8,CWE-125
CVE-2024-23997,Lukas Bach yana =<1.0.16 is vulnerable to Cross Site Scripting (XSS) via src/electron-main.ts.,9.6,CWE-79
CVE-2023-0025,SAP Solution Manager (BSP Application) - version 720 allows an authenticated attacker to craft a malicious link which when clicked by an unsuspecting user can be used to read or modify some sensitive information or craft a payload which may restrict access to the desired resources.  ,6.5,CWE-79
CVE-2024-28074,It was discovered that a previous vulnerability was not completely fixed with SolarWinds Access Rights Manager. While some controls were implemented the researcher was able to bypass these and use a different method to exploit the vulnerability.,9.6,CWE-502
CVE-2025-0202,A vulnerability was found in TCS BaNCS 10. It has been classified as problematic. This affects an unknown part of the file /REPORTS/REPORTS_SHOW_FILE.jsp. The manipulation of the argument FilePath leads to file inclusion. The real existence of this vulnerability is still doubted at the moment.,5.5,CWE-73
CVE-2024-13527,The Philantro – Donations and Donor Management plugin for WordPress is vulnerable to Stored Cross-Site Scripting via the plugin's shortcodes like 'donate' in all versions up to and including 5.3 due to insufficient input sanitization and output escaping on user supplied attributes. This makes it possible for authenticated attackers with contributor-level access and above to inject arbitrary web scripts in pages that will execute whenever a user accesses an injected page.,6.4,CWE-79
